End-of-treatment Beck Depression Inventory (BDI; A. T. Beck, C. H. Ward, M. Mendelson, J. Mock, & J. Erbaugh, 1961) results residualized for baseline BDI were related to right temporal periventricular lesion volume (R2=.32, p=.002) and left temporal grey-white junction lesion volume (R2=.19, p=.02) but were not statistically related to lesion volume in any other brain region or to neuropsychological function.	2003	natural
For MCC, emotion-focused coping and child behavior both predicted depression, anxiety, and GMH; concurrent stress and strain mediated the relationship between child behavior and depression and between emotion-focused coping and each measure of adjustment.	2004	natural
There was a significant effect for time in both groups, indicating an improvement in PTSD symptoms, depression, sleep, and quality of life over time.	2004	natural
Based on basic behavioral theory and recent evidence that the behavioral component may be the active mechanism of change in cognitive-behavioral treatments of clinical depression, the authors designed a treatment to systematically increase exposure to positive activities, and thereby improve affect and corresponding cognitions.	2001	natural
Based on the opposing relationships between anxiety and depression and commitment, the broad factor of neuroticism does not demonstrate any relationship with level of commitment, and the significant effects of anxiety and depression on commitment is contingent upon partialling the effect of the other facet of neuroticism.	2003	natural
A multi-axial evaluation was completed using the Newcastle 1 Depression Rating Scale from 1965 for melancholia (N1) in a subsample of patients (n = 439).	2003	natural
The full models including characteristic pain and depression explained 49 and 20 of the variance in ischemic pain threshold and tolerance, respectively.	2004	natural
The Depression Interview and Structured Hamilton (DISH) is a semistructured interview developed for the Enhancing Recovery in Coronary Heart Disease (ENRICHD) study, a multicenter clinical trial of treatment for depression and low perceived social support after acute myocardial infarction.	2002	natural
Also, cases of postpartum depression were more severe than cases of nonpostpartum depression.	2000	natural
Patients suffering from melancholic depression showed significantly increased S-100B levels compared to healthy controls while non-melancholic patients demonstrated normal levels.	2001	natural
Following statistical adjustment for age, body mass index (BMI), HRT status, and depressive symptoms, the interaction of depression and HRT explained 16 variance in total cholesterol and 17 variance in low-density lipoprotein cholesterol (Ps<.01).	2004	natural
Memory complaints in the presence of depression are associated with high prevalence of epsilon4 and therefore, presumably, a raised risk of subsequent dementia.	2001	natural
This study investigated the moderating effect of social support, hardiness, and the components of the hardiness scale of commitment, challenge, and control on the relationship between stress and depression.	2000	natural
The responses of IL-6 and sIL-1RA following delivery are amplified in women who previously suffered from major depression.	2001	natural
Although there is increasing support for the hypothesis that negative cognitive styles contribute vulnerability to depression, it remains unclear how best to conceptualize the heterogeneity in cognitive vulnerability to depression.	2004	natural
Several days later, individuals completed a test for depression.	2001	natural
This study investigated the convergent validity of the Beck Depression Inventory for Youth in a sample of 34 children (22 boys, 12 girls) who ranged in age from 7 to 14 years (M= 11.3, SD=2.3) by comparing scores with simultaneous ratings on the Children's Depression Inventory.	2004	natural
Specifically, variations in mattering are predictive of depression for women, but not for men.	2001	natural
Teachers rated the PDD group as having more severe anxiety and depression symptoms than parents.	2004	natural
Parallel research on economic inequalities and depression has just begun.	2003	natural
High levels of self-reported distress were identified with 43 and 10 of patients scoring as probable cases on the Hospital Anxiety and Depression Scale (HADS) subscales of anxiety (mean 9.3+/-4.9) and depression (mean 4.8+/-3.7), respectively.	2001	natural
This is in agreement with cognitive theories about cognitive deficits in depression that are regarded as important vulnerability factors in mood disorders.	2004	natural
This is a small proportion of the estimated pound100 million cost of switching to first-line prescribing of SSRIs for depression.	2000	natural
Agoraphobic behavior associated with panic attack is familial and associated with comorbid major depression.	2004	natural
Need for increasing awareness as well as improving methods of detecting depression in physically ill is underscored.	2002	natural
For males, on the other hand, the display of aggressive and depressive behavior in response to interparental depressive behavior was related to increases in depression.	2000	natural
Results indicated that higher levels of chronic stress 6 months prior to each follow-up predicted greater depression severity at follow-up, controlling for depression severity at the start of the chronic stress assessment.	2004	natural
It was suggested that transient mood state did not bias self-referent processing in depression, and Beck's schema hypothesis was supported.	2002	natural
Both clinicians and researchers have noted the widespread existence of negative affectivity on the MMPI and MMPI-2 that may elevate scale scores and eclipse the tests' ability to differentiate depression from other clinical disorders.	2002	natural
In addition to the Autobiographical Memory Test (AMT; Williams & Broadbent, 1986) participants completed a number of questionnaires assessing the presence of traumatic experiences in the past, level of depression and neuroticism.	2004	natural
When using a cut-off of 11 on the EPDS, 26 of 27 women with major depression were identified (sensitivity 96, specificity 78).	2003	natural
Results indicated that a unique 9-item depression factor composed largely of items representing a negative view of oneself existed.	2001	natural
The Edinburgh Postnatal Depression Scale (EPDS) has been validated and used extensively in screening for depression in new mothers, both in English speaking and non-English speaking communities.	2001	natural
Major depression is associated with poor outcome across multiple domains.	2003	natural
The others were the Brief COPE (Carver, 1997), the Center for Epidemiological Studies--Depression Scale (Radloff, 1977), and an abbreviated version of the Profile of Mood States (McNair, Lorr, & Droppelman, 1971).	2000	natural
Consistent with hypotheses, lifetime abuse was associated with elevated levels of anxiety and depression, and women who experienced childhood abuse were more likely to report adult partner abuse.	2004	natural
Higher scores on measures of depression and hostility, but not trait anxiety or worry, distinguished the GAD group.	2004	natural
There was some support for proposals that depression and schizotypy may bring out delusions in OCD and some evidence for the utility of categorising OCD according to the number of obsessions a subject has.	2000	natural
White and African American students in Grades 6-12 (N=822) completed measures of social economic status (SES), body mass index (BMI), depression, current-ideal body image discrepancy, eating attitudes, dieting frequency, dietary intake, and activity level.	2002	natural
In addition, individuals who reported a history of unexplained fatigue at baseline as well as during the follow-up, were at markedly increased risk for new onset major depression as compared to those who never reported such fatigue, (RR = 28.4, 95 CI) (11.7, 68.0).	2001	natural
African American caregivers show more resilience on measures of depression and life satisfaction but are still vulnerable to increases in physical symptoms over time.	2001	natural
Aside from differences anxiety due to cancer type, patients' illness characteristics appear to be risk factors in patients' but not relatives' depression and anxiety.	2004	natural
In an ongoing study, perimenopausal women diagnosed with major depression were randomly assigned to one of three treatment conditions: fluoxetine 10-20 mg alone, estradiol patch 0.1-0.2 mg alone or the combination of fluoxetine 10-20 mg and estradiol patch 0.1-0.2 mg.	2003	natural
Various clinical observations in humans suggest a possible pathophysiological link between depression and disturbances in circadian rhythmicity.	2001	natural
40 older residents living in three upper socioeconomic retirement centers were screened for hearing loss, hearing handicap, and depression.	2001	natural
The finding of a longitudinal relationship between depression and functional outcomes in older adults with a compromised health status provides a rationale for treatment of chronic physical diseases as well as depression in depressed chronically ill elderly, in order to prevent a spiralling decline in psychological and physical health.	2001	natural
The developmental stories of these individuals, largely in their own words, are situated in one transitional developmental period, and the narratives allude to sexual abuse, sexual orientation, relatively early marriage, or depression.	2001	natural
The aggregate levels of psychological distress and depression, anxiety, and obsessive symptoms were significantly higher for women than for men.	2001	natural
We begin with a brief overview of the prevalence and associated personal, societal, and systemic burdens of anxiety and depression.	2004	natural
Multiple causal attributions can coexist demonstrating different associations with comorbid depression and illness behavior.	2004	natural
Important issues about the model of interaction between stress and depression are discussed.	2002	natural
The aim of the study was to find out the validity and reliability of the Turkish version of the Edinburgh Postnatal Depression Scale (EPDS) and to determine the optimum cut-off value for postnatal depression.	2004	natural
The results of this study suggest that the inpatient treatment of depression in the elderly brings about improvements in quality of life that persist for at least 3 months following discharge.	2001	natural
However, this suggestion needs to be tested with prospective studies showing whether AM recall style becomes more specific as a result of an episode of depression.	2004	natural
Depression in the elderly was found to be associated with a variety of risk-factors in cross sectional designs.	2000	natural
The goals of the intervention were to decrease feelings of depression, anxiety, perceived stress, and stigma and to increase perceived social support.	2004	natural
Results demonstrated that symptoms of depression mediated the relationship between global attributions for negative events and illness.	2002	natural
This study builds on previous research indicating that people with dementia who experience stressful life events have a higher risk of depression.	2004	natural
At discharge, patients in both groups showed substantial and statistically significant improvements on self-report measures of depression and eating disorder symptomatology.	2003	natural
Conversely, self-focused attention can be adaptive, facilitating self-knowledge and the development of the alternative functional interpretations of negative thoughts and feelings on which cognitive therapy of depression depends.	2004	natural
Comparisons between changes in coping styles were made between groups of adolescents; those considered at-risk for and resistant to depression, those neither resistant or at-risk for depression, and a male and female group.	2000	natural
In both genders, no significant class differences were found in depression, health status or prevalence of chronic illness.	2003	natural
The finding that cognitive performance was not decreased in individuals with previous depression suggests that cognitive dysfunction is a state phenomenon in depression.	2001	natural
This is most clear with respect to feelings of depression, less so with respect to the use of psychotropic drugs.	2002	natural
Bivariate and multivariate relationships between depression and demographics, health, social stress and support, and religiosity were explored.	2003	natural
However, some individuals do appear at risk of depression in adulthood.	2003	natural
Dysthymia (DD) may be thought of as depression associated with personality disorder, a phase in the pleomorphic natural history of unipolar depression or a result of exposure to chronic physical illness.	2004	natural
The present study explored whether a dimension based on prior course of depression increases the validity of a dimensional model based on symptom severity alone and whether the two dimensions combined improve upon the present categorical system (DSM).	2002	natural
The differentiation between melancholic and non-melancholic depression was performed clinically and was not performed using any standardized instrument.	2001	natural
Conditional Goal Setting offers an explanation for the motivations controlling the setting of important goals in the individual vulnerable to depression.	2002	natural
However, links between BIS and depression appeared state-dependent.	2001	natural
The mean Beck Depression Inventory-II total score and the mean number of symptoms endorsed by the outpatients with a Major Depressive Disorder were significantly (ps<.001) higher than those for outpatients with a Dysthymic Disorder.	2003	natural
Furthermore, the results showed that alexithymic features could also be situational reactions to depression.	2004	natural
Followup analyses demonstrated significant betweencluster differences on the Impact of Event Scale, Beck Depression Inventory, Dissociative Experiences Scale, and nearly all Symptom Checklist90Revised subscales.	2001	natural
The Beck Depression Inventory-II (BDI-II) and the Medical Outcomes Study Short-Form General Health Survey (SF-20) were administered to 90 primary care older patients of a large HMO.	2004	natural
All of the patients had a Hamilton Depression (HAM-D) score greater than 14 at baseline, and each had used at least $20 worth of cocaine per week in the 4 weeks prior to entering the study.	2000	natural
Although no direct relationship between depression and the level of BP was substantiated by multivariate analysis, findings of descriptive analyses revealed statistically significant associations among depression, substance use, poor adherence, and poor BP outcomes.	2003	natural
Application of the diagnostic exclusion rules with regard to concurrent major depression and dysthymia decreased the rate only slightly (5.3).	2002	natural
The percentage of these parents with high depression scores decreased.	2001	natural
It is likely that patients' decisional styles help to manage anxiety and depression when confronted with life-threatening illness.	2003	natural
On the one hand, our results demonstrate a positive relationship between anxiety and level of commitment; on the other, our results demonstrate a negative relationship between depression and level of commitment.	2003	natural
Our results showed that the gluten load (GLT-100) induced a greater depression in food intake than an isocaloric wheat starch load (GLT-0).	2002	natural
As has been previously established, depression had a direct and significant effect on nicotine dependence.	2001	natural
Structured interviews assessed HIV-status disclosure to family and friends, perceived stress of disclosure, social support, and depression.	2003	natural
ANCOVAS for treatment completers showed non-significantly lower levels of OCD symptoms, depression and state anxiety in the treatment condition that did include cognitive interventions.	2004	natural
Women with both poor sleep quality and depression had a worse prognosis than women free from these complaints (HR = 2.6; 95 CI: 1.0-6.4).	2003	natural
The aim of this paper was to specifically analyse the relationship between the different components of academic self-image, defined as the way adolescents represent themselves as students, and self-reported depressive symptoms, assessed with the Children's Depression Inventory (CDI), in a non-clinical sample of 298 adolescents.	2001	natural
It is concluded that the psychometric properties of both tests are adequate across those different cultures and are, in general, applicable to measure symptoms of depression, anxiety, and posttraumatic stress disorder.	2001	natural
Depression during the teenage period is differentiated from a depressed mood, replete with misery and anguish, and depression proper, i.e., a real illness with specific symptoms which are depressive equivalents.	2002	natural
The current study was conducted to investigate the relationship between spirituality and boredom, constraint, social contact, and depression.	2003	natural
Patients were administered the Hamilton Rating Scale for Depression (HRSD), the Global Assessment of Functioning scale (GAF) and neuropsychological tests from the Wechsler Memory Scale.	2001	natural
Participants ( = 139) were referred to Specialty Clinics, Central Coast Mental Health Services for treatment for depression and/or anxiety in CBT groups.	2002	natural
Despite these indications of the possible importance of the ACC in depression there have been relatively few cognitive studies ACC function in patients with major depression.	2004	natural
In the first data set, there were no significant differences in depression, anxiety, and attachment behaviors based on mothers' personal history of abuse.	2001	natural
The prevention approach was modified to include an expanded approach to defining depression and resilience; greater flexibility on the part of the clinician; more intensive engagement between clinician and family, with a focus on immediate daily concerns; as well as awareness of cultural issues and responsiveness to the subject's experience of violence.	2001	natural
The aim of this study was to examine the role of patient preference for counselling in the occurrence of postpartum depression in high-risk women.	2004	natural
Based on serial ratings on visual analogue scales over a 24 hr period, PTSD subjects showed comparable levels of depression as the MDD group, as measured by the mean and maximum levels of mood; however, they had greater mood variability, as measured by the range and coefficients of variation of the mood ratings.	2001	natural
In line with the theoretical proposals of the hopelessness theory, the highest depression scores were observed in those subjects who not only had a negative attributional style for hypothetical achievement-related events, but had also judged such events as personally important, failed a mid-term exam, and judged that failing the exam was of major importance.	2001	natural
While a female preponderance in unipolar depression is a consistent finding in community-based studies, determinants remain speculative.	2004	natural
This pilot study, although limited in size, raises the possibility that cholesterol-lowering drugs are associated with mild, time-limited increases in impulsivity and with mild, time-delayed improvements in depression ratings.	2003	natural
To provide normative data for the Hospital Anxiety Depression Scale (HADS).	2001	natural
Depression is prevalent as a co-morbid condition in diabetes.	2002	natural
Examination of patients' clinical outcomes during a 9-month follow-up period revealed that high levels of behavioural control on the part of relatives significantly predicted relapse in patients with schizophrenia but not in patients with depression.	2002	natural
Two groups of women who were not depressed at the time of the study were compared; only 1 group had a history of major depression.	2000	natural
The results could, in part, explain previous findings, which suggest increased lipid peroxidation in major depression.	2000	natural
Anxiety was reduced by 55 and depression by 60 in Hamilton scales.	2000	natural
Pre- and postintervention data showed reductions in anxiety and depression scores and a concomitant increase in adolescents' self-efficacy.	2001	natural
It is suggested that depression exists as an independent domain, differentiated from negative symptoms, in the structure of schizophrenia symptomatology.	2003	natural
Results showed that only anxiety (but not depression) was related to enhanced imagery for future negative events.	2000	natural
Average minutes of weekly yoga-meditation practice were significantly associated with improvements in depression.	2004	natural
When optimism, pessimism, and emotionality were controlled, PIL was still related to less negative affect, depression, and anxiety, and more positive affect.	2004	natural
This study investigated scores on depression of students in sports.	2002	natural
Information on maternal depression and socio-demographic factors was available for three samples of women (total n = 1256).	2002	natural
In this study, the psychometric properties of the Hamilton Depression Inventory (HDI; Reynolds & Kobak, 1995a) were examined in a sample of 249 undergraduate participants.	2003	natural
This article is a report on a logistical regression analysis, showing that the odds ratios for the probability of maternal depression at two months were: for the infant being unwanted, OR=4.33, 95 Cl: (1.75; 11.60); for the father's negative attitude towards the infant, OR=6.03, 95 Cl: (2.01; 20.09); and for the mother cohabiting with (as opposed to not living with) a male partner, OR=2.77, 95 Cl: (1.08; 7.69).	2004	natural
At Time 1 (T1), the Temperament and Character Inventory (TCI) and Self-rating Depression Scale (SDS) were distributed.	2000	natural
Multivariate analyses indicated that depressive symptoms predicted onset of bulimic pathology but not of substance abuse, bulimic symptoms predicted onset of depression but not of substance abuse, and substance abuse symptoms predicted onset of depression but not of bulimic pathology.	2004	natural
automatic thoughts play a mediating role between dysfunctional attitudes and depression.	2003	natural
Individuals with chronic disease are not screened routinely for depression.	2003	natural
Mood was assessed using three self-rated scales: the Toronto Alexithymia Scale (TAS-20), the State-Trait Anger Scale (STAS), and the Beck Depression Inventory (BDI).	2001	natural
Atypical depression is associated with elevated rates of personality disorders.	2002	natural
This finding suggests that the SGDS-K can be used as an adequate substitute for the GDS-K. The GDS-K and SGDS-K proved valid and reliable case-finding tools for screening DSM-III-R major depression among the elderly psychiatric patients in Korea.	2004	natural
Increased expression of CD62L correlated directly with the global severity of illness, Hamilton Anxiety (HAM-A) and Hamilton Depression (HAM-D) scores.	2000	natural
In addition, significant mean differences were found between starters and nonstarters on constructs of Anger, Confusion, Tension, and Depression, suggesting that nonstarters may not share same psychological profile as their peers who start.	2000	natural
Results showed that the child survivors had higher PTSD symptom scores, higher depression, anxiety, somatization, and anger-hostility scores; and lower physical, psychological, and social QoL than did the comparison group.	2003	natural
At admission, patients completed the Eating Disorder Inventory-2 (EDI-2) and the Beck Depression Inventory (BDI) and the Family Adaptability and Cohesion Evaluation Scale- II (FACES-II).	2003	natural
Repeated measures analyses indicated that relative to usual care (UC), pregnant smokers who received MI reported a greater increase in confidence to abstain from smoking, a decrease in temptation to smoke, and a decrease in level of depression.	2004	natural
Those with subsyndromal depression scored significantly worse on quality of life measures than those with no depression, but the effect size was small and less than the poorer functioning of those with other depressive syndromes, particularly major depression.	2004	natural
Intervening in depression and/or low perceived social support within 28 days after myocardial infarction (MI) in the Enhancing Recovery in Coronary Heart Disease (ENRICHD) clinical trial did not increase event-free survival.	2004	natural
Double depression, or dysthymia with superimposed major depression, is a major public health issue that imposes considerable burden on the community.	2004	natural
This 12-month follow-up study investigated the prevalence of alexithymia and its relationship with depression in a sample of the general population from Eastern Finland (n = 1,584).	2001	natural
This study examined a sample of community-based older adults (55-75) to determine whether scores on the TOMM are influenced by the presence of symptoms of depression or anxiety, as measured by the Beck Depression Inventory (BDI) and State-Trait Anxiety Inventory (STAI), respectively.	2004	natural
The goal of the present study was to investigate whether healthy controls and depressed patients differ in their ability to tolerate supraphysiological doses of T. This was an 8-week open study to investigate side effects and levels of thyroid hormones in 13 healthy controls and to compare results with those of 13 patients with refractory depression (unipolar and bipolar) undergoing the similar procedures and T dosing regimen in a previous augmentation study.	2002	natural
However, female sex and negative affectivity but not anxiety sensitivity or childhood separation anxiety disorder predicted onset of major depression after adjustment for the effects of prior panic attacks.	2000	natural
