Results showed that only anxiety (but not depression) was related to enhanced imagery for future negative events.	2000	natural
Average minutes of weekly yoga-meditation practice were significantly associated with improvements in depression.	2004	natural
When optimism, pessimism, and emotionality were controlled, PIL was still related to less negative affect, depression, and anxiety, and more positive affect.	2004	natural
This study investigated scores on depression of students in sports.	2002	natural
Information on maternal depression and socio-demographic factors was available for three samples of women (total n = 1256).	2002	natural
In this study, the psychometric properties of the Hamilton Depression Inventory (HDI; Reynolds & Kobak, 1995a) were examined in a sample of 249 undergraduate participants.	2003	natural
This article is a report on a logistical regression analysis, showing that the odds ratios for the probability of maternal depression at two months were: for the infant being unwanted, OR=4.33, 95 Cl: (1.75; 11.60); for the father's negative attitude towards the infant, OR=6.03, 95 Cl: (2.01; 20.09); and for the mother cohabiting with (as opposed to not living with) a male partner, OR=2.77, 95 Cl: (1.08; 7.69).	2004	natural
At Time 1 (T1), the Temperament and Character Inventory (TCI) and Self-rating Depression Scale (SDS) were distributed.	2000	natural
Multivariate analyses indicated that depressive symptoms predicted onset of bulimic pathology but not of substance abuse, bulimic symptoms predicted onset of depression but not of substance abuse, and substance abuse symptoms predicted onset of depression but not of bulimic pathology.	2004	natural
automatic thoughts play a mediating role between dysfunctional attitudes and depression.	2003	natural
Individuals with chronic disease are not screened routinely for depression.	2003	natural
Mood was assessed using three self-rated scales: the Toronto Alexithymia Scale (TAS-20), the State-Trait Anger Scale (STAS), and the Beck Depression Inventory (BDI).	2001	natural
a series of aphorisms of depression, meant to be shared with patients early in treatment.	2001	natural
Thus ruminative coping after the loss of a child appears to be a risk factor specifically for major depression.	2003	natural
The results show that the severity of depression was significantly associated with alexithymia.	2001	natural
Atypical depression is associated with elevated rates of personality disorders.	2002	natural
This finding suggests that the SGDS-K can be used as an adequate substitute for the GDS-K. The GDS-K and SGDS-K proved valid and reliable case-finding tools for screening DSM-III-R major depression among the elderly psychiatric patients in Korea.	2004	natural
Increased expression of CD62L correlated directly with the global severity of illness, Hamilton Anxiety (HAM-A) and Hamilton Depression (HAM-D) scores.	2000	natural
This indicates a serotonergic abnormality consistent with that found in major depression where neurological disease is not present.	2003	natural
In addition, significant mean differences were found between starters and nonstarters on constructs of Anger, Confusion, Tension, and Depression, suggesting that nonstarters may not share same psychological profile as their peers who start.	2000	natural
Cross-sectional data prevent analysis of causation; the severest cases of clinical depression may not be represented in a general population sample.	2003	natural
The women with more symptoms of anxiety and depression were those who have experienced more life events and have low perceived social support.	2004	natural
Results showed that the child survivors had higher PTSD symptom scores, higher depression, anxiety, somatization, and anger-hostility scores; and lower physical, psychological, and social QoL than did the comparison group.	2003	natural
We aimed to provide prevalence data on depression and other current mental_disorders, impairment, need of psychiatric care and use of mental_health services among young adults.	2001	natural
At admission, patients completed the Eating Disorder Inventory-2 (EDI-2) and the Beck Depression Inventory (BDI) and the Family Adaptability and Cohesion Evaluation Scale- II (FACES-II).	2003	natural
Repeated measures analyses indicated that relative to usual care (UC), pregnant smokers who received MI reported a greater increase in confidence to abstain from smoking, a decrease in temptation to smoke, and a decrease in level of depression.	2004	natural
Those with subsyndromal depression scored significantly worse on quality of life measures than those with no depression, but the effect size was small and less than the poorer functioning of those with other depressive syndromes, particularly major depression.	2004	natural
Intervening in depression and/or low perceived social support within 28 days after myocardial infarction (MI) in the Enhancing Recovery in Coronary Heart Disease (ENRICHD) clinical trial did not increase event-free survival.	2004	natural
Double depression, or dysthymia with superimposed major depression, is a major public health issue that imposes considerable burden on the community.	2004	natural
This 12-month follow-up study investigated the prevalence of alexithymia and its relationship with depression in a sample of the general population from Eastern Finland (n = 1,584).	2001	natural
NKA and degree of anxiety and depression were measured using Taylor's manifest anxiety scale (MAS) and Zung's self-rating depression scale (SDS).	2001	natural
Adult life functioning was measured by HIV drug and sex risk behaviors, Addiction Severity Index (ASI) composite scores, and depression.	2002	natural
This study examined a sample of community-based older adults (55-75) to determine whether scores on the TOMM are influenced by the presence of symptoms of depression or anxiety, as measured by the Beck Depression Inventory (BDI) and State-Trait Anxiety Inventory (STAI), respectively.	2004	natural
The goal of the present study was to investigate whether healthy controls and depressed patients differ in their ability to tolerate supraphysiological doses of T. This was an 8-week open study to investigate side effects and levels of thyroid hormones in 13 healthy controls and to compare results with those of 13 patients with refractory depression (unipolar and bipolar) undergoing the similar procedures and T dosing regimen in a previous augmentation study.	2002	natural
However, female sex and negative affectivity but not anxiety sensitivity or childhood separation anxiety disorder predicted onset of major depression after adjustment for the effects of prior panic attacks.	2000	natural
This study presents data of 49 patients with depression in Parkinsons disease and 38 patients with major depression.	2003	natural
The objective of this study was to determine the prevalence of anxious depression and to define its clinical correlates and symptom patterns.	2004	natural
Family dysfunction, ineffective social support, low self-esteem, lack of agreement with the decision to migrate, high education levels, high levels of acculturative stress, and high levels of anxiety were significantly associated with high depression levels.	2002	natural
Descriptive epidemiological studies are reviewed, showing that the female preponderance in depression begins to emerge around age 13.	2001	natural
On the Hamilton Depression Rating Scale and Beck Depression Inventory (BDI) scales, recovery of patients with MD and comorbid CPD was inferior to recovery of patients with MD alone.	2002	natural
This review focuses on recent human studies addressing the impact of depression on immune function, and the health consequences of those changes.	2002	natural
Although there are numerous self-help books for depression, relatively few have been empirically tested.	2003	natural
Being a victim of bullying was found to be significantly associated with depression (2 = 10.986; df = 1; p = 0.001) and suicidal ideation (2 = 5.811; df = 1; p = 0.022).	2004	natural
The generalizability of Response Styles Theory, as well as the linkages that may account for correlations between rumination, distraction, and depression, were explored with structural equation modeling in a sample of chronically depressed individuals undergoing treatment with psychotherapy, medication, or combination treatment.	2004	natural
Depression in TBI patients seems compatible with some degree of lack of self-awareness of cognitive and behavioural difficulties.	2001	natural
The PTSD group scored significantly higher than the ASD and subclinical groups on scales assessing somatic complaints, anxiety, anxiety related disorders, depression, non-psychotic symptoms of schizophrenia, and negative relationships.	2001	natural
The urban public has unfavourable attitudes towards depression and a tendency to isolate patients from the society.	2004	natural
Children living with parents treated for depression are at risk for problems irrespective of the parent's course, perhaps due to poor family functioning.	2002	natural
The goal of this study was to test the response styles theory of depression in a sample of 3rd- and 7th-grade children.	2002	natural
The developmental stories of these individuals, largely in their own words, are situated in one transitional developmental period, and the narratives allude to sexual abuse, sexual orientation, relatively early marriage, or depression.	2001	natural
The structure of relationships revealed that somatic factors lead to anxiety and depression in the preoperative period, whereas anxiety and depression lead to somatic factors in the postoperative period.	2002	natural
The Hospital Anxiety and Depression Scale (HADS: Zigmond & Snaith, 1983) was administered at both time points and a modified List of Threatening Experiences (Brugha, Bebbington, Tennant, & Hurry, 1985) was administered mid-course.	2004	natural
These findings indicate important associations among marital quality, social support and depressive symptoms in women, which should be taken into consideration for prevention and intervention strategies targeting depression.	2004	natural
MBCT represents an adaptation of the mindfulness meditation approach into a group programme for relapse prevention of depression.	2004	natural
This study extends previous research by examining the role of communalism, family cohesion, and family support in suicide ideation and depression in African American college students.	2000	natural
Physicians treating AIDS patients should be alerted to the high rate of depression in clinical HIV illness, in order to identify and properly treat depression.	2001	natural
Prior earthquake experience was related to lower postearthquake depression scores.	2000	natural
However, the association between relationship anxiety and maternal depression was moderated by husbands caregiving style.	2003	natural
Some recent negative studies in depression might be explained by insufficient lowering of plasma tryptophan levels.	2001	natural
Deviation from the usual sequence of major depression and anxiety disorders was more often seen among females, subjects with a higher educational level, subjects who experienced childhood parental divorce, and subjects who experienced childhood emotional neglect.	2003	natural
There is considerable disagreement about what happens to the risk of anxiety and depression disorders and symptoms as people get older.	2000	natural
Outcome measures included diagnostic interview as well as parent and child report measures of anxiety and depression.	2004	natural
Early impairment in self-efficacy may place children at risk for later depression and thus may be one pathway for the intergenerational transmission of depression.	2004	natural
The affected people (n = 65) who were close to the epicenter of supercyclone and lost their family members, relatives, and property, experienced more anxiety, depression, and posttraumatic stress than the unaffected (n = 65) who were away from the epicenter of supercyclone and had not experienced any loss.	2002	natural
In light of this need, this article details the criteria used to identify depression in children and adolescents, and examines the available evidence for the use of pharmacological and psychotherapeutic approaches in the treatment of depression in children and adolescents.	2003	natural
It has been suggested that giving reasons for depression is a form of rule-governed behaviour and as such can cause the depression to be harder to treat (i.e. the reasons become functionally true for the individual).	2004	natural
The women with more symptoms of anxiety and depression were those who have experienced more life events and have low perceived social support.	2004	natural
These findings were independent of age, education, and depression scores.	2003	natural
Physical illnesses that can be treated with ADs affected only 30.0 of nMDS subjects without past depression taking ADs.	2004	natural
The Beck Anxiety Inventory, the Beck Depression Inventory, and a newly developed measure, the SARS Impact Scale (SIS), were mailed to 453 Hong Kong Chinese SARS survivors discharged from hospital for 4 weeks or more.	2004	natural
After a 1-day training course in the ICD-10 criteria for depression, ten general practitioners, during an 8-week period assessed all patients aged 18 or older for depressive symptoms in accordance with the ICD-10 criteria.	2001	natural
Only 49 were aware that antidepressants could be used to treat symptoms other than depression.	2004	natural
They also did not differ in terms of psychological characteristics, including depression and prior coping use of cigarettes.	2001	natural
Regression analyses indicated that alexithymia remained a significant and independent correlate of affective pain severity while controlling for either self-efficacy or catastrophizing, but depression accounted for alexithymia's relationship with affective pain.	2002	natural
Psychometric properties of the D-ARK were compared with standard depression scales (Beck Depression Inventory and Geriatric Depression Scale) among 294 adult and 193 senior primary-care patients, respectively, and 163 patients enrolled in cognitive-behavioral depression classes.	2003	natural
Fasting blood samples were collected the same day the assessments were done of anger and hostility using the Buss-Perry Aggression Questionnaire (BPAQ) and depressive symptomatology using the Beck Depression Inventory (BDI).	2004	natural
In this paper, we review the literature on anxiety and depression comorbidity in late life, and we make recommendations for the assessment and treatment of comorbid late-life anxiety and depression.	2001	natural
The purpose of this pilot study was to test the effects of a dyadic intervention (one-to-one support) on social support (Modified Inventory of Socially Supportive Behaviors), self-efficacy (Stanford Inventory of Cancer Patient Adjustment), and depression (Geriatric Depression Scale).	2004	natural
Depression, panic disorder and social phobia showed no significant associations with platelet MAO activity.	2000	natural
Although the Beck Depression Inventory (BDI) is commonly used to assess levels of depressive symptoms in socially anxious adults, its psychometric properties in this context have never been formally examined.	2001	natural
Depression did not predict the later mental fatigue nor was depression predicted by preceding fatigue experiences.	2002	natural
The strongest support was found for the role of developmental factors in the chronicity of depression.	2002	natural
Seventeen percent of subjects received a diagnosis of major depression, 8 had pathological laughing and crying (PLC), 48 had symptoms of emotional dyscontrol without meeting criteria for a formal psychiatric diagnosis and 27 had minimal psychiatric symptoms (emotionally stable).	2001	natural
The aim of this study was to estimate the prevalence of depression among nursing home residents, and the extent of depression recognition among nursing home staff.	2001	natural
Results revealed that trauma participants increased in positive self-perceptions (mastery, personal growth, self-acceptance) and decreased in distress (depression, interpersonal sensitivity, anxiety, somatization) from pretest to posttest.	2003	natural
using 50 reduction on the Hamilton Rating Scale for Depression (HRSD) as response criterion, the efficacy of ECT was higher in patients with delusional depression (92 response) than in the non-deluded patients (55 response).	2003	natural
Only a few reports investigated the prevalence of depression in intravenous drug-users with HIV infection, including both asymptomatic and symptomatic subjects.	2001	natural
The proportion assigned to the depression cluster increased to 70.5 and to 86.2 when higher BDI cutoffs of 16 and 21 were examined, respectively.	2001	natural
Specifically, the level of intrusive thoughts, feelings of safety, nervousness, and depression were all significantly higher for bias crime victims.	2001	natural
Fifty-four individuals with a high degree of religiosity, 47 with a medium degree of religiosity and 64 with low religiosity completed anonymously the Italian versions of well-established measures of obsessive-compulsive (OC) cognitions and symptoms, depression and anxiety.	2002	natural
Approximately 20 of individuals with depression experience episodes that last for two years or longer.	2003	natural
Types of adult crying (healthy crying, crying for no reason, prolonged or frequent crying associated with depression or physiological disorders) and types of inhibited crying (healthy tearlessness, pervasive emotional control, detached tearlessness, and displaced crying) reflect attachment style and may, in addition, be assessed as healthy or symptomatic of psychological or physiological disorders or a combination.	2000	natural
In the interviewed sample (74 women), only educational level independently contributed to the presence of depression.	2004	natural
To assess whether writing with cognitive change or exposure instructions reduces depression or suicidality, 121 undergraduates screened for suicidality wrote for 20 minutes on 4 days over 2 weeks.	2002	natural
Clinical evaluation of depression was evaluated by Hamilton Depression Scale, Montgomery and Asberg Scale, Newcastle Scale and regional cerebral blood flow (rCBF) using the HMPAO-SPECT.	2001	natural
Work characteristics (decision latitude, and opportunity for social interaction at work), together with age, depression, and medical prognosis, correctly classified work status in 78 of cases.	2000	natural
Knowledge level was then correlated with family members' burden, depression, distress, and expressed emotion.	2003	natural
There is also growing evidence that depression is a risk factor for congestive heart failure (CHF) and that CHF patients with major depression have higher rates of mortality and repeat hospitalizations.	2003	natural
Those with subsyndromal depression (2-3 symptoms) at the end of acute treatment were compared to those who were well (< or =1 symptom) and those who were still depressed (> or =4 symptoms) on presentation at intake, the end of treatment, and over the two-year follow-up.	2001	natural
Treatment for depression was associated with significant increases in perceived social support, utilized social support and satisfaction with support, as well as reduction in need for emotional support.	2004	natural
This study investigated whether AM has a role in the development of adult depression in survivors of CSA and whether it is related to circumstances of CSA.	2004	natural
The extent to which current theories on family-related factors associated with children's depression and conduct problems are applicable to Mexican American children was examined among demographically comparable samples of low-income Mexican American (English and Spanish speaking) and Euro-American mothers and children.	2003	natural
Following T. Z. Tang and R. J. DeRubeis's (1999) report of sudden gains (a sudden and substantial improvement in depression symptoms in one between-session interval) in cognitive-behavioral therapy (CBT) for depression, this study explored sudden gains in supportive-expressive (SE) psychotherapy.	2002	natural
When the authors controlled for the quality of other social relationships, not getting along with one's spouse was related to 6 disorders, with the strongest associations found for generalized anxiety disorder, major depression, panic, and alcohol problems; 4 associations remained significant when they controlled for comorbid disorders.	2000	natural
There was a statistically significant relationship between anxiety, depression, and functional somatic symptoms, independent of age and gender.	2004	natural
Age was positively associated with Czech mens 1999 depression (the older panel members compared with the middle-aged members) and negatively with womens problem behavior prior to controls.	2001	natural
The authors tested a stress-sensitization version of a diathesis-stress approach to depression.	2000	natural
Having strong communal values was positively related to suicide ideation and depression.	2000	natural
Change in emotional exhaustion over time showed significant individual variability, whereas change in depression showed little individual variability.	2004	natural
Factor analysis revealed that the factor loading for the BDI-S was congruent with dimensions of depression reported in the literature.	2004	natural
Experiencing both housing and financial difficulties was a significant risk factor for depression in women with secondary education, but not for those without secondary education.	2004	natural
Compared to participants who were not at-risk for depression, participants who were at-risk planned activities less carefully and their plans were realized less fully.	2001	natural
Effects of negative and positive events on subsequent changes in depression were investigated in a prospective design.	2004	natural
Nevertheless, clinicians may prefer to use the GDS when assessing depression in older women, as specific questions found on the GDS may be more relevant to that specific population.	2001	natural
Fatigue was predicted by both physiologic and psychological risk factors, whereas depression was predicted by only psychological risk factors.	2002	natural
Comparison of the two theories suggests that their cognitive vulnerability-stress components overlap largely in the prediction of depression.	2004	natural
The following limitations are present: first, we have not taken into consideration comorbidity of other axis I disorders, especially major depression.	2004	natural
Male depression with onset after 40 had a significantly shorter duration of illness and fewer patients with atypical features than male depression with onset before 40.	2000	natural
Six different cognitive tests and the Heck Depression Inventory (BDI) were given to 3,572 active community residents aged 49 to 93 years.	2002	natural
The vascular depression theory of latelife depression suggests that people with cerebrovascular risk factors (CVRFs) have an increased probability of experiencing depression.	2003	natural
Child severe physical assault was significantly associated with parent characteristics (maternal depression and partner violence); and child characteristics (SGA).	2004	natural
Adolescents from a residential inpatient facility completed the autobiographical memory test alongside measures of depression and hopelessness.	2001	natural
Gender and perceived health were related to all symptom categories independently of each other, and when the effects of various symptom categories were taken into account in the regression analysis, the depression and tension symptom categories could predict about 50 of the explanation.	2004	natural
Patients whose depression is refractory to cognitive behavior therapy and sertraline, two standard treatments for depression, are at high risk for late mortality after myocardial infarction.	2004	natural
Findings suggested that understanding their experience of conflicting cultural expectations, distinctions between psychosocial, spiritual, physical health problems and communication problems (general and culture specific) were central to these women's experiences of depression The implications of results for services are discussed and limitations of the study considered in line with criteria developed for constructivist research.	2002	natural
The three-component model for the care of patients with depression is a system of widely applicable, easily transported strategies and materials to address dissemination.	2002	natural
These findings suggest that treatment for depression is associated with reductions in the severity of fatigue symptoms, and that this relationship is due primarily to treatment related changes in mood.	2003	natural
In attempting to understand the familial basis of depression, most studies have focused on broad indices of depression and mood change.	2004	natural
This article reports on the relations between depression and stages of change for smoking cessation.	2001	natural
Ninety-eight children (67 physically abused, 31 sexually abused) were administered a depression inventory, the Post-Traumatic Stress Disorder-Reaction Index (PTSD-RI), and Children's Attributional Style Questionnaire (CASQ).	2002	natural
The authors suggest that the maha mantra has potential in addressing problems related to stress and depression and that it be considered as one possible component of a spiritual approach to social work practice.	2003	natural
Family and neighborhood variables in adulthood were significantly related to change in depression for females, and peer variables were significant for both males and females.	2004	natural
938 STI clinic patients were offered the Hospital Anxiety and Depression Scale (HAD) and staff rated each patient's psychological health.	2002	natural
