For patients with neurotic disorders, self-esteem did not predict variance in posttreatment depression in addition to that explained by pretreatment depression.	2002	natural
A sample of 143 college students completed measures of suicide ideation, daily stress, depression, general hopelessness, and social hopelessness.	2003	natural
The level of depression, anxiety, and functional and occupational impairment did not remit spontaneously in our untreated depressed HD patients.	2004	natural
The DSM-IV concept of Major Depression and the ICD-10 criteria for depression was not influenced by patients' age.	2001	natural
It is proposed that both drug-induced and developmental abnormalities in the integrity of OFC neurons may lead to deficits in social behavior or other behavioral pathologies, possibly including depression.	2004	natural
Interferon treatment, particularly with the alpha subtype, is unquestionably linked with depression, but the strength of association is uncertain because of erratic ascertainment and pretreatment co-morbidity.	2000	natural
Late-onset depressive disorder is associated with white matter lesions and neuropsychological deficits that in some studies are linked to a poorer outcome for depression.	2004	natural
Phrenophobia was positively associated with anxiety and depression, after adjusting for the other symptom and fears of physical sensations.	2004	natural
This study developed two self-report scales to measure forms and functions of self-criticism and self-reassurance and explore their relationship to depression.	2004	natural
The ED group scored significantly higher than controls on all shame areas when depression was controlled.	2003	natural
Furthermore in cases of postpartum depression the mothers dysfunction has a long-term effect on both the childs development and family interaction.	2004	natural
SAD either has no relationship to social deprivation or is associated with affluence and this distinguishes it from non-seasonal depression.	2002	natural
Family dysfunction, ineffective social support, nonpositive expectations concerning the future, low levels of religiosity, low levels of education and income, and lack of agreement with the decision to immigrate were significantly associated with high levels of depression and suicidal ideation.	2000	natural
Three new antidepressants were used in treating posttraumatic stress disorder (PTSD) and symptoms of depression in Bosnian refugees.	2001	natural
In the course of treatment, the authors learned that dissociative fugue has a complex internal structure, is often preceded by major depression, and can be difficult to differentiate from other dissociative disorders.	2003	natural
The ENRICHD study is a multicenter, randomized, controlled clinical trial of a cognitive-behavioral treatment for depression and low social support in post-MI patients.	2001	natural
Conversely, they tended to report more somatic symptoms, especially at higher levels of depression.	2002	natural
However, consistent with Lester's study, these correlations were not significant when depression was controlled for.	2000	natural
One week later, participants viewed magazine images, before and after which they completed assessments of state body satisfaction, state depression, state anxiety and state anger.	2002	natural
The clinical utility of the HADS in the assessment of anxiety and depression in CFS appears to be fundamentally compromised by the presence of a three-dimensional underlying factor structure.	2003	natural
Depression affects only a minority of older adults, but is a costly illness in terms of suffering, excess medical disability, increased use of health services, and mortality.	2000	natural
This study aimed to document changes in blood pressure (BP) reactivity and heart rate variability (HRV) following CABG surgery, and to determine the impact of mood state, particularly anxiety and depression upon cardiovascular functioning.	2003	natural
Contrary to expectations, the level of depression was not higher in AR compared to NA youth when differences in antisocial behavior between NA and AR were controlled.	2004	natural
Implications concerning mechanisms, course, and consequences of different forms of adolescent depression are presented.	2001	natural
Both ethnic groups reported a greater likelihood of suicide when imagining depression, regardless of religiosity.	2003	natural
The aims of this study were to determine whether attending regular massage classes could reduce maternal depression and also improve the quality of mother-infant interaction.	2001	natural
In a logistic regression analysis, higher depression score at the time of the SCID-II interview and shorter duration of the illness were weakly related to a higher frequency of PDs.	2003	natural
To investigate the clinical characteristics of depression in preschool children.	2003	natural
Survey data were collected on body image concerns, self-esteem, depression, anxiety, obsessive-compulsive symptoms, and skin picking.	2002	natural
These findings suggest that treatment for depression is associated with reductions in the severity of fatigue symptoms, and that this relationship is due primarily to treatment related changes in mood.	2003	natural
Types of adult crying (healthy crying, crying for no reason, prolonged or frequent crying associated with depression or physiological disorders) and types of inhibited crying (healthy tearlessness, pervasive emotional control, detached tearlessness, and displaced crying) reflect attachment style and may, in addition, be assessed as healthy or symptomatic of psychological or physiological disorders or a combination.	2000	natural
Typical and masked symptoms of depression were investigated in three groups: depressed (who met all MDD criteria except duration criterion), those with nonaffective psychiatric disorders (who met criteria for attention-deficit/hyperactivity disorder and/or oppositional defiant disorder), and those who did not meet criteria for any psychiatric disorder.	2003	natural
The subjects who experienced functional decline showed a larger decrease in the number of relatives, friends, and neighbors having frequent contacts, a larger decline in life satisfaction, and a larger increase in depression than those without functional decline.	2000	natural
Depression treatment by General Practitioners (GPs) and patient outcomes improved significantly after a comprehensive 20-h training program of GPs.	2004	natural
Analyses of the relationship between perfectionism and depression and selfesteem found that as students' personal standards increased, their levels of depression decreased and selfesteem increased.	2000	natural
Psychopathology was examined using ten scales from the Adolescent Psychopathology Scale (APS; Reynolds, 1998a) including: Major Depression, Conduct Disorder, Substance Abuse, Schizophrenia, Adjustment Disorder, Anorexia Nervosa, Borderline Personality Disorder, Obsessive-Compulsive Personality Disorder, Schizotypal Personality Disorder, and Avoidant Personality Disorder.	2001	natural
Results suggested that previous bipolar disorder might leave negative problem-solving attitudes and hopelessness scars, whereas major depression and anxiety disorders may not.	2003	natural
The anxiety, depression, and self-denigrating tendencies that had brought the client to therapy called for careful timing, some audacious advice, and several standard cognitivebehavioral procedures.	2002	natural
Participants with IBS differed from both healthy participants and participants with asthma or eczema, making higher estimates of their own lifetime health risks, with differences between healthy individuals and individuals with IBS remaining after controlling for physical symptoms, illness attitudes, anxiety and depression.	2004	natural
The objective of the study was to establish the frequency of depression during pregnancy and the puerperium, and its relationship to marital disharmony and sociodemographic variables.	2000	natural
We have measured platelet MAO in 1551 subjects, recruited from the Australian NHMRC Twin Registry, who have provided information on alcohol use and dependence, smoking, conduct disorder, depression, attempted suicide, panic disorder and social phobia.	2000	natural
Twenty-five adolescents with moderate to severe major depression, lasting an average of 8 months, received 12 weeks of IPT.	2001	natural
Of the 49 eligible women, four were diagnosed with major depression and 16 with an adjustment disorder.	2003	natural
High school students (n = 289; 50.5 male; 21.5 minority) completed a depression inventory and predicted acceptance ratings they expected to receive from peers.	2001	natural
Higher IQ led to greater numbers of social contacts, which was associated with fewer reported symptoms of depression.	2002	natural
Individuals in their 60s (n = 11), 70s (n = 58), and 80s (n = 28) completed the Geriatric Depression Scale and the SF-12 Health Survey.	2004	natural
The purposes of the present study were threefold: to assess the prevalence levels of anxiety, depression, and suicidal ideation in a sample of first-generation Mexican migrant farmworker women in the Midwest United States; to examine the variables that predict depression and suicidal ideation; and to qualitatively--through interviews--determine the stressors experienced by migrant farmworker women.	2003	natural
This research has produced information which indicates that counselling trainees experience significant disruptions in their relationships with their family and friends; that a sizeable number of trainees report feelings of depression and or stress; and that counselling trainers have not addressed these issues effectively.	2001	natural
However, in intention to treat analyses, adolescents who had therapy from trained social workers had a similar level of depression post treatment (mean depression score 17.5, 95 CI 11.8 to 23.3) to those who did not have such therapy (mean depression score 16.7, 95 CI 11.3 to 22.1).	2004	natural
A large literature argues for the Chinese--whether in mainland China or elsewhere--being highly likely to express depression somatically, leading to predictable detection and diagnostic difficulties.	2001	natural
The three groups were compared on a set of personality scales (e.g. general anxiety, depression, test anxiety, neuroticism, loneliness, self-esteem and extraversion), physical well-being factors (e.g. chronic health, eating/drinking/smoking, agitation symptoms, somatic symptoms, and global sickness), and academic performance indicators in medical school (e.g. grade point averages, class rank, and medical licensing examinations), and ratings of clinical competence in postgraduate medical training.	2003	natural
A review of the methodology and results of 9 controlled studies on the acute treatment of bipolar depression and the risk of switches into (hypo)mania is presented.	2000	natural
Actigraphy was carried out on 16 patients with uncomplicated FM, 6 FM patients with comorbid depression, 9 patients with recurrent major depression, and 28 healthy controls over a period of 5-7 days.	2002	natural
Results indicated more similarities (life satisfaction, life regrets, purpose in life, intimacy, substance abuse) than differences (connectedness, depression, selfesteem) between the two groups.	2000	natural
Although the rates of depression were high among the mothers, few eligible mothers agreed to participate.	2004	natural
These data show that the EDA recorded in chronic pain patients with and without co-morbid depression must advantageously be analysed separately.	2004	natural
1994), it is unclear how factors such as age, gender, and level of cognitive functioning may be related to an individual's feelings of depression.	2000	natural
In the present study, we examined the association between depression and the phosphate derivative of vitamin B6 in plasma, pyridoxal phosphate (PLP).	2004	natural
There was great variability between GPs in their ability to detect depression, and their preparedness to prescribe antidepressants.	2002	natural
The results confirmed that such processing is very common before an anticipated feared social event and a significant correlation (=0.49) between anticipatory processing scores and social anxiety was found, which remained when trait anxiety and depression were controlled.	2004	natural
Most depressive disorders were comorbid with other DSM-IV disorders, depression usually occurring secondary to other disorders.	2002	natural
Findings also suggest that maternal depression acts as a mediating mechanism for child behavior.	2003	natural
Factor analysis was performed on the Beck Depression Inventory with a university sample to examine its potential multidimensionality.	2003	natural
Although the study examined Navy recruits, the findings are applicable to depression in young people.	2002	natural
In a Turkish sample, 100 suicide attempters, were compared with 60 healthy controls on measures of hopelessness, depression, and suicidal ideation.	2004	natural
MR was employed with a sample of both melancholic (n=8) and non-melancholic (n=9) unipolar depressed patients and healthy controls (n=10) to determine if motor slowing associated with depression might be reflected in slowed motor preparation (as reflected in slope of the MR function) independent of actual motor slowing (overall response time).	2002	natural
People who needed psychotherapy scored significantly higher on the depression and lack of objectivity scales than those who didn't.	2004	natural
The relationship between suicide attitudes and gender, depression, substance problems, serious suicidal ideation/behavior, and first-hand experience with a suicidal peer was examined.	2004	natural
The partial correlation between rumination and depression (controlling for anxiety level) was .20, and the partial correlation between rumination and anxiety (controlling for depression level) was .17.	2002	natural
When such learning disorders are not detected, women and their therapists might not avail themselves of interventions that can help to treat the reading, visual-spatial, organizational, or other neurocognitive deficits, and indirectly help with patterns of anxiety, depression, and low self-esteem.	2003	natural
The SCAS correlated strongly with a frequently used child self-report measure of anxiety and significantly, albeit at a lower level, with a measure of depression.	2003	natural
Lifetime history of depression was also more common in those individuals reporting the withdrawal symptoms of dysphoria (P<.001), insomnia/hypersomnia (P<.05), vivid unpleasant dreams (P<.01), and psychomotor agitation/retardation (P<.01).	2001	natural
The wish for psychosocial support did not correlate with distress (moderate or severe anxiety and/or depression; Kappa = 0.06; P = 0.560).	2004	natural
In a sample of 178 male veterans aged 21-83 years, older adults (> or = 60 years) reported lower overall depressive symptoms on the Beck Depression Inventory (BDI) and anxiety symptoms on the State-Trait Anxiety Inventory than did younger adults ( < 60 years).	2003	natural
Older Puerto Ricans belong to two rapidly growing demographic groups known to have high rates of depression: the aging and Hispanic populations.	2003	natural
In this group, increases in maternal depression, reductions in regular family routines, and smaller increases in job stability and center-based child care occurred.	2003	natural
The Beck Depression Inventory (BDI), State-Trait Anxiety Inventory (STAI), and Multidimensional Anger Inventory (MAI) were used to assess depression, anxiety, and anger.	2000	natural
Caregivers completed scales measuring depression, burden, religiosity, and religious coping.	2002	natural
In this study, the authors tested for associations between stress or symptoms of depression or anxiety and changes in diurnal cortisol patterns in 91 working parents (57 women and 34 men) across the United States.	2004	natural
Results showed that anxiety sensitivity as indexed by the CASI seems to be a hierarchically organized construct with one higher-order factor (i.e., anxiety sensitivity) and three or four lower-order factors, anxiety sensitivity and trait anxiety were strongly correlated, anxiety sensitivity was substantially connected to symptoms of anxiety disorders (in particular of panic disorder and agoraphobia) and depression, and anxiety sensitivity and trait anxiety both accounted for unique proportions of the variance in anxiety disorder symptoms.	2001	natural
With the recent appearance of SSRI and SNRI, medication options with respect to depression have broadened.	2003	natural
Consistent with predictions, cognitively high-risk participants had higher lifetime prevalence than low-risk participants of major and hopelessness depression and marginally higher prevalence of minor depression.	2000	natural
Disclosure and its association to social support and depression varied for different relationships and these differences have implications for mental_health and coping interventions.	2003	natural
Depression is the leading cause of disease-related disability among women in the world today.	2003	natural
While tic severity was marginally significant as a predictor of psychiatric hospitalization (p < .05), major depression (p < .016) and bipolar disorder (p < .001) were robust predictors of psychiatric hospitalization, even after statistical adjustment for collinearity and correction for all other variables assessed.	2000	natural
For MCC, emotion-focused coping and child behavior both predicted depression, anxiety, and GMH; concurrent stress and strain mediated the relationship between child behavior and depression and between emotion-focused coping and each measure of adjustment.	2004	natural
There was a significant effect for time in both groups, indicating an improvement in PTSD symptoms, depression, sleep, and quality of life over time.	2004	natural
Based on basic behavioral theory and recent evidence that the behavioral component may be the active mechanism of change in cognitive-behavioral treatments of clinical depression, the authors designed a treatment to systematically increase exposure to positive activities, and thereby improve affect and corresponding cognitions.	2001	natural
A multi-axial evaluation was completed using the Newcastle 1 Depression Rating Scale from 1965 for melancholia (N1) in a subsample of patients (n = 439).	2003	natural
The full models including characteristic pain and depression explained 49 and 20 of the variance in ischemic pain threshold and tolerance, respectively.	2004	natural
The Depression Interview and Structured Hamilton (DISH) is a semistructured interview developed for the Enhancing Recovery in Coronary Heart Disease (ENRICHD) study, a multicenter clinical trial of treatment for depression and low perceived social support after acute myocardial infarction.	2002	natural
Patients suffering from melancholic depression showed significantly increased S-100B levels compared to healthy controls while non-melancholic patients demonstrated normal levels.	2001	natural
Following statistical adjustment for age, body mass index (BMI), HRT status, and depressive symptoms, the interaction of depression and HRT explained 16 variance in total cholesterol and 17 variance in low-density lipoprotein cholesterol (Ps<.01).	2004	natural
This study investigated the moderating effect of social support, hardiness, and the components of the hardiness scale of commitment, challenge, and control on the relationship between stress and depression.	2000	natural
The responses of IL-6 and sIL-1RA following delivery are amplified in women who previously suffered from major depression.	2001	natural
Although there is increasing support for the hypothesis that negative cognitive styles contribute vulnerability to depression, it remains unclear how best to conceptualize the heterogeneity in cognitive vulnerability to depression.	2004	natural
Teachers rated the PDD group as having more severe anxiety and depression symptoms than parents.	2004	natural
Parallel research on economic inequalities and depression has just begun.	2003	natural
High levels of self-reported distress were identified with 43 and 10 of patients scoring as probable cases on the Hospital Anxiety and Depression Scale (HADS) subscales of anxiety (mean 9.3+/-4.9) and depression (mean 4.8+/-3.7), respectively.	2001	natural
This is a small proportion of the estimated pound100 million cost of switching to first-line prescribing of SSRIs for depression.	2000	natural
Agoraphobic behavior associated with panic attack is familial and associated with comorbid major depression.	2004	natural
Results indicated that higher levels of chronic stress 6 months prior to each follow-up predicted greater depression severity at follow-up, controlling for depression severity at the start of the chronic stress assessment.	2004	natural
It was suggested that transient mood state did not bias self-referent processing in depression, and Beck's schema hypothesis was supported.	2002	natural
The Edinburgh Postnatal Depression Scale (EPDS) has been validated and used extensively in screening for depression in new mothers, both in English speaking and non-English speaking communities.	2001	natural
The others were the Brief COPE (Carver, 1997), the Center for Epidemiological Studies--Depression Scale (Radloff, 1977), and an abbreviated version of the Profile of Mood States (McNair, Lorr, & Droppelman, 1971).	2000	natural
There was some support for proposals that depression and schizotypy may bring out delusions in OCD and some evidence for the utility of categorising OCD according to the number of obsessions a subject has.	2000	natural
White and African American students in Grades 6-12 (N=822) completed measures of social economic status (SES), body mass index (BMI), depression, current-ideal body image discrepancy, eating attitudes, dieting frequency, dietary intake, and activity level.	2002	natural
Aside from differences anxiety due to cancer type, patients' illness characteristics appear to be risk factors in patients' but not relatives' depression and anxiety.	2004	natural
In an ongoing study, perimenopausal women diagnosed with major depression were randomly assigned to one of three treatment conditions: fluoxetine 10-20 mg alone, estradiol patch 0.1-0.2 mg alone or the combination of fluoxetine 10-20 mg and estradiol patch 0.1-0.2 mg.	2003	natural
Various clinical observations in humans suggest a possible pathophysiological link between depression and disturbances in circadian rhythmicity.	2001	natural
40 older residents living in three upper socioeconomic retirement centers were screened for hearing loss, hearing handicap, and depression.	2001	natural
The finding of a longitudinal relationship between depression and functional outcomes in older adults with a compromised health status provides a rationale for treatment of chronic physical diseases as well as depression in depressed chronically ill elderly, in order to prevent a spiralling decline in psychological and physical health.	2001	natural
The developmental stories of these individuals, largely in their own words, are situated in one transitional developmental period, and the narratives allude to sexual abuse, sexual orientation, relatively early marriage, or depression.	2001	natural
The aggregate levels of psychological distress and depression, anxiety, and obsessive symptoms were significantly higher for women than for men.	2001	natural
We begin with a brief overview of the prevalence and associated personal, societal, and systemic burdens of anxiety and depression.	2004	natural
Important issues about the model of interaction between stress and depression are discussed.	2002	natural
The aim of the study was to find out the validity and reliability of the Turkish version of the Edinburgh Postnatal Depression Scale (EPDS) and to determine the optimum cut-off value for postnatal depression.	2004	natural
However, this suggestion needs to be tested with prospective studies showing whether AM recall style becomes more specific as a result of an episode of depression.	2004	natural
Depression in the elderly was found to be associated with a variety of risk-factors in cross sectional designs.	2000	natural
The goals of the intervention were to decrease feelings of depression, anxiety, perceived stress, and stigma and to increase perceived social support.	2004	natural
Results demonstrated that symptoms of depression mediated the relationship between global attributions for negative events and illness.	2002	natural
Conversely, self-focused attention can be adaptive, facilitating self-knowledge and the development of the alternative functional interpretations of negative thoughts and feelings on which cognitive therapy of depression depends.	2004	natural
Comparisons between changes in coping styles were made between groups of adolescents; those considered at-risk for and resistant to depression, those neither resistant or at-risk for depression, and a male and female group.	2000	natural
In both genders, no significant class differences were found in depression, health status or prevalence of chronic illness.	2003	natural
The finding that cognitive performance was not decreased in individuals with previous depression suggests that cognitive dysfunction is a state phenomenon in depression.	2001	natural
This is most clear with respect to feelings of depression, less so with respect to the use of psychotropic drugs.	2002	natural
Bivariate and multivariate relationships between depression and demographics, health, social stress and support, and religiosity were explored.	2003	natural
However, some individuals do appear at risk of depression in adulthood.	2003	natural
However, links between BIS and depression appeared state-dependent.	2001	natural
