Social workers, compared to general population participants, attributed higher levels of mental_illness at all levels of target involvement.	1983	natural
22 logic of dollar-wise administrators who needs to forsee the cost-benefits that will accrue to the community from the work on prevention of mental_illness.	1981	natural
Based on ego-psychology orientation, mental_illness is classified in terms of premature ego development, ego distortions, ego deviations, ego regression, and ego defects.	1981	natural
In their commentary they use a bio-psychosocial approach to mental_illness.	1980	natural
When mental_illness was simulated, there were more dramatic responses including the use of blood, mutilation, and hatred.	1981	natural
In-patient data show high rates for mental_illness in the Republic of Ireland, particularly for schizophrenia. '	1980	natural
Johnson totally ignores the theoretical and empirical basis for the definition of mental_illness that is used.	1980	natural
Patients with harsh, pessimistic views about mental_illness had more severe psychopathology and did less well over the period of follow-up.	1980	natural
Medical literature showed a surprising lack of interest in mental_illness associated with old age or even in medical problems other than the obvious ones of debility, and there is no way for us to penetrate the silence.	1984	natural
Subjects used the term mental_illness less than the term emotionally disturbed in the case of moderately deviant behavior.	1980	natural
Groups differing in social support were compared on scales measuring attitudes toward mental_illness and personal feelings of anomy.	1982	natural
It is suggested that increasing evidence of neurophysiological etiologies for mental_illness must be taken into account in rationalizing the effectiveness of occupational therapy for psychiatric disorders.	1983	natural
There was a positive relation between mental_illness (disability degree), depth of depression and weight gain.	1981	natural
Procedures were designed to elaborate the position that the cues involved in making mental_illness judgments about a target are not necessarily those associated with mental disease as traditionally defined; that the cues correspond with judgments of mental_illness only in some cases and combinations, and that observers' construct systems affect judgments.	1981	natural
Neuroendocrine tests are now available for studying monoamine function in the brains of patients with mental_illness.	1980	natural
Stresses of medical practice, recognized as severe, do not increase morbidity and mortality of physicians due to physical illness; the rates of substance dependence, divorces, and mental_illness, however, exceed those in the general population.	1982	natural
The children are at greater risk for mental_illness than the parents because theirs is the more dependent role in the relationship.	1981	natural
Using a vignette format, components of attitudes towards mental_illness were assessed in 413 high school students.	1983	natural
A stratified sample (race, sex, and social class) of 469 laymen from two North Carolina communities responded to a 190-item MMPI-based questionnaire with the degree of mental_illness concern evoked by each item.	1980	natural
First, his precise definition of mental_illness is criticized because it excludes diagnostic groups comprised largely of males (personality disorders and substance abusers).	1980	natural
The attitudes of 309 Anglo, Spanish American, and Black American subjects toward mental_illness were investigated.	1981	natural
Goals included increased awareness of nonverbal communication and projection, understanding of manifestations of mental_illness, understanding of students' personal values, understanding of real differences and similarities between students and clients, understanding of the therapist leadership role, and assessment of different frames of reference.	1983	natural
One proposal concerning the manner in which observers apply the mental_illness label to another is that the label is a residual explanation, applied by the observer only after other possible causes have been considered and rejected.	1980	natural
While a low level of involvement, as portrayed in videotaped scenarios, prompts attribution of mental_illness, other features of implicit personality theories also relate to greater or lesser attribution of mental_illness.	1983	natural
The medieval sources indicate that the authors were well aware of the proximate causes of mental_illness, such as humoral imbalance, intemperate diet and alcohol intake, overwork, and grief.	1984	natural
From the perspective of the labelling theory of mental_illness, the aim of this paper was to study some consequences on other people's perception of individuals who have been exempted on this basis.	1983	natural
Based on previous research on mental_illness, mortality differentials, and the quality of life, it is hypothesized that widowhood has an adverse impact on well-being, and that this relation is stronger for men than women.	1982	natural
Immunoglobulin levels were measured in 77 male patients with chronic mental_illness at a Veterans Administration Hospital.	1980	natural
None of them was correlated nor with organic lesions or medical seriousness, neither with psychopathic background, previous mental_illness or treatment by corticoidic drugs.	1980	natural
The results suggest that while attitude components are generally not highly related, perceived severity of mental_illness is positively related to attribution to physical causes, and negatively related to social acceptability.	1983	natural
One hundred and ninety-two subjects (128 male and 64 female) rated their willingness to disclose symptoms of a personal nature, general nature, and mental_illness nature to a male or female physician who had been described as being either high or low in technical competence and either high or low in social competence or beside manner.	1980	natural
Independent of the state of the subject, a positive correlation between commonality and repetition indicates a continuity between normalcy and mental_illness, the absolute value of these two parameters being a measure of a cognitive process.	1982	natural
Work in this area is critically reviewed and methodological problems are identified These problems may lead to underestimating mental_illness among males.	1984	natural
The results indicated that the label of mental_illness was stigmatizing even in the absence of bizarre behaviors.	1984	natural
Mental health professionals have been described as biased in the evaluation of mental_illness, almost always in favor of illness.	1980	natural
Two levels of mental_illness expectany were obtained by changing the context of the interviews.	1980	natural
In only 9 (16) of these descriptions did the sources attribute the mental_illness to sin or wrongdoing, and in these cases the medieval authors appeared to use this attribution for its propaganda value against an enemy of their patron saints, their monastery lands, or their religious values.	1984	natural
In other studies the overall mental_illness level of perceived persons was found to vary with selected independent variables.	1980	natural
180 college students were asked to make judgments assumed to correspond with judgments about the mental_illness of targets who projected various combinations of cues in attire and verbal messages.	1981	natural
Traditional theories of mental_illness have attributed causality to such widely divergent views as intrapsychic mechanisms, biological processes, and interpersonal events.	1982	natural
Patterns of reflective LEM's have been correlated to a number of cognitive and personality variables, bu the relationship to sex, education, and mental_illness is unclear.	1980	natural
Analyses of scores taken from semantic differential scales, a behavior check list, and a question about psychiatric condition showed a tendency for the targets with in-congruent attire and message to be judged as with more mental_illness.	1981	natural
Compared with professionals, cur anderos were found to be reluctant to label the disorders as mental_illness.	1980	natural
Students see depression but not mental_illness as a predisposing aspect.	1980	natural
The delivery of mental_health services was extensively researched; however, a wide diversity of other topics such as work, substance abuse, and attitudes toward mental_illness were also represented.	1980	natural
Over the last decade, sociological research on sex and mental_illness has found that females have higher rates of mental_disorder.	1984	natural
Our results show that there are several distinct types of mental problems, rather than one underlying dimension of mental_illness.	1983	natural
Freud (1930) made it clear that the source of man's biological and cultural evolutionary progress--self-denial--was also responsible for the tragedy of the human condition, namely, repression, eternal psychic ambivalence, and chronic mental_illness.	1983	natural
There were no significant relationships between obesity and present or previous mental_illness (present disability degree, depth of depression, frequency of anxiety attacks, phobia grade, present use of psychotropic drugs, maximum disability degree during life, use of psychotropic drugs during life, contact with a psychiatrist) when due allowance was made for age and social class.	1981	natural
This study investigated the relationship between sex, physical attractiveness, and perceived risk for mental_illness.	1982	natural
A scale, the Mental Illness Behaviors Prediction Scale (MIBPS) was developed for use in studies of ascribed mental_illness.	1980	natural
Over the last decade, sociological research on sex and mental_illness has found that females have higher rates of mental_disorder.	1984	natural
Social workers, compared to general population participants, attributed higher levels of mental_illness at all levels of target involvement.	1983	natural
Dependent variables were attitudes toward seeking mental_health services, opinions about mental_illness, and tendencies to view mental_health problems as spiritual.	1984	natural
One hundred and ninety-two subjects (128 male and 64 female) rated their willingness to disclose symptoms of a personal nature, general nature, and mental_illness nature to a male or female physician who had been described as being either high or low in technical competence and either high or low in social competence or beside manner.	1980	natural
Procedures were designed to elaborate the position that the cues involved in making mental_illness judgments about a target are not necessarily those associated with mental disease as traditionally defined; that the cues correspond with judgments of mental_illness only in some cases and combinations, and that observers' construct systems affect judgments.	1981	natural
He relates how the concept of craziness was progressively replaced by this of mental_illness and how this last concept was no more synonymous of draison.	1982	natural
Although victims continued to show effects of the disaster after 12 months, none developed a major mental_illness for the first time.	1983	natural
The modern stereotype that in the Middle Ages there was a general belief that mental_illness was caused by sin is reviewed.	1984	natural
The aim of this project is to provide a meeting place for people concerned with the reality of mental_illness where they would reflect on different aspects of mental_illness and learn how to read to its manifestations in everyday life.	1980	natural
Factor analysis of the items revealed 3 independent factors: External Attribution (i.e. blaming the crime on social circumstances, victims, society); Mental-Element Attribution (i.e. blaming responsibility for the crime on mental_illness, poor self-control, distorted perception); Guilt-Feeling Attribution (i.e. feelings of remorse, regrets, need for punishment).	1984	natural
180 college students were asked to make judgments assumed to correspond with judgments about the mental_illness of targets who projected various combinations of cues in attire and verbal messages.	1981	natural
Groups differing in social support were compared on scales measuring attitudes toward mental_illness and personal feelings of anomy.	1982	natural
In response to a U.S. Government accusation of political bias in social science research discussed by Hogan and Schroeder in 1981, 23 introductory psychology textbooks were examined for evidence of left-wing rhetoric in their discussions of mental_illness.	1984	natural
Case histories point out the conflict of values and cultural attitudes about mental_illness among refugees due to their changed environment and life style.	1981	natural
This study investigated the relationship between sex, physical attractiveness, and perceived risk for mental_illness.	1982	natural
Traditional theories of mental_illness have attributed causality to such widely divergent views as intrapsychic mechanisms, biological processes, and interpersonal events.	1982	natural
The results indicate that socioeconomic conditions alone are insufficient in explaining the prevalence of mental_illness within the Hispanic inpatient population.	1982	natural
The frequency of mental_illness was higher in the Klinefelter males with karyotype 47,XXY than in the remainder.	1980	natural
In 1960, changing concepts in the fields of the aetiology and treatment of mental_illness, the hugeness of mental hospitals and the transformation of Quebec society from rural to urban hasten the re-organization of psychiatric services, without eliminating the risk of excluding the mentally ill.	1981	natural
For centuries, a relationship between physical illness and mental_illness has been assumed.	1984	natural
Goals included increased awareness of nonverbal communication and projection, understanding of manifestations of mental_illness, understanding of students' personal values, understanding of real differences and similarities between students and clients, understanding of the therapist leadership role, and assessment of different frames of reference.	1983	natural
The authors examined 57 descriptions of mental_illness (madness, possession, alcoholism, epilepsy, and combinations thereof) from pre-Crusade chronicles and saints' lives.	1984	natural
The results suggest that while attitude components are generally not highly related, perceived severity of mental_illness is positively related to attribution to physical causes, and negatively related to social acceptability.	1983	natural
Recent utilization data on first admissions to public mental hospitals are presented Contrary to most work in the field, it is argued that mental_illness among males, relative to females, has increased dramatically.	1984	natural
The attitudes of 309 Anglo, Spanish American, and Black American subjects toward mental_illness were investigated.	1981	natural
They also appear to have certain characteristic ideas about mental_illness that need to be addressed in any attempt to counsel such clients.	1984	natural
The results reflected systematic race and social class differences in the behavioral bases for mental_illness attributions--differences not explainable by overall differences in toleration for deviance.	1980	natural
This article teases out the aspects of unregulated fertility that are likely to result in an unwanted child and examines the evidence that suggest their relationship to mental_illness.	1982	natural
In mental_illness, however, the vulnerability stems from inner sources.	1982	natural
However, results clarified that it is the lack of masculine instrumentality in the personality, not the feminine role per se, which is implicated in mental_illness.	1984	natural
Interviews indicate that children were familiar with simple concepts associated with mental_illness, i.e., crazy, nuts, and cuckoo, but that few children knew more sophisticated terms or psychiatric labels.	1982	natural
Work in this area is critically reviewed and methodological problems are identified These problems may lead to underestimating mental_illness among males.	1984	natural
The present study was an attempt to construct an attitude scale to measure the radical psychosocial or libertarian position about mental_illness and mental_health practices.	1980	natural
Based on previous research on mental_illness, mortality differentials, and the quality of life, it is hypothesized that widowhood has an adverse impact on well-being, and that this relation is stronger for men than women.	1982	natural
Insofar as there is a recognizable general social skill, everyday observation suggests that this usually improves during the adult years and does not deteriorate in later life unless sensory loss is severe or mental_illness strikes.	1983	natural
A review of existing studies indicates that physicians compare favorably with the general population in mortality from physical illness but unfavorably with regard to mental_illness, notably the affective, suicide and addiction.	1982	natural
A stratified sample (race, sex, and social class) of 469 laymen from two North Carolina communities responded to a 190-item MMPI-based questionnaire with the degree of mental_illness concern evoked by each item.	1980	natural
Results were interpreted to indicate another link between physical attractiveness and mental_illness.	1982	natural
Prior to the release of this film, 146 college students were administered a questionnaire on attitudes towards mental_illness.	1983	natural
Patterns of reflective LEM's have been correlated to a number of cognitive and personality variables, bu the relationship to sex, education, and mental_illness is unclear.	1980	natural
The authors report an experience on the assessment of mental_illness prevalence rate in the socio-professional population of four French provinces.	1981	natural
In only 9 (16) of these descriptions did the sources attribute the mental_illness to sin or wrongdoing, and in these cases the medieval authors appeared to use this attribution for its propaganda value against an enemy of their patron saints, their monastery lands, or their religious values.	1984	natural
Johnson totally ignores the theoretical and empirical basis for the definition of mental_illness that is used.	1980	natural
There was a positive relation between mental_illness (disability degree), depth of depression and weight gain.	1981	natural
Parents whose child abusive behavior is a function of extremely maladaptive resolutions of major life issues fall into the hostile-aggressive, passive-dependent, and severe mental_illness typologies, where the prognoses are considerably more guarded.	1983	natural
No differences were found between patients committed under the old law (which stipulated that the presence of mental_illness was a sufficient criterion) and patients committed under the new law (which requires the presence of serious physical harm as an essential criterion).	1984	natural
Results of multiple regression analyses, in which sex, rated physical attractiveness of the subject, type of mental_disorder, and their interactions served as predictors, and perceived risk for mental_illness served as the criterion indicated that decreased attractiveness was associated with an increasing belief in susceptibility to mental_illness (p less than .05).	1982	natural
The role of cultural norms in determining the attribution of mental_illness, and the limitations of Euro-American criteria of psychoses, are discussed in the light of these findings.	1982	natural
The medieval sources indicate that the authors were well aware of the proximate causes of mental_illness, such as humoral imbalance, intemperate diet and alcohol intake, overwork, and grief.	1984	natural
Insofar as there is a recognizable general social skill, everyday observation suggests that this usually improves during the adult years and does not deteriorate in later life unless sensory loss is severe or mental_illness strikes.	1983	natural
The modern stereotype that in the Middle Ages there was a general belief that mental_illness was caused by sin is reviewed.	1984	natural
The implications of these findings for rehabilitation strategies in the management of severe mental_illness are discussed.	1983	natural
These studies continue the exploration of variables related to a person's use of the mental_illness categorization.	1983	natural
There was a positive relation between mental_illness (disability degree), depth of depression and weight gain.	1981	natural
The authors examined 57 descriptions of mental_illness (madness, possession, alcoholism, epilepsy, and combinations thereof) from pre-Crusade chronicles and saints' lives.	1984	natural
Two levels of mental_illness expectany were obtained by changing the context of the interviews.	1980	natural
One hundred and ninety-two subjects (128 male and 64 female) rated their willingness to disclose symptoms of a personal nature, general nature, and mental_illness nature to a male or female physician who had been described as being either high or low in technical competence and either high or low in social competence or beside manner.	1980	natural
In mental_illness, however, the vulnerability stems from inner sources.	1982	natural
The results indicate that socioeconomic conditions alone are insufficient in explaining the prevalence of mental_illness within the Hispanic inpatient population.	1982	natural
As Horwitz (1979) notes, the conflict between the labelling explanation of mental_illness and the psychiatric explanation of mental_illness appears to be unresolved.	1982	natural
Demonstrated that through brief demythologizing, college students' (N = 32) attitudes toward mental_illness could be changed significantly in a non-medical model or psychosocial direction and that this attitude change apparently induced students to report a significantly reduced fear of contracting mental_illness.	1980	natural
Subjects used the term mental_illness less than the term emotionally disturbed in the case of moderately deviant behavior.	1980	natural
Patients varied in terms of their apparent degree of mental_illness, status on admission to the hospital (voluntary vs. involuntary), and their decisions to consent to or refuse the procedure.	1981	natural
When mental_illness was simulated, there were more dramatic responses including the use of blood, mutilation, and hatred.	1981	natural
Using a vignette format, components of attitudes towards mental_illness were assessed in 413 high school students.	1983	natural
Based on previous research on mental_illness, mortality differentials, and the quality of life, it is hypothesized that widowhood has an adverse impact on well-being, and that this relation is stronger for men than women.	1982	natural
Later, jail records would indicate that the victim did not have a history of mental_illness or previous suicide attempts.	1983	natural
Procedures were designed to elaborate the position that the cues involved in making mental_illness judgments about a target are not necessarily those associated with mental disease as traditionally defined; that the cues correspond with judgments of mental_illness only in some cases and combinations, and that observers' construct systems affect judgments.	1981	natural
The study thus indicates that mental_illness, especially depressive disorder, implies a considerably increased risk.	1981	natural
A scale, the Mental Illness Behaviors Prediction Scale (MIBPS) was developed for use in studies of ascribed mental_illness.	1980	natural
The MIBPS is comprised of fifteen items, each of which describes a situation and four alternative behaviors scaled for mental_illness level.	1980	natural
Social workers, compared to general population participants, attributed higher levels of mental_illness at all levels of target involvement.	1983	natural
It is suggested that increasing evidence of neurophysiological etiologies for mental_illness must be taken into account in rationalizing the effectiveness of occupational therapy for psychiatric disorders.	1983	natural
Those participants who gave evidence of having attributed lower levels of involvement, regardless of filmed information, also attributed higher levels of mental_illness.	1983	natural
22 logic of dollar-wise administrators who needs to forsee the cost-benefits that will accrue to the community from the work on prevention of mental_illness.	1981	natural
The children viewed media as less important than suggested by Scheff in providing images of mental_illness and violence.	1982	natural
The medieval sources indicate that the authors were well aware of the proximate causes of mental_illness, such as humoral imbalance, intemperate diet and alcohol intake, overwork, and grief.	1984	natural
He relates how the concept of craziness was progressively replaced by this of mental_illness and how this last concept was no more synonymous of draison.	1982	natural
Signs and patient behaviors that today would not be considered definitive of mental_illness were then frequently cited by the alienist (psychiatrist) as evidence of insanity.	1984	natural
First, his precise definition of mental_illness is criticized because it excludes diagnostic groups comprised largely of males (personality disorders and substance abusers).	1980	natural
Dependent variables were attitudes toward seeking mental_health services, opinions about mental_illness, and tendencies to view mental_health problems as spiritual.	1984	natural
From the perspective of the labelling theory of mental_illness, the aim of this paper was to study some consequences on other people's perception of individuals who have been exempted on this basis.	1983	natural
A review of existing studies indicates that physicians compare favorably with the general population in mortality from physical illness but unfavorably with regard to mental_illness, notably the affective, suicide and addiction.	1982	natural
