The narrow social learning definition of aggression as a reaction to an appraisal of controllable threat is broadened to include reactions to trauma: uncontrollable-unbluntable-inescapable aversive stimuli.	1999	natural
Medical professionals frequently evaluate infants and children with head trauma.	1998	natural
Such information can then be used to estimate the time of injury in cases with obscure histories and will thus aid investigations of nonaccidental trauma.	1997	natural
We conducted a meta-analytic review of neuropsychological studies of mild head trauma (MHT).	1997	natural
A total of 95 inpatients (34 men and 61 women; 41 African-Americans, 52 Caucasians, and 2 other minorities) were administered a structured interview to assess substance abuse/dependence, trauma, and PTSD.	1996	natural
A brief case vignette and a more extensive fragment of an analysis are used to illustrate how the unassimilable empty core of trauma may perpetuate itself in the lives of adult children of Holocaust survivors, exerting a dominating force over their identities, memories, fantasies, and transference feelings.	1998	natural
This paper presents an ecological view of psychological trauma and trauma recovery.	1996	natural
The results indicate an association between history of sexual trauma and symptom severity across a broad range of psychopathology, and with mood and anxiety disorders.	1997	natural
The concept of trauma has been in use since the earliest concepts developed by Freud, but there has been limited effort to define the term with consistency.	1995	natural
That group events are remembered long afterwards is closely related to the memories of survivors of trauma.	1998	natural
The possible benefits of addressing trauma and posttraumatic stress as means of enhancing treatment is explored.	1998	natural
But it took 70 years and a work of fiction to remind us of the beginnings of therapeutic treatment for shell shock in World War I. On the basis of extensive clinical material this paper attempts to describe some pathogenic effects exerted by the transmission of war trauma from fathers to children, speculates about the legacy of this century's terrible war and wonders how we are dealing with this in our therapeutic work.	1999	natural
The dose-effect relationship between cumulative trauma and symptoms was strong for parent reporting on the CBCL; the subscales on both the YSR and CBCL for Anxious/Depressed and Attention Problems revealed dose-effect associations.	1997	natural
In contrast, bipolar disorder at baseline assessment was a significant risk factor for subsequent trauma exposure.	1999	natural
A trauma group psychotherapy approach that investigates the connections between war and childhood traumas and their effects on later adult coping and interpersonal relationships is fundamentally different than existing trauma group treatment paradigms that focus primarily on war-related events.	1998	natural
One purpose of this study was to examine the differences in behavior of children exposed to trauma versus no trauma.	1995	natural
In this paper, we have considered trauma from the perspective of its effects on young children in the context of chronic community and family violence.	1995	natural
The most commonly reported trigger to recall of the trauma was some form of media presentation (i.e., television show, movie), whereas psychotherapy was the least commonly reported trigger.	1997	natural
Only the time elapsed since the trauma-not the division into type of trauma groups-was significantly correlated with severity.	1996	natural
This study examines the psychometric properties of the Intrusive Thoughts Questionnaire (ITQ) and its utility as a predictor of distress among trauma victims.	1999	natural
Special attention is devoted to the daunting challenges and resultant trauma experienced by many of these children and families who have recently immigrated to this country from war-torn home-lands in Central America.	1999	natural
Partners of survivors of childhood sexual abuse may develop a trauma contagion marked by high levels of stress, doubts about to key personal values and assumptions about the world, and a tendency to be drawn into unconscious reenactments with the survivor of the abusive relationship.	1995	natural
Profiles of Axis II features, based on relative frequencies of individual disorder diagnoses derived from a common measure (Personality Diagnostic Questionnaire-Revised), were compared in three trauma samples: male Vietnam combat veterans with PTSD, female inpatients with a history of childhood sexual abuse, and female outpatients with a history of childhood sexual abuse.	1999	natural
Acute stress disorder (ASD) is a recently developed diagnosis that describes posttraumatic stress reactions that occur in the first month following a trauma.	1997	natural
The clinical presentations are oriented around three questions: What are the expectable symptomatic reactions of preverbal infants to trauma?	1995	natural
Only the time elapsed since the trauma-not the division into type of trauma groups-was significantly correlated with severity.	1996	natural
The psychological trauma caused by natural disasters, accidental disasters, disasters of human origin, and violence often leaves the spiritual domain in disarray.	1998	natural
Analyses replicate and extend findings from the literature on life events: social desirability plays a marginal role as a moderator variable in the assessment of trauma.	1996	natural
Additionally, severity was found to significantly contribute to overall adjustment Preliminary analyses showed the following: longer duration and more frequent abuse resulted in higher severity scores; women who showed higher levels of commitment control, and challenge were better adjusted; women whose abuse was more frequent and of longer duration demonstrated more emotional trauma symptoms; and father/stepfather abuse was related to poorer adjustment.	1996	natural
Recently, there has been a resurgence of interest in relations among psychological trauma, dissociative phenomena, and various forms of trauma-related distress that has spawned a prolific amount of research.	1999	natural
Assessment conditions included a descriptive analysis, response scatterplot and Self-Injury Trauma (SIT) Scale.	1997	natural
By this means the patient creates an inner scene which is apt to serve as a mirror for the experience of psychic pain and to represent the preverbal childhood trauma in a symbolic way.	1999	natural
As the incidence of sexual trauma grows, it is becoming increasingly important for family therapists to understand the influence of traumatic events on survivors' sexual and other significant relationships.	1995	natural
Astrocytes are the principal source of extracellular purines in brain after injury, ischemia, or trauma.	1998	natural
Because finger-thumb and 10-cm hand couplings require larger wrist deviations and greater velocities, these objects may pose a greater risk of developing cumulative trauma disorders to the bagger.	1998	natural
His pupil and follower, Michael Balint developed this idea and proposed new ways of describing the mechanism of trauma and and some of the therapeutic consequences.	1998	natural
A sample of 475 female college students completed measures of sexual and physical abuse in childhood (before age 15) and adulthood (after age 15), PTSD and trauma symptoms, and demographic variables.	1998	natural
This paper argues for a closer integration of family therapy and spirituality, and is linked to a manuscript in preparation which explores the clinical application of spirituality to family adaptation following trauma.	1995	natural
The essay also examines some of the challenges and problems in treating trauma and in considering the impact of real events in a relational and social constructionist psychoanalysis.	1996	natural
The prediction of individuals' general intelligence that was held prior to cerebral trauma is essential to the determination of a loss of their cognitive functions.	1996	natural
The relation between combat-related trauma experience and male ego development and the impact of such trauma on subsequent employment, marital, and legal behavior were investigated empirically.	1996	natural
Stepwise logistic regression analysis adjusted for age, gender, and characteristics of the trauma showed that posttraumatic stress disorder, dissociative disorders, agoraphobia, and low self-esteem were overrepresented in the incest-rape group compared to the nonincest-rape group.	1999	natural
Six-months post-trauma fewer MTBI patients than non-TBI reported fear and helplessness in response to the trauma.	1999	natural
The ecological model proposes a multidimensional definition of trauma recovery and suggests that the efficacy of trauma-focused interventions depends on the degree to which they enhance the person-community relationship and achieve ecological fit within individually varied recovery contexts.	1996	natural
Children with PTSD symptoms had significantly more internalizing behavioral problems, as expected; they also had more externalizing problems than did children without trauma symptoms.	1998	natural
A brief historical overview of memory and trauma is provided.	1998	natural
Of the 181 women who completed the Childhood Trauma Questionnaire (CTQ), 109 (60.2) were sexually abused, 100 (55.2) were physically abused, 83 (45.9) were emotionally abused, 151 (83.4) were emotionally neglected, and 108 (59.7) were physically neglected.	1999	natural
Intrusive imagery is both a common response to trauma and a hallmark of Posttraumatic Stress Disorder.	1997	natural
In addition, it highlights the central mechanisms for the emotional aspects of pain, demonstrating the physiological link between tissue trauma and mechanisms of emotional arousal.	1999	natural
New species of claims for psychiatric injury will cause courts to reassess the principles governing the way the common law has compensated those compromised by careless exposure to trauma.	1997	natural
In each case, evidence of significant psychiatric disability and/or malingering was present and seemed to better explain the poor neuropsychological test findings than did the trauma.	1998	natural
Only a minority of patients with severe personality disorders report severe childhood trauma.	1997	natural
They are at risk in myriad ways: for instance, being poor, having chronic health deficits, experiencing the trauma of abuse and neglect, and suffering from a gamut of emotional challenges.	1997	natural
Whereas 26 patients were categorized as Accepting or Coping at the initial interview, 25 were placed in the Experiencing emotional trauma category after treatment was completed.	1996	natural
Individual, group, and family dynamics all provide important contextual information for the processing of sexual abuse trauma in psychotherapy.	1995	natural
Participants were administered a battery of self-report measures that assessed personality, dissociation and childhood trauma and/or abuse.	1999	natural
This article reviews the psychometric properties of the Stressful Life Events Screening Questionnaire (SLESQ), a recently developed trauma history screening measure, and discusses the complexities involved in assessing trauma exposure.	1998	natural
None of the four studies provided both clear confirmation of trauma and adequate documentation of amnesia in their subjects.	1995	natural
In addition, our study replicated Irwin's (Journal of the American Society for Psychical Research, 86, 199208, 1992) finding of a small but significant correlation between childhood trauma and paranormal belief, and extends previous findings showing a small correlation between childhood fantasy and paranormal belief (and experience) to the realm of childhood fantasy, thus addressing the childhood factors model proper.	1995	natural
The paper suggests that an appreciation of this obscure phenomenon is critical in the treatment of trauma.	1998	natural
The author discusses key areas affecting the occurrence of anxiety disorders in women, including medical conditions, epidemiological and diagnostic perspectives, work and the reproductive cycle, trauma (including abuse), and marriage and the family.	1995	natural
In addition, dissociative responses to combat trauma were associated with higher long-term general dissociative symptomatology as measured by scores on the Dissociative Experience Scale, as well as increases in the number of flashbacks since the time of the war.	1997	natural
The data provide further support for the view that common affective consequences of childhood trauma may mediate between such trauma and the development of a dissociative coping style.	1998	natural
These findings provide a starting point for more detailed investigations of the relations between trauma, psychopathology, and violence and suggest that the study of trauma may offer a new way of looking at links between victim and perpetrator.	1998	natural
This paper is a grouping of ideas related to some of the emotional aspects of living with brain trauma and seizures.	1996	natural
The deferred action of psychic trauma is an antiquated concept and psychic trauma has immediate effects as well as far reaching developmental consequences.	1996	natural
This study examined the relationship between a history of trauma and the features and persistence of major depression (MDD) in patients with anxiety disorders.	1997	natural
We investigate the reading performance of a brain-damaged patient, JV, whose reading skills were abolished after trauma but regained four years later.	1995	natural
Factor analytic studies of trauma victims' posttraumatic stress disorder (PTSD) have offered conflicting hypotheses about how to conceptualize PTSD into symptom categories.	1999	natural
A developmental psychopathology framework, with its emphasis on an interdisciplinary perspective, the interplay between work conducted with normal and atypical populations, and its focus on investigating functioning in multiple domains of development concurrently, possesses significant potential for advancing work on memory and trauma.	1998	natural
This investigation was based in an urban, level one trauma center federally designated as a model system of comprehensive rehabilitative services for persons with TBI and persons with SCI.	1999	natural
The responses of 12 outpatients with PTSD were compared with those of panic disorder patients (n = 11), survivors of traumatic events who had not developed PTSD (n =, and mentally healthy subjects with no lifetime history of major trauma (n = 19).	1997	natural
The following three hypotheses were tested: children who report watching greater amounts of television per day will report higher levels of trauma symptoms than children who report lesser amounts of television viewing; children who report watching greater amounts of television per day will report higher levels of violent behaviors than children who report watching lesser amounts of television per day; and children who report a preference for action and fighting programs will report higher levels of violent behaviors than children who report a preference for other types of television programs.	1998	natural
Analyses replicate and extend findings from the literature on life events: social desirability plays a marginal role as a moderator variable in the assessment of trauma.	1996	natural
Freud in The uncanny links the interpretation of uncanniness to compulsive repetition and thus makes the connection to trauma and birth anxiety discussed in later works such as Beyond the pleasure principle and Inhibitions, symptoms and anxiety.	1999	natural
The response of 18 subjects with ABI (XCA, 27.5 years, X period since trauma 6.0 years) to static and dynamic assessment processes are compared.	1996	natural
This paper addresses the losses, trauma, and adjustment difficulties suffered by people who leave behind significant frames of reference and relational contexts that sustain their identifications.	1999	natural
Substance abuse and urban trauma go hand in hand.	1995	natural
The results of trauma can be so debilitating that a missionary might be unable to continue to minister.	1999	natural
Mothers from low socioeconomic status show more often dismissing attachment representations and unresolved loss or trauma.	1996	natural
The trauma is dealt with in the African and African-American spiritual tradition of testifying to, and witnessing of, our history and experience.	1999	natural
A sample of 19 persons complaining of chronic pain and a comparison sample of 25 persons having sustained head trauma were obtained by retrospective chart review.	1995	natural
Athletes with no head trauma history overestimated the expected degree of pre- to postinjury change in symptom status.	1999	natural
Data was collected on 341 persons (mean age 37.7 years) with traumatic brain injury treated at the Level I trauma centre, who required inpatient rehabilitation.	1999	natural
In the spirit of a greater consideration of the interlace between psychoanalysis and cultural trauma (Hunter Brown 1992), this paper examines the relationship between the magnitude of a cultural trauma (and its resonance) and the time it takes for the trauma to be worked through.	1996	natural
These control strategies maintain the intrusive recollections by preventing a change in the meaning of the trauma and of the traumatic memories.	1995	natural
Adolescents who have suffered the trauma of incest or rape often search for inner resolution amidst a society that can be more rejecting than comforting.	1999	natural
History of early childhood trauma was prevalent and highly correlated with Disorders of Extreme Stress Not Otherwise Specified (DESNOS) in a sample of veterans in inpatient treatment for chronic posttraumatic stress disorder (PTSD).	1998	natural
Clinical examples are used to explore issues of contact, the placement of siblings, the impact of parental trauma on a childs development as seen in psychotherapy, and the opportunities for working through afforded by adoption.	1999	natural
A history of childhood trauma was associated with greater functional impairment and higher likelihood of having a personality disorder, but with no difference in Axis I diagnoses.	1997	natural
This leads to new recommendations for sex assignment in cases of genital trauma or hermaphroditic individuals with ambiguous genitalia.	1997	natural
A consistent relation between earlier war trauma, resettlement stress, and symptoms of PTSD was found.	1996	natural
Changes in anxiety as a personality trait was found, indicative of the potential long-term effects of psychological trauma.	1995	natural
Seventy-nine urban adolescent girls attending an adolescent medicine clinic were assessed via clinician-assisted self-report measures called the Adolescent Self-Report Trauma Questionnaire.	1995	natural
This study examines posttraumatic stress disorder (PTSD) symptoms, trauma exposure, gender, and diagnostic comorbidity in a sample of 59 Cambodian young adults (29 male and 30 female) who survived massive trauma as children.	1995	natural
More than two fifths of adolescents experienced at least one DSM-III-R trauma by age 18 years; PTSD developed in 14.5 of these affected youths or 6.3 of the total sample.	1995	natural
In addition, the more personal the trauma was, the worse they felt after their disclosure, and the more disturbed they were about the trauma.	1995	natural
With regard to extreme trauma in childhood, this study develops the following hypotheses: the overwhelming, shattering blow of an external event is met by an equally strong, archaic defence, even in the historical situation itself, as an escape from the unbearable, unspeakable pain; the Janus face of the victim/perpetrator introject is manifest in the masochistic character-structure; these splits can be attenuated in the course of a person's life, with the appropriate help, although they cannot be fully integrated.	1995	natural
Closed head injured subjects who completed the WMS-R were divided into either mild injury (MI, n = 41) or moderate/severe (SI, n = 41) injury groups based on trauma severity indicators and were matched on age and level of education.	1997	natural
Theoretical models of the adjustment process following loss and trauma have emphasized the critical role that finding meaning plays.	1998	natural
Forty-six mothers participated in a cross-sectional exploratory study and completed a range of self-report measures, including the Child Abuse & Trauma Scale, Social Support Inventory, CES-D, Parenting Stress Index, and the Parenting Scale.	1999	natural
The findings suggest that the significant levels of comorbid diagnoses previously found to exist with PTSD in people traumatized as adults can be found among survivors of massive childhood trauma.	1995	natural
Since trauma arises from an inescapable stressful event that overwhelms people's coping mechanisms, it is uncertain to what degree the results of laboratory studies of ordinary events are relevant to the understanding of traumatic memories.	1995	natural
This paper outlines an attachment-theory based model of transgenerational trauma inspired by the successful psychoanalytic treatment of a severely disturbed adolescent with obsessive-compulsive disorder who was the first child of the first daughter of a holocaust survivor.	1999	natural
Eighty adolescent females, aged 14-16 years, answered questions regarding abuse history, attachment style, coping with an interpersonal stressor, depression and trauma symptomatology, and conflict with a best friend.	1999	natural
Length of time since trauma exposure is consistently negatively correlated with PTSD severity.	1996	natural
The possibility of trauma, in particular childhood sexual abuse, as a causative factor in dissociative disorders is discussed.	1999	natural
Although community services may be beneficial for some victims, there is increasing evidence that they can add trauma, rather than alleviate distress (termed secondary victimization).	1999	natural
Temporal disintegration was highest among individuals who had experienced the most severe loss, had previously experienced chronic trauma, and had had their identities threatened by their traumatic experience.	1998	natural
A substantial body of research suggests that the MMPI-2 contains a number of items that are sensitive to closed-head trauma (CHT) and other neurologic conditions.	1997	natural
In the author's view, a careful reading of the two men's late works reveals a conception of trauma as lying in an intersubjective space as a consequence of the meeting of drive and object.	1997	natural
This article explores issues surrounding sexual trauma and chemical dependency.	1995	natural
We explore the significant theme of the rebuilding of trust between mothers and daughters and facilitate a process whereby the woman is able to bear witness to and acknowledge the trauma experienced by her daughter.	1997	natural
Comparing current memory functioning to estimates of premorbid intellectual ability appears to be a sensitive indicator of presence and degree of intellectual and memory dysfunction in head trauma patients.	1997	natural
The course and outcome of posttraumatic symptoms (Impact of Event Scale [IES]) and symptoms of general psychological distress (SCL-90) were examined in relation to type of trauma (loss vs. no loss) and prior exposure to trauma.	1996	natural
Six items pertaining to interpersonal trauma form an internally consistent subscale.	1999	natural
Twelve Bosnian adolescents who experienced the massive psychic trauma of ethnic cleansing were assessed during the first year after their resettlement in the United States.	1995	natural
Forensic and clinical implications are discussed and a plea issued for more study of the memory phenomena that characterize posttraumatic stress disorder (PTSD) and are the focus of trauma survivors treatment.	1995	natural
The need for research into developmental changes in children's reaction to trauma is highlighted.	1998	natural
Compulsive weight lifting and anabolic substance abuse may represent another form of response to the trauma of sexual assault.	1999	natural
This study was designed to assess cognitive functioning 3 years after severe multiple trauma and to investigate how cognitive performance is related to head injury severity and psychological distress respectively.	1999	natural
The present paper discusses the relationship between prolonged traumatic stress and subsequent suicidality by reviewing studies that have examined suicidal behavior in relationship to child abuse and combat trauma.	1997	natural
Dissociative responses to trauma have been hypothesized to be associated with long-term increases in psychopathology.	1997	natural
144 psychiatric inpatients who reported childhood physical or sexual trauma were administered the Symptom Check List-90-Revised, the Dissociative Experiences Scale, and the Dissociative Disorders Interview Schedule.	1997	natural
A substantial portion of trauma experts working in the field of human-engendered violence recognize the possibility that certain traumas can result in personality change.	1999	natural
Because finger-thumb and 10-cm hand couplings require larger wrist deviations and greater velocities, these objects may pose a greater risk of developing cumulative trauma disorders to the bagger.	1998	natural
