In addition, it highlights the central mechanisms for the emotional aspects of pain, demonstrating the physiological link between tissue trauma and mechanisms of emotional arousal.	1999	natural
New species of claims for psychiatric injury will cause courts to reassess the principles governing the way the common law has compensated those compromised by careless exposure to trauma.	1997	natural
In each case, evidence of significant psychiatric disability and/or malingering was present and seemed to better explain the poor neuropsychological test findings than did the trauma.	1998	natural
Only a minority of patients with severe personality disorders report severe childhood trauma.	1997	natural
Individual, group, and family dynamics all provide important contextual information for the processing of sexual abuse trauma in psychotherapy.	1995	natural
Participants were administered a battery of self-report measures that assessed personality, dissociation and childhood trauma and/or abuse.	1999	natural
This article reviews the psychometric properties of the Stressful Life Events Screening Questionnaire (SLESQ), a recently developed trauma history screening measure, and discusses the complexities involved in assessing trauma exposure.	1998	natural
In addition, our study replicated Irwin's (Journal of the American Society for Psychical Research, 86, 199208, 1992) finding of a small but significant correlation between childhood trauma and paranormal belief, and extends previous findings showing a small correlation between childhood fantasy and paranormal belief (and experience) to the realm of childhood fantasy, thus addressing the childhood factors model proper.	1995	natural
The paper suggests that an appreciation of this obscure phenomenon is critical in the treatment of trauma.	1998	natural
The author discusses key areas affecting the occurrence of anxiety disorders in women, including medical conditions, epidemiological and diagnostic perspectives, work and the reproductive cycle, trauma (including abuse), and marriage and the family.	1995	natural
The data provide further support for the view that common affective consequences of childhood trauma may mediate between such trauma and the development of a dissociative coping style.	1998	natural
These findings provide a starting point for more detailed investigations of the relations between trauma, psychopathology, and violence and suggest that the study of trauma may offer a new way of looking at links between victim and perpetrator.	1998	natural
The deferred action of psychic trauma is an antiquated concept and psychic trauma has immediate effects as well as far reaching developmental consequences.	1996	natural
This study examined the relationship between a history of trauma and the features and persistence of major depression (MDD) in patients with anxiety disorders.	1997	natural
We investigate the reading performance of a brain-damaged patient, JV, whose reading skills were abolished after trauma but regained four years later.	1995	natural
Factor analytic studies of trauma victims' posttraumatic stress disorder (PTSD) have offered conflicting hypotheses about how to conceptualize PTSD into symptom categories.	1999	natural
A developmental psychopathology framework, with its emphasis on an interdisciplinary perspective, the interplay between work conducted with normal and atypical populations, and its focus on investigating functioning in multiple domains of development concurrently, possesses significant potential for advancing work on memory and trauma.	1998	natural
This investigation was based in an urban, level one trauma center federally designated as a model system of comprehensive rehabilitative services for persons with TBI and persons with SCI.	1999	natural
The responses of 12 outpatients with PTSD were compared with those of panic disorder patients (n = 11), survivors of traumatic events who had not developed PTSD (n =, and mentally healthy subjects with no lifetime history of major trauma (n = 19).	1997	natural
The following three hypotheses were tested: children who report watching greater amounts of television per day will report higher levels of trauma symptoms than children who report lesser amounts of television viewing; children who report watching greater amounts of television per day will report higher levels of violent behaviors than children who report watching lesser amounts of television per day; and children who report a preference for action and fighting programs will report higher levels of violent behaviors than children who report a preference for other types of television programs.	1998	natural
Freud in The uncanny links the interpretation of uncanniness to compulsive repetition and thus makes the connection to trauma and birth anxiety discussed in later works such as Beyond the pleasure principle and Inhibitions, symptoms and anxiety.	1999	natural
The response of 18 subjects with ABI (XCA, 27.5 years, X period since trauma 6.0 years) to static and dynamic assessment processes are compared.	1996	natural
The results of trauma can be so debilitating that a missionary might be unable to continue to minister.	1999	natural
Mothers from low socioeconomic status show more often dismissing attachment representations and unresolved loss or trauma.	1996	natural
Athletes with no head trauma history overestimated the expected degree of pre- to postinjury change in symptom status.	1999	natural
Data was collected on 341 persons (mean age 37.7 years) with traumatic brain injury treated at the Level I trauma centre, who required inpatient rehabilitation.	1999	natural
Adolescents who have suffered the trauma of incest or rape often search for inner resolution amidst a society that can be more rejecting than comforting.	1999	natural
History of early childhood trauma was prevalent and highly correlated with Disorders of Extreme Stress Not Otherwise Specified (DESNOS) in a sample of veterans in inpatient treatment for chronic posttraumatic stress disorder (PTSD).	1998	natural
Clinical examples are used to explore issues of contact, the placement of siblings, the impact of parental trauma on a childs development as seen in psychotherapy, and the opportunities for working through afforded by adoption.	1999	natural
A history of childhood trauma was associated with greater functional impairment and higher likelihood of having a personality disorder, but with no difference in Axis I diagnoses.	1997	natural
This leads to new recommendations for sex assignment in cases of genital trauma or hermaphroditic individuals with ambiguous genitalia.	1997	natural
A consistent relation between earlier war trauma, resettlement stress, and symptoms of PTSD was found.	1996	natural
Changes in anxiety as a personality trait was found, indicative of the potential long-term effects of psychological trauma.	1995	natural
Seventy-nine urban adolescent girls attending an adolescent medicine clinic were assessed via clinician-assisted self-report measures called the Adolescent Self-Report Trauma Questionnaire.	1995	natural
This study examines posttraumatic stress disorder (PTSD) symptoms, trauma exposure, gender, and diagnostic comorbidity in a sample of 59 Cambodian young adults (29 male and 30 female) who survived massive trauma as children.	1995	natural
More than two fifths of adolescents experienced at least one DSM-III-R trauma by age 18 years; PTSD developed in 14.5 of these affected youths or 6.3 of the total sample.	1995	natural
In addition, the more personal the trauma was, the worse they felt after their disclosure, and the more disturbed they were about the trauma.	1995	natural
With regard to extreme trauma in childhood, this study develops the following hypotheses: the overwhelming, shattering blow of an external event is met by an equally strong, archaic defence, even in the historical situation itself, as an escape from the unbearable, unspeakable pain; the Janus face of the victim/perpetrator introject is manifest in the masochistic character-structure; these splits can be attenuated in the course of a person's life, with the appropriate help, although they cannot be fully integrated.	1995	natural
Closed head injured subjects who completed the WMS-R were divided into either mild injury (MI, n = 41) or moderate/severe (SI, n = 41) injury groups based on trauma severity indicators and were matched on age and level of education.	1997	natural
Theoretical models of the adjustment process following loss and trauma have emphasized the critical role that finding meaning plays.	1998	natural
Since trauma arises from an inescapable stressful event that overwhelms people's coping mechanisms, it is uncertain to what degree the results of laboratory studies of ordinary events are relevant to the understanding of traumatic memories.	1995	natural
This paper outlines an attachment-theory based model of transgenerational trauma inspired by the successful psychoanalytic treatment of a severely disturbed adolescent with obsessive-compulsive disorder who was the first child of the first daughter of a holocaust survivor.	1999	natural
Eighty adolescent females, aged 14-16 years, answered questions regarding abuse history, attachment style, coping with an interpersonal stressor, depression and trauma symptomatology, and conflict with a best friend.	1999	natural
Length of time since trauma exposure is consistently negatively correlated with PTSD severity.	1996	natural
The possibility of trauma, in particular childhood sexual abuse, as a causative factor in dissociative disorders is discussed.	1999	natural
Although community services may be beneficial for some victims, there is increasing evidence that they can add trauma, rather than alleviate distress (termed secondary victimization).	1999	natural
Temporal disintegration was highest among individuals who had experienced the most severe loss, had previously experienced chronic trauma, and had had their identities threatened by their traumatic experience.	1998	natural
We explore the significant theme of the rebuilding of trust between mothers and daughters and facilitate a process whereby the woman is able to bear witness to and acknowledge the trauma experienced by her daughter.	1997	natural
Comparing current memory functioning to estimates of premorbid intellectual ability appears to be a sensitive indicator of presence and degree of intellectual and memory dysfunction in head trauma patients.	1997	natural
The course and outcome of posttraumatic symptoms (Impact of Event Scale [IES]) and symptoms of general psychological distress (SCL-90) were examined in relation to type of trauma (loss vs. no loss) and prior exposure to trauma.	1996	natural
Six items pertaining to interpersonal trauma form an internally consistent subscale.	1999	natural
Twelve Bosnian adolescents who experienced the massive psychic trauma of ethnic cleansing were assessed during the first year after their resettlement in the United States.	1995	natural
The need for research into developmental changes in children's reaction to trauma is highlighted.	1998	natural
Compulsive weight lifting and anabolic substance abuse may represent another form of response to the trauma of sexual assault.	1999	natural
This study was designed to assess cognitive functioning 3 years after severe multiple trauma and to investigate how cognitive performance is related to head injury severity and psychological distress respectively.	1999	natural
The present paper discusses the relationship between prolonged traumatic stress and subsequent suicidality by reviewing studies that have examined suicidal behavior in relationship to child abuse and combat trauma.	1997	natural
Because finger-thumb and 10-cm hand couplings require larger wrist deviations and greater velocities, these objects may pose a greater risk of developing cumulative trauma disorders to the bagger.	1998	natural
For the above reasons this first paper is a ''calling card'' which announces Ferenczi's later reflections on the specific affective qualities that may render the psychoanalytic environment non-traumatic, as well as his criticism of the narcissistic aspects of the analyst (one of the most important motives for subtle and hidden trauma), who views the work of interpretation as the product of a single mind (in my terms: a kind of colonisation and expropriation of the other) rather than as fruit of an encounter that would take into account both the unique characteristics of the partner as well as the rhythms appropriate to such a relationship.	1999	natural
Eighty-two students at the University of Edinburgh were administered three questionnaires relating to childhood trauma, childhood fantasy, and paranormal belief and experience.	1995	natural
Demographic characteristics, residency status, and measures of trauma and postmigration stress were fitted to a structural model in PTS symptoms.	1999	natural
Indeed, the Janetian trauma treatment is intended to break down the client's higher mental functions: by re-experiencing horror, automatic processes of dissociation are reinforced; the client's spontaneous compensatory system is destroyed.	1999	natural
Elevated BE concentration putatively correlates with pain perception in trauma patients.	1995	natural
Accordingly, we may hear in people's trauma psychophysical reactions to events; the playing out of themes from a lifetime; violations whose inner message is a demand to awaken beyond self-protective ways of being; and a uniquely powerful opening for communion.	1995	natural
Clinical trauma accommodation is discussed to offer the processing and adaptation to peer victimization.	1998	natural
However, careful attention to the individual symbol system of young children can reveal the unexpected, particular ways that trauma may be recorded in nonverbal and kinesthetic dimensions, especially when the trauma occurs before the acquisition of language.	1997	natural
Furthermore, neither PTSD severity, dissociative symptom severity, nor extent of preexisting amnesia for childhood trauma contributed to the variance in memory functioning.	1999	natural
The authors examined traumatic injury severity, pain perception, and BE concentration in patients admitted to an urban trauma center.	1995	natural
Astrocytic subtypes in different cortical regions of injured human cerebral cortex of 22 patients with brain trauma, vascular anomalies and brain tumours have been examined by means of light microscopy and conventional transmission electron microscopy.	1999	natural
The second, the debate over the place of gratification and abstinence in controlling the depth of regression and in working through the shame which regression necessarily generates, and the third, the relation between trauma, regression and shame in the work of Ferenczi, together with the shame/narcissistic injury over his rift with Freud and the subsequent allegation by Jones and others of paranoid delusions and psychotic disturbance.	1998	natural
These findings, which are generally consistent with prior reports of reduced hippocampal volume in combat veterans with PTSD, suggest that diminished hippocampal size may be either a consequence of trauma exposure or a risk factor for the development of psychiatric complications following trauma exposure.	1997	natural
While some clinicians assume that traumatic intrusions are historically accurate revisualizations of traumatic incidents, others have suggested that these types of intrusions may represent a worse case scenario (i.e. exaggerated) version of the trauma.	1998	natural
Motor vehicle accident survivors (n = 92) were assessed for acute stress disorder (ASD) within 1 month of the trauma and reassessed (n = 71) for posttraumatic stress disorder (PTSD) 6 months posttrauma.	1998	natural
Men who committed intimate abuse experienced more chronic trauma symptoms than nonabusive controls.	1995	natural
It is hypothesized that various perverse structures may be formed within these seemingly autonomous, amnestic states, in order to contain anxiety and encapsulate the aggression which resulted from early psychic trauma.	1996	natural
There is no simple relationship between trauma and BSI symptoms, but clinicians should consider severe interpersonal trauma to be one pathway to pervasively elevated profiles of the Brief Symptom Inventory.	1998	natural
Theoretical models of the adjustment process following loss and trauma have emphasized the critical role that finding meaning plays.	1998	natural
Although the group is for survivors of childhood trauma, its focus is on the present dilemmas of child rearing rather than on past traumas.	1995	natural
This paper discusses the application of EFT in couples where one or both of the partners have experienced significant trauma.	1998	natural
Twenty-four participants with ASD following civilian trauma were given 5 sessions of either cognitive-behavioral therapy (CBT) or supportive counseling (SC) within 2 weeks of their trauma.	1998	natural
In clinical populations of hospitalized adolescents exposed to multiple forms of trauma, PTSD is a common, but highly comorbid disorder.	1999	natural
We investigate the reading performance of a brain-damaged patient, JV, whose reading skills were abolished after trauma but regained four years later.	1995	natural
The 30 girls were 9-12 years old, within 1 year of trauma, and were screened for psychosis.	1995	natural
Trauma severity was correlated significantly with measures of physical disability, psychiatric distress, illness adjustment, personality, and quality of sleep in patients with fibromyalgia but not in those with rheumatoid arthritis.	1997	natural
The phenomenon of traumatic reenactment has long been recognized as a problem for individual victims of trauma.	1996	natural
This paper discusses the imagery and process of an art therapy support group for low-income isolated lesbians, through five related lenses: women's relational dynamics and the centrality of relationships in lesbians' lives; trauma; socioeconomic class; lesbian identity, visibility, culture, and gender; and transference.	1996	natural
Application of traditional milieu substance abuse treatment for sexual trauma survivors is explored.	1995	natural
Both the opioid and the cortisol concentration rose significantly in plasma in all three groups and in particular resulted significantly higher in the cervical traumatized group where spinal trauma was associated with spinal shock and hypotension.	1997	natural
The ETIG as a whole correlates highly with measures of general psychological symptoms and intrusive and avoidant trauma reactions, although there are indications that each measure relates to different areas of symptoms.	1995	natural
Other major system interventions, testifying and removal of the child from the home, were not statistically correlated to trauma scores.	1997	natural
Results show that 75.4 of trauma patients are screened for blood alcohol levels, and 58.5 are given a urine toxicology, with lowest rates for 12-20 year olds and highest rates for patients over 40 who were confused or incomprehensible.	1996	natural
TAS-20 scores were significantly associated with severity of PTSD symptoms, but not with severity of trauma.	1997	natural
Also, five cases are described who experienced serious trauma, three of them living successful lives and two remaining disabled.	1996	natural
The findings have implications for introduction of expert testimony on postrape behavior and trauma, and discounting of the defendant's culpability with relationship intimacy is examined.	1995	natural
This contributes to harm and trauma to the victims and the community at large.	1995	natural
The Harvard Trauma Questionnaire and a postmigration living difficulties questionnaire were completed by 62 asylum-seekers, 30 refugees, and 104 immigrants who responded to a mail-out.	1999	natural
Amid this, there has been research which reports people perceiving benefits from their trauma experience.	1997	natural
This article presents some Rorschach data for 60 adult closed head injury (CHI) patients who were tested between 3 and 6 weeks after the trauma.	1996	natural
Criterion and construct validity are supported by a substantial correlation between the study instrument and the Trauma Symptom Checklist for Children (-.74) and a moderate correlation between the study instrument and the Child Behavior Checklist for Children (-.40).	1997	natural
Because depression and depressive symptoms are associated with suicide and trauma, the relation between cholesterol and depressive symptoms is of interest.	1997	natural
In principle, pain is awareness of tissue trauma, but pain can occur in the absence of identifiable injury, and sometimes substantive tissue injury produces no pain.	1999	natural
Compared with control group participants, both trauma groups made significantly fewer illness visits at 1-month follow-up; however, real-trauma participants reported more fatigue and avoidance than did the other groups.	1996	natural
In the final section, developmental aspects are addressed by considering the interplay between child and adult trauma.	1998	natural
They were evaluated for history of physical and sexual trauma, suicide attempts, eating habits, and SMB.	1998	natural
No meaningful differences were detected in comparisons between ADHD and control children, either in the rate of trauma exposure or in the development of PTSD.	1999	natural
Present-day conceptions of transgenerational trauma are shown to be already present in Ferenczi.	1997	natural
This study examines posttraumatic stress disorder (PTSD) symptoms, trauma exposure, gender, and diagnostic comorbidity in a sample of 59 Cambodian young adults (29 male and 30 female) who survived massive trauma as children.	1995	natural
The author suggests that the patient needed to turn the analyst into a perverse partner (disavowing her other-ness) in order to reverse and triumph over this core trauma.	1999	natural
SDPT is also unique in having been designed for use in mixed-gendered civilians with varied sources of trauma.	1999	natural
This study examined the construct validity of the Trauma Symptom Checklist-40 (TSC-40; Elliot & Briere, 1992) in a sample of 130 female psychiatric inpatients.	1996	natural
These six clinical findings include: the presence of a high risk disorder or illness; post-traumatic stress disorder; age regression, flashbacks, abreactions or other re-experiencing of the trauma; repetitions, repetition compulsions or re-enactments; characteristics of the memories themselves; and other patterns, dynamics, and connections.	1998	natural
The following three hypotheses were tested: children who report watching greater amounts of television per day will report higher levels of trauma symptoms than children who report lesser amounts of television viewing; children who report watching greater amounts of television per day will report higher levels of violent behaviors than children who report watching lesser amounts of television per day; and children who report a preference for action and fighting programs will report higher levels of violent behaviors than children who report a preference for other types of television programs.	1998	natural
Abraham's previously unheralded concept of traumatophilia has relevance to current clinical controversy regarding constitution and sexual trauma.	1995	natural
Variables associated with a longer time to remit from an episode of chronic PTSD were a history of alcohol abuse and a history of childhood trauma.	1999	natural
The findings highlighted the close relationship between histories of exposure to trauma and high scores on this scale.	1995	natural
Two hundred and seventy-nine college students were surveyed utilizing the symptom checklist from the Courage to Heal Workbook, Trauma Symptom Checklist-40 (TSC-40), Abusive Behavior Inventory (ABI), and questions related to participants' beliefs that they had been abused as a child.	1998	natural
It is argued that it is possible to be effective in ending violence and abuse through a modified couples treatment format that addresses relationship issues, individual trauma, and biological vulnerability while simultaneously taking a clear, moral position that violence, abuse, and inequality are intolerable in any form.	1998	natural
Recent literature reviews find strong support for EMDR's value in trauma therapy.	1998	natural
It was thought that dissociation may be important in preventing the resolution of the trauma.	1999	natural
Findings of a multi-staged narrative analysis suggest that, for women like those in this study, the discovery of HIV seropositivity is a traumatic event, carrying with it elements that are common to other types of trauma: perceived threat to one's life and perceived responsibility for the deaths of others.	1997	natural
As an initial effort to examine Chinese sexual abuse trauma in relation to the cultural construction of sexual victimization of women, this study applies Finkelhor and Browne's (1985) traumagenic dynamics model to examine post-abuse trauma among Chinese child and adolescent survivors in Taiwan.	1998	natural
A case of recovered memory of childhood trauma is reported with documented sexual trauma in early childhood, chronicled evidence of the absence of memory for traumatic experience over a period of time, and substantial evidence of 'spontaneous' recovery of memory.	1998	natural
Those treating victims of real trauma frequently believe that psychoanalysis is not appropriate for their patients.	1996	natural
Sexually addicted pastors unconsciously choose their vocation to cover up childhood trauma and sexual issues.	1997	natural
The trauma is dealt with in the African and African-American spiritual tradition of testifying to, and witnessing of, our history and experience.	1999	natural
