While some clinicians assume that traumatic intrusions are historically accurate revisualizations of traumatic incidents, others have suggested that these types of intrusions may represent a worse case scenario (i.e. exaggerated) version of the trauma.	1998	natural
Motor vehicle accident survivors (n = 92) were assessed for acute stress disorder (ASD) within 1 month of the trauma and reassessed (n = 71) for posttraumatic stress disorder (PTSD) 6 months posttrauma.	1998	natural
Men who committed intimate abuse experienced more chronic trauma symptoms than nonabusive controls.	1995	natural
This is a small study conducted under difficult conditions to test the effectiveness of Eye Movement Desensitization and Reprocessing (EMDR) in treating trauma related reactions following Hurricane Andrew.	1997	natural
Seventy adolescent inpatients completed the Childhood Trauma Questionnaire (CTQ) (Likert-type items are summed to form dimensional scales, and cutoff scores determine abuse status), the Traumatic Events Questionnaire--Adolescents (multiple-choice items determine abuse status) and measures of depression, suicidal ideation, and dissociative symptoms.	1999	natural
Findings suggest that treatment providers need to assess trauma histories and traumatic stress symptoms.	1998	natural
It is hypothesized that various perverse structures may be formed within these seemingly autonomous, amnestic states, in order to contain anxiety and encapsulate the aggression which resulted from early psychic trauma.	1996	natural
The theory considers 3 possible outcomes of the emotional processing of trauma, successful completion, chronic processing, and premature inhibition of processing We discuss the implications of the theory for research design, clinical practice, and resolving contradictions in the empirical data.	1996	natural
This paper reports on a meta-analysis of behavioural data gathered using single case research methodology, while evaluating the immediate effects of a treatment (sensory stimulation) on 24 individuals diagnosed as being in vegetative state following trauma.	1996	natural
There is no simple relationship between trauma and BSI symptoms, but clinicians should consider severe interpersonal trauma to be one pathway to pervasively elevated profiles of the Brief Symptom Inventory.	1998	natural
The rediscovery of DID is due, in part, to the recognition that early childhood trauma in conjunction with the propensity to dissociate, are etiologic factors for the development of DID.	1997	natural
Theoretical models of the adjustment process following loss and trauma have emphasized the critical role that finding meaning plays.	1998	natural
Supportiveness in the parenting relationship aided prediction of both trauma symptoms and adjustment.	1997	natural
Finally, the effect of pre-existing emotional trauma combined with the MTBI is discussed.	1996	natural
Twenty-seven self-identified female survivors of childhood sexual abuse completed the Trauma Symptom Checklist-40, Beck Depression Inventory, State-Trait Anxiety Inventory and a measure designed to elicit subjects' self-generated descriptors of selves.	1998	natural
That group events are remembered long afterwards is closely related to the memories of survivors of trauma.	1998	natural
Although the group is for survivors of childhood trauma, its focus is on the present dilemmas of child rearing rather than on past traumas.	1995	natural
The findings indicated that very intense victimization, particularly in terms of physical injury, had the strongest effect on long-term adjustment in comparison to moderate or minimal victimization in the same trauma.	1996	natural
Others maintain that patients' descriptions of ritualized trauma may constitute a newly identified psychiatric syndrome.	1995	natural
In addition, the more personal the trauma was, the worse they felt after their disclosure, and the more disturbed they were about the trauma.	1995	natural
Intrusive memories and fear and helplessness in response to the trauma were reported less frequently by MTBI than non-TBI patients at the acute phase.	1999	natural
The current study investigated the similarity of personality disorder features in different samples of patients with trauma histories, and specificity of such features compared to other psychiatric samples.	1999	natural
This paper discusses the application of EFT in couples where one or both of the partners have experienced significant trauma.	1998	natural
The psychological reaction of preoccupation with symptoms and emotional distress is not unique to concussion, but also occurs after severe head injury and back injury and relates more to the personal interpretation of the effect of the trauma than to objective indicators of brain injury severity.	1997	natural
DATES syndrome, which comprises drug abuse, assault, trauma and elective surgery, describes archetypal illness behaviour in the injured, but not necessarily in victims.	1995	natural
Twenty-four participants with ASD following civilian trauma were given 5 sessions of either cognitive-behavioral therapy (CBT) or supportive counseling (SC) within 2 weeks of their trauma.	1998	natural
In clinical populations of hospitalized adolescents exposed to multiple forms of trauma, PTSD is a common, but highly comorbid disorder.	1999	natural
Seventeen factors associated with an increase in Tourette symptoms included events causing anxiety, emotional trauma, and social gatherings.	1995	natural
We investigate the reading performance of a brain-damaged patient, JV, whose reading skills were abolished after trauma but regained four years later.	1995	natural
The 30 girls were 9-12 years old, within 1 year of trauma, and were screened for psychosis.	1995	natural
His pupil and follower, Michael Balint developed this idea and proposed new ways of describing the mechanism of trauma and and some of the therapeutic consequences.	1998	natural
Pediatric head trauma caused significantly more subjective symptoms after 6 weeks than orthopedic injury.	1997	natural
The authors build on the work of psychiatrist Lenore Terr, who distinguished Types I and II psychological trauma, by proposing a third category, Type III trauma.	1999	natural
Since the late nineteenth century explanations of sexual trauma have invoked unconscious mental mechanisms of forgetting.	1998	natural
Children (13-18 months, 20-25 months, and 26-34 months) who had experienced trauma injuries were recruited in a hospital Emergency Room and subsequently interviewed about them within days (if verbal) and after 6, 12, and 18 or 24 months.	1998	natural
Trauma severity was correlated significantly with measures of physical disability, psychiatric distress, illness adjustment, personality, and quality of sleep in patients with fibromyalgia but not in those with rheumatoid arthritis.	1997	natural
Results are significant for pre- vs post-EMDR (p =.04), for those with reported trauma history, (p=.01) and when controlled for frequency of sessions and time in therapy prior to the treatment (p=.04).	1996	natural
The phenomenon of traumatic reenactment has long been recognized as a problem for individual victims of trauma.	1996	natural
Additionally, multiple other trauma symptoms were found to be elevated both among those with a history of child sexual abuse and those with bulimic behaviors.	1998	natural
Also, the trauma of contracting AIDS may heighten suicide risk, particularly near the time of HIV testing or if dementia or drug treatment clouds consciousness.	1997	natural
This paper discusses the imagery and process of an art therapy support group for low-income isolated lesbians, through five related lenses: women's relational dynamics and the centrality of relationships in lesbians' lives; trauma; socioeconomic class; lesbian identity, visibility, culture, and gender; and transference.	1996	natural
Application of traditional milieu substance abuse treatment for sexual trauma survivors is explored.	1995	natural
In principle, pain is awareness of tissue trauma, but pain can occur in the absence of identifiable injury, and sometimes substantive tissue injury produces no pain.	1999	natural
Both the opioid and the cortisol concentration rose significantly in plasma in all three groups and in particular resulted significantly higher in the cervical traumatized group where spinal trauma was associated with spinal shock and hypotension.	1997	natural
Consecutive adult non-brain-injured admissions to a major trauma hospital (N = 92) were assessed between 2 days and 4 weeks following an MVA.	1999	natural
The trauma is dealt with in the African and African-American spiritual tradition of testifying to, and witnessing of, our history and experience.	1999	natural
The ETIG as a whole correlates highly with measures of general psychological symptoms and intrusive and avoidant trauma reactions, although there are indications that each measure relates to different areas of symptoms.	1995	natural
Recent precipitants were diverse and triggered affect that was usually related to current life problems or remote trauma.	1999	natural
Other major system interventions, testifying and removal of the child from the home, were not statistically correlated to trauma scores.	1997	natural
Results show that 75.4 of trauma patients are screened for blood alcohol levels, and 58.5 are given a urine toxicology, with lowest rates for 12-20 year olds and highest rates for patients over 40 who were confused or incomprehensible.	1996	natural
To measure the effect of war trauma on the functional health and mental_health status of Cambodian adolescents living in a refugee camp on the Thai-Cambodian border.	1997	natural
TAS-20 scores were significantly associated with severity of PTSD symptoms, but not with severity of trauma.	1997	natural
1997) a metal-analytic review revealed a small effect size attributable to a history of mild head trauma (MHT).	1997	natural
Participants were consecutive referrals to a Veterans Affairs outpatient post-traumatic stress disorder (PTSD) clinic who completed structured interviews, self-report measures (e.g., Minnesota Multiphasic Personality Inventory-2; MMPI-2), and a trauma history questionnaire as part of their routine clinical evaluations.	1999	natural
Also, five cases are described who experienced serious trauma, three of them living successful lives and two remaining disabled.	1996	natural
The findings have implications for introduction of expert testimony on postrape behavior and trauma, and discounting of the defendant's culpability with relationship intimacy is examined.	1995	natural
Results were discussed in terms of the ways in which children who have experienced trauma process information about their worlds.	1998	natural
Exploratory analyses indicated that PTSD symptom severity and the interpersonal nature of the trauma were related to thematic disruption.	1997	natural
This contributes to harm and trauma to the victims and the community at large.	1995	natural
The Harvard Trauma Questionnaire and a postmigration living difficulties questionnaire were completed by 62 asylum-seekers, 30 refugees, and 104 immigrants who responded to a mail-out.	1999	natural
A composite of BPO, anger, trauma symptoms and fearful attachment called Abusive Personality (ABP) correlated .42 with wives reports of emotionally abusive behaviors.	1996	natural
Amid this, there has been research which reports people perceiving benefits from their trauma experience.	1997	natural
The present research compared EMDR and a CBT variant (Trauma Treatment Protocol; TTP) in the treatment of PTSD, via a controlled clinical study using therapists trained in both procedures.	1999	natural
Although trauma is not an intrinsic part of all child abuse, the impact of some abuse may be best conceptualized from a traumatic stress perspective.	1997	natural
Temporal disintegration was highest among individuals who had experienced the most severe loss, had previously experienced chronic trauma, and had had their identities threatened by their traumatic experience.	1998	natural
Thirty-eight female outpatients receiving counseling at a community clinic completed three scales measuring the tendency to experience altered states of consciousness (Dissociative Experiences Scale (DES), Absorption Scale of the MPQ, and the Mysticism Scale), two measures of negative childhood experiences (Child Abuse and Trauma Scale (CAT) and the Self-Injury and Abuse Scale), and the Beck Depression Inventory.	1996	natural
This article presents some Rorschach data for 60 adult closed head injury (CHI) patients who were tested between 3 and 6 weeks after the trauma.	1996	natural
Obstetrical and gynecological conditions possess a unique power to reactivate psychological damage originally engendered by trauma.	1996	natural
Related research on trauma survivors is reviewed and implications for treatment are discussed.	1995	natural
Psychiatric diagnoses were made using the Structured Clinical Interview for DSM-III-R-Non-Patient version, a structured diagnostic interview, and trauma exposure was measured with a Traumatic Life Events Questionnaire.	1995	natural
Trauma victims were selected who had an Injury Severity Score of > or = 16 and were brought to all hospitals in the Mersey region and North Wales over 1 year.	1999	natural
In both cases, closed-head trauma almost certainly prevented long-term memory consolidation.	1997	natural
Criterion and construct validity are supported by a substantial correlation between the study instrument and the Trauma Symptom Checklist for Children (-.74) and a moderate correlation between the study instrument and the Child Behavior Checklist for Children (-.40).	1997	natural
A basis for the internally driven and cyclical aspect of the behavior becomes clearer as does the problems with modulation of arousal, anger, and the high levels of trauma symptoms found in populations of abuse perpetrators.	1999	natural
Because depression and depressive symptoms are associated with suicide and trauma, the relation between cholesterol and depressive symptoms is of interest.	1997	natural
In principle, pain is awareness of tissue trauma, but pain can occur in the absence of identifiable injury, and sometimes substantive tissue injury produces no pain.	1999	natural
Compared with control group participants, both trauma groups made significantly fewer illness visits at 1-month follow-up; however, real-trauma participants reported more fatigue and avoidance than did the other groups.	1996	natural
The author has had extensive clinical experience with psychic trauma, and bases his own views of DID on three assumptions: 1.	1999	natural
There has been a growing awareness of Post-Traumatic Stress Disorder (PTSD) as a consequence of childhood sexual trauma.	1996	natural
Results revealed that observing traumatic events rather than actually experiencing trauma was a significant predictor of psychological distress.	1998	natural
In the final section, developmental aspects are addressed by considering the interplay between child and adult trauma.	1998	natural
Previous studies have identified a number of variables which help to predict cognitive dysfunction following closed head injury (CHI) The purpose of the current study was to evaluate the predictive utility of a number of risk factors in a large sample of trauma patients who suffered CHI and underwent neuropsychological assessment Risk factors included demographic variables, Glasgow coma scale (GCS), CT scan, loss of consciousness (LOC), and blood alcohol level (BAL) Multiple regression was used to assess the role of these variables in predicting cognitive dysfunction Results suggested that LOC did not predict cognitive dysfunction Demographic factors did emerge as predictors of cognitive dysfunction BAL was correlated with initial GCS, but did not predict cognitive dysfunction once post-traumatic amnesia cleared.	1996	natural
They were evaluated for history of physical and sexual trauma, suicide attempts, eating habits, and SMB.	1998	natural
Building upon the trauma and attachment literatures, the present investigation examined the links among trauma, representational models of caregivers, and children's memory for mother-relevant information using an incidental recall task in a sample of maltreated (n = 71) and nonmaltreated (n = 102) children between the ages of 8 and 13 years.	1998	natural
No meaningful differences were detected in comparisons between ADHD and control children, either in the rate of trauma exposure or in the development of PTSD.	1999	natural
The distinction needs to be drawn between the reproduction of the trauma, the form in which the extreme trauma is indelibly tattooed on the memory, and actual recalling.	1995	natural
Present-day conceptions of transgenerational trauma are shown to be already present in Ferenczi.	1997	natural
These findings suggest that, whereas impaired consciousness at the time of a trauma may reduce the frequency of traumatic memories in the initial month post-trauma, MTBI does not result in a different profile of longer-term PTSD.	1999	natural
These results suggest and support other studies that EMDR can be an effective therapeutic intervention for trauma reactions.	1997	natural
This study examined convergent and discriminant validity between the Children's Impact of Traumatic Events Scalerevised (CITES-R) and the Trauma Symptom Checklist for Children (TSCC) in a sample of 80 sexually abused children.	1999	natural
Cognitive deficits in multiple trauma patients were related both to the severity of the traumatic brain injury and to the degree of psychological distress.	1999	natural
This study examines posttraumatic stress disorder (PTSD) symptoms, trauma exposure, gender, and diagnostic comorbidity in a sample of 59 Cambodian young adults (29 male and 30 female) who survived massive trauma as children.	1995	natural
A cognitive-behavioral model of therapy is discussed as an effective model for integrating sexual trauma healing into the ongoing relationship and sex therapy.	1995	natural
The following two points are argued: free symbolic play is a modality well suited to the expression, reworking and mastery of psychic trauma and therefore offers sexually abused children a channel for communication; free symbolic play is a potential source of information to mental_health professionals when attempting to understand the context of a child's experience of sexual abuse.	1996	natural
This paper argues for a closer integration of family therapy and spirituality, and is linked to a manuscript in preparation which explores the clinical application of spirituality to family adaptation following trauma.	1995	natural
The author suggests that the patient needed to turn the analyst into a perverse partner (disavowing her other-ness) in order to reverse and triumph over this core trauma.	1999	natural
The current study examined whether two trauma characteristics that are hypothesized to relate to perceptions of safety, assault location and assailant identity, predict the rate and severity of post-traumatic stress disorder (PTSD) in female rape victims.	1996	natural
SDPT is also unique in having been designed for use in mixed-gendered civilians with varied sources of trauma.	1999	natural
This study examined the construct validity of the Trauma Symptom Checklist-40 (TSC-40; Elliot & Briere, 1992) in a sample of 130 female psychiatric inpatients.	1996	natural
These six clinical findings include: the presence of a high risk disorder or illness; post-traumatic stress disorder; age regression, flashbacks, abreactions or other re-experiencing of the trauma; repetitions, repetition compulsions or re-enactments; characteristics of the memories themselves; and other patterns, dynamics, and connections.	1998	natural
Recently, there has been a resurgence of interest in relations among psychological trauma, dissociative phenomena, and various forms of trauma-related distress that has spawned a prolific amount of research.	1999	natural
The following three hypotheses were tested: children who report watching greater amounts of television per day will report higher levels of trauma symptoms than children who report lesser amounts of television viewing; children who report watching greater amounts of television per day will report higher levels of violent behaviors than children who report watching lesser amounts of television per day; and children who report a preference for action and fighting programs will report higher levels of violent behaviors than children who report a preference for other types of television programs.	1998	natural
Findings are consistent with a model in which the psychological consequences of trauma increase the likelihood of later traumatic experiences.	1999	natural
The theory considers 3 possible outcomes of the emotional processing of trauma, successful completion, chronic processing, and premature inhibition of processing We discuss the implications of the theory for research design, clinical practice, and resolving contradictions in the empirical data.	1996	natural
Abraham's previously unheralded concept of traumatophilia has relevance to current clinical controversy regarding constitution and sexual trauma.	1995	natural
Several arguments substantiate the thesis that Freud's notion of psychical (sexual) trauma was developed in reference to Charcot's notion of traumatic hysteria, and that the early psychoanalytic theory of psychical trauma is clearly indebted to Freud's encounter with Charcot's male traumatic hysterical patients.	1995	natural
None of the subjects were diagnosed with mental retardation, nor did any of the subjects have a history of seizure disorder, head trauma, or other neurodevelopmental_disorders.	1996	natural
Variables associated with a longer time to remit from an episode of chronic PTSD were a history of alcohol abuse and a history of childhood trauma.	1999	natural
The present findings suggest that different forms of CNS trauma may aggregate as a result of a number of antecedent and consequent phenomena in this population.	1998	natural
The findings highlighted the close relationship between histories of exposure to trauma and high scores on this scale.	1995	natural
Two hundred and seventy-nine college students were surveyed utilizing the symptom checklist from the Courage to Heal Workbook, Trauma Symptom Checklist-40 (TSC-40), Abusive Behavior Inventory (ABI), and questions related to participants' beliefs that they had been abused as a child.	1998	natural
It is argued that it is possible to be effective in ending violence and abuse through a modified couples treatment format that addresses relationship issues, individual trauma, and biological vulnerability while simultaneously taking a clear, moral position that violence, abuse, and inequality are intolerable in any form.	1998	natural
Recent literature reviews find strong support for EMDR's value in trauma therapy.	1998	natural
Mild head trauma is often complicated by a persistent set of symptoms known as postconcussion syndrome (PCS).	1999	natural
It was thought that dissociation may be important in preventing the resolution of the trauma.	1999	natural
However, given that there is insufficient research to validate any method for complex or trauma related phobias, that EMDR is a time-limited procedure, and that it can be used in cases for which an exposure in vivo approach is difficult to administer, the application of EMDR with specific phobias merits further clinical and research attention.	1999	natural
Psychosocial outcome at one year post-injury was examined prospectively in 466 hospitalized head-injured subjects, 124 trauma controls, and 88 friend controls.	1995	natural
Many trauma survivor dyads pose intense challenges for couples and marital therapists.	1996	natural
Findings of a multi-staged narrative analysis suggest that, for women like those in this study, the discovery of HIV seropositivity is a traumatic event, carrying with it elements that are common to other types of trauma: perceived threat to one's life and perceived responsibility for the deaths of others.	1997	natural
Four of a novelist's dreams and two contemporaneous pieces of her fiction are examined through the lens of poststructuralism; thus viewed they display narrative coherence in form and content, a reciprocal interaction between dream and written day residue, and a rhetorical function in trauma resolution.	1997	natural
As an initial effort to examine Chinese sexual abuse trauma in relation to the cultural construction of sexual victimization of women, this study applies Finkelhor and Browne's (1985) traumagenic dynamics model to examine post-abuse trauma among Chinese child and adolescent survivors in Taiwan.	1998	natural
Subjects included patients admitted to the trauma service of a large teaching hospital who were suspected of having suffered CHI.	1997	natural
A case of recovered memory of childhood trauma is reported with documented sexual trauma in early childhood, chronicled evidence of the absence of memory for traumatic experience over a period of time, and substantial evidence of 'spontaneous' recovery of memory.	1998	natural
Research suggests that: emotion impacts memory; psychogenic amnesia can be a reaction to unusual levels of trauma; memory is malleable and delayed memories are prone to errors; however, inaccuracies in traumatic memories are more likely to be in peripheral details than central details.	1999	natural
Those treating victims of real trauma frequently believe that psychoanalysis is not appropriate for their patients.	1996	natural
Sexually addicted pastors unconsciously choose their vocation to cover up childhood trauma and sexual issues.	1997	natural
Disruptions of self are conceived according to Jacksonian theory and the notion of trauma.	1998	natural
Clinicians often feel reticent about exploring sexual trauma and its aftermath too soon.	1996	natural
