New species of claims for psychiatric injury will cause courts to reassess the principles governing the way the common law has compensated those compromised by careless exposure to trauma.	1997	natural
The return of the parents' trauma manifested itself most clearly in the necessity felt by the son to organise his own sexuality in a particular way.	1996	natural
In many of these studies, researchers also examined the impact of the co-occurring trauma of childhood physical abuse (CPA) in regard to PTSD symptoms.	1998	natural
In the current study of 93 consecutive head trauma admissions, 24 had complete astereopsis and 41 performed more than 2 SDs below the orthopedic control group mean.	1999	natural
In each case, evidence of significant psychiatric disability and/or malingering was present and seemed to better explain the poor neuropsychological test findings than did the trauma.	1998	natural
In spite of the literature indicating broad disagreement with the definition of ritual abuse in other studies, results indicate 70 of all counselors agreed with a single definition of ritual abuse, and 85 agreed that ritual abuse was an indication of genuine trauma.	1999	natural
Only a minority of patients with severe personality disorders report severe childhood trauma.	1997	natural
They are at risk in myriad ways: for instance, being poor, having chronic health deficits, experiencing the trauma of abuse and neglect, and suffering from a gamut of emotional challenges.	1997	natural
Whereas 26 patients were categorized as Accepting or Coping at the initial interview, 25 were placed in the Experiencing emotional trauma category after treatment was completed.	1996	natural
Individual, group, and family dynamics all provide important contextual information for the processing of sexual abuse trauma in psychotherapy.	1995	natural
Participants were administered a battery of self-report measures that assessed personality, dissociation and childhood trauma and/or abuse.	1999	natural
This article reviews the psychometric properties of the Stressful Life Events Screening Questionnaire (SLESQ), a recently developed trauma history screening measure, and discusses the complexities involved in assessing trauma exposure.	1998	natural
None of the four studies provided both clear confirmation of trauma and adequate documentation of amnesia in their subjects.	1995	natural
In addition, our study replicated Irwin's (Journal of the American Society for Psychical Research, 86, 199208, 1992) finding of a small but significant correlation between childhood trauma and paranormal belief, and extends previous findings showing a small correlation between childhood fantasy and paranormal belief (and experience) to the realm of childhood fantasy, thus addressing the childhood factors model proper.	1995	natural
The paper suggests that an appreciation of this obscure phenomenon is critical in the treatment of trauma.	1998	natural
The author discusses key areas affecting the occurrence of anxiety disorders in women, including medical conditions, epidemiological and diagnostic perspectives, work and the reproductive cycle, trauma (including abuse), and marriage and the family.	1995	natural
In addition, dissociative responses to combat trauma were associated with higher long-term general dissociative symptomatology as measured by scores on the Dissociative Experience Scale, as well as increases in the number of flashbacks since the time of the war.	1997	natural
The data provide further support for the view that common affective consequences of childhood trauma may mediate between such trauma and the development of a dissociative coping style.	1998	natural
These findings provide a starting point for more detailed investigations of the relations between trauma, psychopathology, and violence and suggest that the study of trauma may offer a new way of looking at links between victim and perpetrator.	1998	natural
This paper is a grouping of ideas related to some of the emotional aspects of living with brain trauma and seizures.	1996	natural
The deferred action of psychic trauma is an antiquated concept and psychic trauma has immediate effects as well as far reaching developmental consequences.	1996	natural
This study examined the relationship between a history of trauma and the features and persistence of major depression (MDD) in patients with anxiety disorders.	1997	natural
We investigate the reading performance of a brain-damaged patient, JV, whose reading skills were abolished after trauma but regained four years later.	1995	natural
The present case is considered with reference to Hickey's Trauma Control Model of serial murder (1991).	1995	natural
A substantial number of clients had experienced at least one lifetime trauma (94), and of those, 42 had PTSD during the past year.	1999	natural
The Street Gestalt Completion Test was administered to 18 right-handed men with no history of head trauma, neurological disorders, or familial sinistrality.	1995	natural
Factor analytic studies of trauma victims' posttraumatic stress disorder (PTSD) have offered conflicting hypotheses about how to conceptualize PTSD into symptom categories.	1999	natural
A developmental psychopathology framework, with its emphasis on an interdisciplinary perspective, the interplay between work conducted with normal and atypical populations, and its focus on investigating functioning in multiple domains of development concurrently, possesses significant potential for advancing work on memory and trauma.	1998	natural
This investigation was based in an urban, level one trauma center federally designated as a model system of comprehensive rehabilitative services for persons with TBI and persons with SCI.	1999	natural
All were evaluated comprehensively with assessments in multiple domains of functioning including systematic assessments of trauma and PTSD.	1999	natural
The responses of 12 outpatients with PTSD were compared with those of panic disorder patients (n = 11), survivors of traumatic events who had not developed PTSD (n =, and mentally healthy subjects with no lifetime history of major trauma (n = 19).	1997	natural
The following three hypotheses were tested: children who report watching greater amounts of television per day will report higher levels of trauma symptoms than children who report lesser amounts of television viewing; children who report watching greater amounts of television per day will report higher levels of violent behaviors than children who report watching lesser amounts of television per day; and children who report a preference for action and fighting programs will report higher levels of violent behaviors than children who report a preference for other types of television programs.	1998	natural
The presence of chronic trauma symptoms and similarity to a specific profile for post-traumatic stress disorder (PTSD) were assessed in a group 132 wife assaultive men and 44 demographically matched controls.	1995	natural
Analyses replicate and extend findings from the literature on life events: social desirability plays a marginal role as a moderator variable in the assessment of trauma.	1996	natural
Freud in The uncanny links the interpretation of uncanniness to compulsive repetition and thus makes the connection to trauma and birth anxiety discussed in later works such as Beyond the pleasure principle and Inhibitions, symptoms and anxiety.	1999	natural
The response of 18 subjects with ABI (XCA, 27.5 years, X period since trauma 6.0 years) to static and dynamic assessment processes are compared.	1996	natural
Because it was not possible to say if this distress resulted from the homicide itself or from the fact that people who lose family members to homicide generally have lives rooted in stressful contexts, we compared the homicide sample to two sociodemographically comparable groups of 108 other trauma victims and 119 nonvictims selected from a larger epidemiological dataset.	1998	natural
This paper addresses the losses, trauma, and adjustment difficulties suffered by people who leave behind significant frames of reference and relational contexts that sustain their identifications.	1999	natural
The results of this study indicate not only that victimization and revictimization experiences are frequent, but also that the level of trauma specific symptoms are significantly related to the number of different types of reported victimization experiences.	1996	natural
Substance abuse and urban trauma go hand in hand.	1995	natural
The results of trauma can be so debilitating that a missionary might be unable to continue to minister.	1999	natural
Cumulative data from the Virginia Brain Injury Central Registry, which maintains information on persons presenting to the emergency rooms for evaluation and treatment of head trauma, were analysed for fiscal years 1988-1993.	1996	natural
Mothers from low socioeconomic status show more often dismissing attachment representations and unresolved loss or trauma.	1996	natural
The trauma is dealt with in the African and African-American spiritual tradition of testifying to, and witnessing of, our history and experience.	1999	natural
A sample of 19 persons complaining of chronic pain and a comparison sample of 25 persons having sustained head trauma were obtained by retrospective chart review.	1995	natural
Athletes with no head trauma history overestimated the expected degree of pre- to postinjury change in symptom status.	1999	natural
Data was collected on 341 persons (mean age 37.7 years) with traumatic brain injury treated at the Level I trauma centre, who required inpatient rehabilitation.	1999	natural
In the spirit of a greater consideration of the interlace between psychoanalysis and cultural trauma (Hunter Brown 1992), this paper examines the relationship between the magnitude of a cultural trauma (and its resonance) and the time it takes for the trauma to be worked through.	1996	natural
These control strategies maintain the intrusive recollections by preventing a change in the meaning of the trauma and of the traumatic memories.	1995	natural
Adolescents who have suffered the trauma of incest or rape often search for inner resolution amidst a society that can be more rejecting than comforting.	1999	natural
History of early childhood trauma was prevalent and highly correlated with Disorders of Extreme Stress Not Otherwise Specified (DESNOS) in a sample of veterans in inpatient treatment for chronic posttraumatic stress disorder (PTSD).	1998	natural
Clinical examples are used to explore issues of contact, the placement of siblings, the impact of parental trauma on a childs development as seen in psychotherapy, and the opportunities for working through afforded by adoption.	1999	natural
A history of childhood trauma was associated with greater functional impairment and higher likelihood of having a personality disorder, but with no difference in Axis I diagnoses.	1997	natural
This leads to new recommendations for sex assignment in cases of genital trauma or hermaphroditic individuals with ambiguous genitalia.	1997	natural
A consistent relation between earlier war trauma, resettlement stress, and symptoms of PTSD was found.	1996	natural
Changes in anxiety as a personality trait was found, indicative of the potential long-term effects of psychological trauma.	1995	natural
Seventy-nine urban adolescent girls attending an adolescent medicine clinic were assessed via clinician-assisted self-report measures called the Adolescent Self-Report Trauma Questionnaire.	1995	natural
These results demonstrate that trauma and other adverse life events are strongly associated with alcohol use disorders in adolescents.	1997	natural
This study examines posttraumatic stress disorder (PTSD) symptoms, trauma exposure, gender, and diagnostic comorbidity in a sample of 59 Cambodian young adults (29 male and 30 female) who survived massive trauma as children.	1995	natural
More than two fifths of adolescents experienced at least one DSM-III-R trauma by age 18 years; PTSD developed in 14.5 of these affected youths or 6.3 of the total sample.	1995	natural
A case of recovered memory of childhood trauma is reported with documented sexual trauma in early childhood, chronicled evidence of the absence of memory for traumatic experience over a period of time, and substantial evidence of 'spontaneous' recovery of memory.	1998	natural
In addition, the more personal the trauma was, the worse they felt after their disclosure, and the more disturbed they were about the trauma.	1995	natural
With regard to extreme trauma in childhood, this study develops the following hypotheses: the overwhelming, shattering blow of an external event is met by an equally strong, archaic defence, even in the historical situation itself, as an escape from the unbearable, unspeakable pain; the Janus face of the victim/perpetrator introject is manifest in the masochistic character-structure; these splits can be attenuated in the course of a person's life, with the appropriate help, although they cannot be fully integrated.	1995	natural
Closed head injured subjects who completed the WMS-R were divided into either mild injury (MI, n = 41) or moderate/severe (SI, n = 41) injury groups based on trauma severity indicators and were matched on age and level of education.	1997	natural
Theoretical models of the adjustment process following loss and trauma have emphasized the critical role that finding meaning plays.	1998	natural
Forty-six mothers participated in a cross-sectional exploratory study and completed a range of self-report measures, including the Child Abuse & Trauma Scale, Social Support Inventory, CES-D, Parenting Stress Index, and the Parenting Scale.	1999	natural
The findings suggest that the significant levels of comorbid diagnoses previously found to exist with PTSD in people traumatized as adults can be found among survivors of massive childhood trauma.	1995	natural
Since trauma arises from an inescapable stressful event that overwhelms people's coping mechanisms, it is uncertain to what degree the results of laboratory studies of ordinary events are relevant to the understanding of traumatic memories.	1995	natural
This paper outlines an attachment-theory based model of transgenerational trauma inspired by the successful psychoanalytic treatment of a severely disturbed adolescent with obsessive-compulsive disorder who was the first child of the first daughter of a holocaust survivor.	1999	natural
Eighty adolescent females, aged 14-16 years, answered questions regarding abuse history, attachment style, coping with an interpersonal stressor, depression and trauma symptomatology, and conflict with a best friend.	1999	natural
Length of time since trauma exposure is consistently negatively correlated with PTSD severity.	1996	natural
The possibility of trauma, in particular childhood sexual abuse, as a causative factor in dissociative disorders is discussed.	1999	natural
Although community services may be beneficial for some victims, there is increasing evidence that they can add trauma, rather than alleviate distress (termed secondary victimization).	1999	natural
Temporal disintegration was highest among individuals who had experienced the most severe loss, had previously experienced chronic trauma, and had had their identities threatened by their traumatic experience.	1998	natural
A substantial body of research suggests that the MMPI-2 contains a number of items that are sensitive to closed-head trauma (CHT) and other neurologic conditions.	1997	natural
In an examination of the prevalence and effects of childhood trauma among college freshmen, as expected, the majority of 515 youth reported at least one traumatic experience in childhood.	1998	natural
In the author's view, a careful reading of the two men's late works reveals a conception of trauma as lying in an intersubjective space as a consequence of the meeting of drive and object.	1997	natural
This article explores issues surrounding sexual trauma and chemical dependency.	1995	natural
We explore the significant theme of the rebuilding of trust between mothers and daughters and facilitate a process whereby the woman is able to bear witness to and acknowledge the trauma experienced by her daughter.	1997	natural
Comparing current memory functioning to estimates of premorbid intellectual ability appears to be a sensitive indicator of presence and degree of intellectual and memory dysfunction in head trauma patients.	1997	natural
The course and outcome of posttraumatic symptoms (Impact of Event Scale [IES]) and symptoms of general psychological distress (SCL-90) were examined in relation to type of trauma (loss vs. no loss) and prior exposure to trauma.	1996	natural
Six items pertaining to interpersonal trauma form an internally consistent subscale.	1999	natural
Twelve Bosnian adolescents who experienced the massive psychic trauma of ethnic cleansing were assessed during the first year after their resettlement in the United States.	1995	natural
Forensic and clinical implications are discussed and a plea issued for more study of the memory phenomena that characterize posttraumatic stress disorder (PTSD) and are the focus of trauma survivors treatment.	1995	natural
Receiving positive social support after a trauma generally is related to better adjustment to the trauma.	1999	natural
The need for research into developmental changes in children's reaction to trauma is highlighted.	1998	natural
Compulsive weight lifting and anabolic substance abuse may represent another form of response to the trauma of sexual assault.	1999	natural
This study was designed to assess cognitive functioning 3 years after severe multiple trauma and to investigate how cognitive performance is related to head injury severity and psychological distress respectively.	1999	natural
The present paper discusses the relationship between prolonged traumatic stress and subsequent suicidality by reviewing studies that have examined suicidal behavior in relationship to child abuse and combat trauma.	1997	natural
Over a period up to 44 months post trauma, reaction times were found to decrease faster for patients with longer coma duration.	1996	natural
Dissociative responses to trauma have been hypothesized to be associated with long-term increases in psychopathology.	1997	natural
It was then that fragments of the memory of the sexual trauma emerged.	1995	natural
144 psychiatric inpatients who reported childhood physical or sexual trauma were administered the Symptom Check List-90-Revised, the Dissociative Experiences Scale, and the Dissociative Disorders Interview Schedule.	1997	natural
These findings are consistent with models of anxiety-based disorders which implicate avoidance or escape in the maintenance of such disorders, or which identify the evaluation of the precipitating trauma as important in the acquisition of such disorders.	1995	natural
A substantial portion of trauma experts working in the field of human-engendered violence recognize the possibility that certain traumas can result in personality change.	1999	natural
Because finger-thumb and 10-cm hand couplings require larger wrist deviations and greater velocities, these objects may pose a greater risk of developing cumulative trauma disorders to the bagger.	1998	natural
For the above reasons this first paper is a ''calling card'' which announces Ferenczi's later reflections on the specific affective qualities that may render the psychoanalytic environment non-traumatic, as well as his criticism of the narcissistic aspects of the analyst (one of the most important motives for subtle and hidden trauma), who views the work of interpretation as the product of a single mind (in my terms: a kind of colonisation and expropriation of the other) rather than as fruit of an encounter that would take into account both the unique characteristics of the partner as well as the rhythms appropriate to such a relationship.	1999	natural
Eighty-two students at the University of Edinburgh were administered three questionnaires relating to childhood trauma, childhood fantasy, and paranormal belief and experience.	1995	natural
Findings were (a) age of onset, chronicity and severity of trauma were highly correlated and predicted level of dissociation; (b) both the avoidant and disorganized patterns of attachment were strong predictors of dissociation; (c) dissociation in childhood may be a more normative response to disruption and stress, while dissociation in adolescence and young adulthood may be more indicative of psychopathology; (d) preliminary support was found for a model proposed by G. Liotti that links disorganized attachment, later trauma, and dissociation in adulthood; and (e) strong support was found for N. Waller, F. W. Putnam, and E. B. Carlson's contention that psychopathological dissociation should not be viewed as the top end of a continuum of dissociative symptomatology, but as a separate taxon that represents an extreme deviation from normal development.	1997	natural
Demographic characteristics, residency status, and measures of trauma and postmigration stress were fitted to a structural model in PTS symptoms.	1999	natural
The trauma-memory argument proposes that memories of childhood trauma can affect adult behavior outside awareness and that such unconscious memories can return to awareness even after long delays.	1995	natural
The four elements of the trauma suffered by Holocaust survivors are powerlessness, annihilation anxiety, object loss and torture.	1996	natural
Indeed, the Janetian trauma treatment is intended to break down the client's higher mental functions: by re-experiencing horror, automatic processes of dissociation are reinforced; the client's spontaneous compensatory system is destroyed.	1999	natural
Elevated BE concentration putatively correlates with pain perception in trauma patients.	1995	natural
Accordingly, we may hear in people's trauma psychophysical reactions to events; the playing out of themes from a lifetime; violations whose inner message is a demand to awaken beyond self-protective ways of being; and a uniquely powerful opening for communion.	1995	natural
Clinical trauma accommodation is discussed to offer the processing and adaptation to peer victimization.	1998	natural
However, careful attention to the individual symbol system of young children can reveal the unexpected, particular ways that trauma may be recorded in nonverbal and kinesthetic dimensions, especially when the trauma occurs before the acquisition of language.	1997	natural
47 of athletic trainers who responded believe that every injured athlete suffers psychological trauma.	1996	natural
Interviewers obtained data on demographics, drug use, psychological trauma history, criminal history, social support, and coping behavior variables.	1996	natural
Furthermore, neither PTSD severity, dissociative symptom severity, nor extent of preexisting amnesia for childhood trauma contributed to the variance in memory functioning.	1999	natural
The authors examined traumatic injury severity, pain perception, and BE concentration in patients admitted to an urban trauma center.	1995	natural
Fourteen male sex offenders receiving inpatient treatment were assessed for histories of childhood trauma and dissociative symptoms.	1999	natural
Astrocytic subtypes in different cortical regions of injured human cerebral cortex of 22 patients with brain trauma, vascular anomalies and brain tumours have been examined by means of light microscopy and conventional transmission electron microscopy.	1999	natural
This article describes techniques and therapy strategies to address the chronic sexual dysfunctions that are inherent in couples who are recovering from sex addiction and sex co-addiction and from the underlying sexual trauma that gives fuel to the sexual disorders.	1999	natural
The second, the debate over the place of gratification and abstinence in controlling the depth of regression and in working through the shame which regression necessarily generates, and the third, the relation between trauma, regression and shame in the work of Ferenczi, together with the shame/narcissistic injury over his rift with Freud and the subsequent allegation by Jones and others of paranoid delusions and psychotic disturbance.	1998	natural
These findings, which are generally consistent with prior reports of reduced hippocampal volume in combat veterans with PTSD, suggest that diminished hippocampal size may be either a consequence of trauma exposure or a risk factor for the development of psychiatric complications following trauma exposure.	1997	natural
While some clinicians assume that traumatic intrusions are historically accurate revisualizations of traumatic incidents, others have suggested that these types of intrusions may represent a worse case scenario (i.e. exaggerated) version of the trauma.	1998	natural
Motor vehicle accident survivors (n = 92) were assessed for acute stress disorder (ASD) within 1 month of the trauma and reassessed (n = 71) for posttraumatic stress disorder (PTSD) 6 months posttrauma.	1998	natural
Men who committed intimate abuse experienced more chronic trauma symptoms than nonabusive controls.	1995	natural
This is a small study conducted under difficult conditions to test the effectiveness of Eye Movement Desensitization and Reprocessing (EMDR) in treating trauma related reactions following Hurricane Andrew.	1997	natural
Seventy adolescent inpatients completed the Childhood Trauma Questionnaire (CTQ) (Likert-type items are summed to form dimensional scales, and cutoff scores determine abuse status), the Traumatic Events Questionnaire--Adolescents (multiple-choice items determine abuse status) and measures of depression, suicidal ideation, and dissociative symptoms.	1999	natural
Findings suggest that treatment providers need to assess trauma histories and traumatic stress symptoms.	1998	natural
