Results from this study emphasize the importance of considering different types of social media in relation to substance use and abuse during emerging adulthood and the need to examine these relations by gender.	2017	natural
Despite prior research that shows that parental substance abuse is a risk factor for lengthy foster care stay, little is known about the effect of specific types of substance use on permanency.	2015	natural
The aim of this study is the development and analysis of the psychometric properties of a new instrument to assess the possible psychological abuse experienced in a group setting.	2017	natural
A sample of 1,033 adults completed self-report questionnaires online, and 21.5 reported childhood sexual abuse.	2016	natural
A three-class solution was found to have the best fit to the data: intact functioning families had little family risk; families with criminality had higher probabilities of family criminality, of drug/alcohol abuse, and of being nonintact; and poorly managed families received the poorest parenting and were more likely to be nonintact.	2016	natural
The relationship between different types of substance abuse with risky and preventive behaviors was assessed.	2016	natural
This meta-analysis seeks to quantify the prospective association between neuroticism and the common mental_disorders (CMDs, including anxiety, depression, and substance abuse) as well as thought disorders (psychosis/schizophrenia) and non-specific mental distress.	2016	natural
The research aim was to discover the circumstances, if any, in which contact with the parent who had abused them, could help survivors of intrafamilial child sexual abuse (ICSA) to recover from the inherent relational trauma.	2015	natural
Physical child abuse and teacher harassment should be considered when preventive and intervention programs are developed for adolescents.	2015	natural
After reviewing the prevalence and consequences of ESM for all parties involved, the authors propose standards of practice based on the Situational Crime Prevention framework to prevent sexual abuse by altering the environment and reducing opportunities for offending.	2018	natural
Physical abuse did not predict antepartum and postpartum depression risk.	2016	natural
The review concludes with ways in which future policies could benefit by addressing adolescent stress as a means of reducing adolescent nicotine abuse.	2016	natural
Most studies of female sex workers (FSWs) conducted in the Mexico-US border region have focused on individual HIV risk, centered on sexual behaviors and substance abuse patterns.	2015	natural
By juxtaposing research into the experiences of police officers charged with interviewing children who are the alleged victims of sexual abuse, and clinicians tasked with diagnosing and managing contested cases of thyroid disease, the paper develops an understanding of such practice paradoxes as occasions of stalled transition, or liminal hotspots.	2017	natural
Accordingly, the current study examined whether impulsivity moderated the association between child maltreatment types (i.e., physical abuse, physical neglect, sexual abuse, emotional abuse, and emotional neglect) and BMI.	2017	natural
Overall, clinicians reported that 69 of CAMHS clients had experienced a potentially traumatic experience (any physical, emotional or sexual abuse, child neglect or traumatic event).	2015	natural
Lifetime drug injection was significantly associated with lower education, homelessness, prior criminal justice involvement, opioid use, polysubstance use, childhood physical and sexual abuse, and being HIV-infected, but not with prior OAT.	2016	natural
However, little research has examined how ACT may be paired with other techniques traditionally applied to treat substance abuse, such as motivational interviewing (MI).	2018	natural
Most cases of abuse took place in the home of the abuser.	2018	natural
The 12-month prevalence estimates of regular heavy drinkers, and alcohol abuse disorder and dependence were 2.5, 3.2 and 1.6, respectively.	2017	natural
However, empirical studies show heterogeneous results depending on the type of childhood abuse or neglect and other maltreatment characteristics.	2018	natural
Frequency of abuse did not relate to stress reactions.	2016	natural
We also examined the unique relationship between childhood sexual abuse (CSA) and adult sexual victimization while adjusting for co-occurring substance dependence and psychopathology.	2016	natural
Sexual abuse during childhood is a public health and human rights concern throughout the world, including Sub-Saharan Africa.	2015	natural
Path-analyses confirmed a positive relationship between exposure to traumatic events and PTSD symptom severity, appetitive aggression, the number of committed offenses and drug abuse prior to violence.	2017	natural
Survivors of child sexual abuse (CSA) often delay disclosing or do not disclose the abuse for fear of not being believed.	2015	natural
Mechanisms such as mentalization, attachment, physiological factors, and the cycle of abuse offer a valuable perspective to further our understanding of the relational patterns.	2016	natural
The aim of the current study was to examine whether contact with CPS is associated with improved mental_health outcomes among adult respondents who reported experiencing child abuse, after adjusting for sociodemographic factors and abuse severity.	2018	natural
Analysis of information held by police, probation, and third-sector organizations in Wales about 100 domestic abuse perpetrators, along with 16 practitioner interviews, provides the empirical context for a discussion of the problem of serial domestic abuse.	2016	natural
The current study on Japan provided empirical support consistent with results found in other countries regarding the intergenerational transmission of child physical abuse.	2015	natural
Five groups of young offenders were compared: (a) no known child protection notifications or substantiated experience of abuse and/or neglect, (b) notifications only, (c) substantiated notifications, (d) notifications or substantiations and subsequent placement in out-of-home care (OHC), and (e) placement in OHC only.	2018	natural
The health sector has an opportunity and responsibility to be part of the multisector collaboration to prevent and respond to sexual abuse of minors.	2017	natural
Interviewing victims of child sex abuse requires considerable care in order to minimise error.	2016	natural
Her work in the field of abuse and trauma spans decades.	2017	natural
Perceived social support from the community was lower in the sexual revictimization group than in the single sexual abuse and comparison groups.	2017	natural
Multigroup analyses indicated that adolescence-onset and duration of sexual abuse respectively predicted anxiety and PTSD in females but not males, whereas sexual abuse severity predicted fewer PTSD symptoms in males but not females.	2018	natural
Furthermore, important types of tensions in efforts to safeguard against child sexual abuse are identified: the importance of listening to children and avoiding false allegations, the preschool teacher as a safeguarder and a potential abuser, and the importance of preventing child sexual abuse and providing qualitative care of children.	2016	natural
Progress in identifying polymorphisms associated with DRD profiles could further clarify the underlying biological systems for pharmacological and neuromodulatory interventions, and, as a qualitatively different risk factor from existing prevention programs, impulsive DRD is worthy of investigation at a more general level as a novel and promising drug abuse prevention target.	2015	natural
However, given the plethora of sampling methods, there is a large variation in estimated rates of false allegations of sexual abuse depending on the data source and context of the allegation.	2018	natural
A longitudinal randomized controlled trial tested whether access to permanent housing reduces child maltreatment among inadequately housed families under investigation for child abuse and neglect.	2017	natural
Offering counseling and psychotherapy to patients with pedophilia is considered an essential part of sexual abuse prevention by many experts in the field.	2015	natural
This review comprehensively examines the 23 prior studies that evaluated the intellectual, language, visual-spatial, memory, motor, and/or attention/executive functions in children and adolescents following an experience of childhood abuse and/or neglect.	2016	natural
Results indicated that, regardless of sexual orientation, participants experienced verbal and physical abuse due to their feminine gender expression, beginning in primary school and continuing through university and into the workplace.	2017	natural
Childhood experiences of abuse and neglect were assessed in relation to dysphoric states among patients with borderline personality disorder (BPD) over a 10-year course of prospective follow-up.	2015	natural
Concurrent criterion validity confirmed hypothesized relationships between childhood abuse and health-related quality of life, life satisfaction, self-perceived health, bullying victimization and perpetration, externalizing and internalizing behaviors, and multiple health complaints.	2017	natural
Results of the multinomial logistic regression (MLR) analyses found that children for whom parent/caregiver substance abuse and/or mental_illness was an issue were less likely to be reunified with their parents than remain in care.	2015	natural
Future research should assess the impact of interventions that aim to mitigate poor SEB outcomes due to ACEs, especially sexual abuse.	2017	natural
The study findings suggest that more comprehensive HIV care, which integrates mental_health and substance abuse services in order to enhance meaning and address coping and grief, may be important.	2018	natural
This study highlights the importance of relational components in treatments for substance abuse. (	2015	natural
In light of the prevalence of substance co-use, this review will also explore the effect of tobacco and other substance abuse co-morbidity on the dopaminergic system across study samples in the reviewed literature.	2016	natural
Violence exposure was characterized with dimensional scores reflecting probability of membership in two classes derived via latent class analysis from the Conflict Tactics Scales: Abuse and Harsh Parenting.	2015	natural
Thus, the Sig-1R has become a potential therapeutic target of medication development against drug abuse that differs from traditional monoamine-related strategies.	2016	natural
Given the substantial comorbidity between substance abuse and psychosis, it is critical for researchers and clinicians to consider potential effects of substance abuse when evaluating insanity acquittees for conditional release, especially as substance use relates to future dangerousness.	2016	natural
In rats, PS facilitates the rewarding and neurochemical-stimulating effects of drugs, suggesting that PS may represent a risk factor for drug abuse in humans.	2017	natural
The purpose of this paper is firstly to demonstrate that child sexual abuse happens within the family system in South Africa, and secondly, to argue that the prevention of child sexual abuse should start within the family system and this can be achieved by conducting educational social group work sessions on child sexual abuse with the family members.	2018	natural
This study developed and tested a web-based, drug abuse prevention program for adolescent girls.	2017	natural
Children who enter foster care are at unique risk for developing substance abuse due to experiencing early life stressors.	2018	natural
Moreover, future research is needed to replicate and better understand the explanatory mechanisms underlying the relationships among a history of IPV, abuse perceptions, and gender.	2015	natural
The study compared two independent samples of children aged 810 years: 48 child abuse victims recruited from a centre for Child and Adolescent Psychological Support (NACA) for abused children, and 144 public and private school students.	2018	natural
Childhood abuse has been linked to HIV/sexual risk behaviors among IPV-victimized women; however, limited research has examined factors that may influence this association.	2018	natural
Findings also point to the need for continued assessment of and protection from ongoing physical abuse during adolescence.	2018	natural
This study aims to adapt The HwalekSengstock Elder Abuse Screening Test (H-S East) (Neale, Hwalek, Scott, Sengstock, & Stahl, 1991) to Turkish and to assess its validity and reliability while determining the factors that affect elder abuse.	2016	natural
Abuser weaknesses and strengths as highlighted in the theoretical framework should be further investigated for future prevention and intervention in cases of emotional/psychological abuse.	2017	natural
This study involved interviews with three female victims of on-line grooming and contact sexual abuse and the three adult males who groomed and abused them.	2015	natural
In addition, we found a significant relationship of adolescent abuse with greater risk of both experimental and daily smoking.	2018	natural
Participants were 61 adolescent girls (age: M = 15.33, SD = 1.50 years) with sexual abuse related PTSD seeking treatment at a community mental_health clinic.	2016	natural
Sexual activity online may result in positive experiences for young people, or lead them to engage in risky behaviours possibly resulting in sexual assault or abuse.	2015	natural
The following six themes emerged from the narratives: (a) being a parent, (b) family of origin dysfunction, (c) the impact of abuse, (d) the abuse history and response to abuse, (e) coping, and (f) hopes and desires for the future.	2015	natural
This study sought to explore anecdotal reports that social workers in South Africa are often advised to postpone therapy with child complainants of sexual abuse until after the child's testimony, based on concerns of legal professionals that therapeutic interventions could influence the child's testimony.	2018	natural
There is a fine line between nonabusive physical punishment and physical child abuse, and where this line is drawn is often influenced by prevailing cultural practices and child-rearing beliefs.	2016	natural
The transcripts from the focus groups were analyzed thematically and resulted in four main themes: (a) varied associations of the term abuse, (b) judging elder abuse situations in terms of abuse and severity, (c) self-identification with elder abuse, and (d) prevention of elder abuse.	2017	natural
Of the total sample, 74.4 (n = 134) of the addicted women had been victims of abuse.	2015	natural
This also ranked abuse experienced in terms of severity: concerning, serious or extreme.	2015	natural
I discuss the ways in which early relational trauma and sexual abuse directly contribute to the emergence of epistemic mistrust and the implications of this for the role of mentalizing in psychotherapy.	2016	natural
Using data from the Canadian Incidence Study of Reported Child Abuse and Neglect2008 (N = 2,184), we examined child welfare responses to CE-IPV subtypes or their co-occurrence.	2017	natural
We found that the majority of substantiated physical abuse cases fell within each of the court's limits.	2017	natural
However, little is known as to whether this strategy actually reduces the overall availability of these medications for the purposes of diversion or abuse.	2016	natural
The aim is to introduce and discuss the semi-projective material Play Room which was originally developed to support prevention of sexual abuse among vulnerable children in Denmark.	2017	natural
Child sexual abuse (CSA) is an international public health problem.	2018	natural
However, parents depression symptomatology was found as a mediator of the effect of marital status differences on child physical abuse potential.	2016	natural
Research suggests that there is a relation between childhood sexual abuse (CSA) and adulthood nonheterosexual orientation.	2015	natural
Future studies designed to discriminate the impact of substance of abuse, route of administration, and cue type will help to further clarify cue-induced craving in this population.	2016	natural
In Hong Kong, the use of expressive arts in substance abuse treatment and relapse prevention programs has become increasingly popular in both residential and community-based services.	2016	natural
We predicted that 3rd parties would experience anger when targets of abuse were considered undeserving of mistreatment; angered 3rd parties would then be motivated to harm the abusive supervisor and support the targeted coworker.	2015	natural
The objective of this study was to describe caregiver perceptions about mental_health services (MHS) after child sexual abuse (CSA) and to explore factors that affected whether their children linked to services.	2016	natural
We enrolled more than 200 students and randomly assigned them to play our games or a different series of National Institute on Drug Abuse (NIDA)-produced games.	2016	natural
The present study was designed to clarify the associations between covert narcissism, overt narcissism, negative affect, and child physical abuse (CPA) risk.	2015	natural
Using a national sample of 255 men, we found that hostile sexism was associated with physical violence toward a partner and alcohol use was positively associated with psychological abuse toward a partner.	2017	natural
Literature searches identified 75 sources spanning international peer reviewed work and reports to Government that document or quantify the impacts of mostly historical child sexual abuse occurring in religious, educational, sporting and residential or out-of-home care settings.	2017	natural
Results showed that there are positive relationships between pathological narcissism and BAS with substance abuse and negative relationships between BIS and self-control with substance abuse.	2016	natural
Furthermore, repeated measures multivariate analyses of variance (MANOVA) results suggested that being exposed to violence or abuse did not affect perceptions of climate.	2015	natural
Based on these results, the FKW drawing was validated on the basis of construct validity, convergent validity, and discriminant validity, which confirmed its validity for use as a child abuse discriminator.	2015	natural
In this study, we examined the effects of complainant emotionality, presentation mode, and statement consistency on credibility judgments in an intimate partner abuse case.	2018	natural
This meta-analysis seeks to quantify the prospective association between neuroticism and the common mental_disorders (CMDs, including anxiety, depression, and substance abuse) as well as thought disorders (psychosis/schizophrenia) and non-specific mental distress.	2016	natural
Results revealed that parents at high risk of physical child abuse showed a smaller FAB than lowrisk parents.	2016	natural
Additional studies that assess substance use more broadly and query trauma history, using larger, more diverse samples, are needed to more fully grasp the relevance of these constructs to substance use, including their potential as targets for substance abuse prevention efforts.	2016	natural
Originality/value The relationship between sexual abuse and psychosis may neither be specific to, nor moderated by, gender.	2015	natural
Sexual abuse in childhood increased the odds of reporting poor health and mental distress; some ACEs may have stronger associations to long term health than others.	2018	natural
Results showed that sex offenders with sexual abuse trauma in their past had higher scores of moral disengagement and cognitive distortion toward children than sex offenders without sexual abuse trauma.	2018	natural
This article will examine the need for such training, suggest critical components of child sexual abuse training, and describe various methods of training (e.g., in person, Web-based, and community resources).	2015	natural
The year 2016 marked the 20th anniversary of the Child Abuse Prevention and Treatment Act (CAPTA) amendments (P.L. 104235) that mandated Citizen Review Panels (CRPs).	2017	natural
In this context, family violence means any act of physical violence, emotional/psychological violence, verbal abuse and property damage.	2018	natural
Spouses with a history of child abuse were also less satisfied with their marriage, even as newlyweds; abused wives also declined in satisfaction over time compared to those without this history.	2016	natural
To implement an electronic health record-based child abuse screen in a diverse hospital system and to evaluate the screening rate, rate of positive screens, and number of reports to Child Protective Services and assess whether hospital and patient characteristics are associated with these rates.	2018	natural
Regarding construct validity, higher PIB-C and lower PSB-C scores were associated with a measure of psychological impacts from abuse.	2016	natural
Results also found that youth learned many lessons while playing the game and they believe the game may help prevent substance abuse and relationship violence among the target population of early adolescents.	2015	natural
Child abuse perpetration (ICD-9-CM N-codes 995.5x and E-code E967) was the outcome variable.	2018	natural
Therefore, preliminary associations, by gender, among psychiatric symptoms, history of sexual abuse, substance use, and HIV/STI sexual risk behavior among a pilot sample (N = 60) of court-involved, non-incarcerated (CINI) youths were explored.	2017	natural
It was here that she witnessed child abuse and the challenging social circumstances for many children, igniting her great interest in the protection of children.	2016	natural
The present study examines gender differences in the association between abuse and neglect during childhood, and sexual and violent offending in juvenile delinquents.	2015	natural
A novel finding is that NSSI is potentially antagonized by substance abuse.	2016	natural
Because sugar can cause the release of dopamine in the nucleus accumbens (NAc) similarly to drugs of abuse, we investigated changes in the morphology of neurons in this brain region following short- (4 weeks) and long-term (12 weeks) binge-like sucrose consumption using an intermittent two-bottle choice paradigm.	2016	natural
Yet, unauthorized immigrants were 3.76 times more likely than US-born citizens to have cases with allegations of domestic violence as the primary abuse type.	2015	natural
Alcohol and substance abuse are recognized comorbidities in both conditions.	2016	natural
Elder abuse is a common phenomenon with potentially devastating consequences for older adults.	2016	natural
This study explored whether self-blame moderates the relationship between exposure to specific types of abuse and both poor general psychological adjustment (i.e., self-esteem) and specific symptomatology (i.e., posttraumatic stress disorder [PTSD]) among women who had experienced intimate partner violence (IPV).	2015	natural
This review comprehensively examines the 23 prior studies that evaluated the intellectual, language, visual-spatial, memory, motor, and/or attention/executive functions in children and adolescents following an experience of childhood abuse and/or neglect.	2016	natural
To address this gap, we analyzed data from a large sample of clergy (N = 1,121) and applied a social-ecological model of offending to identify risk factors for sexual abuse perpetration.	2015	natural
Data on 18 OXTR CpG sites, 44 single nucleotide polymorphisms, childhood abuse, and adult depression and anxiety symptoms were assessed in 393 African American adults (age = 41 12.8 years).	2016	natural
Whether conditions of worth theory can explain complex forms of human psychological distress, such as those emanating from early experiences of abuse, neglect and trauma, alongside experiences of physiological events later in life is open to debate.	2016	natural
In men, high plasma testosterone levels were associated with clinical traits, substance abuse and hypomania.	2015	natural
Disordered eating and weight problems are associated with experiencing childhood abuse.	2017	natural
While drug abuse (DA) is strongly familial, we still have limited knowledge about the causes of its cross-generational transmission.	2015	natural
The five cases concern the policing of bankruptcy crimes, money laundering, company management crimes, market abuse and insider dealings, and illegal cartels.	2015	natural
We used the National Longitudinal Study of Adolescent to Adult Health to measure associations between child sexual abuse and substance use and sexual risk behaviors during adolescence, young adulthood, and adulthood among males and females (n = 11,820).	2017	natural
Drawing on research conducted for the Australian Royal Commission into Institutional Responses to Child Sexual Abuse, the present study examined the use of ground rules directions delivered in court in 52 trials by 24 presiding judges in three jurisdictions to 57 child complainants (aged 717.5 years).	2017	natural
Outside of China, a history of childhood sexual abuse (CSA) has been associated with HIV-related risks (behavioral, sexual, and mental_health outcomes) among MSM.	2017	natural
Children who enter foster care are at unique risk for developing substance abuse due to experiencing early life stressors.	2018	natural
The main aim of the current study was to critically evaluate a database used by practitioners for tracking cases of child sexual abuse, in order to identify evidence that may justify investment in improved data gathering and centralised information management systems.	2017	natural
We included 27 peer-reviewed articles on interventions related to economic empowerment, education, and substance abuse in LMICs.	2017	natural
