The study findings suggest that more comprehensive HIV care, which integrates mental_health and substance abuse services in order to enhance meaning and address coping and grief, may be important.	2018	natural
This study highlights the importance of relational components in treatments for substance abuse. (	2015	natural
In light of the prevalence of substance co-use, this review will also explore the effect of tobacco and other substance abuse co-morbidity on the dopaminergic system across study samples in the reviewed literature.	2016	natural
Violence exposure was characterized with dimensional scores reflecting probability of membership in two classes derived via latent class analysis from the Conflict Tactics Scales: Abuse and Harsh Parenting.	2015	natural
Thus, the Sig-1R has become a potential therapeutic target of medication development against drug abuse that differs from traditional monoamine-related strategies.	2016	natural
Given the substantial comorbidity between substance abuse and psychosis, it is critical for researchers and clinicians to consider potential effects of substance abuse when evaluating insanity acquittees for conditional release, especially as substance use relates to future dangerousness.	2016	natural
Participatory action research was utilized to design a survey and semistructured interview to investigate ritual abuse survivor experience of seeking help.	2015	natural
In rats, PS facilitates the rewarding and neurochemical-stimulating effects of drugs, suggesting that PS may represent a risk factor for drug abuse in humans.	2017	natural
The purpose of this paper is firstly to demonstrate that child sexual abuse happens within the family system in South Africa, and secondly, to argue that the prevention of child sexual abuse should start within the family system and this can be achieved by conducting educational social group work sessions on child sexual abuse with the family members.	2018	natural
This study developed and tested a web-based, drug abuse prevention program for adolescent girls.	2017	natural
Children who enter foster care are at unique risk for developing substance abuse due to experiencing early life stressors.	2018	natural
Participants completed measures of childhood trauma (emotional abuse, physical abuse, sexual abuse, emotional neglect and physical neglect), eating psychopathology, dissociation and emotion dysregulation.	2015	natural
Compared to firearm users, overdose users were younger and had higher odds of having had previous suicide attempts/intent disclosures, mental_disorders (e.g. depression/dysthymia: AOR = 1.18, 95 CI = 1.051.34), and substance abuse other than alcohol, but lower odds of having had relationship problems and any crisis.	2018	natural
This study examined how type of perpetrator (family only [FO] vs. generally violent [GV]), readiness to change, and stake in conformity function separately and together in predicting completion of a partner abuse intervention program (PAIP).	2017	natural
Moreover, future research is needed to replicate and better understand the explanatory mechanisms underlying the relationships among a history of IPV, abuse perceptions, and gender.	2015	natural
The interview analysis yielded two main trajectories: one of abuse deterioration and the other of abuse initiation in the context of coping with immigration.	2016	natural
The study compared two independent samples of children aged 810 years: 48 child abuse victims recruited from a centre for Child and Adolescent Psychological Support (NACA) for abused children, and 144 public and private school students.	2018	natural
Childhood abuse has been linked to HIV/sexual risk behaviors among IPV-victimized women; however, limited research has examined factors that may influence this association.	2018	natural
Findings also point to the need for continued assessment of and protection from ongoing physical abuse during adolescence.	2018	natural
This study aims to adapt The HwalekSengstock Elder Abuse Screening Test (H-S East) (Neale, Hwalek, Scott, Sengstock, & Stahl, 1991) to Turkish and to assess its validity and reliability while determining the factors that affect elder abuse.	2016	natural
Abuser weaknesses and strengths as highlighted in the theoretical framework should be further investigated for future prevention and intervention in cases of emotional/psychological abuse.	2017	natural
This study involved interviews with three female victims of on-line grooming and contact sexual abuse and the three adult males who groomed and abused them.	2015	natural
In addition, we found a significant relationship of adolescent abuse with greater risk of both experimental and daily smoking.	2018	natural
Participants were 61 adolescent girls (age: M = 15.33, SD = 1.50 years) with sexual abuse related PTSD seeking treatment at a community mental_health clinic.	2016	natural
Sexual activity online may result in positive experiences for young people, or lead them to engage in risky behaviours possibly resulting in sexual assault or abuse.	2015	natural
The following six themes emerged from the narratives: (a) being a parent, (b) family of origin dysfunction, (c) the impact of abuse, (d) the abuse history and response to abuse, (e) coping, and (f) hopes and desires for the future.	2015	natural
This study sought to explore anecdotal reports that social workers in South Africa are often advised to postpone therapy with child complainants of sexual abuse until after the child's testimony, based on concerns of legal professionals that therapeutic interventions could influence the child's testimony.	2018	natural
There is a fine line between nonabusive physical punishment and physical child abuse, and where this line is drawn is often influenced by prevailing cultural practices and child-rearing beliefs.	2016	natural
The transcripts from the focus groups were analyzed thematically and resulted in four main themes: (a) varied associations of the term abuse, (b) judging elder abuse situations in terms of abuse and severity, (c) self-identification with elder abuse, and (d) prevention of elder abuse.	2017	natural
Of the total sample, 74.4 (n = 134) of the addicted women had been victims of abuse.	2015	natural
This also ranked abuse experienced in terms of severity: concerning, serious or extreme.	2015	natural
I discuss the ways in which early relational trauma and sexual abuse directly contribute to the emergence of epistemic mistrust and the implications of this for the role of mentalizing in psychotherapy.	2016	natural
Using data from the Canadian Incidence Study of Reported Child Abuse and Neglect2008 (N = 2,184), we examined child welfare responses to CE-IPV subtypes or their co-occurrence.	2017	natural
The aims of this study were to examine the relationship between adult-onset posttraumatic stress disorder (PTSD) and subsequent alcohol use outcomes (frequent heavy drinking, alcohol abuse, and alcohol dependence) in non-Hispanic white, non-Hispanic black, and Hispanic US women, and whether this relationship was moderated by ethnic minority stressors (discrimination and acculturation).	2016	natural
Results indicated veterans who reported MST were younger (p = .001), less likely to be currently married (p < .001), more likely to be diagnosed with a mood disorder (p = .040), and more likely to have experienced non-MST sexual abuse either as children or adults (p < .001).	2015	natural
The purpose of this study was to explore the prevalence of substance abuse indicators in a sample of male sexual offenders (N = 679) and to examine the influence of adverse childhood experiences (ACE) on the likelihood of substance abuse outcomes.	2015	natural
We found that the majority of substantiated physical abuse cases fell within each of the court's limits.	2017	natural
However, little is known as to whether this strategy actually reduces the overall availability of these medications for the purposes of diversion or abuse.	2016	natural
The aim is to introduce and discuss the semi-projective material Play Room which was originally developed to support prevention of sexual abuse among vulnerable children in Denmark.	2017	natural
Obstetricians detected abuse histories in less than one quarter of cases.	2016	natural
Child sexual abuse (CSA) is an international public health problem.	2018	natural
However, parents depression symptomatology was found as a mediator of the effect of marital status differences on child physical abuse potential.	2016	natural
Furthermore, some of the proposed solutions may actually increase the likelihood of further abuse.	2015	natural
Research suggests that there is a relation between childhood sexual abuse (CSA) and adulthood nonheterosexual orientation.	2015	natural
Future studies designed to discriminate the impact of substance of abuse, route of administration, and cue type will help to further clarify cue-induced craving in this population.	2016	natural
In Hong Kong, the use of expressive arts in substance abuse treatment and relapse prevention programs has become increasingly popular in both residential and community-based services.	2016	natural
This article focuses on the development of a conceptual framework for explaining the etiology of violence in later life by various groups involved in the field of elder abuse.	2016	natural
We predicted that 3rd parties would experience anger when targets of abuse were considered undeserving of mistreatment; angered 3rd parties would then be motivated to harm the abusive supervisor and support the targeted coworker.	2015	natural
Psychotherapy proceeded through the following steps: (a) conducting drug therapy to deal with symptoms of abstinence from heroin; (b) forming a therapeutic bond to overcome the patient's severe emotional withdrawal; (c) fostering basic metacognitive capacities such as awareness of emotions and their triggers; (d) sharing formulations of maladaptive interpersonal schemas and descriptions of the associated states of mind; (e) conveying an understanding of the link between interpersonal events (recent ones and traumatic memories) and substance abuse; (f) facilitating the acquisition of critical distance from maladaptive schemas; and (g) promoting the use of adaptive coping skills instead of resorting to substance abuse.	2015	natural
The objective of this study was to describe caregiver perceptions about mental_health services (MHS) after child sexual abuse (CSA) and to explore factors that affected whether their children linked to services.	2016	natural
We enrolled more than 200 students and randomly assigned them to play our games or a different series of National Institute on Drug Abuse (NIDA)-produced games.	2016	natural
Children in the intervention group had fewer total substantiated reports of maltreatment, including less physical abuse and neglect than the comparison group by the end of the intervention year.	2018	natural
The present study was designed to clarify the associations between covert narcissism, overt narcissism, negative affect, and child physical abuse (CPA) risk.	2015	natural
Using a national sample of 255 men, we found that hostile sexism was associated with physical violence toward a partner and alcohol use was positively associated with psychological abuse toward a partner.	2017	natural
Literature searches identified 75 sources spanning international peer reviewed work and reports to Government that document or quantify the impacts of mostly historical child sexual abuse occurring in religious, educational, sporting and residential or out-of-home care settings.	2017	natural
Results showed that there are positive relationships between pathological narcissism and BAS with substance abuse and negative relationships between BIS and self-control with substance abuse.	2016	natural
Furthermore, repeated measures multivariate analyses of variance (MANOVA) results suggested that being exposed to violence or abuse did not affect perceptions of climate.	2015	natural
Based on these results, the FKW drawing was validated on the basis of construct validity, convergent validity, and discriminant validity, which confirmed its validity for use as a child abuse discriminator.	2015	natural
In this study, we examined the effects of complainant emotionality, presentation mode, and statement consistency on credibility judgments in an intimate partner abuse case.	2018	natural
This meta-analysis seeks to quantify the prospective association between neuroticism and the common mental_disorders (CMDs, including anxiety, depression, and substance abuse) as well as thought disorders (psychosis/schizophrenia) and non-specific mental distress.	2016	natural
Results revealed that parents at high risk of physical child abuse showed a smaller FAB than lowrisk parents.	2016	natural
Additional studies that assess substance use more broadly and query trauma history, using larger, more diverse samples, are needed to more fully grasp the relevance of these constructs to substance use, including their potential as targets for substance abuse prevention efforts.	2016	natural
Originality/value The relationship between sexual abuse and psychosis may neither be specific to, nor moderated by, gender.	2015	natural
Sexual abuse in childhood increased the odds of reporting poor health and mental distress; some ACEs may have stronger associations to long term health than others.	2018	natural
Results showed that sex offenders with sexual abuse trauma in their past had higher scores of moral disengagement and cognitive distortion toward children than sex offenders without sexual abuse trauma.	2018	natural
This article will examine the need for such training, suggest critical components of child sexual abuse training, and describe various methods of training (e.g., in person, Web-based, and community resources).	2015	natural
The year 2016 marked the 20th anniversary of the Child Abuse Prevention and Treatment Act (CAPTA) amendments (P.L. 104235) that mandated Citizen Review Panels (CRPs).	2017	natural
In both systems, children who leave care continue to struggle on all areas (education, employment, income, housing, health, substance abuse and criminal involvement) compared to their peers from the general population.	2017	natural
In this context, family violence means any act of physical violence, emotional/psychological violence, verbal abuse and property damage.	2018	natural
Spouses with a history of child abuse were also less satisfied with their marriage, even as newlyweds; abused wives also declined in satisfaction over time compared to those without this history.	2016	natural
Delays in disclosing and reporting child sexual abuse to the police are common, particularly among males and those who have been abused by clergy and others in a position of trust.	2017	natural
To implement an electronic health record-based child abuse screen in a diverse hospital system and to evaluate the screening rate, rate of positive screens, and number of reports to Child Protective Services and assess whether hospital and patient characteristics are associated with these rates.	2018	natural
Regarding construct validity, higher PIB-C and lower PSB-C scores were associated with a measure of psychological impacts from abuse.	2016	natural
Results also found that youth learned many lessons while playing the game and they believe the game may help prevent substance abuse and relationship violence among the target population of early adolescents.	2015	natural
Child abuse perpetration (ICD-9-CM N-codes 995.5x and E-code E967) was the outcome variable.	2018	natural
Therefore, preliminary associations, by gender, among psychiatric symptoms, history of sexual abuse, substance use, and HIV/STI sexual risk behavior among a pilot sample (N = 60) of court-involved, non-incarcerated (CINI) youths were explored.	2017	natural
It was here that she witnessed child abuse and the challenging social circumstances for many children, igniting her great interest in the protection of children.	2016	natural
The present study examines gender differences in the association between abuse and neglect during childhood, and sexual and violent offending in juvenile delinquents.	2015	natural
A novel finding is that NSSI is potentially antagonized by substance abuse.	2016	natural
Because sugar can cause the release of dopamine in the nucleus accumbens (NAc) similarly to drugs of abuse, we investigated changes in the morphology of neurons in this brain region following short- (4 weeks) and long-term (12 weeks) binge-like sucrose consumption using an intermittent two-bottle choice paradigm.	2016	natural
Yet, unauthorized immigrants were 3.76 times more likely than US-born citizens to have cases with allegations of domestic violence as the primary abuse type.	2015	natural
Alcohol and substance abuse are recognized comorbidities in both conditions.	2016	natural
Elder abuse is a common phenomenon with potentially devastating consequences for older adults.	2016	natural
This study explored whether self-blame moderates the relationship between exposure to specific types of abuse and both poor general psychological adjustment (i.e., self-esteem) and specific symptomatology (i.e., posttraumatic stress disorder [PTSD]) among women who had experienced intimate partner violence (IPV).	2015	natural
This review comprehensively examines the 23 prior studies that evaluated the intellectual, language, visual-spatial, memory, motor, and/or attention/executive functions in children and adolescents following an experience of childhood abuse and/or neglect.	2016	natural
Results indicated that women reporting higher levels of psychological abuse reported less negative attitudes toward IPV, engaged in less-active coping responses, and had lower NMRE.	2015	natural
To address this gap, we analyzed data from a large sample of clergy (N = 1,121) and applied a social-ecological model of offending to identify risk factors for sexual abuse perpetration.	2015	natural
Data on 18 OXTR CpG sites, 44 single nucleotide polymorphisms, childhood abuse, and adult depression and anxiety symptoms were assessed in 393 African American adults (age = 41 12.8 years).	2016	natural
Whether conditions of worth theory can explain complex forms of human psychological distress, such as those emanating from early experiences of abuse, neglect and trauma, alongside experiences of physiological events later in life is open to debate.	2016	natural
In men, high plasma testosterone levels were associated with clinical traits, substance abuse and hypomania.	2015	natural
Disordered eating and weight problems are associated with experiencing childhood abuse.	2017	natural
While drug abuse (DA) is strongly familial, we still have limited knowledge about the causes of its cross-generational transmission.	2015	natural
The five cases concern the policing of bankruptcy crimes, money laundering, company management crimes, market abuse and insider dealings, and illegal cartels.	2015	natural
We used the National Longitudinal Study of Adolescent to Adult Health to measure associations between child sexual abuse and substance use and sexual risk behaviors during adolescence, young adulthood, and adulthood among males and females (n = 11,820).	2017	natural
Latent class analysis (LCA) results indicated that four classes fit the data best across random halves of the sample and were labeled High ACEs, Moderate Risk of Non-Violent Household Dysfunction, Emotional and Physical Child Abuse, and Low ACEs.	2018	natural
Drawing on research conducted for the Australian Royal Commission into Institutional Responses to Child Sexual Abuse, the present study examined the use of ground rules directions delivered in court in 52 trials by 24 presiding judges in three jurisdictions to 57 child complainants (aged 717.5 years).	2017	natural
Outside of China, a history of childhood sexual abuse (CSA) has been associated with HIV-related risks (behavioral, sexual, and mental_health outcomes) among MSM.	2017	natural
Children who enter foster care are at unique risk for developing substance abuse due to experiencing early life stressors.	2018	natural
The main aim of the current study was to critically evaluate a database used by practitioners for tracking cases of child sexual abuse, in order to identify evidence that may justify investment in improved data gathering and centralised information management systems.	2017	natural
The interview analysis yielded two main trajectories: one of abuse deterioration and the other of abuse initiation in the context of coping with immigration.	2016	natural
We included 27 peer-reviewed articles on interventions related to economic empowerment, education, and substance abuse in LMICs.	2017	natural
The current study aimed to evaluate the progress of an initiative of the Mississippi Department of Mental Health (MDMH) to increase the implementation of evidence-based substance abuse treatment practices by certified providers.	2015	natural
Online forms of sexual harassment and abuse as experienced by adults represent an emerging yet under-researched set of behaviors, such that very few studies have sought to estimate the extent of the problem.	2016	natural
We investigated circadian motherchild adrenocortical attunement in the context of a maternal history of childhood abuse (HoA).	2017	natural
School principals have a very important role to play in the detection and reporting of child abuse and neglect (CAN).	2018	natural
The type of offending strategy also interacts with the context of abuse for most preoffense and offense variables.	2017	natural
Further, more exposure to abuse correlated with a decrease in self-esteem, while an increase in self-esteem greatly reduced depression.	2018	natural
Despite knowledge about the profound effects of child abuse and neglect, we know little about how best to assess whether maltreated children should return home.	2017	natural
A substantial majority of homeless youth and young adults (HYA) experience abuse prior to and during homelessness.	2016	natural
The findings are discussed within the Greek context, highly characterized by its lack of institutional arrangements and adequate child protection services that could facilitate schools to document, examine and share helpful practices for child abuse and neglect.	2017	natural
This prospective, longitudinal study with data collected at four time points investigated how maternal psychiatric symptoms, substance abuse and maternal intrusiveness in interaction were related to early child language skills.	2015	natural
Strategies to secure the compliance of child victims were systematically compared to compare the modi operandi (prior to, during and following abuse), and the type of power (intimate, aggressive, coercive) applied by child sexual offenders in institutional versus non-institutional settings.	2018	natural
Normalization and defensive othering are discussed as techniques of identity management in light of the stigma attached to being a victim of abuse.	2015	natural
Sixty-one percent of participants had a SATI subscale score suggestive of sexual abuse trauma.	2015	natural
Logistic regression results revealed that child sexual abuse increased the odds of experiencing both forced and coerced sexual victimization for both heterosexual and sexual minority students, whereas increased rates of risky sexual behavior were associated with forced and incapacitated sexual victimization but only for heterosexuals.	2018	natural
We examined lifetime prevalence of drug use and substance abuse treatment utilization patterns for US-born and Hispanic immigrants across subgroups.	2015	natural
Prosecutors working with child sexual abuse (CSA) cases involving young children have raised concerns that reliability criteria from the Supreme Court of Sweden are holding children's testimony to impossible standards (e.g., expecting the child's testimony to be long, rich in detail and spontaneous).	2018	natural
In this study, we analyze drop-out rates among perpetrators with alcohol abuse problems and explore whether perpetrators with alcohol abuse problems completing a batterer intervention program differ from those who do not have alcohol abuse problems in a number of outcomes.	2017	natural
While childhood emotional abuse (EA) is often linked to DE and obesity, it is typically not included in comprehensive models of these health problems.	2017	natural
Of the students, 26.3 were in a situation of unperceived abuse, especially the males (29.6), but the level of tolerance of abusive behavior was significantly lower in females.	2017	natural
This paper untangles and translates the extant literature into preliminary practice guidelines; the Sibling Substance Abuse Treatment Matrix.	2018	natural
Finally, distal factors (i.e., more child physical abuse and poorer maternal relationship quality) also were associated with dating violence perpetration.	2018	natural
For example, recent studies have shown that adolescents use technology to harass and abuse others, including dating partners.	2015	natural
For the focus groups, we used the technique of free associations to begin the discussions and vignette-like statements to explore participants attitudes toward elder abuse.	2017	natural
Gender differences are discussed along with recommendations for prevention of male sexual abuse.	2017	natural
We examined the role of sexting coercion as a component of the intimate partner abuse (IPA) construct among young adults to determine whether sexting coercion would emerge alongside other forms of partner aggression as a cumulative risk factor for psychological, sexual, and attachment problems.	2016	natural
The purpose of the current paper is twofold: to review rigorously conducted studies (e.g., included a comparison group; utilized inferential statistics) examining the association of opioid abuse with parenting and child outcomes, and to review parenting intervention programs with these caregivers.	2018	natural
