Although little attention has been paid to the problem of diuretic abuse as a method of weight control, diuretic abuse has been reported since 1968 in patients with anorexia nervosa (Wolff et al.,	1997	natural
The outcome of this study suggests that perinatal assessment of child abuse risk is possible and simple and is related to perceived stressors at the time surrounding delivery.	1999	natural
Substance abuse has been associated with cognitive dysfunction, such as problems with attention, reasoning, and memory.	1999	natural
General quality of childhood memory was found to be unrelated to a history of abuse, and most participants, regardless of their abuse history, reported recovering memories from their childhood in general.	1999	natural
Little is known about the acute effects of drugs of abuse on impulsivity and self-control.	1999	natural
In a forward stepwise regression analysis for panic disorder patients, a history of substance abuse and comorbid depression predicted suicidality.	1999	natural
A case of a mother confabulating an extended sexual abuse of her 13 and 15 year old children involving bizarre sadistic features is presented and discussed.	1996	natural
Aspects of inattention and depression, but not measures of psychopathic tendencies, were correlated with single substance alcohol abuse.	1996	natural
Contrary to other cases of vulvodynia previously reported, Joan had never suffered from real sexual or physical abuse, but experienced her emotional and sexual life in a painfully conflictual way.	1998	natural
Five of the 8 patients with delusional jealousy were found to have an additional alcohol abuse or dependence problem.	1995	natural
The present study employed data originating from 755 6-year-old boys from low SES neighborhoods, who were followed through age 13, to predict this marker, 3 models were tested using LISREL analyses to determine whether individual characteristics and/or peer influences were linked to subsequent substance abuse.	1995	natural
The results indicate a probability that an incidence of crosspeer abuse definable as bullying against teachers by their pupils exists, both from teachers' self reported data, and that reported regarding their colleagues.	1998	natural
We developed three new abuse scales: Psychological/Verbal; Control; and Physical/Sexual, which emerged when survey evidence of a random sample of the general public (N = 195) was factor analyzed.	1997	natural
The findings suggest that policy makers may have to compromise lo obtain public support when designing and implementing intervention programs for intrafamilial child sexual abuse.	1998	natural
As hypothesized, even when demographic differences between groups were controlled, survivors reported significantly less relationship satisfaction, poorer communication, and lower levels of trust in their partners than did women with no history of sexual abuse.	1999	natural
Research has shown that drug abuse treatment can help many individuals.	1995	natural
The objectives were: to investigate the association during pregnancy of sexual abuse before the age of 18 on depressive symptomatology in pregnancy, controlling for the presence of negative life events and challenges; and to investigate the association of selected pregnancy outcomes (maternal labor and delivery factors, infant birth weight and gestational age) with sexual abuse before age 18.	1999	natural
There is growing interest in a number of medications with proven clinical efficacy or potential for treating substance abuse.	1996	natural
Research into the etiology of running away has long provided evidence for the influence of family factors such as abuse, parent-child conflict, and child stress on an adolescent's decision to leave home.	1995	natural
Barriers within the substance abuse field to the adoption of treatment methods suggested by this model are considered and methods of surmounting those barriers are described.	1996	natural
There was no relationship between intrafamilial abuse and depression, self-esteem or behaviour disorder.	1995	natural
Results of hierarchical regression analyses suggested that, after controlling for previous levels of depression, the women's feelings of powerlessness, experience of abuse, and decreased social support contributed to their depression symptoms.	1995	natural
The current paper argues that studying power differentials rather than gender differences may provide a more valuable heuristic for understanding the development of food abuse in varying nations as well as the presentation of eating problems in men.	1997	natural
The factor analysis on SAIS-R perception items identified five factors that accounted for 68.9 of the variance; these factors were Stigma and Resistance to Counseling; Substance Abuse and Incest; Ambivalence; Fear and Anticipation; and Receptivity to Counseling.	1997	natural
Further research is needed to develop a coherent understanding of the relationship of underlying psychological and environmental factors to the observed progression from substance abuse to prostitution.	1998	natural
A Spanish-speaking mother reported for child abuse of her 6-yr-old son and referred by child protective services received Spanish training protocols in their home provided by Project SafeCare.	1998	natural
Information was collected regarding the nature of abuse and system concerns identified in child protective services, foster care, or adoption agencies from across our state.	1999	natural
The present study represents an initial assessment of barriers and motives for quitting, health risk knowledge, and readiness to change in a hospitalized acute and long term care population with psychiatric diagnoses, and dual diagnoses of substance abuse and psychiatric disorders.	1999	natural
21.2 of patients gave a history of sex abuse, with 23.1 of patients having a history of exposure to violence as a child.	1998	natural
Comparisons of rates for different samples was difficult because of the varying criteria used to define alcohol abuse and the absence of operational criteria applicable across different populations.	1999	natural
Abuse by a female was more common in the prisoner group.	1996	natural
The past decade has seen growth in the volume and sophistication of research on adolescent substance abuse and in the conceptualization of this problem.	1998	natural
A relatively new adolescent drug abuse instrument, the Personal Experience Inventory (PEI), was evaluated for convergent and predictive validity in a clinical sample of 140 youths being evaluated for drug treatment referral.	1997	natural
The total sample contained 68 children (35 girls, 33 boys), most of whom were at high-risk either due to poverty, physical abuse and neglect (as determined by substantiated Protective Services reports), or exposure to negative life events.	1995	natural
The severity of maltreatment and the extent of injury for both spouse abuse and child maltreatment were significantly related to police response, with greater use of cautions or charges in more severe cases.	1999	natural
However, the interaction of race/ethnicity with the type of abuse was significant.	1995	natural
Forgiveness was recommended as an effective strategy for counseling childhood sexual abuse survivors.	1998	natural
A patient in twice-a-week psychoanalytic psychotherapy began to recover childhood memories of chronic sexual abuse, including oral, anal and genital penetration.	1997	natural
Residency training in Pediatrics and Family Medicine must also include a core base of knowledge on which to build, as well as offering case oriented training opportunities and electives which cover the field of child abuse in depth.	1998	natural
The extent of childhood victimization (physical abuse, sexual abuse, and neglect) was assessed retrospectively through self-reports in a sample of 301 convicted adult male felons randomly selected from a New York State medium-correctional facility using a structured interview with known psychometric properties.	1998	natural
Hypotheses were generated based on models of aggression and the child abuse literature.	1995	natural
This study leads to three major conclusions: Those exposed to harsh or abusive treatment during childhood are an at-risk population for juvenile offending, substance abuse, and mental_health problems; Much of this elevated risk arises from the social context within which harsh or abusive treatment occurs; Nonetheless, exposure to abuse appears to increase risks of involvement in violent behavior and alcohol abuse.	1997	natural
Implications of findings for interventions for female victims of partner abuse, and women who make nonfatal suicide attempts are discussed.	1999	natural
The Center for hild Protection has been conducting forensic interviews with suspected child victims of abuse since 1978, with videotaping in place since 1983.	1996	natural
The treatment was delivered as individual sessions and evaluated in a study of six substance abuse patients with a single-subject multiple-baseline design.	1997	natural
The women in the sample from the South also reported engaging in sexual coercion (25.7), sexual abuse (7.3), and physically forced sex (1.6), but at lower rates than the other sample.	1998	natural
There was an indication that a trend existed in those girls who experienced penetration abuse for Latinas to score higher on anxiety and depression than African American or White girls.	1995	natural
This paper describes a self-report measure, the Child Abuse and Trauma Scale, which yields a quantitative index of the frequency and extent of various types of negative experiences in childhood and adolescence.	1995	natural
Even in adulthood, the daughters reported a number of characteristics that are normally associated with being a victim of sexual abuse, despite the fact that only two of the six had been so abused.	1999	natural
By highlighting one group member's story of incestuous abuse and paternal pimping, the facilitator examines how her own thoughts and feelings about sexual abuse evolved from a psychological perspective based on individual survival to a better understanding of political, group resistance.	1997	natural
Females had higher rates of anxiety disorders and histories of physical/sexual abuse.	1996	natural
From their analyses, they concluded that the sexual abuse questionnaire and, to a lesser extent, the physical abuse instrument have acceptable levels of reliability and validity.	1995	natural
Finally, recommendations are offered for expanding the TC approach and increasing its effectiveness by treating comorbid problems that are prevalent among prison inmates with substance abuse problems.	1995	natural
Alcohol abuse featured in almost half of the cases.	1998	natural
The Recovery Attitude and Treatment EvaluatorResearch (RAATER) scale is a structured interview that assesses readiness for substance abuse treatment in five subscales: resistance to treatment, resistance to continuing care, biomedical acuity, psychological acuity, and environmental/social problems.	1997	natural
Subjects included 513 low-income women, of whom 105 had experienced contact sexual abuse.	1999	natural
Sexual abuse in childhood is one of many risk factors for becoming a perpetrator of child molestation in adulthood for both cleric and noncleric child molesters.	1996	natural
This article uses the social construction theory of Spector and Kitsuse (1973, 1977) to explain and analyze the evolution of satanic ritual abuse of children from cultural lacuna to social problem.	1996	natural
Systematic research on effective treatment for survivors of childhood sexual abuse with posttraumatic stress disorder (PTSD) is virtually non-existent.	1997	natural
Throughout the Western world, awareness of child sexual abuse has led to action by members of the public to draw attention to horrific crimes against children.	1997	natural
Forgiveness was recommended as an effective strategy for counseling childhood sexual abuse survivors.	1998	natural
The majority of parents denied the abuse.	1999	natural
The destabilization of the family, permissiveness, indifference of the adult world, ethical confusion, peer pressure and the decline of self-discipline among the young are the essential causes of adolescent substance use and abuse.	1996	natural
A convenience sample of 53 abused and 52 nonabused women completed self-report measures related to physical and emotional abuse by an intimate partner (Index of Spouse Abuse), normative beliefs regarding relationships (Silencing the Self), and their self-esteem (Rosenberg Self-Esteem).	1999	natural
This study investigated the relationship between childhood abuse and personality disorder symptoms in a nonclinical sample of college males (N = 584, mean age = 28.8 years).	1999	natural
This article describes the establishment of a multifamily therapy program within a substance abuse treatment facility for adults.	1997	natural
Sexual abuse histories were quite common in this sample.	1995	natural
Victims of childhood abuse and/or neglect had significantly higher PCLR scores than persons in a matched control group, despite controls for demographic characteristics and criminal history.	1996	natural
He proposes that their defending against the aftermath of early and severe abuse is a dynamic factor in the development and maintenance of violent behavior.	1995	natural
Violent offenders reported significantly more childhood neglect than nonviolent offenders but not more physical abuse.	1998	natural
Professionals' performance on both judgment tasks was unrelated to level of experience with sexual abuse cases.	1995	natural
We predicted that both physical and psychological abuse levels would be significantly lower and that selfesteem would increase significantly posttreatment.	1997	natural
Thus, there was an association between animal abuse and a variety of antisocial behaviors, but not violence alone.	1999	natural
The Child Sexual Abuse Accommodation Syndrome described by Summit (1983) seems to be infrequent among the types of cases seen by child protection agencies.	1996	natural
This article alerts readers to the possible combination of physical abuse and purposeful drug administration.	1995	natural
The addicts and the nonaddicts had different risk profiles comparing black and white people, whilst a significant differentiation was found for each race: white addicts scored significantly higher than nonwhite on all of the risk factors, whereas black addicts scored significantly higher than black nonaddicts on risk factors denoting peer school misbehaviour and fighting, personal drug abuse and behavioural deviance.	1997	natural
Twenty-four-hour urine samples were collected from 28 women: 11 women with PTSD who experienced childhood sexual abuse (PTSD+), 8 women who experienced childhood sexual abuse without PTSD (PTSD-), and 9 nonabused controls.	1995	natural
Results supported all three experimental questions, that is, spouses demonstrated severe coaddictive tendencies, often played a supportive role in hiding or encouraging the offender's behavior, and both incest offenders and spouses experienced a wide variety of physical, emotional, and sexual abuse during childhood.	1996	natural
Adult Catholics (1,810) in the United States and Canada were separated into three groups: those who reported no childhood sexual abuse (N = 1,376), those who had been sexually abused as children but not by a priest (N = 307), and those who had been sexually abused by priests (N = 40).	1995	natural
The present study explored the impact of wife abuse on the general and psychological well-being of Chinese women and their children in Hong Kong.	1997	natural
Substantiated reports of child and spouse abuse occurred very infrequently in our sample.	1995	natural
Of the total sample (N = 560 undergraduate students), one quarter reported a history of child abuse, and 18 of these reported that they had a period when they lacked memories of their abuse.	1999	natural
Birth of a low birth weight infant was not associated with a history of child sexual abuse (OR 1.03, 95 CI .44-2.40).	1999	natural
The incidence of alcohol abuse of mothers was the same in all groups.	1999	natural
Women with a psychiatric disorder who also abuse alcohol or other drugs have historically encountered barriers to integrated treatment for both disorders.	1996	natural
The Drug Abuse Treatment Cost Analysis Program (DATCAP) is described in detail along with a companion instrument to analyze treatment financing; the Drug Abuse Treatment Financing Analysis Program (DATFin).	1997	natural
Males taken into police custody for reported spouse abuse (n = 19) and a matched control group (n = 19) were asked to describe the drinking habits of their parents and the extent of intrafamily violence witnessed by them as children.	1997	natural
The role of education in substance abuse recovery has not been clear in either the treatment or recovery models.	1998	natural
A fourth subscale was drawn from the existing CATS items, reflecting reported emotional abuse during childhood.	1998	natural
Childhood abuse experienced by the mothers and socioeconomic status failed to predict the CAPI Abuse scale scores.	1999	natural
Confronting this complexity will advance our understanding of child abuse and lead to more productive interventions and policies to support the growth and well-being of children.	1998	natural
Despite a growing literature pointing to the deleterious health effects of sexual and physical abuse history, few studies provide evidence about which medical symptoms are most affected.	1998	natural
This study explored whether type of abuse experienced (i.e., sexual vs. physical) was related to the type of destructive behavior displayed by children who had been placed in foster care.	1997	natural
While the presence of comorbid anxiety or depressive disorders was consistently associated with moderate increases in the symptoms of alcohol abuse or dependence, alcoholism was associated with large increases in the number of depressive symptoms and little or no increase in phobic symptoms.	1998	natural
Also, ASD symptoms were significantly related to seeing the self as the causal locus of the abuse, forgetting the abuse for a period of time, and the number of abusers, the distress of a recent life event, other forms of distress, and poor social support, Acute stress disorder may occur among many sexual abuse survivors seeking treatment, requiring special intervention to help these patients to manage their reactions to ongoing stresses.	1998	natural
Similar to other studies, the female substance abusers reported greater disturbance on dimensions of employment and psychological functioning, but less severity of alcohol abuse.	1995	natural
Studies of the prevalence of alcohol and drug abuse among trauma patients have produced recommendations that all trauma patients be screened for these substances.	1996	natural
Community education about the risks, signs, symptoms, need, and mechanisms for obtaining treatment of alcohol abuse among youths might help alcohol-abusing individuals receive the help they need.	1996	natural
Dissociative effects of abuse experiences were evaluated separately in the ED and in the normal group.	1995	natural
Substance abuse research is often limited to the measurement of a single outcome--abstinence--and research on alternative models is scarce.	1999	natural
Now the time has come to look at domestic violence in its other manifestations - not only parent to child as in child abuse, but also husband to wife or cohabiter to cohabiter.	1995	natural
Path analyses revealed unidirectional relationships between abuse potential predicting IQ and adaptive behaviors.	1999	natural
Decisions by child protective services to substantiate or not were weakly related to polygraph findings and consistently related to any indicators of possible sexual abuse.	1997	natural
The following two points are argued: free symbolic play is a modality well suited to the expression, reworking and mastery of psychic trauma and therefore offers sexually abused children a channel for communication; free symbolic play is a potential source of information to mental_health professionals when attempting to understand the context of a child's experience of sexual abuse.	1996	natural
A clear recognition by the school of childhood sexual abuse may help to provide the opportunity for the girl to experience success in some arena; this in turn may protect her against the likely adult consequences of low self-esteem and increased psychiatric morbidity.	1995	natural
Professionals who provide services to deaf and hard of hearing individuals may encounter situations related to abuse of alcohol and other drugs.	1998	natural
Providing culturally sensitive definitions of child abuse is difficult as perceptions of what constitutes abuse can vary around the world.	1999	natural
One major factor in the perpetuation of child mistreatment is a family history of abuse.	1996	natural
The objective of the present paper was to examine the social support functions, sources and temporal contexts of Argentinian mothers in relation to child abuse and neglect.	1997	natural
Female children were more expressive than male children in describing sexual parts and/or sexual abuse.	1999	natural
This study investigated maternal abuse and neglect of offspring in a large population of rhesus monkeys over a period of 29 years.	1998	natural
The relationship between a history of childhood abuse and subsequent sexual assault was assessed among 409 consecutive female inpatient admissions.	1996	natural
Mothers frequently had a history of deprivation, neglect or sexual abuse in their own childhoods.	1999	natural
The way in which children are interviewed can make the difference between prosecution, or continued abuse.	1996	natural
This article proposes a discursive reformulation of children's reports of sexual abuse.	1999	natural
To illustrate the process of responding to changes in the substance abuse environment, to advances in knowledge about risk, and to newer technologies, this article provides an overview of the history of two federally funded HIV-prevention programs for out-of-treatment substance abusers and reviews recent changes made to the Standard Intervention protocol.	1998	natural
The probands had grown up in families with more abuse of alcohol and drugs, broken homes, an alcoholabusing father and mother and had taken up their parents concomitant drug and alcohol abuse by parental influences.	1995	natural
This Dual Focus Schema Therapy is being compared to 12-Step Drug Counseling for opioid-dependent individuals with personality disorders in an ongoing study funded by the National Institute on Drug Abuse.	1998	natural
As the initial stage in developing a curriculum to assist family physicians to diagnose and manage alcohol abuse in their practices, questionnaires were mailed to a selected group of family physicians.	1995	natural
This article discusses the scope and limitations of research regarding the causes of premature termination from psychotherapeutic and substance abuse programs and examines the applicability of proposed methodological remedies for assessing and countering attrition to the specific problem of research involving dropouts from treatment.	1998	natural
Lower social support was associated with all disorders, except drug abuse.	1995	natural
The most severe level of sexual abuse was associated with significantly more long-term distress than other levels of abuse in both men and women.	1996	natural
This study aimed to examine the relationships between childhood sexual abuse (CSA) and other adverse development factors and a range of adverse adult psychological and socioeconomic outcomes.	1997	natural
The survey requested demographic details, responses to three case vignettes suggestive of possible physical abuse or neglect, and details of suspected child abuse or neglect reporting behavior.	1998	natural
Multiple regression analyses indicated that disengagement methods of coping with the sexual abuse accounted for unique variance in general psychological distress even after controlling for characteristics of the abuse and methods of coping with other stressors.	1996	natural
There were differences in prevalence of eating and weight problems and of child abuse according to gender and race.	1996	natural
We examined the role of a history of sexual abuse as a predictor of child maltreatment by adolescent mothers in a prospective study of 104 mother-child dyads.	1996	natural
A growing awareness of the high incidence of child abuse over the past two decades has resulted in a proliferation of preventive service agencies and a societal mandate for heightened scrutiny by mental_health professionals of parenting practices.	1999	natural
Few significant gender or ethnic differences emerged, but the significant differences unexpectedly indicated that the female youth were at greater risk for substance abuse than the male youth.	1997	natural
Abuse and neglect did not occur together and were associated with different risk factors.	1998	natural
Treatment of ADHD may enhance effective treatment of substance abuse and behavior problems, yet there are few data regarding pharmacological treatment of ADHD in such youths.	1998	natural
Seventy-three women attending a Family Health Counselling Service's Sexual Abuse Program were invited to participate in a study looking at the effectiveness of sexual abuse counselling.	1997	natural
This article summarizes current issues in drug abuse prevention research through integration of other articles in this journal and by heeding historical trends in prevention science.	1996	natural
This article describes the characteristics and problems of drug abuse treatment settings in Brazil, both for inpatient and outpatient modalities.	1995	natural
