Results indicate that female inmates more frequently experienced employment problems, had lower incomes, more frequently reported cocaine as the primary drug of choice, and were more likely to report depression, anxiety, suicidal behavior, and a history of physical and sexual abuse.	1997	natural
Wide variability in the prevalence estimates of childhood sexual abuse using different instruments highlights the need for agreement on the definition of childhood sexual abuse.	1997	natural
Risk factors for drug abuse disorders included ethnicity other than African American, homelessness for 1 year or more, suicidality, SIB, depressive symptoms, and low self-esteem.	1997	natural
This study has implications for referrals attempting to distinguish head injury effects from those of psychosis or substance abuse.	1999	natural
Requirements for effective therapy include the establishment of a safe environment, cooperation of a partner to allow the patient to be in control, and an exploration of past sexual abuse to avoid recapitulation that may trigger flashbacks or dissociative episodes.	1995	natural
In 1988 I began a report on the accuracy of expert testimony in child sexual abuse cases utilizing Ralph Underwager and Hollida Wakefield as a case study (Wakefield & Underwager, 1988).	1998	natural
Very few studies have attempted to define the underlying link between a history of sexual abuse and subsequent deliberate self-harm (DSH).	1998	natural
This attentional bias was associated with a greater level of specific self-denigratory beliefs as a result of the abuse.	1995	natural
In addition, the influences on long-term adjustment of biological factors, developmental level at the time of abuse, severity of abuse, social context, and prior and subsequent life events are discussed.	1997	natural
Phenomenological analysis of extensive interviews with five adult survivors of paternal incestuous abuse resulted in the identification of several common themes in the daughters' relationships with their mothers.	1995	natural
Sexual abuse among women was associated with higher levels of depression, anxiety, suicidal ideation, suicide attempts, and PTSD, while physical abuse was associated with fewer psychological disturbances.	1997	natural
The client has a long history of childhood sexual abuse (CSA), as well as repeated sexual victimization as an adult and addiction issues.	1996	natural
Post-Traumatic Stress Disorder (PTSD) symptoms in children who reported sexual abuse, and their mothers, were compared for children in two groups: children whose mothers reported having been sexually abused as a child and children whose mothers did not report sexual victimization.	1998	natural
A total of 142 participants (82 children, 60 adolescents) were seen within 8 weeks of discovery of the abuse.	1998	natural
Interviews with 50 children from 2 age groups (56-year-olds, 910-year-olds) who made subsequently substantiated allegations of physical abuse by their parents were subjected to detailed psycholinguistic analysis.	1999	natural
The purpose of this paper was to examine the characteristics of the victims and abusers of child abuse cases on the Child Protection Registry in Hong Kong as of March 1995 and to compare findings with a similar community report of child abuse in Hong Kong conducted approximately 15 years earlier.	1996	natural
Future research should consider further the empirical links among pubertal timing, subjective age, and sexual abuse.	1999	natural
We found that the medical students responsible for treating substance abuse are significantly less religiously and spirituality oriented than the patients they treat, and that the students do not indicate that spirituality is an important component in the care of these patients.	1996	natural
In a pediatric residency training program, all residents viewed 15 slides of children's genitalia (8 normal, 7 abnormal) with either a history specific for sexual abuse or one which was nonspecific.	1995	natural
A meta-analytic approach was used to calculate post-test and follow-up effect sizes of 16 evaluation studies of school programs aimed at the prevention of child sexual abuse victimization.	1997	natural
Using data from the 1991 and 1992 National Household Survey on Drug Abuse, multiple logistic regression models were used to estimate the relative risk of initiating non-medical drug use by 12-17-year-old adolescents living in families without both biological parents present compared to those living with both biological parents.	1997	natural
Fifty-two percent of those reporting abuse also noted periods of forgetting some or all of the abuse.	1999	natural
In order to assess the profile of patients, and also the allocation of staff to the service, all child abuse related patients seen at the Red Cross War Memorial Children's Hospital in Cape Town over the period of June 1989 through July 1990 were reviewed.	1995	natural
Prenatal care providers can play an important role in identifying, intervening in, and making referrals for substance abuse problems among pregnant women.	1995	natural
Children's exposure to spouse or partner physical abuse, which had a substantial prevalence among both child-abusing and control families, reduced the difference in disturbance ratings between children who were themselves physically abused and those who were not.	1995	natural
Predictors of recurrence were child vulnerability, family stress, partner abuse, social support deficits, and an interaction between family stress and social support deficits.	1999	natural
Substance abuse in schizophrenia is a significant management problem for both clients and treatment agencies, impacting on psychotic symptoms, medication adherence, and participation in training and employment.	1995	natural
This program was successful in sponsoring over 215 cultural and educational events, and has resulted in 96 community members making a commitment to sobriety, a community wide change in norms about wellness and substance abuse, the creation of new networks of communication and collaboration, and new tribal policies and enforcement practices to curtail drug and alcohol abuse.	1997	natural
Psychoactive substance abuse or dependence (DSM-III-R) was diagnosed in 12.	1997	natural
Out of a large number of university students who responded to a questionnaire about childhood sexual abuse (CSA), approximately a quarter reported that they had an experience in childhood that qualified.	1997	natural
Of those abused, 69 reported sexual abuse involving physical contact, 9.5 of whom experienced sexual intercourse.	1996	natural
An argument is then developed that suggests the true figure for child abuse may be much higher than is currently accepted and it uses this as the basis for supporting the need for providing school counselling.	1996	natural
Using the Structured Clinical Interview for DSM-III-R, we assessed the prevalence of various forms of substance abuse in this population and attempted to judge whether substance abuse played a role in the index crime which has led to the present incarceration.	1997	natural
The purpose of this paper is threefold: (a) to report an unusually high prevalence of encopresis in a sample of boys in psychiatric residential treatment; (b) to explore the possible relationship of sexual abuse to the development of encopresis in these cases; and (c) to discuss the diagnostic and treatment implications of our findings.	1997	natural
Sexual offenders, even those faking good, showed less sexual abuse empathy than controls (p .05).	1998	natural
The convergence of these factors in intimate violence is analyzed; the potential of routine activity theory in explaining domestic abuse is assessed.	1997	natural
Although intensive outpatient therapy is recommended for treatment of cocaine, psychosocial characteristics associated with crack cocaine abuse are also implicated in attrition from outpatient programs.	1995	natural
These stories relate to interactions in the school or workplace and are discussed within the broader context of existing stereotypes and assumptions about abuse.	1999	natural
An anonymous written questionnaire asking respondents to rate the importance of individual factors to an abuse determination, as well as to rate the likelihood of specific acts incorporated into vignettes to constitute abuse, was administered to participants (n = 323) representing six groups with diverse relationships and experience with children: mental_health professionals, legal professionals, medical professionals, preschool and elementary school teachers, parents, and adult nonparents.	1998	natural
Information concerning childhood abuse history was obtained from the therapists.	1996	natural
Child sexual abuse itself was not a significant predictor of self-injury, suicidal ideation or suicide attempts in this sample.	1999	natural
Sexually abused women, especially those who also experienced physical abuse, had a higher risk of developing CP, although CP symptoms occurred at a high base rate among physically abused women.	1997	natural
The relationship was examined between the self-reported cooperativeness of Australian secondary-school students and their involvement in peer abuse at school, both as bullies and as victims.	1997	natural
Army data are compared to published reports from military service child abuse registries.	1999	natural
A factorial survey was used to gauge how students would react to school-related conflict, street crime, confrontation in a leisure setting, and domestic abuse.	1999	natural
The relation between bodily shame and childhood abuse was replicated.	1997	natural
Adult female outpatients reporting childhood sexual abuse with ritualistic features were compared with a second group of women who reported childhood sexual abuse without ritualism.	1995	natural
The magnitude of the dysfunction also correlated with several antisocial personality-related features, including an increased number of criminal charges and months of incarceration, increased problems associated with drug abuse, and lower intellectual functioning.	1998	natural
For this ethnic group, however, the present study finds that involvement in the ethnic community has a strong negative effect on drug and alcohol abuse, both directly and indirectly, through lessening the likelihood that adolescents will have substanceabusing friends.	1995	natural
The present study examines the effect of child neglect, alone and in combination with abuse, on academic achievement and school disciplinary problems for elementary, junior high, and senior high students.	1996	natural
Qualitative interviews were conducted with a sample of 24 parents of preschool-age children, purposefully selected to be diverse in gender, race/ethnicity, age, and personal experience with sexual abuse victimization.	1996	natural
After encountering numerous obstacles to conducting surveys with Deaf persons about substance abuse using the same methods typically used with hearing persons, the researchers, with a Small Business Innovative Research grant from the National Institute on Drug Abuse, piloted a survey method that uses videodisc and bar code readers to present survey questions signed on screen in American Sign Language and Signed English.	1996	natural
The lack of real autonomy provides for the possibility of abuse including abusive therapies.	1999	natural
The findings support previous suggestions that (a) it is unrealistic to expect children to be able to report repeated events without some confusion about timing of details and (b) children are resistant to misleading questions about abuse.	1999	natural
Sexually abused subjects had increased rates of inappropriate sexual behaviors, substance abuse, and post-traumatic reactions; and were frequently exposed to other confounding environmental risk factors, including physical abuse, family problems and social chaos.	1995	natural
A sample of 475 female college students completed measures of sexual and physical abuse in childhood (before age 15) and adulthood (after age 15), PTSD and trauma symptoms, and demographic variables.	1998	natural
Results suggest that for some children sexual abuse is related to an increased report of subjective somatic complaints.	1995	natural
Extremely high rates of mental_health problems and substance abuse disorders in this sample suggest the need for street-based and nontraditional mental_health services targeted toward these youths and young adults.	1997	natural
In an attempt to assess the unique long-term effects of parental physical abuse, verbal abuse, and emotional neglect, a sample of 247 female and 154 male undergraduates was recruited to complete retrospective questionnaires of parental maltreatment as well as current measures of anger (Brief Anger and Aggression Questionnaire), loneliness and social isolation (UCLA Loneliness Scale), and negative self-esteem (Rosenberg Self-Esteem Scale).	1997	natural
Mean age and survival-hazard techniques were used to study the onset of alcohol abuse and dependence (as defined in the 4th edition of the Diagnostic and Statistical Manual of Mental Disorders; American Psychiatric Association, 1994) in 369 clinical cases drawn from a heterogeneous regional sample.	1995	natural
This paper examines, first, the official German criminal police statistics in order to elucidate the role of alcohol with regard to the commitment of crimes and, second, the relationship of alcohol abuse and chronic offenders in a life course perspective.	1997	natural
In most of the literature on the sequelae or treatment of adult women who were incestuously abused by their fathers, little attention is paid to the impact of the abuse on the daughter's relationship with her mother, other than to hold the mother accountable for the abuse.	1995	natural
The article uses a Michigan civil statute of limitations as an example of a civil law with which sexual abuse survivors in Michigan must contend if they wish to seek compensation through the legal system.	1996	natural
Although the seroprevalence of HIV in adolescents with psychiatric disorders is unknown, studies indicate that adolescents with psychiatric disorders are at greater risk than their peers because of increased rates of unsafe sexual practices, impulsivity, self-destructive attitudes, cognitive immaturity, high rates of substance use, self-cutting behavior, and the sequelae of sexual abuse.	1997	natural
The Challenge Project assessed all 80 convicted perpetrators of child sexual abuse in S.E. London over a 2-year period, and followed them up 1 and 2 years later.	1997	natural
Both childhood sexual abuse and adult sexual victimization predicted suicidal behavior.	1998	natural
This study identifies the risk factors connected with the occurrence of sexual abuse and associated with the severity of sexual abuse, comparing the risk factors derived from U.S. and Taiwan studies.	1996	natural
Because more girls report sexual abuse than boys, it has been widely assumed that boys are less vulnerable or that their abuse is less damaging than the abuse of girls.	1995	natural
Cultural and social factors that may influence psychological functioning subsequent to sexual abuse among Black and Latino girls are identified and discussed.	1995	natural
Severity of illness was associated with concerns about physical abuse (p = .02) among children with head trauma, and with concerns about neglect and frequency of reporting among children with meningitis (p < .01).	1997	natural
Recent literature delineating an association between combat PTSD and earlier childhood abuse is briefly reviewed and forms the basis for a new treatment strategy.	1998	natural
A single-subject multiple baseline design across five players was used to assess the effectiveness of public posting in reducing inappropriate on-court behaviors (e.g., verbal abuse by a player during a match).	1998	natural
To illustrate the process of responding to changes in the substance abuse environment, to advances in knowledge about risk, and to newer technologies, this article provides an overview of the history of two federally funded HIV-prevention programs for out-of-treatment substance abusers and reviews recent changes made to the Standard Intervention protocol.	1998	natural
Physical abuse is a significant risk factor for alcohol dependence as well as for domestic violence independent of the effects of alcohol abuse.	1998	natural
Victims of sexual abuse were found to be more lonely and less likely to utilize their social support system than the controls.	1996	natural
DBT has been shown to be more effective than treatment-as-usual in treating drug abuse in this study, providing more support for DBT as an effective treatment for severely dysfunctional BPD patients across a range of presenting problems.	1999	natural
The patients who reported physical abuse histories scored higher on the somatic symptom section of the General Health Questionnaire.	1996	natural
This group was contrasted with a child sexual abuse group, peer sexual abuse group, and a no sexual trauma group.	1996	natural
Fifty percent of the victims were grade school age children between 7-12, and 62.4 suffered physical abuse.	1996	natural
The rate of social workers in the field of child welfare who would report sexual abuse is higher (70).	1999	natural
Early sexual abuse is also associated with a number of other poor prognostic factors, and further research is needed to define how these variables interact.	1996	natural
Twelve children with intracranial injury secondary to child abuse.	1997	natural
The manner in which sexuality and abuse are dealt with often reflects the way disabled people are regarded by the society.	1995	natural
Of the 76 items of the Abuse Scale, 55 were highly discriminatory, six of them were nonsignificant and 15 of them had differences that were not great enough so as to discriminate people well.	1998	natural
The four primary components of the abuse clarification process are: (a) clarification of the abusive behaviors; (b) offender assumption of responsibility for the abuse; (c) offender expression of awareness of the impact of the abuse on the child victim and family; and, (d) initiation of a plan to ensure future safety.	1998	natural
Twenty-six clinic children (13 males and 13 females) were included, who had experienced sexual, physical, and/or emotional abuse.	1997	natural
There were two objectives; first, to investigate the prevalence and characteristics of child sexual abuse in an American Indian community, and second, to determine whether persons with histories of child sexual abuse are at greater risk to develop psychiatric disorders and behavioral problems than persons who report no such history.	1997	natural
This article discusses the societal implications of substance abuse by pregnant women and women of child-bearing age and reviews their treatment needs as documented in the literature.	1997	natural
Results indicate that each of the abuse dimensions is associated with a broad range of psychiatric symptoms and, in combination with substance abuse, account for almost one third of the variance in overall distress.	1997	natural
Thirteen families of child sexual abuse victims took part in the study through a questionnarie and semi-structured interview.	1998	natural
The article further discusses possible determinants of violent behaviour such as psychotic symptoms and comorbidity with substance abuse and considers who is at particular risk of becoming a target of violent acts.	1998	natural
Mother's nurturance and promotion of autonomy were assessed in a laboratory setting; boys' substance abuse was measured by self-report methods in the same year as the observation.	1997	natural
The physical diagnosis and treatment of child abuse and neglect have traditionally fallen in the domain of physicians; however, nurse practitioners (NPs), registered nurses (RNs), and physician assistants (PAs) are assuming increasing roles in the evaluation and treatment of maltreated children.	1997	natural
The present paper discusses the relationship between prolonged traumatic stress and subsequent suicidality by reviewing studies that have examined suicidal behavior in relationship to child abuse and combat trauma.	1997	natural
These results suggest that reducing violence risk among persons with SMI requires an aggressive approach to improving medication adherence in the context of integrated mental_health and substance abuse treatment.	1998	natural
Persons with more severe substance abuse were more likely to acknowledge a problem and need for treatment.	1999	natural
No gender difference in alcohol or drag abuse was found to be statistically significant.	1998	natural
These results suggest an avenue to target prevention services on a population at risk for child abuse, but not yet self-stigmatized by acting out that risk.	1996	natural
To test the prediction that the interaction of physical abuse and internalizing problems will heighten levels of aggressive behavior in a group of disruptive children.	1995	natural
For girls abused by someone outside of the family, the significant predictors were physical abuse, social isolation, mother's death, and having an alcoholic mother.	1997	natural
Cocaine and multiple drug abuse among young adults has spawned research interest in fetal exposure and the sequela of that exposure during the formative developmental years.	1998	natural
However, the same mediating relationship was not found when attempting to explain the greater psychopathological impact of more 'severe' forms of abuse (childhood experiences; intra-familial abuse).	1998	natural
Findings suggest that randomized studies of treatment for cocaine abuse may produce somewhat larger estimates of improvement than what is observed in more typical treatment situations.	1998	natural
The results supported the hypothesis that clients representing traditional hard-to-reach populations would be more likely to enter treatment for substance abuse through participation in HIV Outreach programs than would clients exposed to treatment-specific recruiting methods (e.g. NTIES).	1999	natural
Considerable debate exists regarding the possible relationship between child abuse and posttraumatic stress disorder (PTSD).	1999	natural
It is suggested in this paper that the concept could be usefully considered in families where a parent is a survivor of child sexual abuse but has kept the trauma a secret.	1999	natural
Although little attention has been paid to the problem of diuretic abuse as a method of weight control, diuretic abuse has been reported since 1968 in patients with anorexia nervosa (Wolff et al.,	1997	natural
The outcome of this study suggests that perinatal assessment of child abuse risk is possible and simple and is related to perceived stressors at the time surrounding delivery.	1999	natural
Substance abuse has been associated with cognitive dysfunction, such as problems with attention, reasoning, and memory.	1999	natural
General quality of childhood memory was found to be unrelated to a history of abuse, and most participants, regardless of their abuse history, reported recovering memories from their childhood in general.	1999	natural
Little is known about the acute effects of drugs of abuse on impulsivity and self-control.	1999	natural
In a forward stepwise regression analysis for panic disorder patients, a history of substance abuse and comorbid depression predicted suicidality.	1999	natural
A case of a mother confabulating an extended sexual abuse of her 13 and 15 year old children involving bizarre sadistic features is presented and discussed.	1996	natural
Aspects of inattention and depression, but not measures of psychopathic tendencies, were correlated with single substance alcohol abuse.	1996	natural
Contrary to other cases of vulvodynia previously reported, Joan had never suffered from real sexual or physical abuse, but experienced her emotional and sexual life in a painfully conflictual way.	1998	natural
Five of the 8 patients with delusional jealousy were found to have an additional alcohol abuse or dependence problem.	1995	natural
The present study employed data originating from 755 6-year-old boys from low SES neighborhoods, who were followed through age 13, to predict this marker, 3 models were tested using LISREL analyses to determine whether individual characteristics and/or peer influences were linked to subsequent substance abuse.	1995	natural
The results indicate a probability that an incidence of crosspeer abuse definable as bullying against teachers by their pupils exists, both from teachers' self reported data, and that reported regarding their colleagues.	1998	natural
Research has shown that drug abuse treatment can help many individuals.	1995	natural
The objectives were: to investigate the association during pregnancy of sexual abuse before the age of 18 on depressive symptomatology in pregnancy, controlling for the presence of negative life events and challenges; and to investigate the association of selected pregnancy outcomes (maternal labor and delivery factors, infant birth weight and gestational age) with sexual abuse before age 18.	1999	natural
There is growing interest in a number of medications with proven clinical efficacy or potential for treating substance abuse.	1996	natural
Barriers within the substance abuse field to the adoption of treatment methods suggested by this model are considered and methods of surmounting those barriers are described.	1996	natural
The current paper argues that studying power differentials rather than gender differences may provide a more valuable heuristic for understanding the development of food abuse in varying nations as well as the presentation of eating problems in men.	1997	natural
