Analyses, controlling for socioeconomic status and ethnicity, showed that a history of physical abuse was predictive of current self-concept, but did not predict social competence as an older adolescent.	1998	natural
This was an experimental study of 14 alcoholic outpatients using the Peniston and Kulkosky (1989, 1991) brainwave treatment protocol for alcohol abuse.	1995	natural
Families in the military are not immune to problems of child abuse and neglect, but few data have been disseminated which describe child maltreatment in the military.	1995	natural
Symptoms of conduct disorder (CD), antisocial personality disorder (ASP), alcohol abuse, drug abuse, and somatization were tabulated for the families of 35 delinquent, substance-abusing (multiple-problem) adolescent male probands and 35 age-matched control males.	1998	natural
One legacy of childhood sexual abuse is the adult survivor's deep alienation from his/her own fantasy life which is accompanied by a profound distrust of the imaginings of others, including the therapist's.	1997	natural
Emotional problems, behavioural problems, suicidal thoughts and behaviour of boys and girls with a history of sexual abuse were compared to those in a matched control group of boys and girls without such a history.	1998	natural
Looking at psychoanalytic diagnoses, a significant correlation between a history of childhood sexual abuse and a diagnosis of hysterical neurosis was found.	1999	natural
However, clients and case managers exhibited little agreement regarding the use of scheduled counseling, supportive counseling, use of day programs, and substance abuse services.	1997	natural
This article reports the results of a qualitative study which addressed the effects of women's childhood sexual abuse (CSA) on male partners and the couple relationship.	1996	natural
Participants were 162 women and 25 men entering an outpatient treatment program for adult survivors of childhood sexual abuse (CSA) in a university-based community mental_health center.	1999	natural
To discuss issues concerning mandatory reporting of child abuse in research settings.	1999	natural
Several assessment measures exist in the adult substance abuse field, but the majority of them are either screening tools or are limited to alcohol use.	1999	natural
The initiatives included integration of alcoholism and drug abuse treatment programs, expansion of Medicaid reimbursement for substance abuse treatment, training and skills development for counselors, and coordinated service development and advocacy for substance abuse and development for counselors, and coordinated service development and advocacy for substance abuse and AIDS/HIV services.	1996	natural
Fifty percent of the victims were grade school age children between 7-12, and 62.4 suffered physical abuse.	1996	natural
This exposition is an attempt to unravel the complexities of the relationship between childhood sexual abuse and adult psychopathology.	1995	natural
These findings suggest that college women who report abuse continue to experience acceptable accuracy in their reality testing but, in comparison to their cohorts who have not been abused, more often become distant from the world and their own sensory experiences.	1999	natural
Empathy enhancement for sexual abuse survivors must be regarded as a key component of sexual abuser treatment programs.	1999	natural
Parenting experience had only a minimal effect on assessments of abuse, while having encountered a case or suspected case of maltreatment at work predisposed individuals to view more ambiguous acts as less likely to constitute abuse.	1998	natural
Those whose sexual abuse involved touching were more suicidal, and felt less able to cope, and less responsibility for their families, than nonabused adults.	1995	natural
Finally, recommendations are offered for expanding the TC approach and increasing its effectiveness by treating comorbid problems that are prevalent among prison inmates with substance abuse problems.	1995	natural
Community collaboration is an exciting way in which community members, multiple agencies, and professionals are organizing to approach the ever-increasing problem of child sexual abuse.	1998	natural
Fifty-five percent of those participants reporting sexual abuse, 47 of those reporting physical abuse, and 34 of those reporting emotional abuse indicated a period of time during which they did not remember the abuse.	1998	natural
These findings are consistent with those of other studies that suggest that, among adults reporting childhood abuse, the experience of forgetting some or all abuse is common.	1999	natural
A major concern of many substance abuse treatment facilities is that female clients have greater dropout rates than male clients.	1997	natural
The role of the medical examination in assessing allegations of child abuse and neglect should be one of integration with those providing the psychosocial assessment.	1999	natural
In terms of the mental_health needs of children and youth, three areas were highlighted: (a) conduct disorders and behavioral problems, (b) emotional problems, and (c) problems related to sexual abuse.	1997	natural
In a prospective, longitudinal study of alcoholism in 134 males, schizotypy was assessed during adolescence, skin-conductance orienting was assessed at ages 18-20 years, and criminal offending and alcohol abuse were assessed at ages 30-33 years.	1999	natural
We attempted to explore these effects in investigations of physical abuse.	1999	natural
The grave physical and emotional consequences of childhood abuse and neglect are undisputed.	1997	natural
The author focuses on incestuous and sexual abuse supporting institutional structures: a) rigid and authoritarian structures, which contribute to the emotional isolation of staff members and b) unstructured and diffuse leadership.	1995	natural
Nevertheless, a substantial minority endorsed the following practices: 37 endorsed searching for childhood roots of presenting complaints; 36 endorsed validation (expressed belief) of the patient's memories as an essential part of therapy; 36 believed in appropriateness of affect as an indicator of truth in memories; 36 believed in the therapeutic value of abreaction; 26 would refer presumed survivors of abuse to specialists in incest recovery; 18 believed in ritual abuse as an important cause of posttraumatic stress disorder (PTSD) and dissociative disorders; 18 trusted symptom checklists as indicators of sexual abuse histories; and 15 believed that memory is a complete record of the individual's history.	1998	natural
This study investigated the association of right-wing authoritarianism and amount of income with wife abuse, 93 men currently involved in relationships completed Altemeyer's Right Wing Authoritarianism Scale, the Conflict Tactics Scale, and reported their age, yearly income, and spouse's yearly income.	1997	natural
Corroboration of scales assessing parental neglect, physical abuse in the household and sexual abuse (either household or nonhousehold) was satisfactory, with a mean correlation for the three experiences of .60 (weighted kappa [Kw]).	1997	natural
Maternal abuse potential was assessed when children were 1, 3, and 5 years old; problematic parenting orientation was assessed when the children were 6 months old; and child development (i.e., IQ, adaptive behavior, and behavior problems) was assessed at ages 3 and 5.	1999	natural
Mean CPTSD-RI scores were higher for students whose abuse had involved sex (sexual and physical abuse, sexual abuse only) than they were for students whose abuse had been physical only.	1995	natural
When the professionals responding to sexual abuse disclosures exhibit a parallel process of role confusion, inadequate communication, secrecy and denial, the victims and their families are further traumatized.	1999	natural
Given the skew of the abuse data for this nonclinical sample, log transformations were performed on the data and the regression analyses were reported.	1996	natural
The processes of cognitive change for both men are outlined and compared by assessing attitudes across the offending areas of rape, voyeurism, exhibitionism and dating abuse.	1998	natural
Seventy women enrolled in an outpatient clinic were asked about childhood histories of physical and sexual abuse in a structured clinical interviews at two times.	1996	natural
Although PCIT is effective with different populations and in different settings, no study to date has demonstrated the effectiveness of PCIT with physically abusive families or families at risk for physical abuse.	1999	natural
Child abuse is surely the most agonizing psychological issue of our time.	1995	natural
However, the interaction of race/ethnicity with the type of abuse was significant.	1995	natural
Substance abuse has been associated with cognitive dysfunction, such as problems with attention, reasoning, and memory.	1999	natural
in the German-speaking area deal with suspected cases of sexual child abuse.	1996	natural
A high prevalence of co-morbidity, such as drug abuse, psychiatric or medical disorder, was a significant finding in these mothers.	1999	natural
In this study, 154 women responded to questions about current and remembered childhood attributions of responsibility for child sexual abuse.	1998	natural
The role of urine monitoring in assessing the recovery of patients from substance abuse is discussed with emphasis on the need to include multiple sources of clinical input in assessing the patient.	1996	natural
These findings are the first empirical evidence for an association between style of anger expression and the long-term consequences of childhood sexual abuse.	1996	natural
Trailing behind the recent acknowledgement of the high incidence of sexual abuse amongst people with intellectual disabilities is a recognition of men with intellectual disabilities as perpetrators of sexual abuse.	1997	natural
Variables of student behavior, severity of behavior, and risk factors such as abuse and outofhome care were not reliable predictors of placement.	1998	natural
Sixty-seven mothers whose children had been sexually abused by others and 65 control mothers were asked about sexual abuse in their own childhood.	1998	natural
Additionally, the child molesters displayed significantly less empathy toward their own victims than toward the general sexual abuse victim.	1999	natural
As hypothesized, even when demographic differences between groups were controlled, survivors reported significantly less relationship satisfaction, poorer communication, and lower levels of trust in their partners than did women with no history of sexual abuse.	1999	natural
Although social-environmental factors play a large role in the development of substance use and abuse, other important contributors reside within the individual.	1996	natural
Third variables included 11 markers of negative growing up experiences including four types of child maltreatment: emotional neglect, physical abuse, physical neglect, and verbal abuse.	1999	natural
Clients in substance abuse treatment are at high risk for smoking-related illness due to higher rates and heavier smoking than the general population.	1995	natural
The aim was to investigate cognitive coping strategies used by a nonclinical sample of women with a history of childhood sexual abuse, to examine whether cognitive appraisals affected their current coping strategies and psychological well-being.	1998	natural
To illustrate how young children can be induced to make false allegations of sexual abuse.	1997	natural
The link between childhood abuse and subsequent victimization was mediated by a higher level of sexual activity among the abuse victims.	1999	natural
The present study examined individual personality characteristics of 65 nonoffending mothers and 94 father/perpetrators, and used canonical correlations and multiple regression analyses to examine patterns of personality traits occurring in 63 pairs of fathers and mothers in which there was acknowledged child sexual abuse by the fathers.	1995	natural
The authors' conceptual framework is applied to make specific predictions about the relationships between particular abuse characteristics and later symptoms, and research on adults with histories of child abuse and on abused children is reviewed for consistency with these predictions.	1997	natural
The normal abuse pattern, with cannabis as the first substance used and a gradual shift to more severe opioid and CNS stimulant abuse, was most true of this type.	1998	natural
The men who participated in the research were largely motivated by their perception that North American society does not acknowledge the sexual abuse of boys.	1999	natural
Suggestions for occupational therapy practice that address the psychosocial sequelae commonly resulting from the concomitant effeels of alcohol abuse, childhood victimization, and neurologic impairment in Women are offered.	1999	natural
Women, younger respondents, and nonparents were more likely to believe the allegations about sexual abuse, but nonparents were less likely than parents to believe a girl's denial of a theft.	1998	natural
In a recent article in this journal, D. H. Gleaves (1996) criticized the sociocognitive model (SCM; N. P. Spanos, 1994) of dissociative identity disorder (DID) and argued in favor of a posttraumatic model (PTM) in which DID is conceptualized as a consequence of childhood abuse and other traumatic events.	1999	natural
The classical repetition compulsion theory of revictimization is less able to accommodate these findings than theories that implicate an effect of childhood abuse on self-concept.	1999	natural
The evidence suggests high levels of child abuse and neglect among the poor and, despite debate on the question, there is no body of empirical data suggesting that these findings are a product of bias predisposing toward overestimates of child maltreatment among the poor.	1998	natural
In addition, certain aspects of the epidemiology of reported sexual abuse in the United States have changed significantly over the past 12 years.	1995	natural
To conduct an item analysis in order to know the capability of the Abuse Scale items for discrimination between both groups of subjects.	1998	natural
At the time we present a method of judging normative sexual development of the child and of disturbances such a sexual abuse.	1996	natural
Results also indicate that victimization on the street and a history of physical abuse in the home are related to the respondents' violent behavior.	1998	natural
This study used the Addiction Severity Index (ASI) to identify the various problems substance abuse clients present when seeking treatment at a Department of Veterans Affairs Medical Center.	1995	natural
We conclude that diagnosing ASPD without attempting to attribute the cause of individual symptoms to substance abuse results in substantially greater temporal stability.	1998	natural
Mean ages of initial experimentation were as follows: inhalants, 9.7 years; marijuana, 11.9 years; alcohol (inebriated), 12.0 years; cigarettes, 11.2 years; for the remaining substances of abuse, the mean age was 13.2-14.7 years.	1999	natural
The patient who presents for evaluation and/or subsequent treatment of a neurological or psychiatric complaint accompanied by a positive history of substance abuse has generally received only modest attention in the clinical practice literature.	1995	natural
Studies in child abuse show that abusive parents score significantly lower on empathy measures as compared to their nonabusive counterparts.	1997	natural
To describe the patient population and use of mental_health treatment at a residential substance abuse treatment program for American Indian and Alaska Native adolescents.	1996	natural
A broad spectrum of very different institutions is confronted with the problem of sexual child abuse.	1996	natural
Although it is not possible for each child in whom abuse is suspected to be seen by a specialist, they should be seen by those staff with the most expertise.	1995	natural
Despite the lack of evidence indicating that children with disabilities are at significantly greater risk for abuse than their nondisabled peers, the presence of a disability raises some unique issues in the identification, assessment, and treatment of special needs children.	1997	natural
Although many important theoretical predictors of abuse proneness were confirmed, many questions arise regarding the diversity of discipline practices that parents use, and the relevance of child's age and social isolation in predicting abuse proneness.	1999	natural
The purpose of the present study was to examine the relationship between childhood and adolescent physical and sexual abuse before the age of 18 and psychosocial functioning in mid-adolescence (age 15) and early adulthood (age 21) in a representative community sample of young adults.	1996	natural
The purpose of this study was to investigate the effects of victim gender, and observer gender on the tendency to attribute responsibility for extrafamilial child sexual abuse to the victim and the nonoffending parents.	1998	natural
Prevalent among the presenting problems include depression and other disorders related to powerlessness, relationship problems, alcohol and substance abuse, and eating disorders.	1996	natural
While the primary focus is on the experiences of survivors of childhood abuse these similarities and parallels are also acknowledged.	1999	natural
Finally, few services are available to families in which elder abuse has been verified and even fewer program evaluations have been performed to assess these services.	1995	natural
The contributions of adversarial beliefs and past sexual abuse to heterosexual aggression among this sample of college women are discussed in relation to the social construction of gender and two specific aspects of social leaming theory.	1996	natural
Abuse characteristics and severity, although critical constructs in child maltreatment research, have been found to be among the constructs least well measured by existing instruments.	1997	natural
The children did not have a history of severe abuse or chaotic family environments.	1999	natural
While further research is needed to address spanking intensity, severity, and context, results of the research suggest that relative exposure to spanking may be an additional risk marker for abuse when considered with other known indicators or risk factors.	1997	natural
This study examined recognition of facial expressions of emotion among women diagnosed with borderline personality disorder (BPD; n = 21), compared to a group of women with histories of childhood sexual abuse with no current or prior diagnosis of BPD (n = 21) and a group of women with no history of sexual abuse or BPD (n = 20).	1999	natural
The Child Sexual Abuse (CSA) Myth Scale was developed to offer a means of reliably measuring acceptance of child sexual abuse myths and stereotypes.	1997	natural
Maternal inexperience and infant age were risk factors for neglect but not for abuse.	1997	natural
However this paper argues that the need to protect children from unethical research has somehow become entwined in the web of secrecy that surrounds the very nature of child abuse.	1997	natural
The findings indicate that population-based enrollment strategies appear favorable to screening-based ones in early home visitation programs seeking to prevent physical child abuse and neglect.	1999	natural
The partner abuse--suicidal behavior link was mediated by psychological distress, hopelessness, and drug use and moderated by social support.	1998	natural
This study examined the frequency of disclosure of abuse by (he alleged victim, as well as the child, examiner, and case characteristics that might influence disclosure.	1997	natural
The role of the medical examination in assessing allegations of child abuse and neglect should be one of integration with those providing the psychosocial assessment.	1999	natural
This study sought to determine whether having preschoolers review those video segments they did not comprehend initially, would increase their comprehension of sex abuse prevention concepts.	1999	natural
The ASI problem areas most to least in need of treatment were: psychiatric, alcohol and drug abuse, employment, family/social, legal, and medical.	1997	natural
In recent years, student assistance programs have become the model approach to early intervention in adolescent substance abuse.	1995	natural
The study aimed to examine the relationship between professional background, number of qualifications, specific training in child sexual abuse and beliefs about indicators of child sexual abuse in professionals who conduct sexual abuse investigatory interviews.	1995	natural
While disclosures about pornography often surface in sexual abuse investigations at day-care centers, the pornography itself rarely materializes.	1997	natural
Results indicate that female inmates more frequently experienced employment problems, had lower incomes, more frequently reported cocaine as the primary drug of choice, and were more likely to report depression, anxiety, suicidal behavior, and a history of physical and sexual abuse.	1997	natural
Wide variability in the prevalence estimates of childhood sexual abuse using different instruments highlights the need for agreement on the definition of childhood sexual abuse.	1997	natural
This study has implications for referrals attempting to distinguish head injury effects from those of psychosis or substance abuse.	1999	natural
Requirements for effective therapy include the establishment of a safe environment, cooperation of a partner to allow the patient to be in control, and an exploration of past sexual abuse to avoid recapitulation that may trigger flashbacks or dissociative episodes.	1995	natural
In 1988 I began a report on the accuracy of expert testimony in child sexual abuse cases utilizing Ralph Underwager and Hollida Wakefield as a case study (Wakefield & Underwager, 1988).	1998	natural
This attentional bias was associated with a greater level of specific self-denigratory beliefs as a result of the abuse.	1995	natural
In addition, the influences on long-term adjustment of biological factors, developmental level at the time of abuse, severity of abuse, social context, and prior and subsequent life events are discussed.	1997	natural
Sexual abuse among women was associated with higher levels of depression, anxiety, suicidal ideation, suicide attempts, and PTSD, while physical abuse was associated with fewer psychological disturbances.	1997	natural
The client has a long history of childhood sexual abuse (CSA), as well as repeated sexual victimization as an adult and addiction issues.	1996	natural
Post-Traumatic Stress Disorder (PTSD) symptoms in children who reported sexual abuse, and their mothers, were compared for children in two groups: children whose mothers reported having been sexually abused as a child and children whose mothers did not report sexual victimization.	1998	natural
Future research should consider further the empirical links among pubertal timing, subjective age, and sexual abuse.	1999	natural
We found that the medical students responsible for treating substance abuse are significantly less religiously and spirituality oriented than the patients they treat, and that the students do not indicate that spirituality is an important component in the care of these patients.	1996	natural
In a pediatric residency training program, all residents viewed 15 slides of children's genitalia (8 normal, 7 abnormal) with either a history specific for sexual abuse or one which was nonspecific.	1995	natural
Using data from the 1991 and 1992 National Household Survey on Drug Abuse, multiple logistic regression models were used to estimate the relative risk of initiating non-medical drug use by 12-17-year-old adolescents living in families without both biological parents present compared to those living with both biological parents.	1997	natural
Fifty-two percent of those reporting abuse also noted periods of forgetting some or all of the abuse.	1999	natural
Children's exposure to spouse or partner physical abuse, which had a substantial prevalence among both child-abusing and control families, reduced the difference in disturbance ratings between children who were themselves physically abused and those who were not.	1995	natural
Predictors of recurrence were child vulnerability, family stress, partner abuse, social support deficits, and an interaction between family stress and social support deficits.	1999	natural
Of those abused, 69 reported sexual abuse involving physical contact, 9.5 of whom experienced sexual intercourse.	1996	natural
Using the Structured Clinical Interview for DSM-III-R, we assessed the prevalence of various forms of substance abuse in this population and attempted to judge whether substance abuse played a role in the index crime which has led to the present incarceration.	1997	natural
The convergence of these factors in intimate violence is analyzed; the potential of routine activity theory in explaining domestic abuse is assessed.	1997	natural
Although intensive outpatient therapy is recommended for treatment of cocaine, psychosocial characteristics associated with crack cocaine abuse are also implicated in attrition from outpatient programs.	1995	natural
Information concerning childhood abuse history was obtained from the therapists.	1996	natural
Child sexual abuse itself was not a significant predictor of self-injury, suicidal ideation or suicide attempts in this sample.	1999	natural
Sexually abused women, especially those who also experienced physical abuse, had a higher risk of developing CP, although CP symptoms occurred at a high base rate among physically abused women.	1997	natural
