Alcohol use disorders is a common co-morbidity of survivors of childhood abuse and neglect.	2017	natural
The existence of these two similar systems, one initiated by the institution involved in the abuse and the other by an independent entity, provided an opportunity to compare the background and motivation of victims who chose to communicate through one channel or the other.	2015	natural
Despite the intervening law reforms designed to improve complainants experience in court, we found that, relative to their historical counterparts, contemporary child complainants of sexual abuse are actually subjected to far lengthier cross-examinations involving a much broader range of strategies and associated tactics.	2017	natural
We used logistic regression to estimate associations of childhood economic factors (parental education, occupation, and unemployment; type of housing; and retrospective perception of poverty) with retrospective reports of perceived child maltreatment (physical abuse, sexual abuse, emotional abuse, neglect, and witnessing of domestic violence), controlling for demographic factors, parental mental_health and substance use, and child health.	2017	natural
Additional barriers to help-seeking include a lack of institutional support and guidelines for offering mental_health services for victims as well as a scarcity of housing, childcare, and employment opportunities for women seeking to break the cycle of abuse.	2017	natural
Sexual abuse in childhood increased the odds of reporting poor health and mental distress; some ACEs may have stronger associations to long term health than others.	2018	natural
Regarding the model with the subtypes of maltreatment, only Emotional Abuse predicted sleep problems.	2018	natural
Respondents who had all three categories of abuse were much more likely to report poor health and mental distress.	2018	natural
Currently, drug abuse potential is primarily assessed postmarketing; no validated tools are available to assess this potential in phase II and III clinical trials.	2016	natural
In particular, we focus on impulsivity and emotion dysregulation as possible triggers of alcohol abuse and personality disorders, ultimately leading to self-harm and interpersonal violence.	2017	natural
This concern is even greater among IPV-exposed toddlers who experience physical abuse.	2016	natural
Mediation analyses provided support for partial mediation, revealing a significant mediating role of emotion dysregulation in the relationships between both emotional abuse and need for approval and borderline personality features in this community sample.	2016	natural
This article adds to the overall knowledge of current practices to investigate, intervene, and mitigate elder abuse and neglect.	2016	natural
It is argued that such patterns of peer abuse are best understood as occurring within the psychosocial contexts of primary adjustment, collaboration and re-enactment.	2016	natural
In 2016, funding was provided to implement two evidencebased models Multisystemic Therapy for Child Abuse and Neglect (MSTCAN) and Functional Family Therapy Child Welfare (FFTCW).	2018	natural
The results indicated that the prevalence rates of physical abuse, physical neglect, emotional abuse, and emotional neglect were 4.0, 40.0, 10.5, and 27.9, respectively.	2017	natural
Parents experienced many problems, including exhaustion, poor mental_health, substance abuse and parenting problems.	2015	natural
List 2 included alcohol abuse, cognitive function, HIV stigma, HIV and treatment symptoms, medication adherence, positive affect, sexual risk behavior, sexual function, social roles, spirituality/meaning of life, and substance abuse.	2015	natural
The purpose of this study is to explore the predictive value of child sexual abuse characteristics (relationship between the child and the suspect, reported coercion, type and frequency of abuse) as well as the disclosure context (disclosure made on purpose or accidentally, maternal belief, and protective actions) on the number of central forensically relevant (CFR) details elicited during the investigative interview of alleged child victims.	2016	natural
Exploratory analyses indicated that somatoform dissociation specifically mediated the relationship between reported sexual abuse and DS diagnosis, along with depressive symptoms.	2017	natural
The current study examined a temporal cascade linking mothers' history of abuse with their children's internalizing difficulties through proximal processes such as maternal postnatal depressive symptoms and responsive parenting.	2015	natural
The least endorsed item in the checklist was an experience of sexual abuse 36 (7.9).	2016	natural
Using data obtained from the 20142015 South Carolina Behavioral Risk Factor Surveillance System, this study assessed the association between categories (household dysfunction; emotional and physical abuse; sexual abuse) and combinations of categories of ACEs on mental and physical health outcomes in adulthood ( =15,638).	2018	natural
This study examined the effects of emotional abuse in childhood, along with physical and sexual abuse, on suicidality in adulthood, and whether and how emotional abuse and depressive symptoms in adulthood mediate the association between the childhood emotional abuse and suicidality.	2015	natural
Service loss increased risk for binge drinking, whereas, for substance abuse, posttraumatic stress disorder increased risk and parent presence during the tornado decreased risk.	2015	natural
In contrast, the prevalence of sexual abuse was very similar across the four countries and was much lower (between 1.00 and 3.50) than cross-national estimates of physical abuse.	2018	natural
Prosecutors working with child sexual abuse (CSA) cases involving young children have raised concerns that reliability criteria from the Supreme Court of Sweden are holding children's testimony to impossible standards (e.g., expecting the child's testimony to be long, rich in detail and spontaneous).	2018	natural
Results indicated that, regardless of sexual orientation, participants experienced verbal and physical abuse due to their feminine gender expression, beginning in primary school and continuing through university and into the workplace.	2017	natural
The current study examined three well-established risk factors for intimate partner aggression (IPA) within Finkel and Eckhardt's I model, including two impellance factors-trait anger and childhood physical abuse history-and the disinhibiting factor of alcohol consumption.	2015	natural
Police files and interview transcripts were analyzed to collect information about the child sexual abuse characteristics, the disclosure context, and the number of CFR details.	2016	natural
This study used the Criteria for Distinguishing Abuse from Accidents Chinese version (CDAA-C) to determine cases of child abuse, undetermined intent, and unintentional injury, and compared risk factors and injury profiles among hospitalized children in Taiwan.	2015	natural
Childhood physical abuse predicts emotional/behavioral, self-regulatory, and social problems.	2015	natural
These moral discourses of spousal violence apparently serve to relieve perpetrators of moral agency; prime battered women to accept abuse; and devastate their agency to leave abusive marital relationships.	2015	natural
Path analysis revealed general as well as differential associations with negative outcomes: parental abuse, parental neglect, and parental psychosocial risks significantly associated with conduct problems, whereas parental abuse uniquely associated with peer problems, and parental neglect with hyperactivity/inattention.	2018	natural
Women who have experienced childhood abuse often have interpersonal difficulties.	2017	natural
The purpose of this paper is to systematically examine and integrate existing literature to determine the prevalence rates of neglect, emotional, physical and sexual abuse and intimate partner violence (IPV).	2017	natural
Of the total sample, 46 of the patients (n = 115) who were addicted to drugs had been victims of abuse.	2015	natural
Given widespread changes in our cultural understanding of abuse as well as more specific changes in the organizational approach to seminary education, these differences underscore the role that youth-serving institutions and society can have in the primary prevention of child sexual abuse.	2015	natural
Sexual abuse, especially within the past year increased marijuana use, alcohol use, number of drugs used, and alcohol and other drug (AOD) problems.	2016	natural
We examined the role of sexting coercion as a component of the intimate partner abuse (IPA) construct among young adults to determine whether sexting coercion would emerge alongside other forms of partner aggression as a cumulative risk factor for psychological, sexual, and attachment problems.	2016	natural
Since professional literature presents an individuals meaning in life as an immunizing factor against substance abuse, the present study sought to examine the impact of level of religiosity and level of ideological-political commitment, through the prism of meaning in life, on the attitudes adopted by adolescents towards such abuse, and their actual use of the various substances.	2015	natural
However, in cases of substantiated childhood sexual abuse, there was a greater odds of risky sexual behaviors in females (OR=2.72) than males (OR=1.69).	2016	natural
In this study, each respondent ( =467) was given two vignettes (one for neglect and one for physical abuse) with one of five drug use conditions.	2017	natural
While a latent construct of physical and emotional child abuse did not predict adult health outcomes directly, child abuse did predict outcomes indirectly through social support.	2016	natural
Using online surveys, we examined the prevalence rates of seven types of victimization (threats, insults, online slander, theft, physical abuse, sexual harassment, and sexual abuse) and three mental_health disorders (stress, anxiety, and depression, as measured by the DASS-21 [Depression Anxiety Stress Scale-21]) among students at two universities in southeastern Spain.	2018	natural
There were significant associations between the experience of child abuse in long-term care and adjustment across the life span in the domains of mental_health, physical health, and psychosocial adjustment.	2018	natural
Gender, a personal history of trauma and attitudes towards continuous vs recovered memories of abuse significantly impact the believability of Child Sexual Abuse (CSA) disclosures in community samples.	2018	natural
In recent years, there has been a great deal of attention given to the potential increased risk of vicarious traumatisation (VT) for clinicians with a history of childhood sexual abuse.	2017	natural
BPD female youth aged 13-21years with (n=29) and without (n=29) a history of child abuse were administered clinical interviews assessing diagnostic history, child abuse, NSSI and suicidality (i.e., ideation, plans, and attempts).	2016	natural
Quantitative results reveal some differences between women and men in victim characteristics, presence of a co-offender, and adulthood experiences with violence but no differences between women and men in experiences of childhood adversity, including prior child sexual abuse victimization.	2017	natural
Additionally, a history of child abuse (CA) was evaluated as a moderator of the association between shame and negative network orientation in this model.	2017	natural
Mothers' history of either sexual or physical abuse alone did not have significant indirect effects on externalizing problems.	2016	natural
This study was carried out to explore the prevalence of elderly abuse, identify its types, associated risk factors and determine quality of their life in Rural Mansoura districts, Egypt.	2018	natural
Multivariate analyses indicated that mothers reporting child sexual abuse were more likely to report more other maltreatments in their childhood and greater prevalence of lifetime history of alcohol abuse disorders, dysthymia, and panic disorder compared with mothers who had not experienced CSA.	2016	natural
Analysis of patterns of violence and abuse suggests that women are more highly victimized, injured, and fearful than men in clinical samples.	2015	natural
There are very few studies that have investigated the incidence of childhood abuse in adult women with psychiatric disorders.	2015	natural
Black and Hispanic youth were less likely than White youth to have used mental_health and substance abuse services, even when controlling for predisposing, enabling, and need factors.	2017	natural
Emotional abuse was an independent predictor of lifetime suicide attempts in BD patients.	2015	natural
The paradigmatic system of societal abuse occurs in totalitarian state systems.	2017	natural
The PCA demonstrated good reproducibility for sexual and emotional abuse with the hypothesized structure.	2018	natural
The results indicated that: DP significantly mediated the relationship between childhood EM and current psychological distress; that a history of EM, but no other forms of childhood abuse, significantly predicted current DP experiences; and EM, attachment-related anxiety, and negative attitudes toward emotions predicted clinical cutoff levels of DP.	2017	natural
Youth Leaders Program (YLP) is a health intervention implemented in a rural Alaskan school district, which utilizes natural helpers and peer leaders to increase protective factors such as school engagement and personal/cultural identities, and to reduce risks associated with drug/alcohol abuse, violence, and bullying.	2016	natural
In addition, we found that mothers' depressive symptoms mediated the associations of neglect and physical abuse victimization with perpetration of physical abuse; depressive symptoms did not explain any aspect of neglect perpetration.	2018	natural
Eighty-five percent of participants with ADHD reported lifetime substance abuse.	2016	natural
Individuals who experienced child abuse were more likely to perpetrate IPV, whereas those aware of the law were less likely to perpetrate IPV.	2015	natural
This finding could play an important role in sexual abuse cases in states where the definition of rape includes penetration of any bodily opening, including labial penetration.	2017	natural
This article reports research findings on the impact of Oglala Lakota Sioux traditional healing on family functioning and youth resiliency where trauma, abuse, or violence are often present.	2016	natural
Retrospective perceptions of childhood poverty were, in particular, strongly associated with most forms of child maltreatment but not with sexual abuse after accounting for other economic factors.	2017	natural
Results indicate that 15 interventions provided HIV/STI information, 13 provided substance abuse prevention information, and few included content tailored to specific needs of FSW.	2015	natural
In the absence of IPV guidelines, nurses employed interventions characterized as counseling, ascertaining abuse, and referral.	2015	natural
He concludes there was no witch-hunt epidemic, finding substantial evidence of sexual abuse in nearly every case he reviewed, contradicting the assertions made about those cases by what he calls the witch-hunt narrative.	2017	natural
Cases were classified as neglect (72.7), abuse (19) or non-child abuse or neglect (non-CAN; and were compared on a range of variables.	2016	natural
Neglect was also associated with multiple sexual partners, and emotional abuse with higher rates of miscarriage.	2017	natural
To implement an electronic health record-based child abuse screen in a diverse hospital system and to evaluate the screening rate, rate of positive screens, and number of reports to Child Protective Services and assess whether hospital and patient characteristics are associated with these rates.	2018	natural
There is growing empirical evidence for an association between childhood abuse (CA) and intimate partner violence (IPV) in adulthood.	2017	natural
This study examined whether and how adults with a history of childhood abuse may experience poor psychological functioning partly due to aspects of current family relationships.	2018	natural
Results from this study emphasize the importance of considering different types of social media in relation to substance use and abuse during emerging adulthood and the need to examine these relations by gender.	2017	natural
The aim of this study is the development and analysis of the psychometric properties of a new instrument to assess the possible psychological abuse experienced in a group setting.	2017	natural
A sample of 1,033 adults completed self-report questionnaires online, and 21.5 reported childhood sexual abuse.	2016	natural
This meta-analysis seeks to quantify the prospective association between neuroticism and the common mental_disorders (CMDs, including anxiety, depression, and substance abuse) as well as thought disorders (psychosis/schizophrenia) and non-specific mental distress.	2016	natural
Physical child abuse and teacher harassment should be considered when preventive and intervention programs are developed for adolescents.	2015	natural
Physical abuse did not predict antepartum and postpartum depression risk.	2016	natural
The review concludes with ways in which future policies could benefit by addressing adolescent stress as a means of reducing adolescent nicotine abuse.	2016	natural
Most studies of female sex workers (FSWs) conducted in the Mexico-US border region have focused on individual HIV risk, centered on sexual behaviors and substance abuse patterns.	2015	natural
By juxtaposing research into the experiences of police officers charged with interviewing children who are the alleged victims of sexual abuse, and clinicians tasked with diagnosing and managing contested cases of thyroid disease, the paper develops an understanding of such practice paradoxes as occasions of stalled transition, or liminal hotspots.	2017	natural
Accordingly, the current study examined whether impulsivity moderated the association between child maltreatment types (i.e., physical abuse, physical neglect, sexual abuse, emotional abuse, and emotional neglect) and BMI.	2017	natural
Overall, clinicians reported that 69 of CAMHS clients had experienced a potentially traumatic experience (any physical, emotional or sexual abuse, child neglect or traumatic event).	2015	natural
Lifetime drug injection was significantly associated with lower education, homelessness, prior criminal justice involvement, opioid use, polysubstance use, childhood physical and sexual abuse, and being HIV-infected, but not with prior OAT.	2016	natural
However, little research has examined how ACT may be paired with other techniques traditionally applied to treat substance abuse, such as motivational interviewing (MI).	2018	natural
Most cases of abuse took place in the home of the abuser.	2018	natural
The 12-month prevalence estimates of regular heavy drinkers, and alcohol abuse disorder and dependence were 2.5, 3.2 and 1.6, respectively.	2017	natural
However, empirical studies show heterogeneous results depending on the type of childhood abuse or neglect and other maltreatment characteristics.	2018	natural
Frequency of abuse did not relate to stress reactions.	2016	natural
We also examined the unique relationship between childhood sexual abuse (CSA) and adult sexual victimization while adjusting for co-occurring substance dependence and psychopathology.	2016	natural
Sexual abuse during childhood is a public health and human rights concern throughout the world, including Sub-Saharan Africa.	2015	natural
Path-analyses confirmed a positive relationship between exposure to traumatic events and PTSD symptom severity, appetitive aggression, the number of committed offenses and drug abuse prior to violence.	2017	natural
Survivors of child sexual abuse (CSA) often delay disclosing or do not disclose the abuse for fear of not being believed.	2015	natural
The aim of the current study was to examine whether contact with CPS is associated with improved mental_health outcomes among adult respondents who reported experiencing child abuse, after adjusting for sociodemographic factors and abuse severity.	2018	natural
Analysis of information held by police, probation, and third-sector organizations in Wales about 100 domestic abuse perpetrators, along with 16 practitioner interviews, provides the empirical context for a discussion of the problem of serial domestic abuse.	2016	natural
The health sector has an opportunity and responsibility to be part of the multisector collaboration to prevent and respond to sexual abuse of minors.	2017	natural
Interviewing victims of child sex abuse requires considerable care in order to minimise error.	2016	natural
Perceived social support from the community was lower in the sexual revictimization group than in the single sexual abuse and comparison groups.	2017	natural
Multigroup analyses indicated that adolescence-onset and duration of sexual abuse respectively predicted anxiety and PTSD in females but not males, whereas sexual abuse severity predicted fewer PTSD symptoms in males but not females.	2018	natural
Furthermore, important types of tensions in efforts to safeguard against child sexual abuse are identified: the importance of listening to children and avoiding false allegations, the preschool teacher as a safeguarder and a potential abuser, and the importance of preventing child sexual abuse and providing qualitative care of children.	2016	natural
Progress in identifying polymorphisms associated with DRD profiles could further clarify the underlying biological systems for pharmacological and neuromodulatory interventions, and, as a qualitatively different risk factor from existing prevention programs, impulsive DRD is worthy of investigation at a more general level as a novel and promising drug abuse prevention target.	2015	natural
A longitudinal randomized controlled trial tested whether access to permanent housing reduces child maltreatment among inadequately housed families under investigation for child abuse and neglect.	2017	natural
Offering counseling and psychotherapy to patients with pedophilia is considered an essential part of sexual abuse prevention by many experts in the field.	2015	natural
Results indicated that, regardless of sexual orientation, participants experienced verbal and physical abuse due to their feminine gender expression, beginning in primary school and continuing through university and into the workplace.	2017	natural
Childhood experiences of abuse and neglect were assessed in relation to dysphoric states among patients with borderline personality disorder (BPD) over a 10-year course of prospective follow-up.	2015	natural
Future research should assess the impact of interventions that aim to mitigate poor SEB outcomes due to ACEs, especially sexual abuse.	2017	natural
The study findings suggest that more comprehensive HIV care, which integrates mental_health and substance abuse services in order to enhance meaning and address coping and grief, may be important.	2018	natural
This study highlights the importance of relational components in treatments for substance abuse. (	2015	natural
In light of the prevalence of substance co-use, this review will also explore the effect of tobacco and other substance abuse co-morbidity on the dopaminergic system across study samples in the reviewed literature.	2016	natural
Violence exposure was characterized with dimensional scores reflecting probability of membership in two classes derived via latent class analysis from the Conflict Tactics Scales: Abuse and Harsh Parenting.	2015	natural
Thus, the Sig-1R has become a potential therapeutic target of medication development against drug abuse that differs from traditional monoamine-related strategies.	2016	natural
Given the substantial comorbidity between substance abuse and psychosis, it is critical for researchers and clinicians to consider potential effects of substance abuse when evaluating insanity acquittees for conditional release, especially as substance use relates to future dangerousness.	2016	natural
In rats, PS facilitates the rewarding and neurochemical-stimulating effects of drugs, suggesting that PS may represent a risk factor for drug abuse in humans.	2017	natural
The purpose of this paper is firstly to demonstrate that child sexual abuse happens within the family system in South Africa, and secondly, to argue that the prevention of child sexual abuse should start within the family system and this can be achieved by conducting educational social group work sessions on child sexual abuse with the family members.	2018	natural
This study developed and tested a web-based, drug abuse prevention program for adolescent girls.	2017	natural
Children who enter foster care are at unique risk for developing substance abuse due to experiencing early life stressors.	2018	natural
Moreover, future research is needed to replicate and better understand the explanatory mechanisms underlying the relationships among a history of IPV, abuse perceptions, and gender.	2015	natural
The study compared two independent samples of children aged 810 years: 48 child abuse victims recruited from a centre for Child and Adolescent Psychological Support (NACA) for abused children, and 144 public and private school students.	2018	natural
This study aims to adapt The HwalekSengstock Elder Abuse Screening Test (H-S East) (Neale, Hwalek, Scott, Sengstock, & Stahl, 1991) to Turkish and to assess its validity and reliability while determining the factors that affect elder abuse.	2016	natural
Abuser weaknesses and strengths as highlighted in the theoretical framework should be further investigated for future prevention and intervention in cases of emotional/psychological abuse.	2017	natural
