The purpose of the current paper is twofold: to review rigorously conducted studies (e.g., included a comparison group; utilized inferential statistics) examining the association of opioid abuse with parenting and child outcomes, and to review parenting intervention programs with these caregivers.	2018	natural
This study examined how childhood sexual abuse (CSA) affects overall QoL as well as severity of PTSD and depressive symptoms.	2017	natural
First, the results support that displaying alcohol-related content on SNS is more strongly associated with alcohol abuse than exposure to this kind of content.	2016	natural
The most common psychiatric disorders seen among pathological gamblers were alcohol abuse (57.4), nicotine dependence (49.5), and any drug use disorder (16.2).	2016	natural
The discussion concludes with thoughts about seeing and not seeing erotic material and/or sexual abuse prompted by the grave of Jimmy Savile.	2015	natural
The purpose of the current study is to examine the use of both a prospective and a retrospective pretest in evaluating the impact of the Strengthening Families Program on foster care involved families affected by parental substance abuse.	2016	natural
The National Institutes of Health has a long history of supporting investigator initiated child abuse research, including risk-factor studies on prevalence, course and consequences of child abuse and neglect.	2017	natural
Alcohol abuse or dependence is a significant problem among American physicians.	2015	natural
Men reporting both physical abuse and sexual coercion against intimate partners reported significantly higher numbers of lifetime partners, higher rates of nonmonogamy, greater endorsement of nonmonogamy, and less frequent condom use relative to nonabusive men or those reporting controlling behavior only.	2016	natural
Roughly equivalent numbers identified as gay (40.6 ) and bisexual (41.3 ), while fewer identified as straight (7.6 ) or down low (10.5 ), with significant differences in age, income, history of incarceration, HIV status, alcohol and drug problems, childhood sexual abuse, and connection to the gay community evident among these groups.	2016	natural
The prostitution diversion program examined in this study contained a subgroup of participants who had experienced multiple types of child abuse, possessed an increased risk of adult victimization, and reported greater trauma symptomatology.	2018	natural
This study investigated associations between sibling hostility (physical abuse, threats of violence, heated verbal conflict) and conduct disorder symptoms, trait hostility, and lifetime aggression after control for variance attributable to physical and sexual abuse, exposure to domestic violence, and peer bullying.	2017	natural
There are several challenges associated with evaluating the prevalence of sexual trauma, including child sexual abuse and adult sexual assault.	2015	natural
Human trafficking victimization is frequently associated with child abuse or neglect and out-of-home placements.	2018	natural
Most of the cases of abuse were planned and carried out under threat, and a certain number of such crimes resulted in pregnancy, were repeated systematically, and became evident when the mothers of the abused children found out or when a pregnant child was referred to a hospital for childbirth.	2016	natural
Individuals in treatment for dissociative identity disorder not uncommonly describe childhood involvement in organized, multi-perpetrator ritual abuse.	2017	natural
The most commonly reported ACEs were household mental_illness, parental separation/divorce, household alcohol/substance abuse, and emotional abuse or neglect by a parent or household member.	2017	natural
A validation study of the Child Sexual Abuse Knowledge Questionnaire (CSA-KQ) was conducted on a sample of 1712 non-empanelled jurors in the greater Sydney area, Australia.	2016	natural
Studies of the association between traumatic experiences and psychopathology in early childhood have primarily focused on specific types of events (e.g., sexual abuse) or aggregated different types of events without differentiating among them.	2016	natural
Google Scholar, PubMed, and Cinahl were searched for studies published from 2006 to March 29, 2016 that reported impact of smoking cessation treatment or quitting smoking on substance use or substance use disorder treatment outcomes in the general population and among those in substance abuse treatment.	2017	natural
Propensity score matching analysis of a national data set sampling over 4,000 young adults suggests that experiencing child sexual abuse influences adult intimate partner violence victimization and perpetration.	2015	natural
Parental childhood abuse history is known to be one of the most robust risk factors for abusing their offspring.	2016	natural
Elder abuse is a common phenomenon with potentially devastating consequences for older adults.	2016	natural
David John Farmers work on anti-administration and O.C. McSwites work on administrative refusal are effective strategies to address the abuse of institutional power.	2018	natural
Avoidance problem solving served as an intermediating variable for the relationship between three types of abuse and PTSD severity.	2015	natural
Data from the Demographic and Health Survey 2007 indicate that multiple factors perpetuate spousal abuse: the individual-level factors of low education and wealth, a micro-level factor of women making decisions regarding household purchases, an exo-level factor relating to the wives failure to seek legal support, and a macro-level factor reflecting cultural support for using violence to control wives.	2015	natural
This study was designed to follow up on a previous study and further explored the association between insecure attachment to parents, social isolation, and interpersonal adequacy to child sexual abuse perpetration in adolescents.	2016	natural
This type of research can be used to evaluate the underlying reasons behind spatial clustering of youth substance and to target local drug abuse prevention interventions and use.	2016	natural
Logistic regression analyses showed that women reporting the most severe abuse, irrespective of category, were significantly more likely to meet the CES-D criteria for depression.	2017	natural
Yet to be examined is if survivors of childhood abuse exhibit fear of self-compassion and whether it relates to psychological functioning.	2016	natural
Among the subsample of adolescent parents, the SafeCare intervention did not result in significantly improved outcomes in terms of preventing recidivism or reduction in risk factors associated with child abuse and neglect as compared to child welfare services as usual.	2018	natural
Each client was assigned a case manager, who arranged meetings with mental_health, substance abuse, and medical care professionals.	2016	natural
Interventions focused on preventing trauma, PTSD, and depression should be multifaceted and be targeted at various levels, for example, individual/interpersonal level (reduce abuse in the household and immediate environment) and community/societal level (reduce crime rates in communities and strengthen conviction policies).	2016	natural
Additional risk factors of IPV included childhood maltreatment, primary psychopathy, alcohol abuse, and illicit drug use.	2015	natural
The aim of this study is to find out the overall prevalence rates for the major forms of abuse among adolescents in the Kingdom of Saudi Arabia and the differences in prevalence by age, gender and living arrangement.	2016	natural
The prevalence of childhood sexual abuse in studies from mainland areas was significantly higher than that from Hong Kong/Taiwan.	2018	natural
It then took the inquiry to the more fundamental issue of the elements of the Churchs structure and its unique culture that enabled sexual abuse and supported the hierarchys counter-productive responses.	2017	natural
In Study 1, with samples from two different national cultures (101 from Germany and 169 from Romania; 143 boys/135 girls; age 13 to 17), animal abuse was negatively associated with affective empathy and national culture; more frequent animal abuse was found in Romania.	2016	natural
Suicidal ideation and behaviors due to sexual abuse (SA) were also examined.	2018	natural
Results showed that (a) sexual abuse was a significant predictor of concerns regarding food and weight gain (p < .05) and (b) other form of trauma (e.g., natural disaster) was a significant predictor of difficulties in individuals relationship with food (p < .05).	2017	natural
Interventions to help low-income mothers dealing with relationship violence and substance abuse should also address the structural violence and substantive barriers these mothers face.	2017	natural
Most criminal justice responses to address sexual violence and abuse against children are aimed at identifying and incarcerating offenders or at best, trying to prevent them from reoffending.	2016	natural
Discusses how Ohio's responded to the mental_health and substance abuse needs of youth in the juvenile justice system by establishing the Ohio's Behavioral Health/Juvenile Justice Initiative.	2015	natural
This study examined influences of alcohol intoxication, attentional control, and childhood sexual abuse (CSA) severity on sex-related dissociation.	2016	natural
High rates of abuse and neglect were predicted by several neighborhood-level measures of structural burden.	2016	natural
Literature that has examined maternal selfreported history of abuse and an observational assessment of infantmother interaction were reviewed.	2017	natural
In this article, I propose a methodological framework to analyze international NGO advocacy campaigns to examine the use or abuse of their discursive power, which in itself could then lead to reflect on the use or abuse of power in their practice.	2015	natural
Depressive symptoms also mediated between emotional abuse in adulthood and suicidality.	2015	natural
Childhood sexual abuse (CSA) occurs across the world, with a prevalence of 20 internationally.	2015	natural
Our results constitute an advance in research on child abuse as they identify a possible time window of non-normative alteration in mother-child interaction.	2015	natural
Victims more frequently experienced web forms of sexual abuse and engaged in risky sexual behaviors outside of the victimization.	2018	natural
In particular, gaps are noted regarding our understanding of the specific forms of polyvictimization that affect traumatized girls development, especially given the highly disproportionate prevalence of sexual abuse among justice-involved girls.	2018	natural
Ms. Ward also outlines procedures for reporting abuse as well as the type of information marriage and family counselors should report to the court when working with a family under investigation by CPS.	2016	natural
Fifty-one percent (95 CI: 4558) reported past year psychological, physical, or sexual intimate partner abuse.	2018	natural
All adverse social reactions after the sexual abuse, including keeping secrets and a repressive family attitude, were higher among group 1 victims than group 2 victims (p < 0.0001).	2018	natural
Anhedonia, or loss of interest or pleasure in usual activities, is characteristic of depression, some types of anxiety, as well as substance abuse and schizophrenia.	2016	natural
Childhood physical and sexual abuse victims are at increased risk for developing depression, anxiety, and post-traumatic stress disorder (PTSD) in adulthood.	2018	natural
We therefore sought to identify whether childhood sexual abuse was associated with syringe sharing among a sample of IDU in Vancouver, Canada.	2015	natural
After controlling for all forms of maltreatment (unique effects), analyses showed that sexual abuse, physical abuse, neglect or witnessing interparental violence remained statistically associated depending on the sexual risk behavior.	2017	natural
Childhood abuse is a powerful prognostic indicator in adults with major depressive disorder (MDD) and is associated with numerous biological risk factors for depression.	2016	natural
Syringe sharing (Adjusted Odds Ratio = 1.83, 95 Confidence Interval 1.28-2.60) remained independently associated with childhood sexual abuse after adjustment for potential confounders.	2015	natural
Thus, mothers' physical abuse history is a risk factor for relatively poor mental_health, which is itself predictive of both later parenting behavior and children's internalizing problems.	2015	natural
Familiarising researchers and practitioners with different countries' policies for police interviews with children contributes to an exchange of knowledge and strengthens global approaches against child abuse.	2016	natural
Juggalo-identifying youth were more likely to have experienced childhood trauma, including physical and sexual abuse and witnessing community violence.	2016	natural
Sibling verbal and physical abuse has been underrepresented in childhood maltreatment research as a potential contributor to lifetime aggression.	2017	natural
The study involved 114 childless undergraduate students, a group that could represent a potential target group for child abuse prevention efforts.	2017	natural
Interview questions focused on current practice in recognizing and responding to child abuse and neglect presentations, the level of training and experience of participants, and subjective reports of confidence in recognizing abuse.	2017	natural
Finally, in the context of intimate partner violence, findings indicated that perpetrators abuse animals to control, coerce, intimidate, and/or manipulate their victims (this effect is moderated by the victims emotional attachment to their pet).	2017	natural
What is needed is to understand the various challenges, barriers and limitations that face child abuse and neglect researchers and impede methodologically rigorous research within child welfare systems in Australia.	2018	natural
Subtypes, such as emotional maltreatment, sexual abuse, physical abuse, and neglect commonly co-occur and may persist across development.	2018	natural
Caffeine is an active adulterant found in several drugs of abuse including coca paste (CP).	2015	natural
Caregivers and care recipients were separately interviewed and provided information on their demographic characteristics and past year percentages of abuse.	2017	natural
This gambling expansion led the Ohio substance abuse monitoring (OSAM) Network, Ohio's drug abuse surveillance system that collects drug trend data on an ongoing basis, to amend its protocol in June 2011 to include collection of data related to problem and pathological gambling to inform current treatment and prevention needs.	2015	natural
Child maltreatment (CM) in foster care settings (i.e., institutional abuse, IA) is known to have negative effects on adult survivors mental_health.	2018	natural
Specifically, physical abuse and sexual abuse were related to higher levels of severity of addiction.	2015	natural
Computer-assisted interviews were used to collect self-reported sexual practices and experiences of physical and psychological abuse at both time points.	2015	natural
The results of this study represent an important step toward establishing lifetime health risks posed by adolescent dating abuse.	2016	natural
Women with intellectual/developmental disabilities in conflict with the law experience childhood trauma, substance abuse and intimate partner violence but continue to have difficulty accessing appropriate therapeutic services, both within correctional settings and upon discharge.	2017	natural
These findings suggest a potential pathway by which child abuse leads to hypertension.	2016	natural
Sexual abuse predicted later onset of Post-traumatic Stress Disorder.	2016	natural
We used two-sample t tests to examine associations of abuse with resting systolic blood pressure (SBP) and diastolic blood pressure (DBP) and blood pressure reactivity to the Trier Social Stress Test and a frustration task.	2016	natural
This research documents the existence, content, and strength of stereotypes that link race and social class to child abuse.	2018	natural
This study investigated the rates of multiple childhood abuses (physical, sexual, and emotional abuse) and multiple street victimizations (robbery, physical assault, and sexual assault) and examined their relative relationships to mental_health outcomes (meeting Diagnostic and Statistical Manual of Mental Disorders, Fourth Edition, Text Revision, criteria for post-traumatic stress disorder [PTSD], depression, and substance use disorder) among a large (N = 601) multisite sample of homeless youth.	2015	natural
Several drugs of abuse, including alcohol and cocaine, alter glutamate transport (GluT).	2015	natural
The picture set includes theoretically-derived attachment scenes, such as separation, death, threat and potential abuse.	2016	natural
A major limitation is the uneven distribution of emotional abuse scores between the controls and GAD patients, with GAD patients reporting higher scores.	2016	natural
First, it is important to note that not all victims disclose their abuse, and thus, not all victims are subject to conversational influences.	2015	natural
Using a convenience sample of 502 adolescents and youths ages 13-23 years from five public and three private senior secondary schools in Nigeria, the study examined associations of gender and physical abuse by parents with anxiety disorders as well as associations of physical abuse by parents and/or teachers with depression in the sample, 39.6 of whom had experienced physical abuse at home and in school.	2015	natural
Presenting disabled womens reflections of childhood violence, help-seeking and responses to disclosure, this article seeks to raise an awareness of violence towards disabled girls and the need for these to be recognised as a serious child protection issue to be included in official definitions of child abuse.	2016	natural
Moreover, physical abuse has a negative impact on the protective nature of strong peer connections.	2015	natural
Although sexual abuse of minors by representatives of the RCC was a structural problem during a period that the Church was highly influential in the Netherlands, the estimated prevalence of the phenomenon is only a fraction of the prevalence rate of non-familial CSA.	2015	natural
Most parents and caregivers (63) reported alleged sexual abuse within 24 hours; 57 obtained medical help within 12 hours of abuse.	2015	natural
Frequency tabulations, bivariate analysis, and logistic regression were performed to describe the prevalence and source of abuse and to determine the association between levels of violence and sexual demographics and mental_health variables.	2015	natural
Emerging evidence of new trends contributing to ARNCs include ready mixed alcohol drinks and childhood trauma and abuse.	2016	natural
While asking about previous suicide attempts is the most accurate way to predict suicidal behavior, age of onset, past abuse, and overuse of alcohol may also be helpful.	2017	natural
The lives of female sex workers (FSW) in the US are typically marked by substance abuse, violence, trauma, and poverty.	2015	natural
He concludes there was no witch-hunt epidemic, finding substantial evidence of sexual abuse in nearly every case he reviewed, contradicting the assertions made about those cases by what he calls the witch-hunt narrative.	2017	natural
Violence against Women (VaW) has come to be recognized as a serious human rights abuse with important consequences not only for women but for whole societies.	2017	natural
Mothers' concerns about their children have been shown to impact their decision making related to abuse, but researchers have not closely explored what happens during mothers' interactions with help sources.	2015	natural
To address this knowledge gap, this secondary data analysis uses data from the 2012 National Child Abuse and Neglect Data System Child File to examine a sample of children reported to the CWS ( =2,401,304) and subsample of children involved in CSA reports ( =179,199).	2016	natural
We predicted and found that the interaction between PBJW and social identification predicted legitimization of wife abuse.	2015	natural
The results suggest social conceptualizations of disability and deafness are important to consider in the context of violence and abuse.	2017	natural
This essay is a response to Jindras review (2017) of Psychology and Spiritual Transformation in a Substance Abuse Program: The Lazarus Project (Williamson and Hood 2016).	2018	natural
Further, some potentially important predictors of parental support remain unexplored, including child-reported abuse stressors (e.g., family conflict, nonsupportive disclosure responses).	2018	natural
As predicted, greater physical abuse was associated with worse EF performance and worse EF was associated with less efficacy in obtaining resources 1 year later.	2017	natural
This study's objective was to assess the value of a certification of normalcy for parents whose children had/didn't have abuse evaluations.	2018	natural
This study provides valuable information to be applied to the substance abuse screening process in elderly men and women.	2015	natural
In men, the DAT1 polymorphism was associated with having experienced sexual abuse in childhood, such that men with the 9R9R genotype reported less sexual abuse experiences than men with the 9R10R or the 10R10R genotypes.	2016	natural
Elder abuse is a common phenomenon with potentially devastating consequences for older adults.	2016	natural
Overall, the 1-year prevalence of sexual abuse was 12.4 (95 confidence interval [CI]: [9.8, 14.9]) and the lifetime prevalence was 14.2 (95 CI: [11.5, 16.9]).	2016	natural
Al-Anon self-help group is the sole source of assistance for families whose members suffer from alcohol abuse problems in Iran.	2015	natural
Girls who experienced sexual abuse were more likely to be obese (OR: 2.6; 95 CI: 1.1-6.4) and demonstrate extreme weight loss behaviors (EWLB) (OR: 2.2; 95 CI: 1.0-4.7).	2016	natural
The main aim of this study was to examine the effect of a potential guardian on the severity of child sexual abuse.	2015	natural
The present study looked at child sexual abuse (CSA) from the perpetrators perspective, focusing on precursors to, sustaining mechanisms, and inhibitors of CSA.	2018	natural
Each client was assigned a case manager, who arranged meetings with mental_health, substance abuse, and medical care professionals.	2016	natural
The samples attending our department were divided into two groups: group 1 comprised victims who recanted their first abuse disclosure, and group 2 comprised victims who insisted on the veracity of their first report at further evaluations.	2018	natural
The association between substance abuse and parenting may result, in part, from parents' emotional disengagement from the parent-child relationship, which makes perceiving and responding to children's cues more challenging.	2016	natural
Sexual and physical abuse in childhood are associated with suicidal ideas throughout the lifespan, so screening for suicidal ideas in younger and older people should be routine and vigorous, and cover experiences in early life: management may require appropriate psychological interventions.	2015	natural
Thus, while SBIRT interventions for substance abuse in Emergency Departments may be appealing from a clinical perspective, evidence from this economic study suggests resources could be better utilized supporting other health interventions.	2017	natural
The influence of parental abuse and neglect on childrens school adjustments was discussed in terms of emotional/behavioral problems and academic competence considering unique Korean cultural context.	2017	natural
The study sample consisted of 85 clients (aged 815) of a service specifically for children reported to child protection due to child abuse and neglect.	2015	natural
These findings can inform clinical interventions as they reinforce the importance of including abuse history in the conceptualizations and treatment of self-harm.	2015	natural
The highest correlated parent or caregiver instability variables to juvenile sex offending status were multiple relocations or homelessness, children placed out of the home, slapping or punching in the home, and sexual abuse victimization.	2015	natural
Thematic analysis of the data revealed that caregivers experienced multiple forms of emotional, psychological, and situational difficulties following the disclosure of child sexual abuse.	2015	natural
When sexual abuse was not experienced, neglect was associated with a higher number of sexual partners (interactive effects).	2017	natural
Six distinct themes of turning points are identified: (a) facing the threat of severe violence; (b) changing their perspective about the relationship, abuse, and/or their partner; (c) learning about the dynamics of abuse; (d) experiencing an intervention from external sources or consequences; (e) realizing the impact of the violence on children; and (f) the relationship being terminated by the abuser or some other cause.	2015	natural
Using data from the National Longitudinal Study of Adolescent to Adult Health (Add Health), results show that child physical and sexual abuse and neglect are predictors of weakened social bonds and increased delinquency during later adolescence.	2016	natural
Childhood abuse has been consistently linked with borderline personality disorder (BPD) and recent studies suggest that some forms of childhood abuse might be uniquely related to both BPD and BPD features.	2015	natural
Sadly, cases of sexual abuse in early childhood education and care (ECEC) settings have ignited fear and uncertainty among stakeholders in regards to what kind of touch and how much love is appropriate to feel for children in ECEC.	2018	natural
