The high stability of eating disorder symptoms and the significant association with overweight and worse mental_health in adulthood underscore the need for early detection and intervention during childhood and adolescence.	2015	natural
Neuropsychology input in youth mental_health services is useful from both a diagnostic and treatment planning perspective and often results in alterations in the therapeutic approach of case managers.	2016	natural
Implications are discussed for clinical practice with LGB persons, and the integration of personality, coping and mental_health theory and research.	2016	natural
Findings revealed substantially higher levels of mental_health symptoms (p < .001) and risk behaviors (p = .001) among 1.5 and second-generation migrant adolescents compared with native-born adolescents, with no significant differences between 1.5 generation and second-generation migrants.	2016	natural
The present study examined the relation between retrospectively reported parental emotion socialization practices and emerging adults mental_health across four ethnic groups.	2015	natural
Lonelier young adults were, as children, more likely to have had mental_health difficulties and to have experienced bullying and social isolation.	2018	natural
MI is a promising intervention to facilitate engagement in adolescent mental_health settings.	2016	natural
We measured commitment to work, job-search effort, professional/technical skills, 'soft' skills (e.g. teamwork, decision-making, communication), optimism about getting ahead, and mental_health and substance use disorders at age 18.	2016	natural
To address the mental_health needs of students, UK universities offer bespoke student counselling services.	2015	natural
This is particularly relevant in mental_health care, where concepts of healing, well-being, and wellness come to fore.	2018	natural
Although research and policymakers support the integration of mental_health services into the schools, there is limited agreement on the ways to package or combine existing supports to achieve prevention-oriented goals.	2015	natural
We used Structural Equation Modelling to substantiate initial latent class analysis findings by investigating a range of mental_health diagnoses.	2018	natural
The relationship between positive mental_health and well-being was examined in 604 North Indian high school and secondary high school going children aged 1118years.	2015	natural
Findings suggest that benefit finding is associated with internalizing mental_health symptoms, pain outcomes, and quality of life in youth with chronic pain.	2017	natural
There is also increasing recognition that a woman's partner can play a vital role in relation to her perinatal mental_health and should be supported and involved in decisions about her care.	2017	natural
The aims of this study were to describe the characteristics of offenders and victims; determine the prevalence of mental_disorder and contact with mental_health services and examine adverse events prior to the offence.	2016	natural
It is thus essential to prepare the national mental_health workforce to provide the best care possible.	2015	natural
We analyze a nationally representative sample of Canadian workers (Canadian Work, Stress, and Health study; N = 3,900) linked to census data and test whether regional unemployment influences the mental_health consequences of job insecurity.	2017	natural
Findings contribute to reconceptualizations of resilience from Mapuche perspectives while identifying culturally meaningful strategies for promoting racial justice and mental_health equity.	2018	natural
The purpose of this meta-analysis was to examine the specific effects of and moderators contributing to school-based mindfulness interventions for mental_health in youth.	2017	natural
Average annual expenditures and use of mental_health, substance abuse and criminal justice services over a 3-year period were determined.	2015	natural
Participants were identified through a statewide mental_health screening project that took place in detention centers across 11 different counties in a Midwestern state during January 1, 2008, to May 10, 2010.	2015	natural
This was a 2 2 factorial cluster randomized controlled trial, in which 846 schools in England were randomly allocated to receive/not receive: booklets for students containing information on mental_health self-management and help seeking, and funding for mental_health support as part of a national mental_health initiative.	2016	natural
These findings have implications for maternal mental_health treatment during pregnancy, which likely affects maternal-fetal programming and may favorably affect perinatal outcomes in the vulnerable Mexican-American population.	2015	natural
Diagnostic sophistication among mental_health professionals, increased availability of psychotherapy services, and economic pressures combine to cause the public to expect cost-effective, successful, and shorter duration of treatments.	2018	natural
Senior housing might partially counter risks such as low mental_health, emerging from life-course disadvantage.	2017	natural
This article outlines steps and challenges in making metaphorical approaches to psychosis much more common than they are currently today, especially in the public mental_health sector.	2018	natural
The general agreement between questionnaire responses and interview accounts appears to be good, and the students emphasized mainly positive emotions and good mental_health.	2017	natural
The subtypes differed on the descriptive dimensions general criminality, substance use, and mental_health problems.	2015	natural
A cross-national (Haiti-United States) expert mental_health team has been overseeing the program.	2016	natural
Barriers to progress in the field are poor access to highquality care; limited mental_health workforce; and few providers trained in the delivery of evidencebased treatments (EBTs).	2017	natural
These results suggest that profiles of mental_health competence and difficulties are a salient factor as children begin school, and illustrate the importance of recognising both competence and difficulties when considering the mental_health of young children.	2018	natural
The article in turn examines Bechdel's work from the perspective of cultural representations of psychotherapy, development of gender identity and expression, and considers the implications of her work for the mental_health practitioner caring for LGBT individuals.	2015	natural
The hospitalisation of a sick newborn can have negative and positive effects on parents mental_health.	2016	natural
In particular, volunteers without a specific professional profile, psychiatrists, medical doctors, and less markedly counselors seemed to protect their mental_health through a SOC.	2015	natural
Such research may inform pertinent prevention efforts, including interventions that improve sleep, enhance resilience, and protect against incident mental_health diagnoses.	2018	natural
We use data from the German Socioeconomic Panel and the National Longitudinal Survey of Youth to examine hours effects on mental_health score at midlife.	2015	natural
Quantitative analysis revealed differences between teacher, parent, and adolescent selfratings, with teachers identifying a higher proportion of refugee students with mental_health problems than parents or adolescents.	2017	natural
These findings are encouraging and suggest that interventions designed to enhance self-compassion and decrease self-criticism can be delivered to broader populations without the direct contact with mental_health professionals.	2018	natural
Our findings revealed that more than one in three parents of court-involved adolescents are currently experiencing significant mental_health symptoms.	2017	natural
General marital quality, nonviolent parent conflict, and physical intimate partner violence independently predicted mental_health.	2016	natural
Thirty-eight therapists and 107 clients from four mental_health clinics in Israel participated in the study.	2015	natural
Maternal mental_health problems can negatively impact children's physiological stress regulation.	2015	natural
This article provides an overview of the special issue on international approaches to school-based mental_health.	2017	natural
Multivariate analyses revealed that specific traumatic experiences prior to homelessness, including sexual abuse, emotional abuse/neglect, and adverse home environment, predicted greater mental_health symptoms.	2016	natural
Highly perceived levels of social support seem to play a crucial role in mental_health, but this inference may be weakened by a possible interference of a lasting competence in looking for social support versus social influences.	2015	natural
Our results indicate that a positive psychology course may be one way to improve students mental_health.	2016	natural
This article examines the Islamic concept of Sufism, tasawwuf, and how concepts such as dhikr (recitation) and knowing ones self can be overlayed to psychological principles of mindfulness and self-efficacyshowcasing the intersection of spirituality and mental_health.	2018	natural
Using hierarchical multiple regression a significant model emerged indicating that the three selves model is predictive of mental_health in adolescents.	2018	natural
We also found that reactive and proactive aggression partially mediated the association between maltreatment and mental_health problems.	2015	natural
Attitudes to aging have been investigated in non-carer populations and found to have important relationships with physical and mental_health.	2015	natural
We examine whether behavioral, mental_health, and physical health characteristics of children with autism are associated with baseline and change in health-related quality of life.	2017	natural
Implications for college administrators and mental_health professionals are discussed.	2015	natural
Anxiety disorders are among the earliest emerging disorders and most common mental_health problem across the lifespan.	2016	natural
This raises the problem of how to increase the cultural awareness of mental_health professionals dealing with the mental_health needs of the immigrant population.	2015	natural
Results are discussed in details with implications for future research and suggestions for mental_health practitioners.	2015	natural
Social skills explained a significant proportion of the variance in mental_health scores across the sample.	2015	natural
The current study sought to clarify the impact of underemployment longitudinally, assessing mental_health 5 times over 8 months after job loss.	2015	natural
These results reveal that approach-avoidance commitment was associated with mental_health via emotional experiences in romantic relationships, and verified Johnson's (1999) and Levinger's (1999) theoretical argument.	2016	natural
We discussed these findings in relation to the strong motivation among unaccompanied minors to create better lives for themselves than they could have in the countries they fled from, irrespective of their traumatic experiences and mental_health problems.	2017	natural
We sought to describe a conceptual framework underlying the beneficial mental_health effects of storytelling, and present formative work developing a storytelling intervention to reduce distress for recently bereaved surrogates.	2015	natural
Substantial levels of mental_health need were identified.	2018	natural
In sum, self-reported discrimination appeared to adversely impact the mental_health of AIs.	2016	natural
Outcome measures, including dyadic mediators (self-efficacy), dyadic appraisal (Cancer Related Communication Problem, CRCP), dyadic coping (Dyadic Coping Inventory, DCI), and dyadic outcomes (physical and mental_health, negative and positive emotions, and marital satisfaction), were assessed at T0 (pre-intervention) and T1 (post-intervention).	2015	natural
We here present an overview of prospective studies that have reported a relationship between parental stress and the morbidity or course of childhood asthma and discuss the role of parental mental_health in its prevention and treatment.	2015	natural
Research in children's mental_health has suggested that emotional and behavioral problems in are inextricably tied to academic difficulties.	2015	natural
PA is inversely related to sadness and suicidality in adolescents, highlighting the relationship between PA and mental_health in children, and potentially implicating PA as a salient option in the response to bullying in schools.	2015	natural
Our results underscore the importance of psychiatric disorders as a prevalent condition in early adolescence, which has a direct impact on the planning of public policies and specific mental_health care services in this age group.	2018	natural
Accommodations were reported by individuals with serious mental_health disabilities who became employed.	2015	natural
History of mental_health problems predicted condom-use barriers, mediated by recent depression and relationship power (0.15, p < 0.001).	2016	natural
Studies have shown that stopping smoking can improve mental_health function, as well as improve outcomes for substance use disorders.	2017	natural
Based on complex trauma theory, the current study investigated: a) the effect of CSA on mental_health outcomes (depressive symptoms, somatic symptom severity, hostility) in late life for men, and b) the moderating effects of childhood adversities and masculine norms in the relationship between CSA and the three mental_health outcomes.	2016	natural
Veterans who used intensive tobacco cessation counseling services were more likely to be homeless, had comorbid mental_health and substance use disorders, and used more VHA services overall than veterans who did not use tobacco cessation services.	2016	natural
Native Americans were among the racial/ethnic groups with lowest treatment utilization, but also among the highest for rates of suicide attempts, highlighting the pressing need for strategies to increase mental_health service use in this particularly vulnerable population.	2016	natural
More posttraumatic stress predicted lower mental_health quality of life, whereas more posttraumatic growth predicted better physical health quality of life and longer survival.	2017	natural
Specifically, as support for children's psychological autonomy increased, so did children's mental_health functioning, but only for those that experienced low to moderate levels of parental monitoring.	2018	natural
Findings revealed that spirituality was closely related to a number of positive outcomes following TBI including psychological coping, physical health, mental_health, productivity, life satisfaction, functional independence and posttraumatic growth.	2018	natural
It is crucial for people to have an immediate link to communitybased mental_health services (CMHSs) after psychiatric crisis.	2017	natural
The negative impact of discrimination on mental_health among lesbian, gay, and bisexual populations has been well documented.	2016	natural
Growth mixture models analysed participants' responses on measures of mental_health and wellbeing for up to 16 years from death.	2015	natural
The positive impact of short-term psychoanalytic psychotherapy highlights the importance of caring for the mental_health of children with physical impairments.	2016	natural
Physical activity promotes better health outcomes across the lifespan, and provides physical and mental_health benefits for women who have recently given birth.	2018	natural
This has been associated with treatment outcome and attitudes towards mental_health problems.	2016	natural
The study is aimed at describing correlates associated with dependence and with treatment for substance use among people with SMI and comorbid substance disorders cared in community mental_health teams (CMHTs).	2015	natural
Results suggest that there is some incongruence with previous research on personality's relationship to stigma, personality does not act as an additive component in the prediction of the relationship between stigma and treatment seeking, and stigma is related only to the perceived need for mental_health treatment but not to an individual's openness to seek that treatment.	2016	natural
Results showed significant overall pre-post effect of an RC on marital functioning (Hedge's g = 0.20) and individual mental_health (g = 0.44).	2016	natural
Specifically, for men, we found a direct pathway from early low SES to drug use in mid adulthood and an indirect pathway to psychological distress through first-grade maladaptation and adolescent poor mental_health.	2016	natural
Recognition of the crucial role of parents in policy and practice can help protect the mental_health of children and families in their refugee journey.	2018	natural
The present prospective longitudinal study (N = 160; 55 males, 105 females) examined shyness trajectories from childhood to the fourth decade of life and mental_health outcomes.	2017	natural
Both bipolar disorder and borderline personality disorder (BPD) are serious mental_health disorders resulting in significant psychosocial morbidity, reduced health-related quality of life, and excess mortality.	2016	natural
This study indicates that the risk factors for offending commonly found in the general criminological literature are also those associated with offending in young people with mental_health problems.	2015	natural
Cognitive fusion has been related to the development and maintenance of a series of mental_health difficulties.	2016	natural
We describe a tri-phasic approach to adapt DBT in Nepal that consists of qualitative interviews with major Nepali mental_health stakeholders (Study, an adaptation workshop with 15 Nepali counselors (Study, and a small-scale treatment pilot with eligible clients in one rural district (Study.	2017	natural
Specifically, higher levels of attachment anxiety, or the combination of attachment anxiety and mental_health concerns, predicted greater levels of self-stigma, which in turn predicted weaker intentions to seek counseling.	2015	natural
In the group that experienced less damage, working >100 h of overtime per month (adjusted odds ratio [OR], 2.06; 95 confidence interval [CI], 1.11-3.82) and poor workplace communication (adjusted OR, 10.96; 95 CI, 6.63-18.09) increased the risk of mental_health distress.	2015	natural
To obtain a child's perspective during a mental_health assessment, he or she is usually interviewed.	2016	natural
Third, psychosocial factors were categorized into four domains: substance use disorder; mental_health (depression, PTSD); psychological abuse (emotional abuse, pregnancy coercion); and violence (physical abuse, sexual abuse) and included as independent associations with each outcome to assess their relative importance.	2018	natural
Students with high use reported poorer health outcomes across numerous areas including mental_health, physical health, risk behaviors, and access to health care.	2018	natural
Results provide a current demonstration of FFT's effectiveness for youth with behavior problems in community-based settings, expand our understanding of the range of positive outcomes of FFT to include mental_health risk and family-defined problem severity and impact, and suggests that it is an effective intervention when implemented in an Irish context.	2016	natural
However, no variable could explain comprehensively, why students of SSHIs have more mental_health problems than mainstream pupils.	2015	natural
Despite bisexual individuals being at increased risk for mental_health and substance use problems, clinicians ability to provide affirmative and competent care to bisexual clients is limited by their lack of bisexual-specific training.	2017	natural
Twenty-five different articles demonstrated the clinical potential of this technology in both the diagnosis and the treatment of mental_health disorders: VR compares favorably to existing treatments in anxiety disorders, eating and weight disorders, and pain management, with long-term effects that generalize to the real world.	2018	natural
Using multiple regression, results indicated that the amount of childhood victimization was a significant predictor of health problems in adulthood, controlling for the significant negative effects of health risk behaviors and mental_health problems on physical health.	2015	natural
Self-administered surveys and electronic VA databases were utilized to examine mental_health treatment retention across racial/ethnic groups in the 6 months following the PTSD diagnosis controlling for treatment need, access factors, age, gender, treatment beliefs, and facility factors.	2015	natural
Numerous studies have found that both personality and the coping strategies used in response to stress play important roles in the development of mental_health problems, particularly adjustment disorder (AD), which is characterised by the onset of different emotional symptoms or behaviour in response to an identifiable stressor.	2015	natural
These findings highlight relationships between childhood abuse and adulthood factors and the mental_health of mothers involved in the criminal justice system, with implications for theory, practice, and research.	2018	natural
We examine associations between childhood sexual abuse (CSA) and substance abuse, the role of mental_health indicators as mediators in these associations and whether or not associations differ by gender.	2016	natural
This is the first metameta-analysis examining the effects of parent-based interventions for children with externalizing behavior problems on parental characteristics (parenting, parental perceptions, parental mental_health, parental relationship quality).	2018	natural
Questions were asked about mental_health, perceived need for support, barriers to accessing mental_health care, and preferences for support.	2018	natural
With adequate training and support, home visitors are wellpositioned to promote access to mental_health services in vulnerable families to support infant mental_health.	2017	natural
Strategies aimed at increasing awareness of the impact of activity restriction and encouraging parents and carers to find ways to maintain essential activity may reduce stress, improving mental_health and well-being in parents and carers.	2017	natural
It is recommended that mental_health services employ the use of dynamic measures when making short-term risk-of-violence predictions for civil and/or forensic inpatients.	2016	natural
Families ( =215) showed significant improvement in all eight family functioning factors over the course of their participation in mental_health home visiting services.	2016	natural
A number of themes related to the experience of stigma in the public life of relatives of people with schizophrenia were elicited in relation to: mental_health care (difficulties in contacting mental_health professionals; in getting appropriate information; lack of alternatives to hospital treatment; absence of appropriate long-term care services); employment of people living with schizophrenia and contact with the police.	2017	natural
Conclusions are made about the bromances potential to improve mens mental_health and social well-being because participants indicate these relationships provide a space for emotional disclosure and the discussion of potentially traumatic and sensitive issues.	2017	natural
Further, a moderate-risk group was found, with slightly above average psychopathy traits and average levels of mental_health problems.	2017	natural
The current study examines the psychometric properties of the Evidence-Based Practice Attitude Scale (EBPAS), an instrument originally designed for mental_health professionals, to measure correctional employees readiness to implement EBPs.	2017	natural
Results prove generally consistent with these propositions, including a direct link from cortisol to mental_health problems.	2015	natural
Participants reporting any mental_health disorder were more likely to report a history of sexual assault (AOR = 2.45, 95 CI = 1.75-3.43) and to have used case management services (AOR = 1.63, 95CI = 1.17-2.27).	2016	natural
This qualitative study used focus groups to evaluate stakeholders' perceptions of organizational factors affecting implementation of an adapted version of Mindfulness-Based Stress Reduction (MBSR) for staff on adolescent mental_health units.	2015	natural
Developmental delay, mental_health, and neurology conditions had the strongest associations (ORs 2.023.3).	2017	natural
Rates of endorsement to items on the Postdeployment Health Reassessment were examined and compared, as were rates of mental_health diagnoses from AFSMs official medical records.	2016	natural
Research on young people's conceptualizations informs both clinical practice and mental_health literacy interventions.	2017	natural
The paper closes with some critical reflections on the role of exercise-based interventions as a means of helping veterans improve their mental_health.	2017	natural
This study aimed to explore adolescent males' perspectives on sport as a context for supporting mental_health.	2018	natural
This review highlights the dearth of evidence about the impact of forced migration on the mental_health of older adults.	2016	natural
Policy makers must address Troublesrelated mental_health effects, in terms of how they carry forward into aging, and consider ways of improving engagement with services and treatments.	2017	natural
We aimed to synthesize the available evidence on the impact of natural disasters on the mental_health and psychological distress experienced by older adults.	2016	natural
Pain-related beliefs were related with poorer mental_health (Disability = -.27; Harm = -.23; Solicitude = -.24; Control = .18; Emotion = -.29) and greater interference in daily activities (Disability =.41; Harm =.13; Solicitude =.29; Control = -.31).	2015	natural
