Anxiety disorders are among the earliest emerging disorders and most common mental_health problem across the lifespan.	2016	natural
This raises the problem of how to increase the cultural awareness of mental_health professionals dealing with the mental_health needs of the immigrant population.	2015	natural
Results are discussed in details with implications for future research and suggestions for mental_health practitioners.	2015	natural
Social skills explained a significant proportion of the variance in mental_health scores across the sample.	2015	natural
The findings are discussed in relation to prior research on the unique association between social support and mental_health among African Americans.	2016	natural
Poor general health and learning disability among children and poor parental mental_health were also associated with exclusion.	2017	natural
This study characterised mental_health, motivation, and their interrelations among 38 elite student-athletes over a 13-week season, while monitoring and considering the influence of their athletic and academic schedules.	2018	natural
The current study sought to clarify the impact of underemployment longitudinally, assessing mental_health 5 times over 8 months after job loss.	2015	natural
Health care use is defined as 1 general or mental_health care contact for mental_health problems.	2017	natural
These results reveal that approach-avoidance commitment was associated with mental_health via emotional experiences in romantic relationships, and verified Johnson's (1999) and Levinger's (1999) theoretical argument.	2016	natural
We discussed these findings in relation to the strong motivation among unaccompanied minors to create better lives for themselves than they could have in the countries they fled from, irrespective of their traumatic experiences and mental_health problems.	2017	natural
We sought to describe a conceptual framework underlying the beneficial mental_health effects of storytelling, and present formative work developing a storytelling intervention to reduce distress for recently bereaved surrogates.	2015	natural
Substantial levels of mental_health need were identified.	2018	natural
In sum, self-reported discrimination appeared to adversely impact the mental_health of AIs.	2016	natural
Outcome measures, including dyadic mediators (self-efficacy), dyadic appraisal (Cancer Related Communication Problem, CRCP), dyadic coping (Dyadic Coping Inventory, DCI), and dyadic outcomes (physical and mental_health, negative and positive emotions, and marital satisfaction), were assessed at T0 (pre-intervention) and T1 (post-intervention).	2015	natural
We here present an overview of prospective studies that have reported a relationship between parental stress and the morbidity or course of childhood asthma and discuss the role of parental mental_health in its prevention and treatment.	2015	natural
Research in children's mental_health has suggested that emotional and behavioral problems in are inextricably tied to academic difficulties.	2015	natural
PA is inversely related to sadness and suicidality in adolescents, highlighting the relationship between PA and mental_health in children, and potentially implicating PA as a salient option in the response to bullying in schools.	2015	natural
Our results underscore the importance of psychiatric disorders as a prevalent condition in early adolescence, which has a direct impact on the planning of public policies and specific mental_health care services in this age group.	2018	natural
Accommodations were reported by individuals with serious mental_health disabilities who became employed.	2015	natural
History of mental_health problems predicted condom-use barriers, mediated by recent depression and relationship power (0.15, p < 0.001).	2016	natural
Studies have shown that stopping smoking can improve mental_health function, as well as improve outcomes for substance use disorders.	2017	natural
Based on complex trauma theory, the current study investigated: a) the effect of CSA on mental_health outcomes (depressive symptoms, somatic symptom severity, hostility) in late life for men, and b) the moderating effects of childhood adversities and masculine norms in the relationship between CSA and the three mental_health outcomes.	2016	natural
Veterans who used intensive tobacco cessation counseling services were more likely to be homeless, had comorbid mental_health and substance use disorders, and used more VHA services overall than veterans who did not use tobacco cessation services.	2016	natural
Native Americans were among the racial/ethnic groups with lowest treatment utilization, but also among the highest for rates of suicide attempts, highlighting the pressing need for strategies to increase mental_health service use in this particularly vulnerable population.	2016	natural
More posttraumatic stress predicted lower mental_health quality of life, whereas more posttraumatic growth predicted better physical health quality of life and longer survival.	2017	natural
Physical activity (PA) interventions have a clear role in promoting mental_health.	2016	natural
Teachers have been shown to have high levels of stress and common mental_disorder, but few studies have examined which factors within the school environment are associated with poor teacher mental_health.	2016	natural
Central to improving the provision of mental_health services, furthering our knowledge of these views is important.	2016	natural
Specifically, as support for children's psychological autonomy increased, so did children's mental_health functioning, but only for those that experienced low to moderate levels of parental monitoring.	2018	natural
Findings revealed that spirituality was closely related to a number of positive outcomes following TBI including psychological coping, physical health, mental_health, productivity, life satisfaction, functional independence and posttraumatic growth.	2018	natural
It is crucial for people to have an immediate link to communitybased mental_health services (CMHSs) after psychiatric crisis.	2017	natural
Logistic regression and generalized estimating equations were used to examine the relationship between atopy at ages 1-5 years [using parent report and objective biological confirmation (sera IgE)], and the range of internalizing and externalizing mental_health problems at ages 5-17 years.	2016	natural
The negative impact of discrimination on mental_health among lesbian, gay, and bisexual populations has been well documented.	2016	natural
Growth mixture models analysed participants' responses on measures of mental_health and wellbeing for up to 16 years from death.	2015	natural
From the qualitative data analysis, five overarching themes have emerged: positive experience of being participants in the program; lack of knowledge on school mental_health issues; enriched understanding and new learning; expansion of SMHP to other schools; suggestions for prospective SMHP.	2016	natural
The positive impact of short-term psychoanalytic psychotherapy highlights the importance of caring for the mental_health of children with physical impairments.	2016	natural
Physical activity promotes better health outcomes across the lifespan, and provides physical and mental_health benefits for women who have recently given birth.	2018	natural
This has been associated with treatment outcome and attitudes towards mental_health problems.	2016	natural
This study makes an important contribution in building evidence toward effective interventions to advance the mental_health and wellbeing of those affected by the Syrian crisis.	2018	natural
The study is aimed at describing correlates associated with dependence and with treatment for substance use among people with SMI and comorbid substance disorders cared in community mental_health teams (CMHTs).	2015	natural
An online survey was administered in May 2009 to assess depressive symptoms using the Depression Anxiety Stress Scale (dependent variable) and a broad range of independent variables including students' demographic, study, psychosocial, and mental_health characteristics.	2016	natural
Results suggest that there is some incongruence with previous research on personality's relationship to stigma, personality does not act as an additive component in the prediction of the relationship between stigma and treatment seeking, and stigma is related only to the perceived need for mental_health treatment but not to an individual's openness to seek that treatment.	2016	natural
Results showed significant overall pre-post effect of an RC on marital functioning (Hedge's g = 0.20) and individual mental_health (g = 0.44).	2016	natural
To document the prevalence and characteristics of nonfearful panic attacks (NFPA) and their consequences on panic identification and access to mental_health services in patients with noncardiac chest pain.	2015	natural
Specifically, for men, we found a direct pathway from early low SES to drug use in mid adulthood and an indirect pathway to psychological distress through first-grade maladaptation and adolescent poor mental_health.	2016	natural
Recognition of the crucial role of parents in policy and practice can help protect the mental_health of children and families in their refugee journey.	2018	natural
The present prospective longitudinal study (N = 160; 55 males, 105 females) examined shyness trajectories from childhood to the fourth decade of life and mental_health outcomes.	2017	natural
Both bipolar disorder and borderline personality disorder (BPD) are serious mental_health disorders resulting in significant psychosocial morbidity, reduced health-related quality of life, and excess mortality.	2016	natural
This study indicates that the risk factors for offending commonly found in the general criminological literature are also those associated with offending in young people with mental_health problems.	2015	natural
Cognitive fusion has been related to the development and maintenance of a series of mental_health difficulties.	2016	natural
We describe a tri-phasic approach to adapt DBT in Nepal that consists of qualitative interviews with major Nepali mental_health stakeholders (Study, an adaptation workshop with 15 Nepali counselors (Study, and a small-scale treatment pilot with eligible clients in one rural district (Study.	2017	natural
Specifically, higher levels of attachment anxiety, or the combination of attachment anxiety and mental_health concerns, predicted greater levels of self-stigma, which in turn predicted weaker intentions to seek counseling.	2015	natural
In the group that experienced less damage, working >100 h of overtime per month (adjusted odds ratio [OR], 2.06; 95 confidence interval [CI], 1.11-3.82) and poor workplace communication (adjusted OR, 10.96; 95 CI, 6.63-18.09) increased the risk of mental_health distress.	2015	natural
To obtain a child's perspective during a mental_health assessment, he or she is usually interviewed.	2016	natural
Third, psychosocial factors were categorized into four domains: substance use disorder; mental_health (depression, PTSD); psychological abuse (emotional abuse, pregnancy coercion); and violence (physical abuse, sexual abuse) and included as independent associations with each outcome to assess their relative importance.	2018	natural
Students with high use reported poorer health outcomes across numerous areas including mental_health, physical health, risk behaviors, and access to health care.	2018	natural
Results provide a current demonstration of FFT's effectiveness for youth with behavior problems in community-based settings, expand our understanding of the range of positive outcomes of FFT to include mental_health risk and family-defined problem severity and impact, and suggests that it is an effective intervention when implemented in an Irish context.	2016	natural
However, no variable could explain comprehensively, why students of SSHIs have more mental_health problems than mainstream pupils.	2015	natural
Despite bisexual individuals being at increased risk for mental_health and substance use problems, clinicians ability to provide affirmative and competent care to bisexual clients is limited by their lack of bisexual-specific training.	2017	natural
We used multilevel modeling to estimate program effects on 13 parentreported outcomes, including parenting practices, children's mental_health, and parental mental_health.	2017	natural
Twenty-five different articles demonstrated the clinical potential of this technology in both the diagnosis and the treatment of mental_health disorders: VR compares favorably to existing treatments in anxiety disorders, eating and weight disorders, and pain management, with long-term effects that generalize to the real world.	2018	natural
Using multiple regression, results indicated that the amount of childhood victimization was a significant predictor of health problems in adulthood, controlling for the significant negative effects of health risk behaviors and mental_health problems on physical health.	2015	natural
Participants were assessed via measures of identity conflict, mental_health, and coping strategies.	2017	natural
Self-administered surveys and electronic VA databases were utilized to examine mental_health treatment retention across racial/ethnic groups in the 6 months following the PTSD diagnosis controlling for treatment need, access factors, age, gender, treatment beliefs, and facility factors.	2015	natural
Numerous studies have found that both personality and the coping strategies used in response to stress play important roles in the development of mental_health problems, particularly adjustment disorder (AD), which is characterised by the onset of different emotional symptoms or behaviour in response to an identifiable stressor.	2015	natural
These findings highlight relationships between childhood abuse and adulthood factors and the mental_health of mothers involved in the criminal justice system, with implications for theory, practice, and research.	2018	natural
We examine associations between childhood sexual abuse (CSA) and substance abuse, the role of mental_health indicators as mediators in these associations and whether or not associations differ by gender.	2016	natural
This is the first metameta-analysis examining the effects of parent-based interventions for children with externalizing behavior problems on parental characteristics (parenting, parental perceptions, parental mental_health, parental relationship quality).	2018	natural
Questions were asked about mental_health, perceived need for support, barriers to accessing mental_health care, and preferences for support.	2018	natural
With adequate training and support, home visitors are wellpositioned to promote access to mental_health services in vulnerable families to support infant mental_health.	2017	natural
Strategies aimed at increasing awareness of the impact of activity restriction and encouraging parents and carers to find ways to maintain essential activity may reduce stress, improving mental_health and well-being in parents and carers.	2017	natural
It is recommended that mental_health services employ the use of dynamic measures when making short-term risk-of-violence predictions for civil and/or forensic inpatients.	2016	natural
Families ( =215) showed significant improvement in all eight family functioning factors over the course of their participation in mental_health home visiting services.	2016	natural
A number of themes related to the experience of stigma in the public life of relatives of people with schizophrenia were elicited in relation to: mental_health care (difficulties in contacting mental_health professionals; in getting appropriate information; lack of alternatives to hospital treatment; absence of appropriate long-term care services); employment of people living with schizophrenia and contact with the police.	2017	natural
Conclusions are made about the bromances potential to improve mens mental_health and social well-being because participants indicate these relationships provide a space for emotional disclosure and the discussion of potentially traumatic and sensitive issues.	2017	natural
Further, a moderate-risk group was found, with slightly above average psychopathy traits and average levels of mental_health problems.	2017	natural
The current study examines the psychometric properties of the Evidence-Based Practice Attitude Scale (EBPAS), an instrument originally designed for mental_health professionals, to measure correctional employees readiness to implement EBPs.	2017	natural
Interventions aimed at developing the perceived employability of Chinese bank employees may help to improve mental_health in this group.	2016	natural
Results prove generally consistent with these propositions, including a direct link from cortisol to mental_health problems.	2015	natural
Participants reporting any mental_health disorder were more likely to report a history of sexual assault (AOR = 2.45, 95 CI = 1.75-3.43) and to have used case management services (AOR = 1.63, 95CI = 1.17-2.27).	2016	natural
This qualitative study used focus groups to evaluate stakeholders' perceptions of organizational factors affecting implementation of an adapted version of Mindfulness-Based Stress Reduction (MBSR) for staff on adolescent mental_health units.	2015	natural
Developmental delay, mental_health, and neurology conditions had the strongest associations (ORs 2.023.3).	2017	natural
Rates of endorsement to items on the Postdeployment Health Reassessment were examined and compared, as were rates of mental_health diagnoses from AFSMs official medical records.	2016	natural
Research on young people's conceptualizations informs both clinical practice and mental_health literacy interventions.	2017	natural
The paper closes with some critical reflections on the role of exercise-based interventions as a means of helping veterans improve their mental_health.	2017	natural
This study aimed to explore adolescent males' perspectives on sport as a context for supporting mental_health.	2018	natural
We begin by highlighting the importance of attention for children's emotion regulation abilities and mental_health.	2015	natural
This review highlights the dearth of evidence about the impact of forced migration on the mental_health of older adults.	2016	natural
Policy makers must address Troublesrelated mental_health effects, in terms of how they carry forward into aging, and consider ways of improving engagement with services and treatments.	2017	natural
We aimed to synthesize the available evidence on the impact of natural disasters on the mental_health and psychological distress experienced by older adults.	2016	natural
Pain-related beliefs were related with poorer mental_health (Disability = -.27; Harm = -.23; Solicitude = -.24; Control = .18; Emotion = -.29) and greater interference in daily activities (Disability =.41; Harm =.13; Solicitude =.29; Control = -.31).	2015	natural
Improvements in mental_health were noted in Intervention group.	2015	natural
Severe depression and poor mental_health were significant correlates of SMD.	2015	natural
We assessed school network, sociodemographic covariates, and mental_health using the Strengths and Difficulties Questionnaire (SDQ).	2017	natural
The results of the study suggest that a number of barriers exist in relation to adolescent males utilising computerised mental_health interventions, such as unfamiliarity with this form of help, perceived control over decisionmaking, effort involved and concerns around confidentiality.	2018	natural
Eight focus groups were conducted with 32 adults (16 men and 16 women) currently receiving services at a community mental_health center.	2017	natural
Results indicate a reasonable fit of the proposed model, with interrelations between maternal mental_health, paternal partnership satisfaction, and mental_health.	2015	natural
However, their risk of mental_health problems was greater on occasions when they did experience hardship.	2015	natural
The article discusses five findings of relevance to health professionals: the line between a desire disorder and asexuality is not clear-cut; asexually identified individuals may experience distress, so distress alone does not separate a desire disorder from asexuality; asexually identified individuals may face sexual pressure from a partner or may have difficulty negotiating sexual activity with a partner; asexuality does not need to be distressing, rather it can be experienced as a fulfilling form of sexuality; and many asexually identified individuals believe in the usefulness of low sexual desire as a diagnostic category and support medical and mental_health professionals in their efforts to develop treatments for sexual desire disorders.	2015	natural
Psychology has recently increased attention to identifying psychological qualities in individuals that indicate positive mental_health, such as hope.	2016	natural
Polyvictimization fully accounted for the differences in mental_health symptoms between non-Hispanic Blacks and non-Hispanic Whites, and partially accounted for the differences between Hispanics and non-Hispanic Whites.	2015	natural
Study 2 demonstrated that pro-immigration (vs. anti-immigration) perceivers in Germany ascribed a mental_health (vs. terrorism) motive to a suicide attack by a Syrian refugee, predicting lower endorsement of punitiveness against his group (i.e., refugees) as a whole.	2018	natural
40 nurses/clinical officers, 60 Community Health Workers (CHWs), 51 Faith Healers (FHs), and 59 Traditional Healers (THs) from 20 facilities were trained to screen and refer patients with eight priority mental_health conditions using the mhGAP-IG.	2018	natural
It is recommended that future mental_health court research examine the impact of available community services, as well as consider the effect of criminogenic risk factors, on therapeutic and recidivism outcomes.	2015	natural
Given the heightened importance of mental_health services in recent years and the perceived stigma associated with seeking psychiatric treatment, music may play an important role in mitigating negative affective states that would otherwise prevent patients from accessing care.	2015	natural
The review shows that leisure and recreation provide a number of benefits to minorities, including facilitating interracial/intergroup contacts, creating opportunities for learning and cultural exchange, helping to strengthen bonds with ethnic communities and families, facilitating preservation of ethnic culture, fostering socio-economic advancement and improving physical and mental_health.	2015	natural
Clients in the meditation condition made significant changes in mental_health symptoms (t = 5.252, df = 31, p = .000) and trauma symptoms (t = 6.009, df = 31, p = .000) from pre-treatment to post-treatment, whereas non-significant changes were observed among the control condition clients.	2015	natural
It has the potential to be used in clinical and research fields to study psychopathology and mental_health.	2015	natural
The objective of this study was to examine the association between suicidal thoughts and self-harming behavior and referral for mental_health services among children involved in the Child Welfare System in Ontario, Canada.	2018	natural
BED is associated with global functional impairment and mental_health problems.	2018	natural
The journal will continue with the previous tradition of publishing high-quality original research, and will disseminate this research to an audience with the aim of improving mental_health for all.	2016	natural
Our study provides evidence to support the notion that a good mental_health state is not simply the absence of a mental_disorder.	2016	natural
The goal of this paper is to present the perspectives of DSM5 and RDoC to the science of mental_health disorders and the impact of this debate on the future of human stress research.	2017	natural
We present a case report of a 19-year-old, first-year, female undergraduate student from China to illustrate a comprehensive approach for the mental_health treatment of Chinese international students.	2018	natural
All participants apart from seven found working with transcultural mental_health workers either more effective than or as effective as working with interpreters due to their holistic approach in understanding the various mental_health aspects and cultural boundaries.	2015	natural
Finally, ethical guidelines for VR research in forensic mental_health are provided.	2018	natural
Bisexual people constitute the largest sexual minority group in North America and experience significant mental_health disparities in relation to heterosexuals, gays, and lesbians.	2016	natural
Assessment, as an intervention, is a hallmark of infant mental_health that has not been evaluated for treatment effectiveness.	2018	natural
This was primarily characterised by providing emotional support and maintaining contact, as well as checking on their mental_health and being a good listener.	2017	natural
The influence of parent mental_health on children was mediated by its effect on parenting practices.	2015	natural
Using data from the 2011 National Survey of Midlife Development in the United States Refreshed Sample (N = 980), this paper examines how three types of spousal problemspoor physical health, poor mental_health, and behavioral disordersare related to respondents family-to-work conflict (FWC) among employed adults aged 2561.	2017	natural
Publicly funded mental_health services play an important role in serving children with autism spectrum disorder (ASD).	2018	natural
Outcomes included utilization of speech therapy, occupational therapy, behavior therapy, and mental_health services by service sector.	2016	natural
