This was primarily characterised by providing emotional support and maintaining contact, as well as checking on their mental_health and being a good listener.	2017	natural
The influence of parent mental_health on children was mediated by its effect on parenting practices.	2015	natural
Using data from the 2011 National Survey of Midlife Development in the United States Refreshed Sample (N = 980), this paper examines how three types of spousal problemspoor physical health, poor mental_health, and behavioral disordersare related to respondents family-to-work conflict (FWC) among employed adults aged 2561.	2017	natural
Publicly funded mental_health services play an important role in serving children with autism spectrum disorder (ASD).	2018	natural
Outcomes included utilization of speech therapy, occupational therapy, behavior therapy, and mental_health services by service sector.	2016	natural
Outcomes were less favourable in children/adolescents who presented with chronic PNES and in those with a chronic, comorbid mental_health disorder that failed to resolve with treatment.	2017	natural
Utilising these as a springboard to expand certain ideas, some latent, some more manifest in the papers, regarding the history and the terrain concerning the mental_health issues in our culture.	2015	natural
The CRITQ was filled out by mothers and fathers at 6 and again at 12 months as part of a longitudinal study of mental_health during the first years of life (the Little in Norway study, N = 1,041 families enrolled; V. Moe & L. Smith, 2010).	2018	natural
Parental belief systems can strongly influence childrens affect, behavior, and mental_health.	2016	natural
It may be important for mental_health professionals to consider these gender differences in categorisation and patterns of symptoms when screening for depression to increase chances of university students receiving appropriately targeted treatment.	2016	natural
Better mental_health, more optimistic illness perceptions, attribution to psychological causes, and stronger internal locus of control were associated with lower disability and better HRQL.	2016	natural
We report on a randomized controlled trial of Targeted Mental Health in Schools (TaMHS), which is a nationally mandated school-based mental_health program in England.	2015	natural
Social isolation is a major risk factor for poor physical and mental_health among older adults.	2018	natural
Little is known about how social support and wealth impacts the mental_health of women caring for young children in low- and middle-income countries.	2016	natural
With adequate training and support, home visitors are wellpositioned to promote access to mental_health services in vulnerable families to support infant mental_health.	2017	natural
Findings indicate substantive impacts of homelessness on parental mental_health, parenting authority, material resources, parenting environments and social support.	2017	natural
Caregivers completed the Child Behaviour Checklist (CBCL) to assess childrens mental_health.	2018	natural
Despite professional values about advocacy for people managing mental_health challenges, research on mental_health providers indicates that this group expresses as much or more stigma than laypeople.	2016	natural
The aim of this study was to assess the effect of retrospectively reported childhood adversity on self-reported onset of asthma and chronic bronchitis in adulthood, independent of potential confounding and mediating variables (including respondent's mental_health).	2018	natural
These findings suggest that early identification and development of child strengths can mitigate risk-taking behaviors, mental_health, and functional difficulties among youth in the child welfare system.	2016	natural
However, whether a child's exposure to IPV leads to increased adjustment difficulties is likely to depend on a variety of factors, including the caregiver's mental_health and the developmental time period when IPV exposure occurs.	2017	natural
New referrals to a community mental_health service were randomly sampled from 4 time points over a 30-year period, 1983, 1993, 2003 and 2013, using a mental_health information system.	2015	natural
Problem drinkers demonstrated the most degraded physical and mental_health.	2016	natural
In both surveys, four components of stigma were assessed: characteristics ascribed to persons with a depression, belief in a continuum of symptoms from mental_health to mental_illness, emotional reactions to people afflicted by depression (fear, anger, and pro-social reactions), and desire for social distance.	2015	natural
BED was associated with significant impairment in aspects of HRQoL relating to both physical and mental_health; the Short Form 36 Physical and Mental Component Summary mean scores varied between 31.1 to 47.3 and 32.0 to 49.8, respectively.	2015	natural
The counseling profession calls for a strength-based conceptualization of the personal, developmental, emotional, relational, and mental_health issues facing transgender clients.	2015	natural
Efforts aimed at reducing attitudinal barriers toward treatment seeking for mental_disorders may not effectively reduce the sex disparity in mental_health help seeking.	2015	natural
Is the introduction of evidencebased psychotherapy into mainstream child and adolescent mental_health services (CAMHS) a breakthrough for a scientific approach to child mental_health?	2017	natural
The high prevalence of mental_health problems (MHP) in childhood and adolescence is a global health challenge of the 21st century.	2015	natural
Emotional closeness with newly added confidants was related to improved mental_health in both indicators (B = 0.09, CI = 0.14 to 0.04 for depression; B =1.13, CI = 0.671.60 for quality of life).	2017	natural
The results also suggest that police officers tended to believe that their peers were less willing to seek mental_health services for several common presenting issues than they actually were.	2015	natural
Studying the psychological health of college students from rural China in comparison with students who originate from urban areas may shed light on the mental_health disparities of the two populations.	2017	natural
Furthermore, moving beyond perceptions of adolescent mental_health, these articles compare parent and adolescent perceptions of diverse aspects of family functioning (e.g., family conflict, parent-adolescent communication, family relationships, parental authority).	2016	natural
It is concluded that a common foundational ingredient in all the creative artists support groups described in this article is the dual focus on creativity and mental_health.	2018	natural
Our review demonstrates that there is still a need for a stronger and broader evidence base in the field of mental_health promotion, which should focus on both universal work and targeted approaches to fully address mental_health in our young populations.	2018	natural
Ten adolescents meeting full diagnostic criteria for PTSD were recruited from a specialized outpatient mental_health clinic and offered a standardized intensive PE.	2017	natural
This study aimed to test the feasibility of using a mobile device (Apple technology: iPodTouch, iPhone or iPad) among people with severe mental_illness (SMI) in a rehabilitation and recovery process and to document the parameters to be taken into account and the issues involved in implementing this technology in living environments and mental_health care settings.	2015	natural
Despite Swedens good child health statistics, data on the mental_health and wellbeing of Swedish preschool children is scarce and not routinely collected in healthcare.	2018	natural
Findings suggest LGBTQ midlife mental_health is predicted by financial anxiety, physical health, self-compassion, alienation, self-transcendence, and body shame (R =.61), and self-compassion, physical health, financial anxiety, and self-transcendence in older adulthood (R =.56).	2016	natural
A number of attempts have been made to construct such a platform, and this paper introduces PsyberGuide, which offers a step towards providing objective and actionable information for publicly available mental_health apps.	2018	natural
These results add to the literature on the relationship between housing conditions and HIV health outcomes by demonstrating that residence in supportive housing is associated with improvements in CD4 count and viral load for a sample of formerly homeless persons living with HIV/AIDS, two-thirds of whom had co-occurring physical health, mental_health, or substance abuse problems.	2017	natural
Fifty adult outpatients and 50 age- and sex-matched healthy controls were administered a battery of neuropsychological tests investigating major cognitive domains, psychopathology (anxiety and depression), alexithymia, and HRQoL. At the bivariate level, psoriasis patients (compared to healthy controls) performed worse on most of the neuropsychological tests, and they also reported more anxiety and depressive symptoms, higher scores for alexithymia, and worse physical and mental_health.	2018	natural
Delineating possible divergent patterns between specific mental_health conditions resulting from political violence and IPV takes on an increased urgency given that, although they are related, the two most commonly reported outcomes of these two types of violence-post-traumatic stress disorder (PTSD) and depression-not only require different types of treatment, but may in fact be generated or maintained by disparate paths.	2015	natural
Not accounting for baseline depression, perceiving friends as being depressed (adjusted odds ratio [AOR] = 1.32, 95 confidence interval [CI] [1.12, 1.56]) and as having stigmatizing attitudes toward mental_health conditions (AOR = 1.92, 95 CI [1.31, 2.79]) were associated with increased odds of personal depression.	2018	natural
The present study was conducted to ascertain the effectiveness of Project ECHO, a Hub and Spokes tele-mentoring model to bridge the urban-rural divide in mental_health and addiction care in the context of a developing country like India.	2018	natural
When students with disabilities are eligible for special education and related services under the Individuals With Disabilities Education Act (IDEA), mental_health services are required if such services are needed to provide students with a free appropriate public education (FAPE).	2017	natural
While a significant body of research suggests that exposure to intimate partner violence (IPV) during childhood has severe and long-lasting consequences, little is known about how children cope with witnessing IPV, including who they tell about the violence, whether they receive support after disclosing, and the association between childhood disclosure and adulthood mental_health.	2015	natural
Although the dire mental_health needs of Indigenous communities are well established in the literature, the empirical evidence for psychotherapeutic treatment for these populations is perceived to be scant.	2016	natural
Associations of NEET status with concurrent mental_health problems were independent of pre-existing mental_health vulnerability.	2016	natural
Outcome domains included comorbid mental_health disorders, academic functioning, social functioning, child and family quality of life, parent mental_health, and parenting behaviors.	2016	natural
Fostering children is common in sub-Saharan Africa, but few studies examine these children's mental_health needs.	2016	natural
To compare the effectiveness of a Brief Intervention (BI) and Treatment As Usual (TAU) in a sample of children and adolescents seeking mental_health treatment from a Child and Youth Mental Health Service (CYMHS).	2017	natural
Self-compassion, which refers to the tendency of being kind and understanding to oneself when confronted with personal failings and difficulties, is increasingly investigated as a protective factor within the context of mental_health problems.	2016	natural
Both patient's and spouse's mental_health consistently related to their own relationship satisfaction.	2016	natural
Drawing on previous work on the relationship between intensive mothering ideologies and mental_health outcomes, the present study analyzed the relationship between the pressure to be the perfect mother and psychological well-being for modern mothers.	2015	natural
Overall, the results suggest that family-based interventions in low secure settings can be developed from existing treatment being used in generic and forensic mental_health settings.	2015	natural
Self-reported quality of life was assessed using nine items from the KIDSCREEN-10 and mental_health was assessed using the Me and My School Questionnaire.	2016	natural
These findings cast doubt on the construct of spiritual intelligence and suggest that existential thinking and the production of meaning may be closely related to mental_health.	2017	natural
Retrospective reports of childhood trauma can be seen as reliable and are in keeping with results found with other mental_health populations.	2016	natural
Since some of them are primarily of behavioral nature, the present findings could be a valuable target in mental_health care.	2016	natural
The implications for outdoor education and mental_health practices as well as research applications of this new measure are discussed.	2017	natural
Rates of endorsement to items on the Postdeployment Health Reassessment were examined and compared, as were rates of mental_health diagnoses from AFSMs official medical records.	2016	natural
Clinical services for self-harm patients should have access to appropriate care for provision of help for relationship difficulties and problems concerning alcohol and mental_health issues.	2016	natural
Mental health literacy is increasingly referenced as a goal of mental_health policy.	2015	natural
This article focuses on the use of neuroimaging to investigate the neural processes and outcomes of music therapy interventions for mental_health populations.	2015	natural
Objectification theory posits that social situations invite scrutiny and dissatisfaction with appearance (especially among women), in turn affecting mental_health, sexual satisfaction, and enjoyment of social interactions.	2016	natural
Timely and openly shared psychosocial insights by experts in mental_health into the evil consequences of wall builders are essential to the physical, mental, and spiritual health of individuals and nations.	2018	natural
Outcomes were mental_health (depression), cannabis use, alcohol use, self-reported aggression, official records of antisocial behaviour, poor general health, poor education, and poor employment.	2017	natural
Using longitudinal design, this research demonstrated the different trajectories of depression scores between boys and girls over time and provided evidence for interventions improving adolescent mental_health in a semi-urban area of Vietnam.	2018	natural
This highlights the need for further research focused on the costs and clinical effectiveness of providing psychological thinking within the acute inpatient mental_health setting.	2015	natural
The General Practitioner was identified as the primary contact for accessing mental_health services.	2018	natural
The present study was conducted to investigate the impact of cyber aggression and cyber victimization on the mental_health and well-being of young adults.	2018	natural
Self-reported and teacher-reported questionnaire data on psychiatric symptoms and self-report interview data on psychiatric disorders were used to divide children into three levels of mental_health problems: no symptoms, only psychiatric symptoms and psychiatric disorders.	2016	natural
This work is part of a larger literature seeking to understand and interpret multi-informant assessments of psychological phenomena, namely mental_health.	2016	natural
These findings highlight the importance of school connectedness for adolescent wellbeing and suggest that academies can be more successful in promoting levels of school connectedness which can then impact positively on individual mental_health.	2018	natural
The findings suggest that service providers and policy makers urgently need to address the mental_health needs of transgender people, particular younger transgender people.	2017	natural
The present study explored differences in mental_health between women who experienced a trauma which involved a loss of fetal or infant life compared to women whose trauma did not involve a loss (difficult childbirth).	2016	natural
5924 mental_health service users in England were interviewed as part of the Viewpoint survey between 2009 and 2014 using the Discrimination and Stigma Scale.	2018	natural
While it is encouraging that mental_health services look to have been focusing on those who turned out to be at highest risk, clinicians may need to be particularly vigilant when following up individuals who had been drinking alcohol at the time of an initial self-harm presentation.	2017	natural
Participants expressed concern that mainstream services fail to meet the mental_health needs of this patient group, and lead to increased patient vulnerability.	2018	natural
The incidence of mental_health disorders subsequent to GDM was attenuated after adjustment for clinical and socioeconomic factors.	2015	natural
Policies for mental_health care are improving in Iran and accurate data is needed.	2017	natural
Decades later, these statements still hold true researchers have given little attention to the intersection of geography and mental_health.	2017	natural
Child neglect, exposure to intimate partner violence (IPV), insecure caregiver-child attachment, and caregiver mental_health problems were associated with higher initial levels of internalizing and externalizing behavior problems.	2017	natural
This study examined whether Tuning Relationships with Music, a dyadic therapy for parents and adolescents, increased responsive parent-adolescent interactions and parent emotion coaching whilst reducing conflict and adolescent mental_health difficulties.	2018	natural
However, when controlling for traditional bullying, cyberbullying did not remain a predictor of negative mental_health outcomes.	2015	natural
Children in contact with the child welfare system (CWS) represent a vulnerable population that is at an increased risk of poor mental_health and academic outcomes.	2018	natural
Despite the prevalence of the DSM in mental_health practice, research, and the public imagination, it remains the target of criticism.	2018	natural
This study systematically reviewed the global literature on mental_health outcomes and risk factors for mental ill health among Indigenous women who experienced IPV.	2017	natural
Overall, college students believe mental_health care should be funded.	2017	natural
Supporting childrens social and emotional learning benefits all elements of childrens development and has been associated with positive mental_health and wellbeing, development of values and life skills.	2018	natural
Mothers completed questionnaires providing information on their childrens behaviors and their own mental_health and stress levels at intake.	2018	natural
Support from these relatives, friends, neighbors, and colleagues can provide a buffer against effects on the survivor's physical health, mental_health, and quality of life, and has been shown to be protective against future abuse.	2016	natural
This article examines how the use of restrictive physical interventions (RPIs) for pupils within a social, emotional and mental_health (SEMH) special needs primary school relate to teacher professionalism.	2018	natural
Second, we verify that the choice of the atypical experience is relevant in shaping the relationship with mental_health (a novelty for Italy).	2015	natural
These findings have implications for the targeting of mental_health prevention programs tailored specifically for males and females affected by violence.	2015	natural
Participants in the tailored app improved significantly more on psychological distress and positive mental_health relative to the random app and EMA-only conditions.	2018	natural
Positive mental_health seems to confer resilience and should be taken into account, when assessing individuals for suicide risk.	2018	natural
The mental_health problems of the children were assessed by the self-reported version of the strengths and difficulties questionnaire (SDQ).	2017	natural
Although emerging research has indicated that self-stigma may have similar consequences for parents of children with mental_health disorders, currently we lack a comprehensive description of how parents experience self-stigma.	2016	natural
In addition, childrens self-concept, observable signs of negative IWMs, and mental_health were assessed.	2018	natural
A Dutch sample of 1581 adolescents (average age 14.6 years) completed a questionnaire in 2010 about mental_health problems, pro-social behavior, need for and use of support and the illness of family members and any care tasks performed by the respondent.	2016	natural
In more recent years, gamblers are also more likely to have attempted suicide, to report a co-occurring mental_health disorder, and to start treatment having already been prescribed medication.	2019	natural
Findings from both models indicated that social support mediated the relationships between exposure to violence and mental_health among adolescents.	2018	natural
The two groups of mothers were compared on their past family abuse experiences and past family relations, their mental_health history, their current psychological distress, their parenting behaviors, and their current levels of family functioning.	2016	natural
Chinese migrants have a low utilisation of mental_health services but a high proportion of involuntary admissions to mental_health services in Australia.	2015	natural
Face to face household surveys in ten high income (HI), six upper-middle income (UMI) and five low/lower-middle (LLMI) income countries totalling 101,258 adults interviewed with the WMH CIDI plus questions on use of care for mental_health problems and religiosity.	2016	natural
To improve mental_health outcomes in TGNC individuals, health providers and researchers should strive to not only promote functional coping strategies for managing genderrelated stress but also decrease dysfunctional coping strategies.	2017	natural
Implications for ongoing quality improvement efforts by program managers and clinicians related to the feasible implementation of EBA in school mental_health settings are discussed.	2015	natural
The analysis highlights substantial rates of psychopathological discontinuity in a community sample and identifies the children most at risk of chronic mental_health problems.	2017	natural
Prior substance treatment, longer hospital stay, and mental_health should be examined in future linkage studies. (	2017	natural
This study systematically reviewed the global literature on mental_health outcomes and risk factors for mental ill health among Indigenous women who experienced IPV.	2017	natural
Maternal satisfaction was the only parenting variable that predicted both maternal mental_health and childrens emotional and behavioral problems, suggesting that it is a protective factor for both mothers and children.	2016	natural
Logistic regression models tested factors related to the probability that a child would not present mental_health problems at follow-up.	2016	natural
This study aimed to determine the level of psychological distress among sentenced prisoners aged 50 years and older, to compare this level to that seen among younger prisoners and older people in the community, and to investigate which mental_health history, cognitive functioning, socio-demographic, and criminal justice characteristics were associated with psychological distress.	2016	natural
Native veterans' medical need was elevated for primary and mental_health care.	2015	natural
Findings highlight avenues for improving access to child mental_health services, including increased provision that is free to service users and flexible to their needs, with opportunities to develop trusting, supportive relationships with professionals.	2017	natural
The present study examined the efficacy of online training (OLT), instructor-led training (ILT), and a treatment manual (TM) in training mental_health clinicians in two core strategies of Dialectical Behavior Therapy (DBT): chain analysis and validation.	2015	natural
This study evaluates whether the psychometric properties of the Pediatric Symptoms Checklist-17 (PSC-17), a common behavioral health measure typically used as a dichotomous screening tool for mental_health needs, support its use as a continuous measure for tracking behavioral health over time.	2018	natural
Environmental exposures play a critical role in the genesis of some child mental_health problems.	2016	natural
Although loving-kindness meditation (LKM) has shown some promise as a psychological intervention, little is known about the effectiveness of LKM for reducing one of the most prevalent mental_health problems: anxiety.	2016	natural
Our estimates suggest that smoking causes poor mental_health and its effects are concentrated for measures that indicate more severe problems.	2017	natural
The potential significance of childhood adversity and sleep problems for prevention of later mental_health problems are discussed.	2018	natural
Perceived social participation restrictions in the group of early patients were found to be negatively associated with the mental_health component of the HRQoL ( = 0.192; p 0.05) and in the established RA group with the physical health component of the HRQoL ( = 0.271; p 0.001).	2016	natural
Future research should seek to increase mental_health service use in adolescents with BDD and to improve rates of disorder detection in clinical settings.	2017	natural
