This raises the problem of how to increase the cultural awareness of mental_health professionals dealing with the mental_health needs of the immigrant population.	2015	natural
Results are discussed in details with implications for future research and suggestions for mental_health practitioners.	2015	natural
Social skills explained a significant proportion of the variance in mental_health scores across the sample.	2015	natural
The current study sought to clarify the impact of underemployment longitudinally, assessing mental_health 5 times over 8 months after job loss.	2015	natural
These results reveal that approach-avoidance commitment was associated with mental_health via emotional experiences in romantic relationships, and verified Johnson's (1999) and Levinger's (1999) theoretical argument.	2016	natural
Substantial levels of mental_health need were identified.	2018	natural
In sum, self-reported discrimination appeared to adversely impact the mental_health of AIs.	2016	natural
Outcome measures, including dyadic mediators (self-efficacy), dyadic appraisal (Cancer Related Communication Problem, CRCP), dyadic coping (Dyadic Coping Inventory, DCI), and dyadic outcomes (physical and mental_health, negative and positive emotions, and marital satisfaction), were assessed at T0 (pre-intervention) and T1 (post-intervention).	2015	natural
Research in children's mental_health has suggested that emotional and behavioral problems in are inextricably tied to academic difficulties.	2015	natural
PA is inversely related to sadness and suicidality in adolescents, highlighting the relationship between PA and mental_health in children, and potentially implicating PA as a salient option in the response to bullying in schools.	2015	natural
Our results underscore the importance of psychiatric disorders as a prevalent condition in early adolescence, which has a direct impact on the planning of public policies and specific mental_health care services in this age group.	2018	natural
History of mental_health problems predicted condom-use barriers, mediated by recent depression and relationship power (0.15, p < 0.001).	2016	natural
Studies have shown that stopping smoking can improve mental_health function, as well as improve outcomes for substance use disorders.	2017	natural
Veterans who used intensive tobacco cessation counseling services were more likely to be homeless, had comorbid mental_health and substance use disorders, and used more VHA services overall than veterans who did not use tobacco cessation services.	2016	natural
Native Americans were among the racial/ethnic groups with lowest treatment utilization, but also among the highest for rates of suicide attempts, highlighting the pressing need for strategies to increase mental_health service use in this particularly vulnerable population.	2016	natural
More posttraumatic stress predicted lower mental_health quality of life, whereas more posttraumatic growth predicted better physical health quality of life and longer survival.	2017	natural
Specifically, as support for children's psychological autonomy increased, so did children's mental_health functioning, but only for those that experienced low to moderate levels of parental monitoring.	2018	natural
Findings revealed that spirituality was closely related to a number of positive outcomes following TBI including psychological coping, physical health, mental_health, productivity, life satisfaction, functional independence and posttraumatic growth.	2018	natural
It is crucial for people to have an immediate link to communitybased mental_health services (CMHSs) after psychiatric crisis.	2017	natural
The negative impact of discrimination on mental_health among lesbian, gay, and bisexual populations has been well documented.	2016	natural
Growth mixture models analysed participants' responses on measures of mental_health and wellbeing for up to 16 years from death.	2015	natural
Physical activity promotes better health outcomes across the lifespan, and provides physical and mental_health benefits for women who have recently given birth.	2018	natural
This has been associated with treatment outcome and attitudes towards mental_health problems.	2016	natural
Results showed significant overall pre-post effect of an RC on marital functioning (Hedge's g = 0.20) and individual mental_health (g = 0.44).	2016	natural
Specifically, for men, we found a direct pathway from early low SES to drug use in mid adulthood and an indirect pathway to psychological distress through first-grade maladaptation and adolescent poor mental_health.	2016	natural
Both bipolar disorder and borderline personality disorder (BPD) are serious mental_health disorders resulting in significant psychosocial morbidity, reduced health-related quality of life, and excess mortality.	2016	natural
This study indicates that the risk factors for offending commonly found in the general criminological literature are also those associated with offending in young people with mental_health problems.	2015	natural
Specifically, higher levels of attachment anxiety, or the combination of attachment anxiety and mental_health concerns, predicted greater levels of self-stigma, which in turn predicted weaker intentions to seek counseling.	2015	natural
In the group that experienced less damage, working >100 h of overtime per month (adjusted odds ratio [OR], 2.06; 95 confidence interval [CI], 1.11-3.82) and poor workplace communication (adjusted OR, 10.96; 95 CI, 6.63-18.09) increased the risk of mental_health distress.	2015	natural
To obtain a child's perspective during a mental_health assessment, he or she is usually interviewed.	2016	natural
Third, psychosocial factors were categorized into four domains: substance use disorder; mental_health (depression, PTSD); psychological abuse (emotional abuse, pregnancy coercion); and violence (physical abuse, sexual abuse) and included as independent associations with each outcome to assess their relative importance.	2018	natural
Students with high use reported poorer health outcomes across numerous areas including mental_health, physical health, risk behaviors, and access to health care.	2018	natural
Results provide a current demonstration of FFT's effectiveness for youth with behavior problems in community-based settings, expand our understanding of the range of positive outcomes of FFT to include mental_health risk and family-defined problem severity and impact, and suggests that it is an effective intervention when implemented in an Irish context.	2016	natural
However, no variable could explain comprehensively, why students of SSHIs have more mental_health problems than mainstream pupils.	2015	natural
Despite bisexual individuals being at increased risk for mental_health and substance use problems, clinicians ability to provide affirmative and competent care to bisexual clients is limited by their lack of bisexual-specific training.	2017	natural
Twenty-five different articles demonstrated the clinical potential of this technology in both the diagnosis and the treatment of mental_health disorders: VR compares favorably to existing treatments in anxiety disorders, eating and weight disorders, and pain management, with long-term effects that generalize to the real world.	2018	natural
Using multiple regression, results indicated that the amount of childhood victimization was a significant predictor of health problems in adulthood, controlling for the significant negative effects of health risk behaviors and mental_health problems on physical health.	2015	natural
Self-administered surveys and electronic VA databases were utilized to examine mental_health treatment retention across racial/ethnic groups in the 6 months following the PTSD diagnosis controlling for treatment need, access factors, age, gender, treatment beliefs, and facility factors.	2015	natural
Numerous studies have found that both personality and the coping strategies used in response to stress play important roles in the development of mental_health problems, particularly adjustment disorder (AD), which is characterised by the onset of different emotional symptoms or behaviour in response to an identifiable stressor.	2015	natural
These findings highlight relationships between childhood abuse and adulthood factors and the mental_health of mothers involved in the criminal justice system, with implications for theory, practice, and research.	2018	natural
We examine associations between childhood sexual abuse (CSA) and substance abuse, the role of mental_health indicators as mediators in these associations and whether or not associations differ by gender.	2016	natural
With adequate training and support, home visitors are wellpositioned to promote access to mental_health services in vulnerable families to support infant mental_health.	2017	natural
Strategies aimed at increasing awareness of the impact of activity restriction and encouraging parents and carers to find ways to maintain essential activity may reduce stress, improving mental_health and well-being in parents and carers.	2017	natural
It is recommended that mental_health services employ the use of dynamic measures when making short-term risk-of-violence predictions for civil and/or forensic inpatients.	2016	natural
Families ( =215) showed significant improvement in all eight family functioning factors over the course of their participation in mental_health home visiting services.	2016	natural
A number of themes related to the experience of stigma in the public life of relatives of people with schizophrenia were elicited in relation to: mental_health care (difficulties in contacting mental_health professionals; in getting appropriate information; lack of alternatives to hospital treatment; absence of appropriate long-term care services); employment of people living with schizophrenia and contact with the police.	2017	natural
Conclusions are made about the bromances potential to improve mens mental_health and social well-being because participants indicate these relationships provide a space for emotional disclosure and the discussion of potentially traumatic and sensitive issues.	2017	natural
Further, a moderate-risk group was found, with slightly above average psychopathy traits and average levels of mental_health problems.	2017	natural
This qualitative study used focus groups to evaluate stakeholders' perceptions of organizational factors affecting implementation of an adapted version of Mindfulness-Based Stress Reduction (MBSR) for staff on adolescent mental_health units.	2015	natural
Developmental delay, mental_health, and neurology conditions had the strongest associations (ORs 2.023.3).	2017	natural
Rates of endorsement to items on the Postdeployment Health Reassessment were examined and compared, as were rates of mental_health diagnoses from AFSMs official medical records.	2016	natural
Research on young people's conceptualizations informs both clinical practice and mental_health literacy interventions.	2017	natural
The paper closes with some critical reflections on the role of exercise-based interventions as a means of helping veterans improve their mental_health.	2017	natural
This review highlights the dearth of evidence about the impact of forced migration on the mental_health of older adults.	2016	natural
Policy makers must address Troublesrelated mental_health effects, in terms of how they carry forward into aging, and consider ways of improving engagement with services and treatments.	2017	natural
We aimed to synthesize the available evidence on the impact of natural disasters on the mental_health and psychological distress experienced by older adults.	2016	natural
Pain-related beliefs were related with poorer mental_health (Disability = -.27; Harm = -.23; Solicitude = -.24; Control = .18; Emotion = -.29) and greater interference in daily activities (Disability =.41; Harm =.13; Solicitude =.29; Control = -.31).	2015	natural
However, their risk of mental_health problems was greater on occasions when they did experience hardship.	2015	natural
The article discusses five findings of relevance to health professionals: the line between a desire disorder and asexuality is not clear-cut; asexually identified individuals may experience distress, so distress alone does not separate a desire disorder from asexuality; asexually identified individuals may face sexual pressure from a partner or may have difficulty negotiating sexual activity with a partner; asexuality does not need to be distressing, rather it can be experienced as a fulfilling form of sexuality; and many asexually identified individuals believe in the usefulness of low sexual desire as a diagnostic category and support medical and mental_health professionals in their efforts to develop treatments for sexual desire disorders.	2015	natural
Psychology has recently increased attention to identifying psychological qualities in individuals that indicate positive mental_health, such as hope.	2016	natural
Study 2 demonstrated that pro-immigration (vs. anti-immigration) perceivers in Germany ascribed a mental_health (vs. terrorism) motive to a suicide attack by a Syrian refugee, predicting lower endorsement of punitiveness against his group (i.e., refugees) as a whole.	2018	natural
Given the heightened importance of mental_health services in recent years and the perceived stigma associated with seeking psychiatric treatment, music may play an important role in mitigating negative affective states that would otherwise prevent patients from accessing care.	2015	natural
The review shows that leisure and recreation provide a number of benefits to minorities, including facilitating interracial/intergroup contacts, creating opportunities for learning and cultural exchange, helping to strengthen bonds with ethnic communities and families, facilitating preservation of ethnic culture, fostering socio-economic advancement and improving physical and mental_health.	2015	natural
Clients in the meditation condition made significant changes in mental_health symptoms (t = 5.252, df = 31, p = .000) and trauma symptoms (t = 6.009, df = 31, p = .000) from pre-treatment to post-treatment, whereas non-significant changes were observed among the control condition clients.	2015	natural
It has the potential to be used in clinical and research fields to study psychopathology and mental_health.	2015	natural
The objective of this study was to examine the association between suicidal thoughts and self-harming behavior and referral for mental_health services among children involved in the Child Welfare System in Ontario, Canada.	2018	natural
Our study provides evidence to support the notion that a good mental_health state is not simply the absence of a mental_disorder.	2016	natural
The goal of this paper is to present the perspectives of DSM5 and RDoC to the science of mental_health disorders and the impact of this debate on the future of human stress research.	2017	natural
All participants apart from seven found working with transcultural mental_health workers either more effective than or as effective as working with interpreters due to their holistic approach in understanding the various mental_health aspects and cultural boundaries.	2015	natural
Bisexual people constitute the largest sexual minority group in North America and experience significant mental_health disparities in relation to heterosexuals, gays, and lesbians.	2016	natural
Assessment, as an intervention, is a hallmark of infant mental_health that has not been evaluated for treatment effectiveness.	2018	natural
This was primarily characterised by providing emotional support and maintaining contact, as well as checking on their mental_health and being a good listener.	2017	natural
The influence of parent mental_health on children was mediated by its effect on parenting practices.	2015	natural
Using data from the 2011 National Survey of Midlife Development in the United States Refreshed Sample (N = 980), this paper examines how three types of spousal problemspoor physical health, poor mental_health, and behavioral disordersare related to respondents family-to-work conflict (FWC) among employed adults aged 2561.	2017	natural
Utilising these as a springboard to expand certain ideas, some latent, some more manifest in the papers, regarding the history and the terrain concerning the mental_health issues in our culture.	2015	natural
It may be important for mental_health professionals to consider these gender differences in categorisation and patterns of symptoms when screening for depression to increase chances of university students receiving appropriately targeted treatment.	2016	natural
We report on a randomized controlled trial of Targeted Mental Health in Schools (TaMHS), which is a nationally mandated school-based mental_health program in England.	2015	natural
Caregivers completed the Child Behaviour Checklist (CBCL) to assess childrens mental_health.	2018	natural
Problem drinkers demonstrated the most degraded physical and mental_health.	2016	natural
The counseling profession calls for a strength-based conceptualization of the personal, developmental, emotional, relational, and mental_health issues facing transgender clients.	2015	natural
Efforts aimed at reducing attitudinal barriers toward treatment seeking for mental_disorders may not effectively reduce the sex disparity in mental_health help seeking.	2015	natural
The high prevalence of mental_health problems (MHP) in childhood and adolescence is a global health challenge of the 21st century.	2015	natural
Emotional closeness with newly added confidants was related to improved mental_health in both indicators (B = 0.09, CI = 0.14 to 0.04 for depression; B =1.13, CI = 0.671.60 for quality of life).	2017	natural
Ten adolescents meeting full diagnostic criteria for PTSD were recruited from a specialized outpatient mental_health clinic and offered a standardized intensive PE.	2017	natural
Despite Swedens good child health statistics, data on the mental_health and wellbeing of Swedish preschool children is scarce and not routinely collected in healthcare.	2018	natural
These results add to the literature on the relationship between housing conditions and HIV health outcomes by demonstrating that residence in supportive housing is associated with improvements in CD4 count and viral load for a sample of formerly homeless persons living with HIV/AIDS, two-thirds of whom had co-occurring physical health, mental_health, or substance abuse problems.	2017	natural
Fifty adult outpatients and 50 age- and sex-matched healthy controls were administered a battery of neuropsychological tests investigating major cognitive domains, psychopathology (anxiety and depression), alexithymia, and HRQoL. At the bivariate level, psoriasis patients (compared to healthy controls) performed worse on most of the neuropsychological tests, and they also reported more anxiety and depressive symptoms, higher scores for alexithymia, and worse physical and mental_health.	2018	natural
Not accounting for baseline depression, perceiving friends as being depressed (adjusted odds ratio [AOR] = 1.32, 95 confidence interval [CI] [1.12, 1.56]) and as having stigmatizing attitudes toward mental_health conditions (AOR = 1.92, 95 CI [1.31, 2.79]) were associated with increased odds of personal depression.	2018	natural
While a significant body of research suggests that exposure to intimate partner violence (IPV) during childhood has severe and long-lasting consequences, little is known about how children cope with witnessing IPV, including who they tell about the violence, whether they receive support after disclosing, and the association between childhood disclosure and adulthood mental_health.	2015	natural
Associations of NEET status with concurrent mental_health problems were independent of pre-existing mental_health vulnerability.	2016	natural
Outcome domains included comorbid mental_health disorders, academic functioning, social functioning, child and family quality of life, parent mental_health, and parenting behaviors.	2016	natural
To compare the effectiveness of a Brief Intervention (BI) and Treatment As Usual (TAU) in a sample of children and adolescents seeking mental_health treatment from a Child and Youth Mental Health Service (CYMHS).	2017	natural
Drawing on previous work on the relationship between intensive mothering ideologies and mental_health outcomes, the present study analyzed the relationship between the pressure to be the perfect mother and psychological well-being for modern mothers.	2015	natural
Overall, the results suggest that family-based interventions in low secure settings can be developed from existing treatment being used in generic and forensic mental_health settings.	2015	natural
Retrospective reports of childhood trauma can be seen as reliable and are in keeping with results found with other mental_health populations.	2016	natural
Since some of them are primarily of behavioral nature, the present findings could be a valuable target in mental_health care.	2016	natural
Rates of endorsement to items on the Postdeployment Health Reassessment were examined and compared, as were rates of mental_health diagnoses from AFSMs official medical records.	2016	natural
Timely and openly shared psychosocial insights by experts in mental_health into the evil consequences of wall builders are essential to the physical, mental, and spiritual health of individuals and nations.	2018	natural
Self-reported and teacher-reported questionnaire data on psychiatric symptoms and self-report interview data on psychiatric disorders were used to divide children into three levels of mental_health problems: no symptoms, only psychiatric symptoms and psychiatric disorders.	2016	natural
These findings highlight the importance of school connectedness for adolescent wellbeing and suggest that academies can be more successful in promoting levels of school connectedness which can then impact positively on individual mental_health.	2018	natural
The findings suggest that service providers and policy makers urgently need to address the mental_health needs of transgender people, particular younger transgender people.	2017	natural
The present study explored differences in mental_health between women who experienced a trauma which involved a loss of fetal or infant life compared to women whose trauma did not involve a loss (difficult childbirth).	2016	natural
The incidence of mental_health disorders subsequent to GDM was attenuated after adjustment for clinical and socioeconomic factors.	2015	natural
Decades later, these statements still hold true researchers have given little attention to the intersection of geography and mental_health.	2017	natural
This study examined whether Tuning Relationships with Music, a dyadic therapy for parents and adolescents, increased responsive parent-adolescent interactions and parent emotion coaching whilst reducing conflict and adolescent mental_health difficulties.	2018	natural
Children in contact with the child welfare system (CWS) represent a vulnerable population that is at an increased risk of poor mental_health and academic outcomes.	2018	natural
Mothers completed questionnaires providing information on their childrens behaviors and their own mental_health and stress levels at intake.	2018	natural
These findings have implications for the targeting of mental_health prevention programs tailored specifically for males and females affected by violence.	2015	natural
Positive mental_health seems to confer resilience and should be taken into account, when assessing individuals for suicide risk.	2018	natural
The mental_health problems of the children were assessed by the self-reported version of the strengths and difficulties questionnaire (SDQ).	2017	natural
Although emerging research has indicated that self-stigma may have similar consequences for parents of children with mental_health disorders, currently we lack a comprehensive description of how parents experience self-stigma.	2016	natural
A Dutch sample of 1581 adolescents (average age 14.6 years) completed a questionnaire in 2010 about mental_health problems, pro-social behavior, need for and use of support and the illness of family members and any care tasks performed by the respondent.	2016	natural
The two groups of mothers were compared on their past family abuse experiences and past family relations, their mental_health history, their current psychological distress, their parenting behaviors, and their current levels of family functioning.	2016	natural
To improve mental_health outcomes in TGNC individuals, health providers and researchers should strive to not only promote functional coping strategies for managing genderrelated stress but also decrease dysfunctional coping strategies.	2017	natural
The analysis highlights substantial rates of psychopathological discontinuity in a community sample and identifies the children most at risk of chronic mental_health problems.	2017	natural
Prior substance treatment, longer hospital stay, and mental_health should be examined in future linkage studies. (	2017	natural
This study systematically reviewed the global literature on mental_health outcomes and risk factors for mental ill health among Indigenous women who experienced IPV.	2017	natural
Maternal satisfaction was the only parenting variable that predicted both maternal mental_health and childrens emotional and behavioral problems, suggesting that it is a protective factor for both mothers and children.	2016	natural
This study aimed to determine the level of psychological distress among sentenced prisoners aged 50 years and older, to compare this level to that seen among younger prisoners and older people in the community, and to investigate which mental_health history, cognitive functioning, socio-demographic, and criminal justice characteristics were associated with psychological distress.	2016	natural
