The aim of this research was to investigate trauma symptomatology specifically related to perpetrating a violent offence in a sample of mentally disordered offenders.	2008	natural
This study indexed the extent to which deficits in extinction learning before trauma exposure are a risk factor for persistent posttraumatic stress after trauma exposure.	2006	natural
Third, the relationship between trauma and meaning is assessed in three age cohorts: the young-old, the old-old and oldest-old.	2005	natural
We examine one particular (and, we believe, important) aspect of PTSD: The creation and maintenance of causal attributions about trauma.	2006	natural
Results suggest that tonic immobility could be one path through which trauma survivors develop PTSD symptoms.	2008	natural
Data were collected from a treatment-seeking sample of trauma victims (n=158) and a college sample (n=178).	2006	natural
Directive leadership was more effective when trauma severity was high or when the team was inexperienced.	2005	natural
Simultaneously with this revised version of drive theory, a structural theory for the realm of healthy self- and object preservation and for pathological or deadened self and object parts is developed, including the devastating effects of trauma.	2006	natural
Therefore, the present hypothesis suggests that there exists an emotional trauma that affects athletes after seeing someone in their own sport sustain a serious injury.	2008	natural
Anxiety, helplessness, numbness, and threat were greater at the time of the trauma than when experiencing the intrusive memory.	2007	natural
The literature on vicarious traumatization has suggested that traumasensitive supervision may help to minimize the effects of vicarious exposure to trauma; however, nothing from the perspective of trauma counselors was noted.	2005	natural
In reviewing the historical underpinnings and contextual nature of phenotype, it is hoped that the reader will gain a greater appreciation of the role of phenotype in the lives of Puerto Ricans and understand how phenotype, and, most importantly, historical trauma can be related to a host of psychological concerns.	2008	natural
The current paper reviews the psychological impact of chronic interpersonal violence and the relevant literature regarding group therapy for trauma survivors.	2007	natural
At treatment entry, nearly all participants reported lifetime trauma exposure, and over one third met criteria for posttraumatic stress disorder (PTSD).	2009	natural
Significant improvement in the Sojourners was observed in trauma symptoms, emotional well-being, cancer self-efficacy, and desire for information on breast cancer resources.	2006	natural
A recent review article on panic disorder in this journal brought together Freudian psychoanalysis, studies of classical conditioning, neurobiological research, developmental research showing the effects of early trauma, and PTSD research.	2007	natural
Memory fragmentation was associated with participants indicating that they provided more incoherent accounts of trauma during police interview.	2009	natural
The goal of this study was to understand better the risk of compassion fatigue (the trauma suffered by the helping professional) and burnout (emotional exhaustion, depersonalization, and reduced sense of personal accomplishment), and the potential for compassion satisfaction (the fulfillment from helping others and positive collegial relationships) among Colorado county child protection staff using the Compassion Satisfaction/Fatigue Self-Test [Figley, C. R., & Stamm, B. H. (1996).	2006	natural
The discovery of the compulsion to repeat instituted a paradigmatic shift in Freud's formulations, emphasizing the process of repetition of trauma, and instituting a link between the network of concepts indicated above.	2007	natural
Trauma generates the lies and hiddenness as a means of coping with abuse and indifference.	2005	natural
This comment traces the historical and theoretical foundations that underlie the concept of secondary trauma (i.e., compassion fatigue) and discusses the implications for family psychology practice in helping veterans and their families recover from their ordeals.	2005	natural
Finally, a broader view of outcome assessment in such research is called for, including not just reduction in psychopathological symptoms but attention to coping styles, affect management, resilience, social reorganization, and sensitivity to subsequent trauma.	2005	natural
To address this question we administered Lang's Looking at Pictures test, in which a series of pictures are rated for valence (pleasant-unpleasant) and arousal (high-low), to 10 male and 11 female Bosnian refugees suffering from PTSD (DSM-IV criteria) and to control groups of 11 male and 10 female Bosnian refugees with similar trauma exposure but without PTSD or any other major mental_illness.	2005	natural
Cognitive-behavioral theories (CBTs) describe etiological factors in trauma, guide research that has identified risk for PTSD, and help develop interventions that can effectively reduce posttrauma symptomatology.	2008	natural
Poly-victimization was highly predictive of trauma symptoms, and when taken into account, greatly reduced or eliminated the association between individual victimizations (e.g., sexual abuse) and symptomatology.	2007	natural
Specifically, the authors hypothesized that experiences associated with natural disaster including personal loss, separation from family and/or community, and lack of community support as well as previous loss or trauma would be related to increased symptomatology in both children and adolescents.	2009	natural
Level of trauma symptoms correlated positively with perception of benefit, and experiencing a previous trauma also correlated positively with perceived benefits.	2006	natural
Independent predictors of ASD severity included prior trauma exposure, peritrauma exposure and perceptions of the child's pain and life threat, and child ASD severity.	2009	natural
Findings suggest that multiple factors influence perspectives on addressing trauma among individuals with HIV and CSA, and that resiliency might influence these attitudes.	2006	natural
Analysis of the Trauma Symptom Inventory (TSI; Briere, 1995) clinical subscales confirmed that women who reported coerced sexual intercourse endorsed symptoms levels more consistent with the adult rape group than with the non-victim group.	2006	natural
The results show, as hypothesized, that the dreams of children exposed to severe military trauma incorporated more intense and more negative emotional images.	2008	natural
The author dedicates particular attention to the undifferentiated background, the nature-environment torn by the trauma, and to the need to reconstruct this fabric of experience in the analytical relationship, as a fundamental element to the recomposition of the dissociated nuclei.	2005	natural
This case study describes the treatment of an individual with Posttraumatic Relationship Syndrome (PTRS), a newly proposed mental_health syndrome that occurs subsequent to the experience of trauma in an intimate relationship.	2006	natural
Findings suggest that, as predicted by betrayal trauma theory, women who have experienced high-betrayal abuse show alterations in automatic emotional processes consistent with caregiving-maintenance goals in an abusive environment.	2009	natural
According to the cognitive model of Ehlers and Clark (Behaviour Research and Therapy 38 (2000) 319), chronic PTSD results from distorted beliefs about the trauma or its sequelae.	2005	natural
One-hundred and ninety-two incarcerated women who were participating in a trauma and abuse psychoeducation program were evaluated for childhood abuse, maltreatment and current dissociative symptoms.	2007	natural
A discussion of the special dynamics of trauma groups and important considerations for group conducting follows and the issue of vicarious traumatization for the group conductor is addressed.	2005	natural
Interventions to improve asthma outcomes should include assessment and treatment of trauma and PTS symptoms.	2006	natural
Fortunately, advances in videoconferencing-based technologies are improving rural trauma survivors' access to remote specialty clinics, thereby allowing access to optimal treatments for PTSD.	2009	natural
This article presents a reconceptualization of trauma in terms of the damage it inflicts on the patient's conception of his or her world.	2009	natural
Information on children's mental_health needs was obtained from the Child Behavior Checklist and Trauma Symptom Checklist.	2007	natural
Throughout, my thoughts are informed by our clinical experience with the essential role of witnessing in sustaining life after massive trauma.	2009	natural
The students completed questionnaires on sociodemographic data followed by the Trauma Checklist and the Child PTSD Checklist.	2007	natural
Those who reported penile trauma were younger than those who did not.	2008	natural
Four dominant categories emerged: Negative consequences of sexual trauma, Becoming a survivor, Pregnancy: A new beginning beyond sexual trauma, and the Integration of sexual trauma and motherhood.	2009	natural
First, the characteristics of intrusions and related phenomena, such as appraisals of the trauma and maladaptive thought control strategies are reviewed.	2009	natural
These findings emphasize connections between physical and psychological trauma and the importance of an interdisciplinary approach to torture treatment.	2007	natural
The cause of Native American DV may be anchored in historic trauma, poverty, alcohol and drugs, and rural isolation.	2007	natural
Among students with the lowest number of additional traumas, the usual dose-response pattern of increasing PTSD symptoms with increasing 9/11 exposure was observed; among those with medium to high cumulative life trauma, PTSD symptoms were substantially higher and uniformly so regardless of 9/11 exposure dose.	2008	natural
After controlling for PTSD, depression, panic and substance use disorders, and pre-9/11 trauma, patients who screened positive (vs. negative) for GAD symptoms were roughly twice as likely to report having a loved one at the 9/11 disaster site, twice as likely to know someone who was killed by the attacks, and twice as likely to know someone who was involved with the rescue/recovery efforts after the disaster.	2009	natural
Type of SCI and trauma recency were not significantly correlated with PTSD symptoms or general health problems but previous traumatic events were.	2006	natural
The principal limitations of the study were its small sample size and the use of a nonstandardized trauma measure.	2008	natural
Since maltreatment is a sensitive topic that is not reported on easily, trauma interviews are promising assessment instruments since they provide the opportunity to probe and clarify.	2009	natural
In addition, findings from three cases of individuals with severe brain trauma will be presented to show the influence of brain trauma on baseline cerebrovascular parameters measured by fMRI.	2007	natural
The finding that emotional stress reactivity is most pronounced for subjects who experienced trauma early in life confirms prior evidence suggesting that the effects of trauma are more detrimental when trauma occurs at a younger age.	2006	natural
We used the Childhood Trauma Questionnaire (CTQ) to assess childhood maltreatment and the Beck Depression Inventory-II to assess depression levels.	2007	natural
Front-line workers, advocates, researchers and correctional officials in Canada, the U.S. and the U.K. have recognized the high proportion of imprisoned women who have experienced childhood sexual abuse and have called for the development of appropriate prison counseling services that take into account women's histories of trauma (Battle et al.,	2007	natural
These findings indicate the importance of considering the psychological consequences of trauma during both assessment and treatment of the eating disorders.	2007	natural
Findings from a nationwide United States survey reveal that trauma arising between the ages of 18 and 30 years is associated with a diminished sense of meaning in life, and that current emotional support reduces the effects of trauma on meaning, whereas negative inter-personal contacts tend to intensify the pernicious effects of trauma on meaning in life.	2005	natural
No previous study has investigated the association between early trauma and suicidal behavior in medical students.	2009	natural
In the hospital sample, the protective effect of the rs110402 A-allele against developing depression after childhood trauma was observed in men (N = 424), but not in women (N = 635).	2009	natural
With a sample of 120 Gulf War veterans, the present study investigated the main effects of childhood and lifetime trauma, combat exposure, and coping strategies on posttraumatic stress disorder (PTSD), as well as combat exposure's moderating effects on the other variables' relationships with PTSD.	2005	natural
Uncertainty persists about the impact of trauma on the long-term mental_health of resettled refugees.	2007	natural
Civilian trauma survivors with PTSD, trauma survivors with no PTSD and non-trauma-exposed control participants (N = 49) provided autobiographical memories of events that they believe shaped who they are.	2005	natural
Both men had experienced overwhelming loss and trauma.	2009	natural
When examined with combat exposure, childhood trauma has a complex relationship to PTSD severity.	2009	natural
Non-clinical psychotic experiences were strongly and independently associated with both bullying (OR=2.9, 95 CI 1.8-4.8) and sexual trauma (OR=4.8, 95 CI 2.3-10.1).	2006	natural
Results from this and other studies suggest that the occurrence of defects in HPA function in PTSD may be specific responses to particular combinations of trauma type, genetic susceptibility, and individual history.	2009	natural
This meta-analysis of 58 resting baseline studies, 25 startle studies, 17 standardized trauma cue studies, and 22 idiographic trauma cue studies compared adults with and without posttraumatic stress disorder (PTSD) on psychophysiological variables: facial electromyography (EMG), heart rate (HR), skin conductance (SC), and blood pressure.	2007	natural
The mimetic phenomena enacted with an older brother and at the kindergarten are found to result from cumulative trauma at her contacting a loving but mind-blind mother.	2005	natural
Subjects were 161 psychology students (female, n = 121; male, n = 40) who had experienced trauma but received no previous treatment.	2006	natural
Although preliminary, these results provide support for the further investigation of gratitude in trauma survivors.	2006	natural
The authors describe how the Poisson regression method for analyzing count or frequency outcome variables can be applied in trauma studies.	2008	natural
The field of traumatic stress is poised to integrate, more fully than in the past, a variety of aspects of trauma such as social betrayal, as well as outcomes of trauma such as depression, criminality, and physiological harm that go beyond posttraumatic stress.	2005	natural
This study indexed the extent to which deficits in extinction learning before trauma exposure are a risk factor for persistent posttraumatic stress after trauma exposure.	2006	natural
The findings are consistent with Finkelhor and Browne's (1986) traumagenic model, which suggests that the experience of child sexual abuse often results in feelings that interfere with one's cognitive development and emotional orientations to the world and causes trauma by distorting the victim's self concept and worldview.	2007	natural
HIV prevention efforts targeting adults with SMI must occur on multiple levels (e.g., individual, group, community, structural/policy), address several domains of influence (e.g., psychiatric illness, trauma history, social relationships), and be integrated into existing services (e.g., psychotherapy, substance abuse treatment, housing programs).	2005	natural
Support or regularly scheduled reflective supervision as well as selfcare is crucial for those who work with trauma.	2009	natural
Foetal abnormalities were detected in six cases between the first and the thirteenth day after the trauma.	2006	natural
Results encourage further evaluation of trauma history as a multifaceted construct.	2008	natural
Veterans who have a history of CD are at high risk for trauma exposure and development of PTSD.	2005	natural
The more men practise the woman superior position during intercourse, the more likely trauma to the penis is to occur.	2008	natural
Although services to runaway youth must continue to focus on safe, short-term residential care, trauma issues must be acknowledged.	2007	natural
Effectiveness of an integrated traumainformed approach to treating women with cooccurring disorders and histories of trauma was evaluated.	2007	natural
Furthermore, priming for trauma-related words measured soon after the trauma was associated with subsequent PTSD severity at 3, 6, and 9 months.	2005	natural
We examined whether trauma history and PTSD were related to physical health in patients with an SUD.	2007	natural
Among GIP patients, a hierarchical regression revealed that GIP-associated trauma recall and catastrophic cognitions explained variance in GIP severity beyond a measure of general psychopathology (SCL).	2007	natural
We investigated the posttraumatic stress disorder (PTSD) module's trauma screen of the Structured Clinical Interview for DSM-IV (SCID), a single-item traumatic event history query.	2008	natural
Civilian trauma survivors with and without PTSD (N=41) provided autobiographical memories of events in response to positive and negative cue words.	2008	natural
Group therapy for trauma survivors provides an opportunity to share experiences with others in a supportive environment.	2007	natural
Maternal AAls were collected from 45 low-income mothers with high rates of childhood trauma when their children were age 7; Strange Situation assessments had been collected at 18 months of age.	2005	natural
Although recovery is highly individualized, participants' narratives indicated three critical elements: disclosing the abuse; making meaning of one's trauma; and developing supportive relationships.	2008	natural
I present a conceptual examination of the effects of massive trauma in relation to what I refer to as the 'unfinished business' of trauma.	2008	natural
By exploring the role of causal attributions in creating and sustaining posttraumatic symptoms, we hope to understand better the subjective experience of trauma and its sequelae.	2006	natural
When treating trauma in groups, attention needs to be paid to containment, and as such there is an analysis of the relationship between containment and structure in group analytic groups.	2009	natural
Examination of predictors of symptom change and treatment response showed that life stress, trauma history, and depressive symptom severity were negatively associated with outcomes.	2008	natural
This study explores ERP differences associated with cue-related responses to both drug and trauma cues in a three-category oddball task using neutral, drug-, and trauma-related pictorial stimuli.	2008	natural
Those with a history of trauma, depression, generalized anxiety disorder or panic reported significantly more disability than those without a psychiatric history.	2009	natural
In recent years, researchers and clinicians have begun to examine how individual exposure to traumatic stress affects the spouses/partners, children, and professional helpers of trauma survivors.	2005	natural
The history and current status of these services are reviewed in light of the current literature on early trauma intervention.	2009	natural
There were no differences between the no childhood trauma (n = 14) and childhood trauma groups on psychiatric symptoms, but a significant relationship was found between trauma history and all aspects of social functioning.	2009	natural
Seventy-five subjects (69.3 female, mean age=35.4+/-12.0) with DSM-IV BDD completed the Childhood Trauma Questionnaire and were interviewed with other reliable and valid measures.	2006	natural
Eye movement desensitization and reprocessing (EMDR) has become a leading method of intervention with trauma and PTSD with effective results in an extremely short time.	2007	natural
The distinction between intrusive memories and rumination is of clinical importance as intrusive memories usually decrease with imaginal reliving of the trauma, whereas rumination may require different therapeutic strategies, such as rumination-focused or mindfulness-based cognitive therapy.	2007	natural
This article is part of a life story inquiry of how people make meaning of their past drug abuse in terms of childhood loss and trauma.	2007	natural
Thirty-four children with a history of interpersonal trauma and no initial diagnosis of anxiety disorder participated in the study.	2005	natural
Forgiveness is associated with lower levels of stress, but not trauma, perhaps because trauma is an extreme form of stress.	2005	natural
We studied 111 patients admitted to the gambling treatment program at the Brecksville VA Medical Center and found that 64 of gamblers reported a history of emotional trauma; 40.5, physical trauma; and 24.3, sexual trauma.	2006	natural
Despite these consistent findings, the mechanism for the increased risk of obesity following developmental trauma is unknown.	2009	natural
Evaluating this decline after pediatric blunt hepatic trauma could establish parameters for estimating the time of inflicted injuries.	2008	natural
Perhaps the major challenge is to achieve a caring environment for children who have experienced trauma and much change.	2007	natural
This study specifically examined the influence of family cohesion and adaptability on college students' trauma symptoms and psychological well-being in a sample of 189 undergraduate students.	2007	natural
Implications of these findings for developing trauma research protocols are discussed.	2008	natural
The findings showed that, after controlling for an indicator of trauma severity, (a) higher neuroticism individuals reported more PTSD symptoms, depression symptoms, and somatic problems after negative events, and (b) these relationships disappeared after controlling for pre-trauma symptoms.	2009	natural
Results indicated that the time since the most recent trauma moderated the association between cortisol and PTSD symptoms and comparisons indicated that there were significant differences in the size of the correlations across the recent and distal trauma groups.	2007	natural
The tragic events of 9/11 were experienced as an overwhelming individual trauma for those closest to the attacks and as a disorienting collective trauma for the nation as a whole.	2006	natural
Although many reliable and valid assessment instruments are available in the trauma field, comparison across trauma studies is made difficult by the differing methodologies and assessment techniques.	2005	natural
Exposure to early trauma has frequently been linked to adult psychopathology, including personality disorders.	2008	natural
Threat appraisal and defensive coping may play crucial roles in determining the neuroendocrine response to trauma with potential mental_health consequences, particularly PTSD.	2005	natural
Parental support was only associated with the Dissociation and was not found to account for variance in relation to trauma symptoms.	2008	natural
This meta-analysis of 58 resting baseline studies, 25 startle studies, 17 standardized trauma cue studies, and 22 idiographic trauma cue studies compared adults with and without posttraumatic stress disorder (PTSD) on psychophysiological variables: facial electromyography (EMG), heart rate (HR), skin conductance (SC), and blood pressure.	2007	natural
According to betrayal trauma theory, adult survivors of childhood sexual abuse (CSA) who were molested by their caretakers (e.g., a father) are especially likely to dissociate (repress) their memories of abuse.	2005	natural
The main focus of this article is on the description of 3 qualitative studies on birth trauma, posttraumatic stress disorder due to birth trauma, and the anniversary of a traumatic birth.	2009	natural
The results support a diathesis stress model in which high trait anxiety interacts with trauma exposure in the elicitation of anxiety-related distress but the study needs to be replicated before further conclusions can be drawn.	2008	natural
We recommend group treatment in three stages and suggest that art therapists who treat combat-related PTSD receive specialized training in trauma intervention and PTSD theory.	2006	natural
The scales were highly associated with equivalent scales of the Childhood Trauma Questionnaire (i.e., good convergent validity), and showed good correspondence with patient file information (i.e., good criterion validity).	2009	natural
I conclude that trauma theory and theology are not antithetical disciplines, and a consideration of both brings greater insights than the disciplines considered alone.	2008	natural
Dissociative identity disorder and borderline personality disorder resemble each other in trauma histories and comorbidity.	2005	natural
These results call into question the role of A1 trauma criterion and the definition of traumatic events.	2009	natural
Accident and emergency departments and trauma surgeons are not only in a position to provide more accurate information on the nature and extent of clinically significant injury, but they can contribute substantially to violence prevention.	2007	natural
The sample consisted of 102 individuals who met strict criteria for an eating disorder, and who were interviewed regarding trauma history and comorbid impulsive behaviours.	2007	natural
