Results provide new insight into the process by which children reveal interpersonal trauma and have implications for debates concerning the credibility of child sexual abuse allegations and treatment in dependency samples.	2007	natural
After controlling for other 18 demographics, delinquent history, commitment offense type, and comorbid psychiatric symptoms that are consistent with the importation model of inmate behavior, the authors found that wards with greater exposure to early life trauma evinced more sexual misconduct, suicidal activity, and total misconduct reviewed by the parole board.	2009	natural
To date, research on the psychosocial consequences of mass trauma resulting from war and organized violence on children has primarily focused on the individual as the unit of treatment and analysis with particular focus on mental_disorders caused by traumatic stress.	2008	natural
Is it realistic to expect women who have suffered early childhood trauma to have developed this capacity within such a short time?	2007	natural
Findings suggest that, as predicted by betrayal trauma theory, women who have experienced high-betrayal abuse show alterations in automatic emotional processes consistent with caregiving-maintenance goals in an abusive environment.	2009	natural
This case illustrates powerfully the impact of trauma in the parents' backgrounds on the internal world of the child, and how the method provides a useful bridge between parent and child work.	2007	natural
In recent years, researchers and clinicians have begun to examine how individual exposure to traumatic stress affects the spouses/partners, children, and professional helpers of trauma survivors.	2005	natural
A clinical vignette illustrates the turning of trauma's imperative for witnessing into an address in the analytic encounter.	2009	natural
This paper considers Freud's concept of trauma and its resonances in contemporary cultural discourse, focusing on the complex temporality and the unknowable dimension of traumatic experience.	2006	natural
Eschewing a clinical interview to assess the impact of interpersonal trauma in older adult women may be a mistake.	2008	natural
To improve outcomes following a workplace trauma, the Workers' Compensation Board of Alberta (WCB-AB) has developed and implemented an evidence-based care model (CM) to assist its staff to manage these claims.	2006	natural
Third, this article encourages expanding psychology's role beyond the treatment of trauma to encompass disaster planning and mitigation efforts from a broader public health perspective.	2007	natural
The present study examined latent class trajectories of posttraumatic stress disorder (PTSD) and associations between demographics, prior trauma, and reason for referral on class membership.	2009	natural
Trauma generates the lies and hiddenness as a means of coping with abuse and indifference.	2005	natural
This study evaluates the post-traumatic and post-operative release kinetics of S-100B in 45 trauma victims without head injury.	2006	natural
A systematic review of the literature on mental_disorder in prisoners, published in 2002, made no mention of post-traumatic stress disorder (PTSD), but indicators from other studies suggest that a history of serious and chronic trauma is common among offenders.	2007	natural
Trauma' is a twofold concept in that it relates to mental experience and links an external event with the specific after-effects on an individual 's psychic reality.	2008	natural
She lived in a world of concrete symbols, her primary process damaged such that she could not create generative symbols to process her trauma.	2008	natural
Twin models were fit to estimate the genetic and environmental variance common and specific to Diagnostic and Statistical Manual of Mental Disorders, Revised Third Edition, lifetime diagnoses of PTSD, combat trauma, and 3 comorbid conditions: ND, AD, and MD.	2008	natural
The results show, as hypothesized, that the dreams of children exposed to severe military trauma incorporated more intense and more negative emotional images.	2008	natural
Unexpectedly, two subjects with no history of oral trauma demonstrated abnormally deficient (4 S.D. below the mean) cool threshold detection abilities for the tongue, suggesting that there may exist subjects in the population who have profoundly poor lingual temperature processing.	2006	natural
Three processes were isolated consistent with Cognitive-Behavioral models of trauma: exposure, devaluation, and benefit-finding.	2006	natural
Increased incidence of other disorders following trauma exposure occurs primarily among trauma victims with PTSD.	2009	natural
In the 16 of the sample who reported trauma exposure and poly-substance use, the trauma occurred after the onset of all substance use, with the exception of crack cocaine use.	2006	natural
The September Issue of Jerhre Features four themes: Experiments that IRBs might conduct to evaluate alternative candidates for best IRB practices; Ways of learning and respecting the values of research participants, with special focus on participants from traditional cultures; Evidence-based assessment of the emotional risk inherent in research on trauma and other kinds of research that may produce an emotional response; and Procedures for sharing data and solving problems of disclosure risk while retaining analytical usefulness of the data.	2006	natural
Data collected from survivors of serious motor vehicle trauma (N=458) were used to test the hypothesis that severity of PTSD would hold a significant indirect relationship with social support through negative network orientation.	2009	natural
With the intention to generalize these thoughts to all genocide allowing for their variances focusing on the Holocaust, the most studied of genocides, much is said about the horrors it has and continues to visit on victims, the traumatic consequences that follow from this genocide, the chosen trauma it has become for the thenvictimized society.	2009	natural
Her major goal for therapy was to get help in achieving her lifelong dream of becoming an artist, a dream that was initially interrupted by rape trauma and that had subsequently been difficult to attain because of psychological factors.	2006	natural
Our cross-sectional study provides further evidence that social acknowledgment should be regarded as a protective or resource factor in the aftermath of trauma.	2009	natural
37 patients (50) reported no trauma, 22 patients (29.7) experienced traumatic events without diagnosis of PTSD and 15 patients (20.3) had comorbid PTSD.	2009	natural
This article focuses on what workplace violence and trauma includes, the effects of repeat events, how resilient people are while trying to prevent additional events if possible in the workplace.	2006	natural
This may particularly be true for patients with panic disorder with agoraphobia (PDA) as a first panic attack resembles trauma.	2009	natural
The authors investigated the association among gender and trauma type and risk of PTSD among people living within an area of conflict.	2009	natural
The risk factors with the strongest unique influence on depression were from early adolescence: neuroticism, low self-esteem, anxiety; from late adolescence: trauma; and history of depression.	2009	natural
The evidence suggests that dissociation needs to be considered in the context of other factors in the aftermath of trauma if optimal identification of high-risk individuals is to be achieved.	2005	natural
During EMDR processing, the client demonstrated emotional and cognitive changes consistent with trauma resolution, insight, and personal growth.	2007	natural
Twenty-nine women participated in a 12-week psychoeducational trauma and abuse intervention program called Esuba.	2009	natural
Over the course of such treatment many challenging ethical areas surface including transference/counter-transference problems, evocative and provocative behaviors in clients, questions of therapist self-disclosure, confidentiality concerns, trauma reenactment possibilities, boundary issues, dual relationship questions, competence issues, diagnostic dilemmas, and fees problems.	2009	natural
Female entertainers employed by Western allied forces during the Vietnam conflict completed the Posttraumatic Stress Checklist-Military (PCL-M), the Revised Impact of Event Scale (IES-R), and the General Health Questionnaire (GHQ-12) in response to war zone exposure categories of life threat, sexual discrimination and abuse, and personal trauma.	2009	natural
Instead, memories for sexual trauma were associated with a remarkably high level of vividness, detail, and sensory components.	2008	natural
While there has been a growing interest in the presentation of Bipolar Disorder (BD) in children and adolescents, few studies have investigated the psychosocial functioning of these individuals and its relationship to trauma and suicidal ideation.	2006	natural
These data suggest that a general factor associated with various forms of trauma predicts number of psychophysiological and pain disorders and that a specific predictor may be witnessing violence in childhood.	2006	natural
An overview of children's normal age-related responses to bereavement and of the special circumstances of trauma and grief provides the foundation for understanding the unique family and community stressors of 9/11 that impacted the children and group leaders.	2005	natural
Trauma focused cognitive behavioural therapy (TFCBT) is recommended as a first line treatment for post traumatic stress disorder (PTSD).	2006	natural
This case study of a 5monthold infant describes the symptoms of trauma following a surgical procedure (cranial remodeling) with shortterm hospital stay.	2007	natural
Birth mothers who retained custody of their infants had higher demographic risks and perinatal risks, higher childhood trauma, and higher psychiatric symptoms compared to birth mothers who did not use cocaine and non-parental caregivers of cocaine-exposed infants.	2007	natural
The authors review issues such as the high correlations between pseudoneurological and dissociative symptoms, the high rates of trauma reported for both groups, and the position that these phenomena share underlying processes.	2007	natural
The purpose of the study was to investigate the prevalence of posttraumatic stress disorder (PTSD) after prolonged intensive care unit (ICU) treatment and to study the differences between trauma patients and patients who were admitted with other diagnoses.	2006	natural
This article describes a new easy-to-administer and understand, interview-based instrument that systematically and comprehensively assesses a person's Lifetime Trauma and Victimization History (LTVH).	2005	natural
This article briefly reviews the multiple moderating factors that help account for the divergent patterns in HPA function as well as methodological advances that will continue to improve the assessment of HPA function in youth exposed to violence and trauma.	2005	natural
Military personnel returning from Iraq and Afghanistan have been exposed to physical and emotional trauma.	2009	natural
The meaning making model of adjusting to highly stressful events is widely accepted among stress and trauma researchers.	2008	natural
These problems are discussed in relation to experiences of fragmented memories in trauma within the context of ICS.	2008	natural
Extralegal factors, such as individual characteristics (e.g., race/ethnicity, gender, and mental_health and trauma histories) and social/environmental characteristics (e.g., family conflict, unmet service needs, and prior social service use) influenced how youth traveled across the sectors of care.	2008	natural
Psychosocial trauma has definite roots, and destroys our inner worldthe world of our most valuable meaningsinfects our minds with hate against others, and breaks the social fabric we belong to.	2006	natural
Western treatment protocols for psychological trauma often prescribe recitation of narratives, despite evidence that the human brain's storage of traumatic memories undermines verbalization.	2009	natural
Cambodian adolescent/caregiver dyads (n=288) were examined for links between caregiver trauma history and adolescent academic achievement, using self reports of adolescents' relationships with caregivers, caregivers' reports of trauma history and symptoms (Harvard Trauma Questionnaire), and school records of adolescents' academic achievement.	2009	natural
Differences were found in trauma symptoms between abstainers, moderate drinkers, and heavy drinkers, with heavy drinkers reporting more severe symptoms.	2007	natural
This study aimed to investigate the emotions and cognitions contained in hotspots of memory for trauma, as well as their associated images.	2005	natural
The model employs a systems theory framework within which therapeutic tasks that facilitate recovery from trauma are offered.	2005	natural
By reducing violence and trauma, and by providing appropriate psychological support to trauma survivors, we may be able to reduce rates of IED.	2009	natural
The aim of this research was to investigate trauma symptomatology specifically related to perpetrating a violent offence in a sample of mentally disordered offenders.	2008	natural
Third, the relationship between trauma and meaning is assessed in three age cohorts: the young-old, the old-old and oldest-old.	2005	natural
We examine one particular (and, we believe, important) aspect of PTSD: The creation and maintenance of causal attributions about trauma.	2006	natural
Data were collected from a treatment-seeking sample of trauma victims (n=158) and a college sample (n=178).	2006	natural
Directive leadership was more effective when trauma severity was high or when the team was inexperienced.	2005	natural
Anxiety, helplessness, numbness, and threat were greater at the time of the trauma than when experiencing the intrusive memory.	2007	natural
The literature on vicarious traumatization has suggested that traumasensitive supervision may help to minimize the effects of vicarious exposure to trauma; however, nothing from the perspective of trauma counselors was noted.	2005	natural
In reviewing the historical underpinnings and contextual nature of phenotype, it is hoped that the reader will gain a greater appreciation of the role of phenotype in the lives of Puerto Ricans and understand how phenotype, and, most importantly, historical trauma can be related to a host of psychological concerns.	2008	natural
The current paper reviews the psychological impact of chronic interpersonal violence and the relevant literature regarding group therapy for trauma survivors.	2007	natural
At treatment entry, nearly all participants reported lifetime trauma exposure, and over one third met criteria for posttraumatic stress disorder (PTSD).	2009	natural
Significant improvement in the Sojourners was observed in trauma symptoms, emotional well-being, cancer self-efficacy, and desire for information on breast cancer resources.	2006	natural
A recent review article on panic disorder in this journal brought together Freudian psychoanalysis, studies of classical conditioning, neurobiological research, developmental research showing the effects of early trauma, and PTSD research.	2007	natural
Memory fragmentation was associated with participants indicating that they provided more incoherent accounts of trauma during police interview.	2009	natural
The goal of this study was to understand better the risk of compassion fatigue (the trauma suffered by the helping professional) and burnout (emotional exhaustion, depersonalization, and reduced sense of personal accomplishment), and the potential for compassion satisfaction (the fulfillment from helping others and positive collegial relationships) among Colorado county child protection staff using the Compassion Satisfaction/Fatigue Self-Test [Figley, C. R., & Stamm, B. H. (1996).	2006	natural
The discovery of the compulsion to repeat instituted a paradigmatic shift in Freud's formulations, emphasizing the process of repetition of trauma, and instituting a link between the network of concepts indicated above.	2007	natural
Trauma generates the lies and hiddenness as a means of coping with abuse and indifference.	2005	natural
This comment traces the historical and theoretical foundations that underlie the concept of secondary trauma (i.e., compassion fatigue) and discusses the implications for family psychology practice in helping veterans and their families recover from their ordeals.	2005	natural
Finally, a broader view of outcome assessment in such research is called for, including not just reduction in psychopathological symptoms but attention to coping styles, affect management, resilience, social reorganization, and sensitivity to subsequent trauma.	2005	natural
Poly-victimization was highly predictive of trauma symptoms, and when taken into account, greatly reduced or eliminated the association between individual victimizations (e.g., sexual abuse) and symptomatology.	2007	natural
Specifically, the authors hypothesized that experiences associated with natural disaster including personal loss, separation from family and/or community, and lack of community support as well as previous loss or trauma would be related to increased symptomatology in both children and adolescents.	2009	natural
Level of trauma symptoms correlated positively with perception of benefit, and experiencing a previous trauma also correlated positively with perceived benefits.	2006	natural
Findings suggest that multiple factors influence perspectives on addressing trauma among individuals with HIV and CSA, and that resiliency might influence these attitudes.	2006	natural
Analysis of the Trauma Symptom Inventory (TSI; Briere, 1995) clinical subscales confirmed that women who reported coerced sexual intercourse endorsed symptoms levels more consistent with the adult rape group than with the non-victim group.	2006	natural
The results show, as hypothesized, that the dreams of children exposed to severe military trauma incorporated more intense and more negative emotional images.	2008	natural
This case study describes the treatment of an individual with Posttraumatic Relationship Syndrome (PTRS), a newly proposed mental_health syndrome that occurs subsequent to the experience of trauma in an intimate relationship.	2006	natural
Findings suggest that, as predicted by betrayal trauma theory, women who have experienced high-betrayal abuse show alterations in automatic emotional processes consistent with caregiving-maintenance goals in an abusive environment.	2009	natural
One-hundred and ninety-two incarcerated women who were participating in a trauma and abuse psychoeducation program were evaluated for childhood abuse, maltreatment and current dissociative symptoms.	2007	natural
A discussion of the special dynamics of trauma groups and important considerations for group conducting follows and the issue of vicarious traumatization for the group conductor is addressed.	2005	natural
Interventions to improve asthma outcomes should include assessment and treatment of trauma and PTS symptoms.	2006	natural
Fortunately, advances in videoconferencing-based technologies are improving rural trauma survivors' access to remote specialty clinics, thereby allowing access to optimal treatments for PTSD.	2009	natural
This article presents a reconceptualization of trauma in terms of the damage it inflicts on the patient's conception of his or her world.	2009	natural
Information on children's mental_health needs was obtained from the Child Behavior Checklist and Trauma Symptom Checklist.	2007	natural
Throughout, my thoughts are informed by our clinical experience with the essential role of witnessing in sustaining life after massive trauma.	2009	natural
The students completed questionnaires on sociodemographic data followed by the Trauma Checklist and the Child PTSD Checklist.	2007	natural
Four dominant categories emerged: Negative consequences of sexual trauma, Becoming a survivor, Pregnancy: A new beginning beyond sexual trauma, and the Integration of sexual trauma and motherhood.	2009	natural
First, the characteristics of intrusions and related phenomena, such as appraisals of the trauma and maladaptive thought control strategies are reviewed.	2009	natural
Among students with the lowest number of additional traumas, the usual dose-response pattern of increasing PTSD symptoms with increasing 9/11 exposure was observed; among those with medium to high cumulative life trauma, PTSD symptoms were substantially higher and uniformly so regardless of 9/11 exposure dose.	2008	natural
After controlling for PTSD, depression, panic and substance use disorders, and pre-9/11 trauma, patients who screened positive (vs. negative) for GAD symptoms were roughly twice as likely to report having a loved one at the 9/11 disaster site, twice as likely to know someone who was killed by the attacks, and twice as likely to know someone who was involved with the rescue/recovery efforts after the disaster.	2009	natural
Since maltreatment is a sensitive topic that is not reported on easily, trauma interviews are promising assessment instruments since they provide the opportunity to probe and clarify.	2009	natural
In addition, findings from three cases of individuals with severe brain trauma will be presented to show the influence of brain trauma on baseline cerebrovascular parameters measured by fMRI.	2007	natural
Front-line workers, advocates, researchers and correctional officials in Canada, the U.S. and the U.K. have recognized the high proportion of imprisoned women who have experienced childhood sexual abuse and have called for the development of appropriate prison counseling services that take into account women's histories of trauma (Battle et al.,	2007	natural
These findings indicate the importance of considering the psychological consequences of trauma during both assessment and treatment of the eating disorders.	2007	natural
Findings from a nationwide United States survey reveal that trauma arising between the ages of 18 and 30 years is associated with a diminished sense of meaning in life, and that current emotional support reduces the effects of trauma on meaning, whereas negative inter-personal contacts tend to intensify the pernicious effects of trauma on meaning in life.	2005	natural
No previous study has investigated the association between early trauma and suicidal behavior in medical students.	2009	natural
In the hospital sample, the protective effect of the rs110402 A-allele against developing depression after childhood trauma was observed in men (N = 424), but not in women (N = 635).	2009	natural
With a sample of 120 Gulf War veterans, the present study investigated the main effects of childhood and lifetime trauma, combat exposure, and coping strategies on posttraumatic stress disorder (PTSD), as well as combat exposure's moderating effects on the other variables' relationships with PTSD.	2005	natural
Uncertainty persists about the impact of trauma on the long-term mental_health of resettled refugees.	2007	natural
Civilian trauma survivors with PTSD, trauma survivors with no PTSD and non-trauma-exposed control participants (N = 49) provided autobiographical memories of events that they believe shaped who they are.	2005	natural
Both men had experienced overwhelming loss and trauma.	2009	natural
When examined with combat exposure, childhood trauma has a complex relationship to PTSD severity.	2009	natural
Non-clinical psychotic experiences were strongly and independently associated with both bullying (OR=2.9, 95 CI 1.8-4.8) and sexual trauma (OR=4.8, 95 CI 2.3-10.1).	2006	natural
Results from this and other studies suggest that the occurrence of defects in HPA function in PTSD may be specific responses to particular combinations of trauma type, genetic susceptibility, and individual history.	2009	natural
This meta-analysis of 58 resting baseline studies, 25 startle studies, 17 standardized trauma cue studies, and 22 idiographic trauma cue studies compared adults with and without posttraumatic stress disorder (PTSD) on psychophysiological variables: facial electromyography (EMG), heart rate (HR), skin conductance (SC), and blood pressure.	2007	natural
The mimetic phenomena enacted with an older brother and at the kindergarten are found to result from cumulative trauma at her contacting a loving but mind-blind mother.	2005	natural
The authors describe how the Poisson regression method for analyzing count or frequency outcome variables can be applied in trauma studies.	2008	natural
The field of traumatic stress is poised to integrate, more fully than in the past, a variety of aspects of trauma such as social betrayal, as well as outcomes of trauma such as depression, criminality, and physiological harm that go beyond posttraumatic stress.	2005	natural
This study indexed the extent to which deficits in extinction learning before trauma exposure are a risk factor for persistent posttraumatic stress after trauma exposure.	2006	natural
The findings are consistent with Finkelhor and Browne's (1986) traumagenic model, which suggests that the experience of child sexual abuse often results in feelings that interfere with one's cognitive development and emotional orientations to the world and causes trauma by distorting the victim's self concept and worldview.	2007	natural
HIV prevention efforts targeting adults with SMI must occur on multiple levels (e.g., individual, group, community, structural/policy), address several domains of influence (e.g., psychiatric illness, trauma history, social relationships), and be integrated into existing services (e.g., psychotherapy, substance abuse treatment, housing programs).	2005	natural
Support or regularly scheduled reflective supervision as well as selfcare is crucial for those who work with trauma.	2009	natural
