This study specifically examined the influence of family cohesion and adaptability on college students' trauma symptoms and psychological well-being in a sample of 189 undergraduate students.	2007	natural
Implications of these findings for developing trauma research protocols are discussed.	2008	natural
The findings showed that, after controlling for an indicator of trauma severity, (a) higher neuroticism individuals reported more PTSD symptoms, depression symptoms, and somatic problems after negative events, and (b) these relationships disappeared after controlling for pre-trauma symptoms.	2009	natural
Results indicated that the time since the most recent trauma moderated the association between cortisol and PTSD symptoms and comparisons indicated that there were significant differences in the size of the correlations across the recent and distal trauma groups.	2007	natural
The tragic events of 9/11 were experienced as an overwhelming individual trauma for those closest to the attacks and as a disorienting collective trauma for the nation as a whole.	2006	natural
We found there is little consensus over measures used within each trauma domain.	2006	natural
Although many reliable and valid assessment instruments are available in the trauma field, comparison across trauma studies is made difficult by the differing methodologies and assessment techniques.	2005	natural
Exposure to early trauma has frequently been linked to adult psychopathology, including personality disorders.	2008	natural
Threat appraisal and defensive coping may play crucial roles in determining the neuroendocrine response to trauma with potential mental_health consequences, particularly PTSD.	2005	natural
Parental support was only associated with the Dissociation and was not found to account for variance in relation to trauma symptoms.	2008	natural
We conclude that research on the subject of treatment for pediatric PTSD following single-incident trauma constitutes a neglected part of the study of pediatric PTSD.	2005	natural
This meta-analysis of 58 resting baseline studies, 25 startle studies, 17 standardized trauma cue studies, and 22 idiographic trauma cue studies compared adults with and without posttraumatic stress disorder (PTSD) on psychophysiological variables: facial electromyography (EMG), heart rate (HR), skin conductance (SC), and blood pressure.	2007	natural
Women did better with integrated treatment and with mandated treatment regardless of treatment condition for psychiatric, trauma, and substance use outcomes at both follow-ups.	2009	natural
Some people remain affected for considerable periods of time, but others are able to adjust relatively quickly, and some even go on to report experiencing positive personal changes as a result of experience of trauma.	2005	natural
The findings underscore the importance of evaluating both the psychological and physiological effects of trauma, even in the absence of a diagnosis of PTSD.	2009	natural
Overall, caregiver trauma predicted caregiver education, which then predicted caregiver warmth, but not adolescents' academic achievement.	2009	natural
According to betrayal trauma theory, adult survivors of childhood sexual abuse (CSA) who were molested by their caretakers (e.g., a father) are especially likely to dissociate (repress) their memories of abuse.	2005	natural
The main focus of this article is on the description of 3 qualitative studies on birth trauma, posttraumatic stress disorder due to birth trauma, and the anniversary of a traumatic birth.	2009	natural
The authors investigate how trauma counselors can use stories in supervision to help diminish the effects of vicarious traumatization.	2006	natural
This study tested the hypothesis that trauma memories are disjointed from other autobiographical material in posttraumatic stress disorder (PTSD).	2008	natural
A novel task designed to assess nonautobiographical memory for content and order information was administered to trauma survivors with (n = 26) and without PTSD (n = 55) as well as to nontraumatized healthy adults (n = 30).	2009	natural
The purpose of this study is to explore the effectiveness of a group trauma and abuse intervention for prostituted women from two settings, prison and a community exiting program.	2009	natural
The results support a diathesis stress model in which high trait anxiety interacts with trauma exposure in the elicitation of anxiety-related distress but the study needs to be replicated before further conclusions can be drawn.	2008	natural
One hundred twenty-four caregivers completed the Adult Attachment Interview (AAI) and a lifetime trauma interview during the age 13 wave of the study.	2009	natural
We recommend group treatment in three stages and suggest that art therapists who treat combat-related PTSD receive specialized training in trauma intervention and PTSD theory.	2006	natural
The scales were highly associated with equivalent scales of the Childhood Trauma Questionnaire (i.e., good convergent validity), and showed good correspondence with patient file information (i.e., good criterion validity).	2009	natural
I conclude that trauma theory and theology are not antithetical disciplines, and a consideration of both brings greater insights than the disciplines considered alone.	2008	natural
Dissociative identity disorder and borderline personality disorder resemble each other in trauma histories and comorbidity.	2005	natural
These results call into question the role of A1 trauma criterion and the definition of traumatic events.	2009	natural
Accident and emergency departments and trauma surgeons are not only in a position to provide more accurate information on the nature and extent of clinically significant injury, but they can contribute substantially to violence prevention.	2007	natural
The results suggest that the psychobiological consequences of exposure to the same traumatic event may differ as a result of an interaction between age and the composite history of trauma exposure.	2007	natural
When there is enough recovery, the protective collusion is undone and the trauma is revived as acute enactment.	2008	natural
During EMDR processing, the client demonstrated emotional and cognitive changes consistent with trauma resolution, insight, and personal growth.	2007	natural
The sample consisted of 102 individuals who met strict criteria for an eating disorder, and who were interviewed regarding trauma history and comorbid impulsive behaviours.	2007	natural
The findings suggest the importance of adapting models of residential substance abuse treatment to address concurrent issues related to trauma history.	2008	natural
The meaning making model of adjusting to highly stressful events is widely accepted among stress and trauma researchers.	2008	natural
Contrary to predictions, the two groups did not differ on measures hypothesized to influence suppression ability, but within group correlations indicated tentative support for mood states and prior trauma being related to autobiographical intrusions.	2007	natural
Initially recalling the trauma from an observer vantage point was related to more severe PTSD symptoms at that time and 12 months later.	2009	natural
As such, they may explain interindividual variation, as well as the long-lasting effects of trauma exposure.	2009	natural
This study explores such relationships using measures of religious action and behaviors in a community sample of 327 church-going, self-identified trauma survivors.	2008	natural
Participants included 317 Bedouin men serving in the Israeli Defense Forces (IDF), who disclosed extensive trauma and loss.	2007	natural
In conclusion, partial PTSD did not differ significantly from full PTSD in terms of duration, comorbidity, and dysfunction, but they differed markedly in terms of associated trauma types.	2007	natural
Most of these proteins expressed in a fluctuant fashion within 18 hours after trauma, with mean levels lower than control.	2009	natural
Our findings suggest that specific disorders are linked to interpersonal trauma and PTEs that occur in childhood rather than later in life.	2008	natural
Exposure to community violence and partner violence were associated with increased reporting of trauma symptoms.	2005	natural
The addition of the remaining cognitive factors assessing subjective appraisals of the trauma and cognitive coping style resulted in the model accounting for 61-65 of the variance of post-traumatic stress disorder (PTSD) symptoms 8 months post trauma.	2007	natural
This article examines the reality of trauma in our world and the possibility of utilizing forgiveness as a therapeutic tool to enable victims to transform the wounds of trauma.	2006	natural
The measure could be readily adapted for other populations of children experiencing trauma.	2007	natural
Previous cluster analysis research of exposed youth was extended to include youth PTSD symptoms and trauma history.	2008	natural
Results suggest that trauma as a set, as well as being the victim of a violent crime, are significantly related to future violent behavior.	2005	natural
Therefore, the current study examines how trauma, severe stressful events, posttraumatic stress disorder (PTSD), and depressive symptoms are related to physical functioning and health utilization in HIV-infected men and women living in rural areas of the South.	2005	natural
There are hardly any well-validated trauma interviews available that assess the extent of maltreatment in and outside the family in various dimensions.	2009	natural
This study was designed to evaluate attitudes toward and utilization of evidence-based practices (EBPs) among mental_health professionals specializing in trauma.	2007	natural
Our objectives in the study were first, to examine the rates of exposure to childhood, adult and lifetime (child plus adult) trauma in a population with schizophrenia and a population with non-psychotic psychiatric diagnoses and second, to examine the effect of trauma on the symptoms of schizophrenia.	2006	natural
Thirteen patients scored above the cut-off on the trauma measure, indicating a high rate of trauma symptoms.	2008	natural
The current study examines qualitative interview data from 17 individuals, analyzed using a retroductive methodology to identify how intimate relationships are affected when there is a history of trauma exposure.	2006	natural
Further, data suggested that these four trajectories were related in theoretically meaningful ways to pre-treatment variables, such as anaclitic and introjective personality styles and trauma.	2009	natural
Current knowledge about cultural differences in the trauma autobiographical memory is limited.	2009	natural
Research suggests victims experience both short-term and long-term effects due to the unresolved trauma of sexual abuse.	2006	natural
Implications of the findings for trauma research and practice are discussed.	2009	natural
Results suggest that different trauma types lead to unique variants of the PTSD syndrome, which may result from different etiological factors and may require different treatment approaches.	2009	natural
Little is also known about resilience and strengths that may mitigate or prevent the risk of intergenerational transmission of trauma.	2008	natural
Simultaneous multiple regression analyses were used to examine relationships between gender, age, maltreatment history, and vicarious trauma.	2007	natural
We are beginning to understand the underlying molecular programming of the stress-response system, which may mediate the destructive long-term effects of cruelty to children, explain the evolutionary stability of cruelty, and provide opportunities for its reversal of early trauma.	2006	natural
A study of trauma was conducted by asking 782 nurses to complete a questionnaire.	2009	natural
Among the plausible arguments are differences in the types of trauma experienced, inflated rates due to methodological gender bias, socially defined social roles and confounding stressors, biological differences, and differences in cognitive perceptions of traumatic events.	2007	natural
Neither severity of interparental violence nor maternal trauma symptoms was related to child behavior problems.	2006	natural
First, the characteristics of intrusions and related phenomena, such as appraisals of the trauma and maladaptive thought control strategies are reviewed.	2009	natural
Assimilation analysis, a method for tracking client movement in psychotherapy, was used to document changes in dominant and submissive voices during clients' disclosure of the trauma.	2009	natural
In the real world, false memories involving trauma and abuse have resulted in real-life consequences.	2009	natural
Early exposure to assaultive trauma can influence risk for depression into adulthood.	2009	natural
The cause of HFP was perineal and/or genital trauma in 5 cases.	2008	natural
No significant differences in socially related fear (i.e., fear of negative evaluation, fear of socially observable arousal symptoms) were found between participants reporting assaultive or nonassaultive trauma.	2009	natural
As for the degree of satisfaction during sexual relationships before and after the diagnosis, about 60 of paraplegic men declare they were highly satisfied before the trauma, whereas today only 30 still are.	2008	natural
We assess the potential of a panel of serum biomarkers to identify chronic neuronal injury in amateur boxers as compared to healthy controls without any history of head trauma.	2009	natural
Trauma generates the lies and hiddenness as a means of coping with abuse and indifference.	2005	natural
Psychoanalytic opinion continues to be dichotomized in regard to the role of trauma versus intrapsychic conflict as contributing to pathogenesis.	2008	natural
The 3 patients improved enduringly, confirming earlier findings that exposure to the main trauma is not essential for PTSD to improve.	2005	natural
Subjects were administered with the Childhood Trauma Questionnaire (CTQ), the Dissociative Experiences Scale (DES) and the White Bear Suppression Inventory (WBSI).	2009	natural
Sixty percent of them reported experiencing more than one probable trauma.	2007	natural
The events of 9/11 and the widening impact of psychological trauma today have raised a higher level of awareness about the potentially deleterious effects of psychological trauma on the individual.	2005	natural
Processing of trauma history must become a major therapeutic component, and differential treatment plans for women and men and different ethnic groups should be developed.	2006	natural
Though delirium has consistent core clinical features, it has a very wide range of precipitating factors, including acute illness, surgery, trauma, and drugs.	2008	natural
However, there has been almost no research on the resolution of moral dilemmas following exposure to severe trauma.	2007	natural
Terr's framework and data collected from the National Comorbidity Survey (NCS) are used to examine differences in personality between adult survivors of childhood Type I trauma, childhood Type II trauma, and a control group of adults not traumatized as children.	2007	natural
This review praises Bromberg's rich and evocative new book for its clinical and theoretical usefulness and elaborates on three broad themes: the analyst's personal role in traumatic enactments, dissociative/addictive uses of the body, and the distinction between life-threatening and developmental trauma.	2007	natural
The authors tested the feasibility to train therapists to run a protocol using HR to reduce negative thoughts associated with posttraumatic stress disorder (PTSD) in women veterans who have had sexual trauma or abuse.	2008	natural
WRAP draws from a Stage 1 treatment approach to address chronic interpersonal trauma and dissociation by incorporating psychopharmacology, individual and group psychotherapy.	2007	natural
The painting depicts the psychic representation of trauma in visual form and at the same time, the impossibility of representing trauma at all.	2007	natural
Data were obtained from the Israeli National Trauma Registry, and included injured children (0-17) hospitalized between 1997 and 2003, because of TV-related injury.	2007	natural
The authors report relationships between PTSD symptoms and objective sleep measures from the early aftermath of trauma.	2007	natural
These problems are discussed in relation to experiences of fragmented memories in trauma within the context of ICS.	2008	natural
This study examined the accuracy of the 17-item Dutch version of the Davidson Trauma Scale (DTS) and the four-item SPAN (Startle, Physiological Arousal, Anger and Numbness) to detect survivors at risk for posttraumatic stress disorder (PTSD) within the first 2 weeks after the trauma.	2008	natural
This was especially the case at 6 months for those with high pre-treatment levels of trauma.	2009	natural
The present study used a California Bay Area school-based sample of 307 adolescents to examine whether the relationship of trauma symptoms to delinquency is buffered by higher ethnic identity and whether this buffering effect is relatively more important for ethnic minorities than it is for Caucasians.	2008	natural
Overall, these results suggest that early emotional trauma may be related to personality dimensions associated with poor impulse control and interpersonal behavior.	2008	natural
In an analogue study, thought suppression and cognitive processing was manipulated in 4 experimental groups after participants (n=80) viewed a trauma film.	2009	natural
The trauma film paradigm provides a prospective experimental tool for investigating analogue peri-traumatic cognitive mechanisms underlying intrusion development.	2008	natural
In factor analysis, the 25 items of traumatic events experienced in North Korea were divided into three factors: Physical Trauma, Political-Ideological Trauma, and Family-Related Trauma.	2005	natural
Scores from five subscales correlated significantly with trauma severity as measured by the Harvard Trauma Questionnaire, although the magnitude of the correlations was low to modest, ranging from .08 to -.43.	2007	natural
The aim of this paper is to give an account of Ferenczi 's trauma theory as it emerges from his writings of 1931-32 and to specify the points on which he differs from Freud.	2009	natural
Vignettes of composite therapeutic conversations are included in the description of trauma model therapy.	2008	natural
The study provides initial data that support recent work in the trauma field with nonathletes, indicating that contextualized, traumabased assessment and intervention is an appropriate therapeutic approach when working with athletesurvivors of childhood sexual abuse.	2008	natural
While the case takes place in an unusual setting and the patient represents a special population, the therapeutic intervention dramatically reveals therapeutic opportunities which clinicians may integrate in many other cases and settings where trauma is treated.	2009	natural
Rates of trauma exposure in South African children and adolescents range from 40 to 100 and rates of PTSD range from 6 to 22.	2005	natural
Research into this phenomenon has often disregarded the voices of those affected by the trauma and do not give an insider's perspective on the process through which a person with a brain injury develops awareness of their difficulties.	2006	natural
With regard to third generation traumatization, various reports suggest the presence of intergenerational transmission of trauma.	2008	natural
Substance use is significantly associated with physical injury, yet relatively little is known about the prevalence of specific substance use disorders among trauma patients, or their associated sociodemographic characteristics.	2007	natural
Therefore, the goal of this article is to address this shortcoming within the literature by responding to three important questions: (a) What is the most important thing we have learned about violence and trauma in the past 20 years? (	2005	natural
We propose that Pennebaker's work on structured disclosure of trauma provides a suitable analogue to explore questions of interest.	2006	natural
Relevant psychological perspectives on stress, loss, and trauma can therefore usefully illuminate specific biblical events.	2008	natural
The present study examined self-reported romantic attachment style and Adult Attachment Interview (AAI) states of mind regarding early attachment relationships, personality dimensions, and psychopathology in a psychiatric sample of trauma survivors.	2007	natural
The amount of synergism was estimated from the additive statistical interaction between baseline cannabis use, childhood trauma and urbanicity on the one hand, and baseline psychotic experiences on the other, in predicting 3-year follow-up psychotic experiences, using data from two large, longitudinal, random population samples from the Netherlands [The Netherlands Mental Health Survey and Incidence Study (NEMESIS)] and Germany [The Early Developmental Stages of Psychopathology (EDSP) study].	2007	natural
Finally, drawing on other mixed methods designs available, several follow-up mixed methods studies were described for this sample study, enabling trauma researchers to view design options for applying mixed methods research in trauma investigations.	2009	natural
In this article, the authors discuss the interface between trauma exposure and participation in longitudinal research, before describing in detail a model to address those effects.	2006	natural
The main intervention consists of exposure to external trauma-associated cues (exposure in vivo) and to mental trauma reminders (exposure in sensu).	2008	natural
In a hierarchical regression analysis, trauma symptoms, ethnicity, and ethnic identity statistically interacted to predict delinquency, such that greater levels of ethnic identity were related to less delinquency in the face of increasing levels of trauma symptoms; this effect was especially important for ethnic minorities relative to Caucasians.	2008	natural
Theoretical questions raised by later authors, informed by clinical work with children who have suffered deprivation and trauma in infancy, are then considered.	2009	natural
Fourth, low self-control was overwhelmingly the strongest predictor of career criminality and far exceeded the impact of age, race, ethnicity, gender, socioeconomic status, mental_illness, attention deficit hyperactivity disorder diagnosis, and trauma experience.	2008	natural
This introduction briefly describes the articles that comprise this volume, emphasizing their status both as individually unique and worthwhile contributions to this literature and as a collection of works that speak powerfully to the promise of multi-cultural research and practice and to the need for a theoretical framework able to account for wide variations in individual expressions of psychological trauma, trauma recovery, and resilience.	2007	natural
Variability in reporting was associated with trauma type, a lifetime posttraumatic stress disorder, and antisocial personality disorder.	2007	natural
We review what is known about trauma and post-traumatic stress disorder following sexual abuse and explore the different treatment needs for these two survivor groups.	2008	natural
The present study examined latent class trajectories of posttraumatic stress disorder (PTSD) and associations between demographics, prior trauma, and reason for referral on class membership.	2009	natural
The LTVH inquires about 30 traumas and victimization experiences (including general traumas, physical assault/abuse, sexual assault/abuse, kidnapping/stalking, family/friend murdered or committed suicide, witnessed trauma to someone else, and crime victimizations) and age of onset, perpetrator, degree of danger and fear experienced, duration, and frequency of each experience.	2005	natural
Results suggest that level of distress after participating in trauma research was insufficient to reduce willingness for, or perceived benefit from, participation in trauma survey research.	2009	natural
A defensive organization arises to manage this trauma and its attendant revenge fantasies.	2006	natural
Therefore, the current study examines how trauma, severe stressful events, posttraumatic stress disorder (PTSD), and depressive symptoms are related to physical functioning and health utilization in HIV-infected men and women living in rural areas of the South.	2005	natural
In addition to carrying with them memories of untold trauma, they bring with them many special needs.	2006	natural
The patients were examined 3.2 2.5 h (mean SD) after their actual trauma and presented with modestly elevated concentrations of CRP (2.7 2.1 mg/L) as compared with the controls (2 2.2 mg/L).	2008	natural
Grandparents who raise their grandchildren reportedly endure high levels of stress, and grandchildren purportedly experience childhood trauma that can lead to poor psychological adjustment.	2006	natural
This response addresses methodological problems with the contest, explores examples of forgetting trauma from literature written before 1800, examines social and historical aspects of the issue, and summarizes the extensive cognitive and neurological data that Pope et al.	2009	natural
Simultaneous multiple regression analyses were used to examine relationships between gender, age, maltreatment history, and vicarious trauma.	2007	natural
Experience of at least one type of trauma was reported by 79.9 of subjects, and the most common forms of trauma were physical neglect, emotional abuse, and emotional neglect.	2007	natural
To explain variance in depression in students (N = 648) using a model incorporating sexual trauma, pessimism, and risky sex.	2009	natural
The authors differentiate two types of traumatic experience: trauma with agency and trauma without agency.	2009	natural
