M. Cloitre, K. Koenen, L. R. Cohen, and H. Han (2002; see record 2002-18226-001) presented results of a randomized trial that clearly demonstrate the safety and efficacy of a treatment program delivering skills training in affective and interpersonal regulation (STAIR) prior to conducting imaginal exposure (IE) to trauma memories for adults with posttraumatic stress disorder (PTSD) related to childhood abuse.	2004	natural
Comorbidity of substance abuse disorders (SUD) and psychiatric disorders is one of the most important areas of investigation in contemporary drug abuse treatment research.	2004	natural
Because their appropriations stemmed from a wider culture racked with inconsistencies about the proper treatment of animals, respondents' presentations of self were split between those who no longer spoke of abuse as fun and admonished themselves for having done this and those who still clung to the idea that harming animals was fun and were seemingly untroubled by their former acts.	2002	natural
Patients with PTSD/depressive disorder were more likely to use mental_health/substance abuse services, have longer lengths of stay, and report more psychological distress than others.	2003	natural
ACOAs appear at increased risk for a variety of negative outcomes, including substance abuse, antisocial or under-controlled behaviors, depressive symptoms, anxiety disorders, low self-esteem, difficulties in family relationships, and generalized distress and maladjustment.	2000	natural
Findings also indicate that biological father abuse may be associated with greater sexual aversion and sexual ambivalence.	2003	natural
The key emphasis was on the reporting of child abuse to statutory child protection authorities, and the treatment and punishment of individual offenders.	2001	natural
Attempters and completers shared core characteristics: previous attempts, impulsivity, substance abuse, and psychic turmoil within a cycling/mixed bipolar disorder.	2002	natural
The Abuse Disability Questionnaire (ADQ) was administered to women who used domestic violence shelters services and to a community sample of women who were members of the Chamber of Commerce.	2000	natural
A comparison was made of arrested male offenders from ages 18 to 30 (n = 223) and similar community controls (n = 222) selected from five cities in Colombia as to their family background, exposure to abuse, family stressors, perceived care and history of childhood disruptive behaviour problems.	2001	natural
Individuals who experience child physical orsexual abuse are at greater risk for adjustment problems.	2002	natural
After the Soviet Union dissolved in 1989, it became apparent that there was little recognition of the problems of child abuse and neglect, professionally, legally, or societally.	2004	natural
Population-adjusted rates of reported and substantiated child abuse were correlated with rates of children in poverty, single-parent families, marriage and divorce, unemployment, high-school dropouts, median family income, elder abuse, birth and death rates, numbers of physicians and other healthcare providers, hospital, social workers, and number of caseworkers in the Department of Human Services.	2003	natural
Groups who had experienced childhood sexual abuse displayed the highest degree of personality disturbance; however, the additive effects of repeated sexual trauma were limited.	2001	natural
Evidence from 85 studies was examined to identify risk factors most strongly related to intimate partner physical abuse perpetration and victimization.	2004	natural
A fuller pattern of mediation was shown when the retrospective abuse variable was modeled.	2003	natural
The present research examined differences in demographics and substance-related problems in populations admitted to three substance abuse treatment settings--outpatient (n = 1132), intensive outpatient (n = 1190), and residential (n = 149)--and tested whether interactions between client characteristics and type of setting predicted rates of 30-day retention and treatment completion.	2002	natural
Tragically, childhood sexual abuse may lead the victim to become an abuser later in life, sometimes while still a minor.	2001	natural
Study data were drawn from the 2000 and 2001 National Household Surveys on Drug Abuse.	2004	natural
In Studies 3 and 4, the second-order abuse factor showed acceptable test-retest reliability, partner agreement, and correlation (significant for males only) between observer ratings of dating partners' interactions and youths' CADRI scores.	2001	natural
To test the hypothesis that childhood sexual abuse increases the risk of eating disturbance in children.	2000	natural
The goals of the current study were to determine whether incorporating disability benefit management into combined outpatient psychiatric/addiction treatment was feasible and clinically useful for managing severely mentally ill, substance-abusing patients over time, and then if patients in this program would demonstrate the first-week-of-the-month increased substance abuse and hospitalizations shown in other studies.	2004	natural
It is important to identify the unique needs and concerns of these individuals and culturally sensitive programs that will be successful in recruiting and retaining these individuals in drug abuse treatment services.	2000	natural
The authors examined the impact of substance abuse counselor (SAC) recovery status and education level on (a) SACS' sensitivity to ethical dilemmas and (b) extent to which training might help resolve dilemmas.	2003	natural
This study attempted to extract an MMPI-2 scale identifying adult male and female victims of childhood physical abuse.	2000	natural
Physical abuse and parental drug abuse predicted daily drug use in the whole sample and selected subgroups, whereas parental alcohol abuse predicted daily alcohol use in the whole sample.	2001	natural
Initial findings demonstrate a phenomenological link between CEA and eating psychopathology, and suggest that this association might be different to the links for other forms of trauma (i.e., CEA may have a relationship with a broader range of eating symptoms than sexual and physical abuse).	2000	natural
The relationship between the SASSI-A and variables with known relationships to adolescent substance abuse (i.e., lack of religious involvement, single parent household, learning disability, early onset of use, conduct problems) was examined.	2003	natural
Some patients reported heroin-related sexual effects to be a motivating factor for ceasing drug abuse.	2002	natural
The relationship between AS and negative emotion situations substance use remained after controlling trait anxiety in a combined group (anxiety disorders and substance abuse only groups).	2001	natural
The commentaries examine attributions in relation to treatment and in the context of a model of child abuse sequelae.	2002	natural
Children's social expectations regarding peers, and two social behaviors--aggressive behavior and prosocial behavior--were found to mediate between abuse and positive and negative social status, as well as between abuse and positive and negative reciprocity.	2001	natural
False recognition--the mistaken belief that one has previously encountered a novel item--was examined in four groups of subjects: women reporting recovered memories of childhood sexual abuse, women who believe that they were sexually abused as children but who cannot recall this abuse (the repressed group), women who were sexually abused as children and always remembered the abuse, and women with no history of childhood sexual abuse.	2000	natural
Reported rates of physical and emotional abuse were higher than the depressed group, but this result was influenced by comorbid diagnoses.	2003	natural
Families with an incident case of spouse abuse identified during the study period were twice as likely to have a substantiated report of child abuse compaired with other military families, rate ratio, 2.0, (95 confidence interval [CI] 1.9-2.1).	2000	natural
A large, multi-site data set of children referred into Comprehensive Community Mental Health Services both with and without reported histories of sexual abuse, was examined.	2003	natural
Child maltreatment in the forms of abuse and neglect is a serious social problem, affecting over 1.5 million children in the US annually.	2002	natural
Participants were 99 hospitalized women with and without reported histories of childhood sexual abuse.	2004	natural
In boys, self-report sexual abuse is strongly and independently associated with suicidal thoughts, plans, threats, deliberate self-injury, and suicide attempts, after controlling for current levels of depression, hopelessness, and family dysfunction.	2004	natural
In addition, patients completed standardized questionnaires regarding pain, pain impact, anxiety, depression, posttraumatic stress disorder-like symptoms, and sexual and physical abuse.	2004	natural
This will make the drug abuse testing program more meaningful.	2000	natural
In particular, family problems experienced by adolescents alone can seem daunting, with such issues as divorce, abuse, and discord changing the very fabric of family structure, and significantly impacting adolescent development.	2004	natural
The technical difficulties posed for the child psychotherapist working with children who have themselves experienced violence and abuse are addressed.	2004	natural
Children exposed to significant abuse, neglect and household dysfunction often present a confusing and difficulttotreat clinical picture.	2003	natural
The women in the PD group were significantly more likely to have had a history of self-harm and of sexual abuse as a child than women in the MI group, but the PD women remained significantly longer in prison awaiting a hospital bed.	2004	natural
This study examined the effects of a gender-specific HIV/STD prevention intervention with two dosage levels (four-session, eight-session) among women reporting physical abuse by a current or recent (past year) intimate partner.	2003	natural
Chronic consumption of several drugs of abuse (cannabis, stimulants, opioids) has been associated with the presence of neuropsychological impairments in a broad range of functions.	2004	natural
Thirty patients who met DSM-IV criteria for schizophrenia or schizoaffective disorder as well as criteria for substance abuse or substance dependence, were treated in a 12-month prospective, open-label trial of olanzapine.	2001	natural
Attempters and completers shared core characteristics: previous attempts, impulsivity, substance abuse, and psychic turmoil within a cycling/mixed bipolar disorder.	2002	natural
Previous experience with this type of abuse viewed was also studied.	2000	natural
The author examined cross-sectional and longitudinal research which demonstrates the impact on sexually abused children of living in a climate of violence, suffering physical abuse, exposure to abuse of maternal figures, and suffering disruption and poor quality of care and supervision.	2002	natural
Little is known about adolescents with DSM-IV-defined inhalant abuse and dependence.	2004	natural
This study examined associations between childhood abuse and personality disturbances in 228 drug-dependent women.	2004	natural
In a study of 41 adult survivors of childhood sexual abuse, the level of childhood traumatization was found to have contributed to delayed disclosure of the abuse.	2001	natural
We assessed the main behavioral disturbances (suicide attempt, carving, violence, delinquency, substance abuse, and eating disorder) and the main current axis I disorder in each sub-group.	2003	natural
Factor analysis showed the existence of two factors reflecting care and control, with psychological abuse associated with both factors.	2002	natural
In addition, rapidity of improvement was predicted only by decreased polysubstance abuse.	2004	natural
This report describes the cascade of stressful events and secondary life changes experienced by parents in a case of alleged sexual abuse at a day care program.	2003	natural
We examined the combined influence of juror, victim, and defendant gender on jurors decisions in child sexual abuse cases.	2002	natural
Several authors have discussed the possibility that nonlinear dynamics might clarify substance abuse and chemical dependence.	2002	natural
Because of its extensive consumption and because it has pharmacological stimulant properties similar to amphetamine and cocaine, MPD has the potential of abuse.	2000	natural
A case-management model for individuals with substance abuse and mental_health disorders who are involved in the criminal justice system is described, based on the experience of a rural demonstration project.	2000	natural
Sixty-six individuals completed measures of abuse history, attachment style, and posttraumatic stress symptomatology.	2000	natural
This study develops a method for examining the reliability of such data and applies it to the Massachusetts Substance Abuse Management Information System (SAMIS).	2002	natural
Abuse history and prospective condom use data were collected from 214 HIV infected and 189 uninfected women participating in the HIV Epidemiology Research Study (HERS) who were inconsistent condom users at baseline and received two safer sex counseling sessions.	2004	natural
Details about childhood physical abuse and adult abuse were also collected in a two-phase study.	2002	natural
The study population was comprised of 167 2- to 17-year-old children of Seattle women with police-reported or court-reported intimate partner abuse.	2003	natural
Women (but no men) with a history of abuse attributed less power or control to self than to children.	2002	natural
This model is recommended for use in various settings and includes a supportive therapy group and two specialized therapy groups, one for childhood sexual abuse survivors and the other for sexual assault (acquaintance rape and stranger rape) survivors.	2003	natural
Although perpetrators of child neglect often abuse illicit substances, treatment outcome evaluations in drug-abusing young mothers who have been found to neglect their children are conspicuously absent.	2004	natural
The Questionnaire on Differentiated Assessment of Addiction (QDAA) is a multi-modal, selfrating instrument for the Assessment of addiction and abuse of psychotropic substances.	2004	natural
This study examines the relationship between drug abuse and maternal aggression (MA) among low-income women, controlling for a number of factors that often obscure the nature of the links between these two behaviors.	2000	natural
This study examined dissociative symptoms in relation to changes in evening salivary cortisol levels after recounting traumatic experiences among 49 women with PTSD for child sexual abuse (CSA).	2003	natural
These efforts generally focused on six target populations: families receiving welfare and involved with child welfare, sanctioned families or families nearing time limits, relative caregivers receiving child-only payments, welfare clients who experience domestic violence, teens that cannot live with parents due to abuse or neglect, and clients with complex service needs.	2004	natural
Another finding was that a greater severity of emotional neglect and physical neglect, rather than abuse, was significantly related to higher levels of alexithymia.	2001	natural
Both assessments evaluate individuals for sexual and physical abuse before age 18, and the two have similar formats and wording.	2004	natural
Over the past decade, a contentious debate regarding delayed memories of childhood sexual abuse (CSA) has existed.	2003	natural
These families contained a high proportion of individuals affected with ADHD (32.8), which was highly comorbid with conduct disorder (50; odds ratio 11.5, 95 confidence interval = 6.4-20.9), oppositional defiant disorder (25.4; odds ratio 2.7, confidence interval = 1.5-4.8), and associated conditions including nicotine dependence and alcohol abuse and/or dependence.	2004	natural
The present study was designed to identify the impact of drinking problems, impulsivity, and a history of childhood physical abuse on both male-to-female (MFIPV) and female-to-male intimate partner violence (FMIPV).	2004	natural
In addition to the immediate effects of the abuse, numerous long-term consequences have been identified, including an increased risk of developing psychological disorders and attempting suicide.	2000	natural
In a sample of 137 women, 39 reported prior sexual abuse.	2002	natural
Prospective studies document that preventive interventions can reduce the prevalence of substance abuse and antisocial behavior.	2000	natural
Are they trained to use an office visit to promote health, identify early abuse and dependence, intervene, and make recommendations?	2004	natural
Both physical abuse and sexual abuse were associated with purging two or more times per week.	2002	natural
Factor analysis indicated that the ADQ contained eight factors, suggesting that impairment from partner abuse is multidimensional in its effects.	2000	natural
For females, some groups defined by drinking patterns/levels and current drinkers without symptoms of alcohol abuse or dependence were more likely to report using emergency services than lifetime abstainers.	2001	natural
The most frequent types of bullying reported were theftrelated, verbal abuse, being made to do chores, physical assaults and intimidation.	2004	natural
The association between emotional numbing and perceived relationship quality remained significant in regression analyses even after controlling for fathers' family-of-origin stressors, combat exposure, depression, and substance abuse.	2002	natural
Rates of forgetting were similar among victims who experienced sexual abuse, physical abuse, and multiple types of traumas.	2002	natural
The proposed model is designed to create a new generation of JDCs that maximizes the effectiveness of local resources and delivers research-based interventions to youth and families impacted by substance abuse and delinquency.	2003	natural
The results suggest that mock jurors' judgments in sexual abuse cases reflect their stereotypes about sexual abuse and expectations regarding the relative likelihood of repression in various circumstances.	2001	natural
Patients living farther from their source of outpatient mental_health care were less likely to obtain aftercare following inpatient substance abuse treatment.	2003	natural
Numbers of past admissions to completed detox, methadone, or other types of drug abuse treatment were totaled and ranked to determine most frequent type.	2001	natural
Although alcohol expectancy (expectations about the effects of drinking alcohol on one's behavior and mood) and drinking refusal self-efficacy (one's perceived ability to resist drinking in high-risk situations) have consistently been demonstrated to be useful to our understanding of alcohol use and abuse, the specificity of these constructs to alcohol consumption has not been previously demonstrated.	2000	natural
This study examined whether insomnia persisted after completion of cognitive behavioral therapy (CBT) for PTSD and whether persistence of insomnia was associated with continuing nightmares, vigilance, depression, childhood abuse history, or having been traumatized in a sleep-related context.	2004	natural
The purpose of this series is to review the strength of risk and protective factors for each of seven forms of family violence: partner physical, psychological, and sexual abuse; child physical, psychological, and sexual abuse and child neglect.	2001	natural
Hierarchical logistic regression was used to assess the independent contribution of social isolation and substance dependence to the likelihood that women will experience physical abuse.	2002	natural
Various causes have been suggested, including TV violence, dysfunctional families, grinding poverty, child abuse, domestic violence, poor emotional and cognitive development, drugs, gangs, inequitable educational opportunity, and latchkey homes.	2001	natural
Personality disorders, substance abuse disorders, bipolar disorder, and psychosis are mental_health problems that can prevent a person from holding medical certification required in airline flying.	2002	natural
Children who develop their internal working models of attachment in situations of neglect or abuse, carry the effects of these models into new placements if they are then adopted or fostered.	2003	natural
Distal historical variables (e.g., relationships with fathers perceived as less caring, and being yelled at daily as a child), current enduring personality factors (e.g., aggression and hostility, neuroticism), environmental stressors (e.g., very low income) and proximal variables (verbal and physical aggression between parents) all appear to be related to child psychological abuse.	2001	natural
Fewer than half of the children received a medical examination related to the physical abuse, but the majority had received basic wellness care, including immunizations.	2003	natural
Such virtual other participation, leaving a participatory emotional memory of having been a virtual co-author, simulating the other's movements, is seen to play a role in cultural learning and circular re-enactment of care and abuse, pertaining to intrapsychic and traumatic aspects of intersubjectivity.	2003	natural
There is, however, limited research on the impact this type of community notification has on actual rates of child sexual abuse.	2001	natural
Liddle and Dakof's (1995) comprehensive review of the status of family-based treatment for drug abuse concluded that this modality offered a promising, but not definitive approach to treating drug abuse among adolescents and adults.	2003	natural
The current study addresses these issues using data collected by James Gaudin and distributed by the National Data Archive on Child Abuse and Neglect at Cornell University.	2001	natural
These limitations include failure to control for the effects of child physical abuse and general life stress, employment of nonrepresentative samples from battered women's shelters, and reliance on a single contemporaneous reporter, usually the mother, for information on both independent and dependent measures.	2003	natural
The purpose of the study was to investigate the extent and nature of spontaneous attributional activity elicited by a newspaper report of child sexual abuse.	2002	natural
The aim of this analysis of five clinical cases is to show how an experience of sexual abuse can contribute towards increasing individual vulnerability and become one of several factors that come together to aggravate and complicate the symptoms characterising eating disorders.	2003	natural
This study examined the relationship between sexual revictimization and interpersonal problems in a sample of adult survivors of childhood sexual abuse diagnosed with post-traumatic stress disorder.	2001	natural
All five neighborhoods are known to be plagued by poverty, violence, substance abuse, and gang activity.	2004	natural
Each subject voluntarily completed questionnaires documenting history of childhood abuse, pain, psychological symptomatology and medical and surgical history.	2000	natural
Alterations in ERP responses appear to be a general characteristic of alcoholism in men, although the presence of other comorbid disorders, particularly drug abuse or dependence together with antisocial personality, results in the greatest reductions in P3 amplitude.	2001	natural
The animal literature on sex differences in drug abuse treatment effectiveness is also discussed.	2004	natural
Interviews (N = 9,398) of non-alcohol-dependent or abuse adults from a random sample of members of a large HMO were analyzed.	2000	natural
The results of this initial study suggest that a history of prior abuse is associated with alterations in physiological reactivity to subsequent mental stress in women, but that the biological correlates of abuse may be different for PMDD vs. non-PMDD women.	2003	natural
To develop a scale to measure emotional abuse among school children aged 13-15 years in Sri Lanka that can be used in field settings.	2003	natural
Seventy-eight currently drinking, older adults meeting a diagnosis of alcohol abuse or dependence were recruited via advertising to complete a health interview; 48 were reinterviewed approximately 3 years later.	2000	natural
First, to examine the relationships between childhood sexual abuse and HIV drug and sexual risk taking behaviors among female prisoners, and second, to examine the relationship between a marginal adult living context and HIV drug and sexual risk taking behavior among female prisoners.	2000	natural
This paper discusses some of the historical, philosophical and cultural differences between the US and the UK that have led to the respective differences in societal attitudes and treatment practices for substance abuse or substance misuse within these two separate societies.	2001	natural
At the bivariate level, both physical and sexual child abuse were associated with significantly increased risk for all five types of adult abuse as well as depression and anxiety.	2003	natural
Greater dissociative symptoms were associated with lower mean HR, whereas abuse and neglect, being a girl, and participating in the free association task were associated with higher mean HR.	2004	natural
There were 108 patients in substance abuse treatment who met DSM-III-R diagnostic criteria for cocaine abuse or dependence who completed an assessment battery at pretreatment, posttreatment, and 3-month follow-up.	2000	natural
The evaluation of multiple psychological indicators appears to be a useful method for case conceptualization and planning interventions within a promising individual therapy model that focuses both on substance abuse and psychiatric symptoms and maladaptive schemas and coping styles.	2001	natural
