In this paper, we use data from the National Household Surveys on Drug Abuse (NHSDA) to estimate simple descriptive statistics and analysis of variance (ANOVA) models of the relationship between symptoms of dependence and labor market outcomes for alcohol, cigarettes, marijuana, and other illicit drugs.	2000	natural
Clinicians and researchers use a language of fragmentation that limits experiential descriptions of women abuse survivors.	2000	natural
This article reports on a study of individuals in long-term recovery from substance abuse (median = 12 years) and examines the factors they cite as important in establishing and maintaining their recovery status.	2002	natural
Sending young children to boarding school may be considered a particularly British form of child abuse and social control.	2004	natural
These categories are: psychiatric disability, intellectual disability, physical disability, family violence, alcohol abuse and substance abuse.	2002	natural
Assessing HIV risk in substance abuse settings can help to identify patients who may benefit from HIV-risk reduction programs.	2003	natural
Depression and anxiety were investigated in relation to seven types of child and adult intimate partner abuse.	2003	natural
An article, ;A Meta-analytic Examination of Assumed Properties of Child Sexual Abuse Using College Samples,; published in the July 1998 edition of the Psychological Bulletin resulted in an unprecedented amount of media attention and became the first scientific article to be formally denounced by the United States House of Representatives.	2000	natural
The only abuse variable that was positively and significantly associated with emotional problems was emotional abuse.	2001	natural
Findings converge on the conclusion that anxiety disorder and alcohol disorder can both serve to initiate the other, especially in cases of alcohol dependence versus alcohol abuse alone.	2000	natural
The management of women presenting to hospital after self-poisoning should include assessment of abuse experiences, and instigation of appropriate treatment in those with significant sequelae of abuse.	2001	natural
After adjustment for other childhood adversity, prior child sexual abuse was associated with a range of outcomes in adulthood, including current membership of a nontraditional family type (single mother and stepfather) poorer psychological well-being, teenage pregnancy, parenting behaviors, and adjustment problems in the victim's later offspring.	2004	natural
This study is a comprehensive review of lesbian domestic abuse in the psychological, sociological, legal, and social work literature.	2001	natural
Little is known about adolescents with DSM-IV-defined inhalant abuse and dependence.	2004	natural
Because their appropriations stemmed from a wider culture racked with inconsistencies about the proper treatment of animals, respondents' presentations of self were split between those who no longer spoke of abuse as fun and admonished themselves for having done this and those who still clung to the idea that harming animals was fun and were seemingly untroubled by their former acts.	2002	natural
Abused girls and boys who did talk to someone about the abuse most often discussed the abuse with their best friend (42.5 and 18.0, respectively), their mother (38.8 and 32.2, respectively), and their friends (27.2 and 19.5, respectively).	2001	natural
Drug abuse research and theory has become much more sophisticated over the last 2 decades, and some of the advancements parallel concepts that are part of the developmental psychopathology approach.	2000	natural
Compared to nonusers, 12-month Ecstasy users were significantly more likely to be White, to have less supervision after school, and to have used all other drugs of abuse during the 12 months preceding the interview.	2002	natural
Preliminary findings indicate that sexual or physical abuse are not important factors for a female to join a gang.	2000	natural
Friend was the highest indicated perpetrator in all patterns of sexual abuse.	2001	natural
Family-based therapy is one of the most thoroughly studied treatments for adolescent drug abuse.	2000	natural
There were few correlates of initial child treatment involvement (sexual abuse or parent and family services received concurrently).	2003	natural
It appears these various forms of abuse are experienced by the participants as widespread, suggesting that a much more serious problem may exist than has been recognised.	2001	natural
Sexual or physical abuse was more common than neglect among sexual offenders with fewer than three prior maltreatment reports.	2001	natural
The effects of parental substance abuse on substance abuse outcome of their children appear to be partly mediated by their neglectful parenting.	2002	natural
Further examination revealed the following two factors that predicted MA more powerfully than drug abuse: (a) being in a violent couple and (b) the use of avoidant coping strategies.	2000	natural
Future divorce research should include abuse history as a possible confounding variable.	2002	natural
These relate to the role of MRECs and LRECs in screening social research proposals, recently implemented legislation about data protection, heightened concerns within the NHS about confidentiality and consent, and increasing awareness of the risk of child abuse in health care settings.	2004	natural
Although adherence to aftercare therapy in substance abuse treatment is associated with improved treatment outcome, relatively little research has explored methods of improving aftercare adherence.	2001	natural
and social affairs, and phenomena such as child abuse, infanticide and incest may occur.	2001	natural
With respect to the used protocol of the MS procedure in the present study, our results do not provide support for the suggestion that this procedure is a relevant model for studying development of psychopathology and vulnerability to drug abuse.	2004	natural
Women in treatment for substance abuse have been reported to have more severe problems at assessment than men but not to differ in treatment retention.	2001	natural
Large effect sizes were found between perpetration of physical abuse and five risk factors (emotional abuse, forced sex, illicit drug use, attitudes condoning marital violence, and marital satisfaction).	2004	natural
This study examined ethnic group differences in abuse characteristics, appraisal processes, primary caregiver support, and adjustment following sexual abuse discovery.	2001	natural
Women with a history of childhood sexual abuse reported more chronic pain symptoms and utilized more health care resources compared to nonabused control subjects.	2000	natural
This study was designed (a) to assess attitudes toward wife abuse in a sample of Muslim women and men in Canada and (b) to assess whether those attitudes were influenced by self-esteem.	2001	natural
Considerable research suggests that social influences-based drug abuse prevention programming has produced the most consistently successful preventive effects.	2000	natural
Although relationships were apparent in the data, all predictors together accounted for less than 25 of the variance in outcome measures, indicating that a history of abuse is only one aspect of a womans life that impacts on her general wellbeing.	2002	natural
The experience of physical and sexual abuse was found to be the most highly discriminative function.	2002	natural
Explanations include historical beliefs like eugenics, service principles such as normalisation, economics and an overriding concern to protect women and men with learning disabilities from abuse.	2003	natural
The causal relationships cannot be studied in a cross-sectional retrospective design, but immature coping strategies and increased rates of dissociation appeared important only in chronic fatigue and headache, suggesting that these are not part of the causal pathway between abuse experiences and the other later physical health problems.	2002	natural
Cannabis is the most frequently reported illicit drug of abuse among adolescents.	2004	natural
The study randomly assigned male inmates with co-occurring serious mental_illness and chemical abuse (MICA) disorders to either modified therapeutic community (MTC) or mental_health (MH) treatment programs.	2004	natural
The goal of the present study was to investigate the consistency of children's reports of sexual and physical abuse.	2002	natural
The revised Childhood Trauma Questionnaire (CTQ), which assesses physical, emotional, and sexual abuse as well as physical and emotional neglect, was administered to female patients with obsessive-compulsive disorder (OCD; n = 74; age: 36.1 plus minus 16.3), TTM (n = 36; age: 31.8 plus minus 12.3), and a group of normal controls (n = 31; age: 21.5 plus minus 1.0).	2002	natural
Females experienced significantly higher rates of sexual abuse compared to males, and sexual minority youth experienced significantly higher rates of physical and sexual abuse compared to heterosexual youth.	2002	natural
Curiously, there still exist many myths and misperceptions about priests who sexually abuse children and their victims.	2003	natural
Clinton's accounts of Lewinsky were part of how he attended to issues alive in court concerning himself, including his possible exploitation and abuse of power in an asymmetrical relationship; his motives, sincerity, credibility and intentions; and, indirectly, his fitness for office as President.	2003	natural
Psychological and spiritual healing for African American women survivors of childhood sexual abuse are defined and discussed.	2000	natural
First-year results suggest the feasibility of implementing a statutory right to physician-assisted suicide successfully in this country, without abuse or negative incident.	2000	natural
This article reports findings of a study on self-injury, childhood abuse, and self capacities that supports a theory for understanding and assisting self-injuring individuals in crisis.	2000	natural
The Measurement of Parental Style (MOPS), which creates the subscales indifference, overcontrol and abuse for each parent.	2004	natural
Although cigarette smoking is endemic among illicit drug users, drug abuse treatment programs rarely encourage smoking cessation and often discourage it.	2003	natural
In summary, most mothers/survivors were comfortable with physicians using general questions to screen for IPV but preferred in-depth discussions about the abuse and resource sharing in private.	2003	natural
Specific object relations problems were predicted by different patterns of sexual abuse.	2001	natural
A cutoff score of 6 or above on the AUDIT is suggested for detection of current alcohol abuse in this population.	2000	natural
A number of high-risk family characteristics, including high conflict, divorce, abuse, and parental psychopathology, are considered in the development of stress vulnerability.	2004	natural
Although it was found that substance abuse in the family of origin, offspring dissociation, and offspring codependency were associated, no support was found for the prediction that dissociation mediates the relationship between substance abuse in the family of origin and offspring codependency.	2001	natural
These groups include men served for both substance abuse and mental_health, for only substance abuse, and for only mental_health.	2003	natural
Couples in which one or both members have experienced childhood sexual abuse may be at risk for relational problems.	2002	natural
To estimate the prevalence and correlates of alcohol and drug abuse and dependence among rural, urban, and metropolitan U.S. residents.	2004	natural
based on the specific characteristics of the sexual abuse experienced, can be identified in this sample of abused females; and (b) whether these profile groups predict different patterns of adverse short- or long-term outcomes.	2001	natural
While problem recognition appears to explain much of the effect of very rural residence on treatment utilization for alcohol abuse, the effects of being from a very rural area on seeking treatment for drug abuse remain statistically significant even after controlling for several other variables.	2001	natural
Data from 75 participants in a longitudinal study of methamphetamine (MA) abuse were used to differentiate the cognitive performance of those who remained abstinent, relapsed, or continued to use during treatment.	2004	natural
Furthermore, whereas the effect of reported childhood sexual abuse on absorption was accounted for by taxon membership, reported childhood emotional abuse related to absorption independent of taxon membership.	2002	natural
The study population was comprised of 167 2- to 17-year-old children of Seattle women with police-reported or court-reported intimate partner abuse.	2003	natural
Thirty polysubstance abusers were compared to a comparison group of 24 subjects who did not use illicit drugs of abuse.	2000	natural
The increased risk for substance abuse in offspring of separated parents where the father is a substance abuser is concluded to be due to the combination of transmission of more severe liability from the father and fewer resources available to the single mother for effective parenting.	2001	natural
Three types of childhood abuse were correlated with each other and with adaptability and cohesion.	2002	natural
The primary finding was that the relation between physical abuse history and physical abuse potential was significantly mediated (z = 2.19, p < .05) by level of dissociation, with dissociation accounting for approximately half of the observed relation between history of abuse and abuse potential.	2000	natural
Once adjustment at abuse discovery was accounted for, shame and attribution style explained additional variation in subsequent adjustment, whereas abuse severity did not.	2002	natural
One-third of respondents reported physical abuse, and 22, sexual abuse during childhood.	2003	natural
The new goal calls for greater use of assessment tools in locating those families deemed to be at risk for further abuse.	2001	natural
While recent research has focused on the impact of abuse and other interpersonal traumas in childhood, little attention has been given to the experiences of children who have been removed from their homes.	2002	natural
This paper summarizes outcome findings from an evaluation of residential treatment projects funded by the Center for Substance Abuse Treatment (CSAT), in the Substance Abuse and Mental Health Services Administration, under its Residential Women and Children and Pregnant and Postpartum Women demonstration programs.	2004	natural
With this media coverage and the help of various civic and non-profit organizations' child welfare advocacy efforts, a national level public policy for preventing child abuse is near completion.	2000	natural
High rates of childhood and adult abuse were reported among these long-term welfare recipients.	2004	natural
Research on the impact of substance use and abuse on human sexual function has some limitations due to small and nongeneralizable samples, lack of controlled research design or comparison groups, reliance on self-reported data, or failure to specify or control for dosage effects, expectancies, social effects, and multiple substance use.	2001	natural
The theorized model proposed that self-esteem was determined by family support and gender, and that family support, in turn, was predicted by state anxiety, aggression, substance abuse, depression, and ethnicity.	2001	natural
The questions of resilience and discontinuity in the affective development of survivors of child abuse are explored from the viewpoint of Vygotsky's cultural-historical theory and current social constructivist theories.	2000	natural
However the role of the rest of organisms in the sexual abuse is more difficult of specifying.	2000	natural
Significant correlations were found between self-assessed progress in treatment and major depression (versus bipolar disorder), use of psychotropic medication, and less abuse from mother or primary caretaker.	2002	natural
Initial reliability and validity of a new retrospective measure of child abuse and neglect.	2004	natural
A positive relation was also found between the frequency of physical abuse and hostile attributional tendencies among males.	2003	natural
The sample included 92 guardians of sexually abused children presenting at a medical center for a sexual abuse medical and forensic evaluation.	2002	natural
It concentrates on those professionals caring for the physical health of victims of child abuse and neglect, although there are many similarities between child maltreatment and other family violence victims.	2004	natural
Data from an experiment on homelessness and substance abuse are used to compare sample selection, conventional control variable, instrumental variable, and propensity score matching correction strategies.	2002	natural
However, two of the associations which emerged, namely between parents' abuse and being divorced or never married and between parents' abuse and being childless, are worth noting, since they could be interpreted as failures or, on the contrary, as active and positive choices made by abused women in a difficult context.	2003	natural
The current study examines multiple empirically based perspectives (i.e., child, caregiver, and clinician) of behavior and functioning as they contribute to the clinical and psychosocial profile of children (aged 5 to 17.5 years) with reported histories of sexual abuse.	2003	natural
A total of 106 elder respondents were surveyed, approximately half in person and half via the telephone, to evaluate the feasibility of using a telephone-based structured interview to measure both assault and abuse, as well as to screen for psychopathology in a geriatric population.	2003	natural
In this review, revictimization refers to the occurrence of at least one incident of childhood sexual abuse followed by a subsequent incident of adult sexual victimization.	2001	natural
Hierarchical regression analyses were used to assess whether childhood abuse, social support, and problem-solving appraisal were independently predictive of suicidality, and further, whetherproblem-solving appraisal and social support moderated the childhood abuse-suicidality relationship.	2002	natural
The authors review research demonstrating the variable effects of childhood sexual abuse, the need for intervention, and the effectiveness of available treatment models.	2000	natural
However, there were significant interactions between parental history of abuse and consistency of discipline, as well as abuse history and depression and PTSD.	2001	natural
The results provide strong support for the argument that sexual abuse exists in Palestinian society, as well as for the hypothesis that sexual abuse has a strong psychological impact on victims.	2001	natural
The test-retest reliability in childhood abuse reports was moderate.	2004	natural
The results indicate that persons diagnosed with APD, with histories of substantial drug abuse and criminality, can benefit from TC treatment with aftercare in the community or at the very least, do as well as those with no APD.	2002	natural
This article reviews the literature on the relationship between communication development and childhood abuse and neglect.	2003	natural
Based on their recall of the first child sexual abuse incident, 28 police officers and 86 social workers from 10 training sessions on child sexual abuse in Hong Kong indicated how strong they felt about their emotions in 10 categories of 37 responses.	2000	natural
In the US, a strong association exists between child sexual abuse and suicidal behaviour, mediated by psychopathology.	2001	natural
Bivariate analysis found that outpatient treatment compliance was more likely among women who smoked cigarettes before pregnancy, women who had received previous substance abuse treatment, and women whose partner had received previous substance abuse treatment.	2001	natural
For the 102 items, psychologists were more likely to label the behaviors as psychological abuse, but this tendency was due to psychologists considering the behaviors as either always or possibly abusive, whereas lay persons demonstrated a bimodal response pattern of rating the behaviors as always or never psychological abuse.	2004	natural
The contribution of these negative affects to PTCA was examined after controlling individually for the effects of parental attributions and contextual variables widely regarded as etiological factors in child physical abuse.	2002	natural
Clinicians should screen for abuse in this age group to prevent behaviors that lead to long-term health problems.	2003	natural
Parental depression/anxiety and possible child abuse were associated independently with 2- to 3-times higher rates of disorder.	2000	natural
Boys who report current high distress about sexual abuse have 10-fold increased risk for suicidal plans and threats, and 15-fold increased risk for suicide attempts, compared to non-abused boys.	2004	natural
This study showed a high prevalence of depression in drug addicts, regardless of the type and duration of drug abuse, and a significant association between depression and severity of drug addiction.	2000	natural
The author conducted secondary data analysis of 3 previously reported studies (D. J. Higgins & M.P. McCabe, 1998, 2000b, 2003) to examine whether respondents are best classified according to their experience of separate maltreatment types (sexual abuse, physical abuse, psychological maltreatment, neglect, and witnessing family violence) or whether their experience reflects a single unifying concept: child maltreatment.	2004	natural
Spirituality and its relationship to mental_health outcomes (self-concept and coping style), familial attitudes (family climate and attitudes toward parenting), and satisfaction with social support was examined among African American women in recovery from substance abuse.	2000	natural
Teachers who mentioned lowered self-esteem were more likely to generate it as the result of emotional abuse rather than physical abuse.	2003	natural
This study examined whether children who received child welfare services (e.g., in-home or out-of-home placement) were more or less likely to become incarcerated as serious and violent youthful offenders than those children who were investigated as victims of abuse and neglect but received no further child welfare intervention.	2000	natural
Karen Saywitz and her coauthors provide an overview of current treatments for child sexual abuse victims.	2000	natural
A general tendency to somatize explained part of the relationship of abuse to NES.	2003	natural
Sixty-six individuals completed measures of abuse history, attachment style, and posttraumatic stress symptomatology.	2000	natural
Family Neglect by itself also led to poor parenting, and sexual abuse as a child led to aggressive parenting.	2001	natural
Research shows that out lesbian, gay and bisexual youth often experience long- term and repeated abuse when they are growing up.	2002	natural
Mixed mania, secondary mania, and mania associated with substance abuse--as well as rapid cycling --generally respond poorly to lithium therapy.	2001	natural
To better understand what factors are associated with a woman's likelihood of compliance with treatment, this study assesses 244 pregnant, substance-using women enrolled in a specialized substance abuse treatment program.	2001	natural
These findings empirically demonstrate an association between IBS and emotional abuse, as well as a possible connection with psychosocial variables, that may mediate the connection between emotional abuse and functional bowel symptoms.	2000	natural
Males, addiction-certified psychiatrists, and those treating substance abuse patients were more comfortable providing OBOT.	2004	natural
She teaches a wide variety of courses, including human development, the history of psychology, family violence, assessment and treatment of child abuse and neglect, children's cognitive development, and developmental psychopathology.	2004	natural
The paper seeks to highlight the way in which the impact of abuse and trauma on babies and very young children is often underestimated and to illustrate ways in which the team of this particular family centre addresses this issue in its recommendations for court.	2002	natural
The USAF-FAP Severity Index is a multidimensional rating system for clinicians' evaluations of the severity of seven forms of family maltreatment: partner physical, emotional, and sexual abuse; child physical, emotional, and sexual abuse; and child neglect.	2004	natural
The present study evaluates personality traits associated with substance abuse and recidivism among delinquent boys, and prospectively determines the extent to which these factors are predictive of criminal recidivism.	2001	natural
We conducted latent trajectory analyses to test these hypotheses using interview data about antisocial behaviors and substance abuse assessed at ages 18, 21, and 26 in men from the Dunedin Multidisciplinary Health and Development Study (N = 461).	2004	natural
Once adjustment at abuse discovery was accounted for, shame and attribution style explained additional variation in subsequent adjustment, whereas abuse severity did not.	2002	natural
The research data support the formulation of a personal construct theory of drug abuse, focusing on the implications of acquiring a drug self-subsystem by the drug user.	2002	natural
A cutoff score of 6 or above on the AUDIT is suggested for detection of current alcohol abuse in this population.	2000	natural
The communitywide coalition has long been a politically correct strategy for addressing substance abuse.	2000	natural
