This study examines the relationship between drug abuse and maternal aggression (MA) among low-income women, controlling for a number of factors that often obscure the nature of the links between these two behaviors.	2000	natural
This study examined dissociative symptoms in relation to changes in evening salivary cortisol levels after recounting traumatic experiences among 49 women with PTSD for child sexual abuse (CSA).	2003	natural
These efforts generally focused on six target populations: families receiving welfare and involved with child welfare, sanctioned families or families nearing time limits, relative caregivers receiving child-only payments, welfare clients who experience domestic violence, teens that cannot live with parents due to abuse or neglect, and clients with complex service needs.	2004	natural
Another finding was that a greater severity of emotional neglect and physical neglect, rather than abuse, was significantly related to higher levels of alexithymia.	2001	natural
Both assessments evaluate individuals for sexual and physical abuse before age 18, and the two have similar formats and wording.	2004	natural
Over the past decade, a contentious debate regarding delayed memories of childhood sexual abuse (CSA) has existed.	2003	natural
Information from in-depth interviews of males reported to authorities for physical child abuse and their female partners (n = 45) was quantitatively and qualitatively analyzed and compared to to males and their female partners from the same neighborhood living with a child of the same gender and age (+/-3 years) as the abused child (n = 44).	2000	natural
These families contained a high proportion of individuals affected with ADHD (32.8), which was highly comorbid with conduct disorder (50; odds ratio 11.5, 95 confidence interval = 6.4-20.9), oppositional defiant disorder (25.4; odds ratio 2.7, confidence interval = 1.5-4.8), and associated conditions including nicotine dependence and alcohol abuse and/or dependence.	2004	natural
The present study was designed to identify the impact of drinking problems, impulsivity, and a history of childhood physical abuse on both male-to-female (MFIPV) and female-to-male intimate partner violence (FMIPV).	2004	natural
In addition to the immediate effects of the abuse, numerous long-term consequences have been identified, including an increased risk of developing psychological disorders and attempting suicide.	2000	natural
In a sample of 137 women, 39 reported prior sexual abuse.	2002	natural
Prospective studies document that preventive interventions can reduce the prevalence of substance abuse and antisocial behavior.	2000	natural
This study develops a two-gender measure of abuse as documented by requests for protection.	2004	natural
Are they trained to use an office visit to promote health, identify early abuse and dependence, intervene, and make recommendations?	2004	natural
Both physical abuse and sexual abuse were associated with purging two or more times per week.	2002	natural
Factor analysis indicated that the ADQ contained eight factors, suggesting that impairment from partner abuse is multidimensional in its effects.	2000	natural
For females, some groups defined by drinking patterns/levels and current drinkers without symptoms of alcohol abuse or dependence were more likely to report using emergency services than lifetime abstainers.	2001	natural
Our aim was to investigate the psychological impact of abuse and negative life events during childhood, adolescence and adulthood in patients recruited from a sexual health clinic.	2000	natural
Both general environmental risk factors (psychological problems in the fathers, family climate, family health and conflicts) and environmental factors related to the parental alcohol abuse (severity of the alcohol abuse, the child's level of exposure to the alcohol abuse, changes in routines and rituals due to drinking) were related to child adjustment.	2003	natural
Results also indicated that attributional style predicted depression beyond the variance accounted for by abuse type (i.e., physical or sexual).	2002	natural
The most frequent types of bullying reported were theftrelated, verbal abuse, being made to do chores, physical assaults and intimidation.	2004	natural
The association between emotional numbing and perceived relationship quality remained significant in regression analyses even after controlling for fathers' family-of-origin stressors, combat exposure, depression, and substance abuse.	2002	natural
Features of schizoidness, the varieties of schizoid presentations, the etiology and pathogenesis of drug/alcohol abuse in the schizoid, and readily clinically apparent psychodynamic features are discussed.	2002	natural
Rates of forgetting were similar among victims who experienced sexual abuse, physical abuse, and multiple types of traumas.	2002	natural
The proposed model is designed to create a new generation of JDCs that maximizes the effectiveness of local resources and delivers research-based interventions to youth and families impacted by substance abuse and delinquency.	2003	natural
The results suggest that mock jurors' judgments in sexual abuse cases reflect their stereotypes about sexual abuse and expectations regarding the relative likelihood of repression in various circumstances.	2001	natural
The purpose of this paper is to supplement the existing body of literature on judicial bias against protective parents who allege sexual abuse in contested custody/visitation cases.	2000	natural
Patients living farther from their source of outpatient mental_health care were less likely to obtain aftercare following inpatient substance abuse treatment.	2003	natural
Numbers of past admissions to completed detox, methadone, or other types of drug abuse treatment were totaled and ranked to determine most frequent type.	2001	natural
The findings of this investigation suggest that the current intensive inpatient group treatment program appears to reduce PTSD symptoms effectively for a sample of adult survivors of abuse.	2003	natural
Both measures are valid and reliable instruments for screening for alcohol and drug abuse among adults seeking evaluation for ADHD.	2000	natural
Although alcohol expectancy (expectations about the effects of drinking alcohol on one's behavior and mood) and drinking refusal self-efficacy (one's perceived ability to resist drinking in high-risk situations) have consistently been demonstrated to be useful to our understanding of alcohol use and abuse, the specificity of these constructs to alcohol consumption has not been previously demonstrated.	2000	natural
This study examined whether insomnia persisted after completion of cognitive behavioral therapy (CBT) for PTSD and whether persistence of insomnia was associated with continuing nightmares, vigilance, depression, childhood abuse history, or having been traumatized in a sleep-related context.	2004	natural
The purpose of this series is to review the strength of risk and protective factors for each of seven forms of family violence: partner physical, psychological, and sexual abuse; child physical, psychological, and sexual abuse and child neglect.	2001	natural
Hierarchical logistic regression was used to assess the independent contribution of social isolation and substance dependence to the likelihood that women will experience physical abuse.	2002	natural
Knowing children's prior knowledge of abuse prevention concepts and what changes after intervention would be invaluable to program personnel.	2000	natural
Various causes have been suggested, including TV violence, dysfunctional families, grinding poverty, child abuse, domestic violence, poor emotional and cognitive development, drugs, gangs, inequitable educational opportunity, and latchkey homes.	2001	natural
Personality disorders, substance abuse disorders, bipolar disorder, and psychosis are mental_health problems that can prevent a person from holding medical certification required in airline flying.	2002	natural
Children who develop their internal working models of attachment in situations of neglect or abuse, carry the effects of these models into new placements if they are then adopted or fostered.	2003	natural
Distal historical variables (e.g., relationships with fathers perceived as less caring, and being yelled at daily as a child), current enduring personality factors (e.g., aggression and hostility, neuroticism), environmental stressors (e.g., very low income) and proximal variables (verbal and physical aggression between parents) all appear to be related to child psychological abuse.	2001	natural
Fewer than half of the children received a medical examination related to the physical abuse, but the majority had received basic wellness care, including immunizations.	2003	natural
Such virtual other participation, leaving a participatory emotional memory of having been a virtual co-author, simulating the other's movements, is seen to play a role in cultural learning and circular re-enactment of care and abuse, pertaining to intrapsychic and traumatic aspects of intersubjectivity.	2003	natural
There is, however, limited research on the impact this type of community notification has on actual rates of child sexual abuse.	2001	natural
Findings suggest that heightened bodily sensitivity, emotional avoidance, and perceived uncontrollability are common sequelae of patients seeking residential substance abuse treatment, but they do not contribute uniquely to drug of choice and measures of addiction severity.	2003	natural
Liddle and Dakof's (1995) comprehensive review of the status of family-based treatment for drug abuse concluded that this modality offered a promising, but not definitive approach to treating drug abuse among adolescents and adults.	2003	natural
The current study addresses these issues using data collected by James Gaudin and distributed by the National Data Archive on Child Abuse and Neglect at Cornell University.	2001	natural
These limitations include failure to control for the effects of child physical abuse and general life stress, employment of nonrepresentative samples from battered women's shelters, and reliance on a single contemporaneous reporter, usually the mother, for information on both independent and dependent measures.	2003	natural
The purpose of the study was to investigate the extent and nature of spontaneous attributional activity elicited by a newspaper report of child sexual abuse.	2002	natural
The aim of this analysis of five clinical cases is to show how an experience of sexual abuse can contribute towards increasing individual vulnerability and become one of several factors that come together to aggravate and complicate the symptoms characterising eating disorders.	2003	natural
Of 77 women participating in a randomized clinical trial of non-pharmacological treatments for severe PMS, 42 were interviewed regarding their sexual abuse history.	2000	natural
This study examined the relationship between sexual revictimization and interpersonal problems in a sample of adult survivors of childhood sexual abuse diagnosed with post-traumatic stress disorder.	2001	natural
All five neighborhoods are known to be plagued by poverty, violence, substance abuse, and gang activity.	2004	natural
To determine the prevalence of a history of child sexual abuse (CSA) in a random sample of adult patients presenting for routine health care to family practice clinics in Israel.	2000	natural
Each subject voluntarily completed questionnaires documenting history of childhood abuse, pain, psychological symptomatology and medical and surgical history.	2000	natural
Alterations in ERP responses appear to be a general characteristic of alcoholism in men, although the presence of other comorbid disorders, particularly drug abuse or dependence together with antisocial personality, results in the greatest reductions in P3 amplitude.	2001	natural
Age was also significantly related to the amount of detail in children's abuse disclosures.	2002	natural
After several incidents of child sexual abuse, much of it incestuous, were brought to light in the community, they were discussed openly, contained, and punished.	2001	natural
The animal literature on sex differences in drug abuse treatment effectiveness is also discussed.	2004	natural
Interviews (N = 9,398) of non-alcohol-dependent or abuse adults from a random sample of members of a large HMO were analyzed.	2000	natural
The results of this initial study suggest that a history of prior abuse is associated with alterations in physiological reactivity to subsequent mental stress in women, but that the biological correlates of abuse may be different for PMDD vs. non-PMDD women.	2003	natural
To develop a scale to measure emotional abuse among school children aged 13-15 years in Sri Lanka that can be used in field settings.	2003	natural
Most respondents reported severe sexual abuse by their mothers.	2004	natural
Those in Experiment 1 who saw the picture as child sexual abuse or as a problematic child-adult situation without sexual implications reported a significant increase of anxiety level.	2001	natural
A childhood history of sexual or physical abuse is highly prevalent in borderline personality disorder (BPD) and is associated with self-destructive behavior in clinical and nonclinical samples.	2002	natural
Seventy-eight currently drinking, older adults meeting a diagnosis of alcohol abuse or dependence were recruited via advertising to complete a health interview; 48 were reinterviewed approximately 3 years later.	2000	natural
First, to examine the relationships between childhood sexual abuse and HIV drug and sexual risk taking behaviors among female prisoners, and second, to examine the relationship between a marginal adult living context and HIV drug and sexual risk taking behavior among female prisoners.	2000	natural
This paper discusses some of the historical, philosophical and cultural differences between the US and the UK that have led to the respective differences in societal attitudes and treatment practices for substance abuse or substance misuse within these two separate societies.	2001	natural
At the bivariate level, both physical and sexual child abuse were associated with significantly increased risk for all five types of adult abuse as well as depression and anxiety.	2003	natural
Greater dissociative symptoms were associated with lower mean HR, whereas abuse and neglect, being a girl, and participating in the free association task were associated with higher mean HR.	2004	natural
However, although individuals subjected to multiple types of abuse were more likely to interpret the song in a literal manner, they did not necessarily name their experiences as rape or violence.	2001	natural
There were 108 patients in substance abuse treatment who met DSM-III-R diagnostic criteria for cocaine abuse or dependence who completed an assessment battery at pretreatment, posttreatment, and 3-month follow-up.	2000	natural
Furthermore, more studies are needed on the relation between substance abuse, coping style, and psychopathology.	2001	natural
The evaluation of multiple psychological indicators appears to be a useful method for case conceptualization and planning interventions within a promising individual therapy model that focuses both on substance abuse and psychiatric symptoms and maladaptive schemas and coping styles.	2001	natural
There was no association between SIB, suicide attempts, alcohol abuse and stealing, but a positive correlation between SIB and drug abuse was found (r = 0.284, p < 0.003).	2004	natural
Defining child abuse.	2004	natural
Although the effects of paternal alcoholism on the psychosocial adjustment of children are well documented, the impact of fathers' illicit drug abuse on their children is poorly understood.	2004	natural
Ethnic minority women with less formal education, more traumatic and stressful life events, and longer duration of sexual abuse had greater odds of PTSD within certain sexual assault history subgroups.	2002	natural
The following measurements were employed: the Suicide Risk Scale (SRS) Beck Depression Inventory (BDI), the Life Events Checklist (LEC), and the Childhood Sexual Abuse Questionnaire (CSEQ).	2003	natural
Few studies have examined the relationship between pathological gambling and substance abuse treatment outcome.	2002	natural
This study investigates the correlates and psychological outcomes of domestic abuse among women in a semi-industrial country.	2004	natural
Retrospective data on course were obtained for several indices of substance use, abuse, and related morbidity.	2000	natural
Although the association between maternal and paternal alcohol use disorders and non-problematical drinking in offspring was minimal, there was a strong effect for the transition to hazardous use and for alcohol abuse and dependence; the effect of parental concordance for transition into hazardous use was particularly striking.	2002	natural
Deaf children are at greater risk of sexual abuse than hearing children.	2004	natural
Although the retrospective reporting of these experiences cannot establish a causal association with certainty, exposure to parental alcohol abuse is highly associated with experiencing adverse childhood experiences.	2001	natural
This paper demonstrates the application and integration of family systems therapy and cognitive behavioral therapy for the treatment of symptomatic children with histories of sexual abuse.	2000	natural
Participants in this study included individuals with documented histories of perpetrating sexual abuse (N = 46) and a control group (N = 44), all between the ages of 12 and 23.	2001	natural
Findings suggest that: sexual abuse affects long-term health outcomes and healthcare utilization; and physical health sequelae of abuse may differentially affect females, depending upon the pattern of abuse characteristics.	2002	natural
This investigation evaluated the validity and utility of two versions of the Substance Abuse Subtle Screening Inventory (SASSI, SASSI-2; Miller, 1988, 1996) for determining alcohol related risks among law enforcement applicants.	2001	natural
Results from path analyses showed that a history of child sexual abuse seems to increase vulnerability for adult sexual and physical victimization and appears to contribute to current PTSD symptoms within the cumulative context of other adult trauma.	2000	natural
This study of bulimic women examined the relationship between the severity of four forms of reported child abuse (emotional abuse, neglect, physical abuse, sexual abuse) and bulimic pathology.	2002	natural
The prevalence of smoking, drinking alcohol, and experimenting with drugs was closely related to both physical and sexual abuse.	2003	natural
The preliminary data suggest that serotonergic agents may play a role in the effective treatment of methamphetamine abuse and dependence within the context of other effective behavioral interventions.	2002	natural
The present research examined differences in demographics and substance-related problems in populations admitted to three substance abuse treatment settings--outpatient (n = 1132), intensive outpatient (n = 1190), and residential (n = 149)--and tested whether interactions between client characteristics and type of setting predicted rates of 30-day retention and treatment completion.	2002	natural
This study does not support all elements of the labeling perspective, but it suggests that the labeling approach provides a useful framework for understanding the relationships between disability and substance abuse.	2001	natural
Events that these mothers have experienced during childhood are examined, experiences including abuse, placement, separation, bereavement, rejection, neglect, lack of love and role reversal.	2004	natural
The present study examined 104 actual child sexual abuse interviews with children age 214 years (M=6.5).	2002	natural
Courts need to take a differentiated approach to spousal abuse, one that recognizes its different forms, nature and effects on adults and children, with a continuum of responses ranging from ordinary visitation, through supervision of exchanges or visitation, to termination of visitation.	2000	natural
This study investigated the specificity of empirically derived screening measures for the detection of symptom exaggeration in persons with a diagnosis of alcohol abuse (n = 30), polysubstance abuse (n = 43), or head trauma (n = 27).	2004	natural
Path analysis showed that although Joseph, Williams, and Yule's model did not fit the data, a modified version based on the sexual abuse literature fit the data well.	2000	natural
A close temporal correlation between symptoms of psychosis and substance abuse was established for amphetamines (including ecstasy), LSD and excessive abuse of cannabis.	2002	natural
Various aspects of both physical and sexual abuse experiences were predictive of TSI scores.	2003	natural
Thus, modulation of NO systems may be a potential therapeutic target for treatment of substance abuse.	2001	natural
Outcome on this measure was compared with error scores and response timing variables on a computerized version of the Category Test (CT) in both normal individuals and individuals with neurological, psychiatric, or substance abuse histories.	2002	natural
The difference between women exposed and not exposed to domestic harassment, violence, sexual abuse, or a combination thereof was largest regarding the length of sick leave in long (>30 days) sick-leave spells.	2000	natural
None of these has compared the interviewer behavior in a day care abuse case with interviewer behavior in normal sexual abuse cases by the Child Protective Service (CPS) in the USA.	2000	natural
Youths in schools assigned to the intervention arms learned cognitive and behavioral skills for substance abuse prevention.	2000	natural
Using a more sophisticated measure of substance abuse may further explicate the relation between social anxiety and drinking.	2003	natural
The evaluation of suspected child sexual abuse is one of the most complicated forensic assessments.	2002	natural
Performance differences were not attributable to co-morbid psychiatric disorders or substance abuse.	2000	natural
Participants who had been victim of physical abuse were less specific than participants who had not been confronted with such physical adversities.	2004	natural
Based on self-reports the prevalence during childhood of psychological, physical, emotional, and ritualistic abuse among 559 high school students in Standards 7, 8, 9, and 10 of three high schools in the Mpumalanga Province of South Africa was examined.	2001	natural
A logistic regression analysis performed on a sample of 1867 adolescents indicated that a combination of physical abuse, sexual abuse, history of familial drug use, family violence, ethnicity, and a history of familial violence were significant in differentiating substance abusers from non-abusers.	2001	natural
Sexual harassment was associated with a variety of eating disorder symptoms, even when controlling for experiences of sexual abuse/assault and physical abuse.	2000	natural
Prevention campaigns need to inform the public that inhalant abuse is not just a problem among youngsters, and intervention services for adult abusers should be provided within the context of employee assistance programs.	2001	natural
Data on severity included two measures of SRD-associated problems (one patient-rated and one psychiatrist-rated), substance abuse vs. dependence, self-help activities, and previous treatment.	2001	natural
In summary, most mothers/survivors were comfortable with physicians using general questions to screen for IPV but preferred in-depth discussions about the abuse and resource sharing in private.	2003	natural
Women who were bullied scored significantly lower on Father Care on the PBI and significantly higher on Emotional Neglect, Emotional and Physical Abuse and Physical Neglect on CTQ than those who weren't.	2002	natural
Sexual abuse, suicide attempts and dissociative symptoms were higher in ANP and ANB patients compared to ANR.	2003	natural
The intent of the survey was to identify which standardized assessment instruments were most frequently used by MACs and perceived to be most important in their substance abuse practices.	2003	natural
The lack of relationship between abuse and conventional religious behaviours is somewhat inconsistent with prior results, and likely represents a ceiling effect.	2002	natural
This study examined patient and program factors that influenced the receipt of scheduled supportive services in the Drug Abuse Treatment Outcome Studies (DATOS).	2003	natural
Full PTSD was associated with a higher level of prior psychopathology, higher parental acute distress, and higher rates of prior sexual abuse, compared with partial or no PTSD.	2000	natural
These findings suggest that the DAST-A holds promise as a drug abuse screening measure in psychiatrically impaired adolescent populations.	2000	natural
Results showed that women reported more childhood sexual abuse (CSA) than men, and men committed more violent and sexual offenses than women.	2003	natural
To assess the incidence and nature of concerns about sexual abuse, with particular reference to erroneous concerns of sexual abuse made by children.	2000	natural
Substance abuse and poverty are briefly examined as factors that can contribute, in some instances, to family and community violence among low-income fathers.	2002	natural
Results of this study indicate the need to assess adolescents for TS, including victimization and maltreatment histories, when entering substance abuse treatment and the need to simultaneously address issues of substance use, TS, and related mental_health, physical health, and HIV sex risk behavior while in treatment.	2003	natural
