Both Functional Independence Measure (p = .025) and Geriatric Depression Scale15 (p = .017) scores at T1 predicted the PSS10 score at T3.	2017	natural
Furthermore, female Arab adolescents were found to be more susceptible to suicide ideation when depression levels were high.	2017	natural
After controlling for age and duration of infertility, somatization and anxiety predicted positive religious coping whilst all the domains of psychological health (somatization, anxiety and depression) precited negative religious coping.	2017	natural
A sample of 520 Spanish adolescents (mean age = 16.11, SD = 0.98, range = 1319, 57.9 girls) completed the FFMQ and measures of depression and rumination initially and after 4 months.	2016	natural
Fifty-nine outpatients with CVA and 128 outpatients with classic asthma were interviewed about psychosomatic and psychiatric symptoms, and they underwent three psychological tests: Self-rating Depression Scale (SDS), State-Trait Anxiety Inventory (STAI), and Comprehensive Asthma Inventory (CAI).	2015	natural
In our data, a mediation model best explained the association between the key constructs: Adolescents with normative RSA patterns exhibited lower levels of depression and trait maladaptive mood repair, and benefited more from instructed (state) mood repair in the laboratory.	2016	natural
In the multivariate model, those who reported 'moderate' or 'high' levels of stress were 1.7 (95 CI: 0.9, 3.1) and 3.9 (95 CI: 1.7, 9.1) times more likely to have depression (reference ='low' level), respectively.	2016	natural
In males as well as females in the follicular phase, however, no correlation between sweet taste threshold and depression was found.	2015	natural
The participants were administered Beck Depression Scale, Edinburgh Postnatal Depression Scale (EPDS), Mood Disorders Questionnaire (MDQ), and Modified Hypomania Symptom Checklist-32 (mHCL-32).	2016	natural
To follow the course of MDD in women with prior histories of depression followed during an index pregnancy.	2018	natural
Our major finding is the robust association between anhedonia and current suicidal ideation, independently of depression.	2017	natural
Maternal depression significantly decreased over the course of treatment, and maternal depression had an indirect effect on child PTSD symptom change.	2016	natural
All patients were assessed at baseline and post-treatment (12 weeks) for fatigue severity (primary outcome) and impact, physical activity (leisure time physical activity, number of daily steps and personal activity goal progress), health-related quality of life, somatic distress and psychological distress (depression and anxiety).	2015	natural
In this paper, studies comparing the management of smoking, diabetes, hypertension and dyslipidaemia, in patients with and without depression, anxiety, schizophrenia, bipolar or personality disorder, were reviewed.	2018	natural
Unexpectedly, liking behaviors were associated with depression, anxiety, and stress, whereas lying behaviors were related to anxiety only.	2018	natural
In a cross-lagged structural equation model controlling for trait levels and prior states, our results indicated that earlier loneliness positively predicted future states of social anxiety, paranoia, and depression.	2016	natural
In contrast, exposure to ELSs predictive of depression had similar effects in both diagnostic groups.	2016	natural
The factors that may explain these differences addressed in this study include: alcohol abuse, exposure to suicidal behavior of friends and family, depression, and gun access.	2017	natural
They completed the attachment and relationship measures at Time 1, and the measures of stress, anxiety, and depression at both times.	2016	natural
Using the stress process model as a guide, we hypothesized that early burden would predict later depression and anxiety, and this would be mediated by social support.	2017	natural
These findings suggest that migration stresses, which include maternal depression, lack of social support and the sense of belonging, are associated with child attachment, and these variables should be considered in the design of appropriate interventions.	2017	natural
The most frequent NPS was apathy, with an overall prevalence of 49 (95 CI 41-57), followed by depression, aggression, anxiety and sleep disorder, the pooled prevalence estimates of which were 42 (95 CI 37-46), 40 (95 CI 33-46), 39 (95 CI 32-46) and 39 (95 CI 30-47), respectively.	2016	natural
Semi-structured interviews were carried out with a purposive sample of seven patients presenting to a mental_health service in London, UK with symptoms of first-episode major depression.	2015	natural
Outcome measures assessed chest pain (frequency and interference), anxiety (GAD7), depression (Patient Health Questionnaire-9 (PHQ-9)), somatic symptoms (PHQ-15) and illness perceptions (Brief Illness Perception Questionnaire) at baseline, 3 and 6 months post-assessment.	2016	natural
Research on adolescence has previously shown that factors like depression and burnout are influenced by friendship groups.	2015	natural
Increased risk of depression was found to be associated with rural residents (OR 2.24, 95 CI 1.333.78) and the comorbidity of chronic diseases (OR 3.83, 95 CI 1.3311.02).	2018	natural
Saliva cortisol may be a useful marker that reveals alterations in nonsuicidal patients suffering from depression, adjustment disorder, anxiety, or eating disorders who might be at risk.	2017	natural
In contrast to the tripartite model, NA is subdivided into worry (characteristic for anxiety) and dysthymia (characteristic for depression), which leads to a four-variable model of anxiety and depression encompassing emotionality, worry, dysthymia, and anhedonia.	2016	natural
By contrast, adolescents with atypical RSA patterns exhibited higher levels of depression and dispositional maladaptive mood repair, which, in turn, mediated the relations of RSA patterns and depression symptoms.	2016	natural
How does Spatiotemporal Psychopathology, as demonstrated in the first paper on depression, stand in relation to these approaches?	2016	natural
This study aimed to compare percentage change in purging, depression, and cognitive eating disorder (ED) symptoms for associations with BN remission post-treatment and at six months follow-up.	2015	natural
The prevalence of possible or definite depression was high among pregnant WLWH.	2018	natural
Cognition & Emotion, 24, 719-728] and examined the longitudinal effects of attentional retraining on symptoms of depression.	2016	natural
After adjusting for the covariates of interest, the lack of PA for leisure was associated with a significant increase in depression only among males (YA: OR 1.45, 95 CI 1.022.06; MAA: OR 2.38, 95 CI 1.404.03; OA: OR 5.35, 95 CI 2.1413.37).	2017	natural
The present paper investigates to which degree 7 common depression scales differ in their item content and generalizability.	2017	natural
Psychological research on depression exploded in the early years of my work.	2018	natural
The indirect effect of social support on depression is via the mediating effect of self-esteem.	2018	natural
However, the influence of specific symptom dimensions of depression and apathy on cognition is not well understood.	2017	natural
Multivariate Poisson and negative binomial regression analyses were conducted with 11 baseline covariates entered simultaneously: age, gender, years of formal education, perceived control, hypertension/diabetes, body mass index, exercise status, as well as GAD severity, panic disorder severity, and depression severity.	2017	natural
Evidence shows that depression is associated with lower accuracies at both levels of interpersonal perception, which in turn are associated with greater interpersonal difficulties.	2015	natural
Although research indicates that psychophysiological factors influence youths susceptibility to the negative effects of parent depression in childhood and adolescence, little research has examined whether psychophysiology plays this role in emerging adulthood.	2015	natural
Coping, gender, depression and perceived control predicted group membership to a modest degree.	2016	natural
In this study we investigated the relative accessibility of phenomenological characteristics in autobiographical memories of 104 students with and without a previous history of a depression.	2016	natural
Even less is known about factors that protect against depression in military populations.	2015	natural
Interestingly, the persistent mice were slower to give up when confined to an inescapable pool of water (a test asserted to be indicative of susceptibility to depression) and exhibited a more extensive pattern of search for omitted rewards.	2017	natural
Metacognition correlated strongly with symptoms of depression, anxiety and obsessive-compulsive disorder.	2015	natural
Results indicated that higher quality behavioral intervention components were associated with greater improvement in posttreatment depression scores, higher quality cognitive intervention components were marginally associated with worsening posttreatment depression scores, and relational intervention components were not associated with depression outcome.	2017	natural
Immunization led to 30 decrease in alcohol consumption and recovery of general behavioral parameters such as motor activity, anxiety and depression level.	2017	natural
Depressive and anxiety symptoms were measured using the Edinburgh Postnatal Depression Scale (EPDS), the State Trait Anxiety Inventory (STAI), and the mothers perception of infant with the Mothers Object Relation Scale (MORS).	2018	natural
Participants described a significant loss event prior to onset of depression.	2015	natural
Severity of depression, suicidal ideation, and anxiety were evaluated.	2015	natural
Patients were randomly assigned to groups A (treatment) and B (control) and their levels of anxiety and depression at the beginning and the end of the hemodialysis were measured using Spielberger State-Trait Anxiety Inventory and Beck Depression Inventory tests, respectively.	2016	natural
The aim of this pilot study was to develop an adjunctive hatha yoga intervention for bipolar depression, and to evaluate its preliminary feasibility, acceptability, and safety in a 10-week randomized controlled trial.	2016	natural
Co-occurring depression and anxiety is associated with increased functional impairment and suicidality compared to depression alone.	2015	natural
Undergraduate students ( =472) completed the Positive and Negative Affect Schedule (PANAS), the Emotional Reactivity Intensity and Perseveration Scale (ERIPS, adapted from the PANAS), the Kessler Psychological Distress Scale (K10), and the Depression Anxiety and Stress scales (DASS).	2018	natural
It is not clear whether specific target groups for psychotherapies in adult depression benefit as much from these treatments as other patients.	2018	natural
Its convergent validity was supported by its significant association with anxiety, depression, sleep quality, and QOL.	2017	natural
A hierarchical linear regression analysis revealed that PTSD and depression in combination contributed significantly to the prediction of sexual concerns in African American women.	2016	natural
Examination of the slopes for the rate of change for the three depression groups indicated no change in the non-depressed group and a decrease in depression scores over time for both the mild/moderate and severely depressed groups.	2015	natural
This implementation study was part of the Ostrobothnia Depression Study, in Finland, which covered implementation of motivational interviewing (MI) and behavioral activation (BA) within regional public psychiatric secondary care.	2015	natural
Relative to non-gamblers, pathological gamblers exhibited greater difficulties of emotion regulation, as well as more anxiety, depression, and drug abuse.	2016	natural
Findings revealed that emergency sheltered or unsheltered homeless girls experience higher levels of depression, higher levels of dysfunctional emotional regulation strategies, lower indexes of subjective well-being, and experience negative emotions more intensely and frequently than the comparison at risk for homelessness group.	2017	natural
Thus, research should focus on supporting trauma survivors late in life, particularly when they come from low or middle income countries because these patients have higher rates of depression in elderly populations.	2018	natural
The MHAI, and measures of state anxiety (Depression, Anxiety and Stress Scales-21), trait worry (Penn State Worry Questionnaire), and health anxiety (Short Health Anxiety Inventory) were administered to 104 adult volunteers from the general community.	2016	natural
We aimed to deepen the clinical utility of humiliation assessment in the study of depression.	2015	natural
This study included patients with cancer diagnosed with depression in German neuropsychiatric practices between 2004 and 2013.	2016	natural
Among participants who underwent GMT, benefits were most prominent in persons with poorer pre-training dual-tasking ability, depression, and methamphetamine use disorders (ds = .35-1.04).	2016	natural
Despite a reduction in depression and anxiety scores, these differences were not statistically significant. :	2017	natural
We find that smoking and smoking addiction are associated with lower levels of happiness and higher levels of depression.	2017	natural
153 individuals with DSM-IV diagnosis of depression (n = 58), bipolar disorder (n = 37), or schizophrenia (n = 58) who were receiving outpatient psychiatric care at a university clinic enrolled in a trial of supported employment and completed a baseline assessment.	2018	natural
For LGBTQ students of color, engaging in LGBTQ-specific spaces can strengthen the association between sexual orientation victimization and depression.	2016	natural
As for the risk factors, depression, but not anxiety, partially mediated the effect of relational victimization and verbal victimization on D-SIB.	2016	natural
A principle component analysis (PCA) revealed an Anxiety Factor and a Depression Factor, which explained 50.26 of the total variance.	2015	natural
The study included 28 self-selected college participants (14 couples) who were pretested to determine level of relationship distress (DAS), trust between partners (RTS), and symptoms of depression (BDI-II) prior to completing the 8-week education program.	2015	natural
Thirty-seven nulliparous, French-speaking women, aged 18 years in their third trimester of pregnancy completed self-report questionnaires assessing fear of childbirth, spontaneous use of mental imagery, prenatal depression and trait anxiety, and participated in a mental imagery interview to assess spontaneous childbirth-related mental images.	2018	natural
Delayed engagement in HIV care threatens the success of HIV treatment programs in sub-Saharan Africa and may be influenced by depression.	2016	natural
Therefore, the goal of this study was to examine the relations of physical activity and sedentary behavior to depression and anxiety symptom severity among an understudied patient population, patients in residential substance use disorder (SUD) treatment.	2018	natural
Pre-trauma self-reported depression severity and trait rumination - but not trait worry-predicted onset of PTSD during follow-up, controlling for demographic and clinical history variables, as well as psychiatric diagnoses at baseline.	2015	natural
Pre to post change scores on the depression (-10.6 vs. -3.9; p < .001) and anxiety measures (-9.2 vs. -2.5; p = .01) were significantly greater in the comorbidity subgroup relative to the subgroup without comorbidity but only for those treated with the full CBT; no difference was found for those treated with either BT or CT alone.	2016	natural
Depression symptoms were measured weekly via interactive voice response (IVR) calls using the Patient Health Questionnaire (PHQ-9).	2015	natural
At 3-month follow-up, 61.1 of CBT-I participants were in clinical remission from their insomnia and depression, compared with 5.6 of the self-help group.	2015	natural
Participants (n = 164) completed a personality assessment once as their true self and once as the self they present on Facebook (Facebook self), as well as measures of social connectedness, subjective well-being, depression, anxiety, and stress.	2016	natural
Although PA for leisure is not associated with depression among Brazilian females, the obtained results suggest that this association is significant among Brazilian males, who may be able to benefit from PA for leisure to reduce their symptoms of depression.	2017	natural
Depression was associated with fewer ED/urgent care visits and overnight hospitalizations, while no association was found with missed primary care appointments.	2018	natural
However, only a few small studies have investigated the association between perinatal maternal depression and poor academic achievement in adolescence.	2016	natural
Those using a secure attachment style reported the least mean trauma, depression, and anxiety symptoms.	2017	natural
To date, emotional trust has not been examined in the context of depression and suicide attempts; the broad aim of the present study was to examine this relationship.	2017	natural
The results showed that parenting satisfaction mediated the association between both the family condition management dimensions (family life difficulty and parental mutuality) and depression.	2018	natural
Prescription rates for antidepressants (ADs) are high and continue to increase, despite evidence of significant adverse effects, including withdrawal symptoms, and marginal benefit relative to placebo only for short-term treatment of major depression.	2019	natural
We determined that pain intensity and symptoms of depression were partial mediators of their respective and independent effects on physical function.	2017	natural
Finally, we show unique associations for male and female adolescents, such that changes in family cohesion were only related to changes in depression for girls.	2015	natural
There is general population evidence that physical exercise is effective in reducing the risk of depression and has positive effects on mood.	2015	natural
Optimising depression and anxiety symptoms in adults with heart disease is an international priority.	2018	natural
The results from the two experiments, the first inducing sadness (Experiment and the second measuring subclinical depression (Experiment, show that, as expected, participants who are sad or minor to moderately depressed showed less flanker interference compared to participants who were neither sad nor depressed.	2016	natural
This aberrant placental gene expression could provide a possible mechanistic explanation for the co-occurrence of maternal depression, fetal growth restriction, impaired maternal behaviour and poorer offspring outcomes.	2016	natural
Mixed regression was used to determine the course of self-reported depressive symptom severity (Beck Depression Inventory II; BDI-II) after treatment termination, and to test whether CT and IPT differed throughout the follow-up phase.	2018	natural
After adjusting for confounders, negative partner interactions were significantly associated with increased likelihood of depression, anxiety, and suicidal ideation, while positive partner interactions were significantly and inversely related to anxiety and suicidal ideation.	2015	natural
Symptoms of posttraumatic stress, anxiety, and depression significantly explained 16.5 of the variance in alcohol misuse.	2017	natural
Neither dementia nor antidepressant medication modified the relation of pathology to depression.	2016	natural
We report the case of a 60-year-old woman with multiple sclerosis who was referred to an inpatient psychiatry unit with complaints of worsening depression along with hopelessness, characterized by unrelenting crying.	2015	natural
Transgender people who engage in problematic gaming behavior are younger, and present with high interpersonal problems, and depression, which can affect a successful transition.	2017	natural
Dimension harm avoidance was significant predictor of improvement of depression in all points of measurement.	2016	natural
To examine these issues, adolescents with current/past major depression (probands; n=218), never depressed biological siblings of probands (n=207), and emotionally-well controls (n=183) were exposed to several positively valenced probes.	2016	natural
The data collection tools used included a socio-demographic and obstetric questionnaire, Cranleys MaternalFetal Attachment Scale, the Edinburgh Postnatal Depression Scale and the Maternal Self-Efficacy Scale.	2018	natural
The GEE showed that physical and emotional neglect and multiple types of CM were associated with higher overall depression risk across the perinatal period.	2016	natural
The findings of the systematic review indicate that there is limited evidence available specific to the treatment of moderate depression and that this research seems to suggest that psychotherapy or combined treatment has a beneficial effect.	2017	natural
The present study used crosslagged panel analyses to test longitudinal associations among emotion regulation, prefrontal cortex (PFC) function, and depression severity in adolescent girls.	2018	natural
Overall, depression and state and trait anxiety scores decreased in the C-ED group compared with the HC group throughout the antenatal and postnatal periods.	2015	natural
In addition to highlighting risk factors and potential treatment targets for depression, this study suggests a potential biological mechanism underlying the effects of psychotherapies that reduce rumination on negative affect (e.g., cognitive behavioral therapy).	2018	natural
Three studies (N = 429) tested whether SES moderates the link between cognitive reappraisal ability (CRA; measured with surveys and in the laboratory) and depression.	2016	natural
Sense of belonging was associated with fewer mental_health symptoms, and significantly mediated the effect of threats on anxiety, depression, and stress for females only, such that threat exposure was associated with reduced sense of belonging, which in turn increased anxiety, depression, and stress.	2019	natural
While active coping was not significantly associated with any outcomes, predeployment avoidant coping in both soldiers and significant others was associated with increased anxiety, PTSD, and depression post deployment (actor effects).	2017	natural
This study aimed to further understand how narrative flexibility contributes to therapeutic outcome in brief psychotherapy for depression utilizing the Narrative-Emotion Process Coding System (NEPCS), an observational measure that identifies specific markers of narrative and emotion integration in therapy sessions.	2016	natural
Construct validity was also supported by finding a significant negative correlation between self-efficacy and depression.	2015	natural
High-resolution structural magnetic resonance imaging was used to assess adolescents with self-reported subthreshold depression (n = 119) and healthy control adolescents (n = 461), all recruited from a community-based sample.	2015	natural
Multivariable Poisson regression with a robust variance estimator was used to assess the association between depression and linkage to care or ART initiation.	2016	natural
The reliance on a brief self-report measure of somatization tendency, not originally designed to assess separate EED and CCD factors, highlights the need for measurement tools for the assessment of cultural scripts in cross-cultural depression research.	2015	natural
Low motivational congruence (incongruence) was associated with depression, anxiety, and stress during late pregnancy and the first days after childbirth, and with symptoms of depression at 1012 weeks postpartum.	2015	natural
The aim of this article was to investigate how anxiety and depression impact upon each other over the course of a counselling intervention.	2017	natural
Emotion regulation partially mediated the associations of overall mindfulness with symptoms of depression and anxiety; associations with Observe were fully mediated.	2017	natural
There was also a consistent association between SCD and depression, but not between SCD and objective cognition, in those with high and low levels of SCD reporting, in all ranges of cognitive performance, and in those with mild to moderate depression.	2017	natural
This study investigated the effects of group walking in forests for people with significant mental ill-health including depression, bipolar and anxiety disorders based on a pilot program in Ireland.	2016	natural
Mania was the first episode in a majority (85) of the cases, and was the most frequent episode in the course of the illness, followed by depression.	2015	natural
Applying Lewinsohn's depression model, we examined how residents' BaCo and ExCo relate to their depressive symptoms.	2016	natural
Nineteen patients with hypochondriasis (HYP), 33 patients with depression, and 52 healthy control participants completed the Toronto Alexithymia Scale, the Response Styles Questionnaire, and additional symptom and illness behaviour scales.	2017	natural
Subthreshold depression is prevalent in primary care and is associated with poorer quality of life, higher health care use and increased risk of major depressive disorder (MDD).	2015	natural
We sought to determine the prevalence of and factors associated with anxiety and depression symptoms in young women with newly diagnosed de novo MBC.	2018	natural
Furthermore, the mothers with the highest scores for HOME environment and responsivity to their infant ' s cues at six months were mothers experiencing deteriorating symptoms of depression.	2015	natural
Involvement in partner's care was an independent significant predictor for depression.	2015	natural
