We find that smoking and smoking addiction are associated with lower levels of happiness and higher levels of depression.	2017	natural
Approximately 10 of first year medical students have clinically relevant anxiety or depression which may affect academic success and quality of life.	2016	natural
153 individuals with DSM-IV diagnosis of depression (n = 58), bipolar disorder (n = 37), or schizophrenia (n = 58) who were receiving outpatient psychiatric care at a university clinic enrolled in a trial of supported employment and completed a baseline assessment.	2018	natural
For LGBTQ students of color, engaging in LGBTQ-specific spaces can strengthen the association between sexual orientation victimization and depression.	2016	natural
As for the risk factors, depression, but not anxiety, partially mediated the effect of relational victimization and verbal victimization on D-SIB.	2016	natural
A principle component analysis (PCA) revealed an Anxiety Factor and a Depression Factor, which explained 50.26 of the total variance.	2015	natural
The study included 28 self-selected college participants (14 couples) who were pretested to determine level of relationship distress (DAS), trust between partners (RTS), and symptoms of depression (BDI-II) prior to completing the 8-week education program.	2015	natural
Family history of depression was associated with midlife depression after adjusting for participant's history of major depression prior to midlife, trait anxiety and baseline age, and timevarying menopausal status, body mass index, very upsetting life events, and chronic difficulties (OR = 2.24, 95 CI = 1.174.29, P = .02).	2017	natural
Thirty-seven nulliparous, French-speaking women, aged 18 years in their third trimester of pregnancy completed self-report questionnaires assessing fear of childbirth, spontaneous use of mental imagery, prenatal depression and trait anxiety, and participated in a mental imagery interview to assess spontaneous childbirth-related mental images.	2018	natural
Delayed engagement in HIV care threatens the success of HIV treatment programs in sub-Saharan Africa and may be influenced by depression.	2016	natural
Therefore, the goal of this study was to examine the relations of physical activity and sedentary behavior to depression and anxiety symptom severity among an understudied patient population, patients in residential substance use disorder (SUD) treatment.	2018	natural
Pre-trauma self-reported depression severity and trait rumination - but not trait worry-predicted onset of PTSD during follow-up, controlling for demographic and clinical history variables, as well as psychiatric diagnoses at baseline.	2015	natural
Substantial correlation remained when accounting for shared symptoms between depression and the biological syndrome ( = .45) and frailty index ( = .56) models.	2016	natural
For example, women double the rates of stress-related mental_disorders such as depression and posttraumatic stress disorder (PTSD) than men, and have higher rates of exposure to adversity early in life.	2016	natural
Pre-post changes and Cohens d effect sizes were calculated for questionnaire measures of mindfulness, perceived stress, and symptoms of anxiety and depression.	2017	natural
Pre to post change scores on the depression (-10.6 vs. -3.9; p < .001) and anxiety measures (-9.2 vs. -2.5; p = .01) were significantly greater in the comorbidity subgroup relative to the subgroup without comorbidity but only for those treated with the full CBT; no difference was found for those treated with either BT or CT alone.	2016	natural
Depression symptoms were measured weekly via interactive voice response (IVR) calls using the Patient Health Questionnaire (PHQ-9).	2015	natural
To identify depression, we applied the Patient Health Questionnaire-9.	2015	natural
At 3-month follow-up, 61.1 of CBT-I participants were in clinical remission from their insomnia and depression, compared with 5.6 of the self-help group.	2015	natural
Participants (n = 164) completed a personality assessment once as their true self and once as the self they present on Facebook (Facebook self), as well as measures of social connectedness, subjective well-being, depression, anxiety, and stress.	2016	natural
Although PA for leisure is not associated with depression among Brazilian females, the obtained results suggest that this association is significant among Brazilian males, who may be able to benefit from PA for leisure to reduce their symptoms of depression.	2017	natural
Using a nationally representative sample of over 16,940 kindergarteners (ages 56); we examine the association between the timing and persistence of maternal depression, measured in kindergarten and third grade, and children's school behaviors, academic achievement, and school absences through fifth grade.	2015	natural
Depression was associated with fewer ED/urgent care visits and overnight hospitalizations, while no association was found with missed primary care appointments.	2018	natural
However, only a few small studies have investigated the association between perinatal maternal depression and poor academic achievement in adolescence.	2016	natural
In none of the analyses was melancholic or atypical depression found to significantly moderate outcome (indicating a better or worse outcome of these patients in CBT compared to ADM; i.e., an interaction), predict outcome independent of treatment group (i.e., a main effect), or predict outcome within a given modality.	2016	natural
Findings from this review have implications for the design of interventions to improve recruitment into depression trials.	2015	natural
Those using a secure attachment style reported the least mean trauma, depression, and anxiety symptoms.	2017	natural
To date, emotional trust has not been examined in the context of depression and suicide attempts; the broad aim of the present study was to examine this relationship.	2017	natural
The results showed that parenting satisfaction mediated the association between both the family condition management dimensions (family life difficulty and parental mutuality) and depression.	2018	natural
Prescription rates for antidepressants (ADs) are high and continue to increase, despite evidence of significant adverse effects, including withdrawal symptoms, and marginal benefit relative to placebo only for short-term treatment of major depression.	2019	natural
Associations between schools, health services and social support groups and depression are statistically significant and independent of each other.	2015	natural
We determined that pain intensity and symptoms of depression were partial mediators of their respective and independent effects on physical function.	2017	natural
Finally, we show unique associations for male and female adolescents, such that changes in family cohesion were only related to changes in depression for girls.	2015	natural
There is general population evidence that physical exercise is effective in reducing the risk of depression and has positive effects on mood.	2015	natural
Optimising depression and anxiety symptoms in adults with heart disease is an international priority.	2018	natural
The results from the two experiments, the first inducing sadness (Experiment and the second measuring subclinical depression (Experiment, show that, as expected, participants who are sad or minor to moderately depressed showed less flanker interference compared to participants who were neither sad nor depressed.	2016	natural
This aberrant placental gene expression could provide a possible mechanistic explanation for the co-occurrence of maternal depression, fetal growth restriction, impaired maternal behaviour and poorer offspring outcomes.	2016	natural
Mixed regression was used to determine the course of self-reported depressive symptom severity (Beck Depression Inventory II; BDI-II) after treatment termination, and to test whether CT and IPT differed throughout the follow-up phase.	2018	natural
Chronic exposure to socioeconomic disadvantage in childhood may alter neural circuitry involved in reward anticipation in adolescence, which in turn may confer risk for depression.	2015	natural
After adjusting for confounders, negative partner interactions were significantly associated with increased likelihood of depression, anxiety, and suicidal ideation, while positive partner interactions were significantly and inversely related to anxiety and suicidal ideation.	2015	natural
Symptoms of posttraumatic stress, anxiety, and depression significantly explained 16.5 of the variance in alcohol misuse.	2017	natural
Neither dementia nor antidepressant medication modified the relation of pathology to depression.	2016	natural
We report the case of a 60-year-old woman with multiple sclerosis who was referred to an inpatient psychiatry unit with complaints of worsening depression along with hopelessness, characterized by unrelenting crying.	2015	natural
Transgender people who engage in problematic gaming behavior are younger, and present with high interpersonal problems, and depression, which can affect a successful transition.	2017	natural
Prospectively childhood behavioral problems and low self-esteem are associated with depression.	2018	natural
Dimension harm avoidance was significant predictor of improvement of depression in all points of measurement.	2016	natural
To examine these issues, adolescents with current/past major depression (probands; n=218), never depressed biological siblings of probands (n=207), and emotionally-well controls (n=183) were exposed to several positively valenced probes.	2016	natural
While various abnormalities have been observed during this activity, their meaning and significance for depression, along with its various psychopathological symptoms, are yet to be defined.	2016	natural
The data collection tools used included a socio-demographic and obstetric questionnaire, Cranleys MaternalFetal Attachment Scale, the Edinburgh Postnatal Depression Scale and the Maternal Self-Efficacy Scale.	2018	natural
The GEE showed that physical and emotional neglect and multiple types of CM were associated with higher overall depression risk across the perinatal period.	2016	natural
Furthermore, higher depression scores were associated with poorer forgetting.	2016	natural
PTSD demonstrated similar relationships as major depression with psychological, quality of life, and disability outcomes and significant but somewhat smaller associations with pain.	2015	natural
The findings of the systematic review indicate that there is limited evidence available specific to the treatment of moderate depression and that this research seems to suggest that psychotherapy or combined treatment has a beneficial effect.	2017	natural
The present study used crosslagged panel analyses to test longitudinal associations among emotion regulation, prefrontal cortex (PFC) function, and depression severity in adolescent girls.	2018	natural
Overall, depression and state and trait anxiety scores decreased in the C-ED group compared with the HC group throughout the antenatal and postnatal periods.	2015	natural
In addition to highlighting risk factors and potential treatment targets for depression, this study suggests a potential biological mechanism underlying the effects of psychotherapies that reduce rumination on negative affect (e.g., cognitive behavioral therapy).	2018	natural
This study evaluated the factorial validity of the Beck Depression InventoryII with a diverse sample of 919 university students.	2015	natural
Multi-level random intercept models and moderation analyses were conducted to examine the links between sleep, entrapment, and suicidal ideation, adjusting for anxiety and depression severity.	2018	natural
We hypothesized that both parental depression and parenting quality mediate the effects of parental early adversity on offspring regulatory outcomes.	2017	natural
Three studies (N = 429) tested whether SES moderates the link between cognitive reappraisal ability (CRA; measured with surveys and in the laboratory) and depression.	2016	natural
Sense of belonging was associated with fewer mental_health symptoms, and significantly mediated the effect of threats on anxiety, depression, and stress for females only, such that threat exposure was associated with reduced sense of belonging, which in turn increased anxiety, depression, and stress.	2019	natural
While active coping was not significantly associated with any outcomes, predeployment avoidant coping in both soldiers and significant others was associated with increased anxiety, PTSD, and depression post deployment (actor effects).	2017	natural
This study aimed to further understand how narrative flexibility contributes to therapeutic outcome in brief psychotherapy for depression utilizing the Narrative-Emotion Process Coding System (NEPCS), an observational measure that identifies specific markers of narrative and emotion integration in therapy sessions.	2016	natural
Construct validity was also supported by finding a significant negative correlation between self-efficacy and depression.	2015	natural
These results support body esteem as a mechanism that contributes to increased depression among girls in adolescence-despite a differential impact of pubertal timing for Caucasian and African American girls.	2015	natural
High-resolution structural magnetic resonance imaging was used to assess adolescents with self-reported subthreshold depression (n = 119) and healthy control adolescents (n = 461), all recruited from a community-based sample.	2015	natural
Logistic regression was used to determine the association between elevated PTSD symptoms and each aversive cognition, adjusting for age, sex, race, ethnicity, education, depression, and ACS status.	2017	natural
Multivariable Poisson regression with a robust variance estimator was used to assess the association between depression and linkage to care or ART initiation.	2016	natural
The reliance on a brief self-report measure of somatization tendency, not originally designed to assess separate EED and CCD factors, highlights the need for measurement tools for the assessment of cultural scripts in cross-cultural depression research.	2015	natural
Low motivational congruence (incongruence) was associated with depression, anxiety, and stress during late pregnancy and the first days after childbirth, and with symptoms of depression at 1012 weeks postpartum.	2015	natural
Prospective cohort or case-control studies were included if they: focused on the development of IBS in population-based or gastroenteritis cohorts; explored the effects of anxiety and/or depression at baseline as predictors of IBS onset at a future point.	2016	natural
The aim of this article was to investigate how anxiety and depression impact upon each other over the course of a counselling intervention.	2017	natural
Emotion regulation partially mediated the associations of overall mindfulness with symptoms of depression and anxiety; associations with Observe were fully mediated.	2017	natural
There was also a consistent association between SCD and depression, but not between SCD and objective cognition, in those with high and low levels of SCD reporting, in all ranges of cognitive performance, and in those with mild to moderate depression.	2017	natural
This study investigated the effects of group walking in forests for people with significant mental ill-health including depression, bipolar and anxiety disorders based on a pilot program in Ireland.	2016	natural
Mania was the first episode in a majority (85) of the cases, and was the most frequent episode in the course of the illness, followed by depression.	2015	natural
Applying Lewinsohn's depression model, we examined how residents' BaCo and ExCo relate to their depressive symptoms.	2016	natural
Nineteen patients with hypochondriasis (HYP), 33 patients with depression, and 52 healthy control participants completed the Toronto Alexithymia Scale, the Response Styles Questionnaire, and additional symptom and illness behaviour scales.	2017	natural
Subthreshold depression is prevalent in primary care and is associated with poorer quality of life, higher health care use and increased risk of major depressive disorder (MDD).	2015	natural
We sought to determine the prevalence of and factors associated with anxiety and depression symptoms in young women with newly diagnosed de novo MBC.	2018	natural
Furthermore, the mothers with the highest scores for HOME environment and responsivity to their infant ' s cues at six months were mothers experiencing deteriorating symptoms of depression.	2015	natural
Involvement in partner's care was an independent significant predictor for depression.	2015	natural
Two hundred and sixty-five mothers with recurrent unipolar depression, partners and adolescents from Wales were assessed.	2018	natural
Rates of recorded depression in English general practices were falling prior to the economic recession but increased again subsequently, among men, associated with increased unemployment.	2015	natural
MBCT may reduce geriatric anxiety, although its effects on geriatric depression were not measured.	2018	natural
During the last few decades, mapping of CSD has been successfully applied to characterize several neuropsychiatric conditions such as alcoholism, schizophrenia, depression, anxiety disorders, childhood/developmental_disorders, and neurological conditions (i.e., epilepsy and brain lesions) using electrophysiological data from resting state and during cognitive performance.	2015	natural
The existing evidence supporting the use of contemporary behavior therapies for adolescent depression is promising but limited.	2017	natural
Depression has been linked to multiple forms of aggressive behavior in college students; however, it is unclear which aspects of depression explain this connection.	2018	natural
We measured overall social media use, nighttime-specific social media use, emotional investment in social media, sleep quality, self-esteem and levels of anxiety and depression.	2016	natural
Several personal factors (depression, anxiety, pain intensity, and catastrophizing) and contextual/environmental factors (parenting characteristics) were consistently associated with higher levels of disability, whereas evidence for other factors was less consistent.	2016	natural
The decreased quality of life is similar to that of other chronic diseases, such as diabetes type 2, depression, and osteoarthritis.	2015	natural
Symptoms like anxiety, low self esteem, paranoia, extreme hurtfulness, migraine, Post Partum Depression, obsessive traits, alcoholism in the family are amongst the findings which will be presented in greater detail.	2015	natural
We controlled anxiety or depression at 6 and 12 months and chromosome 3 status, which accurately predicts 10year survival.	2018	natural
At the time of initial assessment, 44 of patients had a previous psychiatric history, although the majority (62) reported no symptoms of depression.	2015	natural
Children completed measures assessing loneliness and depression.	2016	natural
These results suggest that the LOF has a distal relationship to depression and social anxiety.	2016	natural
Greater sensitivity to anesthesia during induction was significantly associated with higher MBMD future pessimism scores and marginally associated with higher MBMD depression scores.	2015	natural
Converging evidence indicates that abnormal glutamatergic and synaptic systems may be associated with the pathophysiology of depression.	2017	natural
Little is known about the longitudinal genetic and environmental association between juvenile irritability and symptoms of anxiety and depression.	2015	natural
Sustained viral response was associated with significantly lower depression and fatigue.	2015	natural
Thus, the present study aimed to test the differential roles of NSSI in the pathways from NE (specified by depression, anxiety, and stress) to SI and from NE to SA.	2017	natural
Moderated mediation analysis further indicated that the indirect effect of social exclusion on depression was moderated by implicit theories.	2018	natural
Serial mediation models interrogated the effect of stressful life events (List of Threatening ExperiencesModified) mediated by appraisal and coping (Perceived Stress Scale and ConnorDavidson Resilience Scale), on symptoms of anxiety and depression (Zung Selfrating Anxiety Scale and Center for Epidemiologic Studies Depression Scale).	2018	natural
PTSD and depression are common conditions among Iraq/Afghanistan Veterans.	2015	natural
The total association of anticipated prejudice was relatively smaller and mediated by depression and social isolation.	2017	natural
Associations with provider status (staff vs. intern), setting (in-person vs. telehealth), initial severity (PTSD; depression), and eventual treatment gains were examined.	2016	natural
The RVAS predicts measures of depression more strongly than it does measures of anxiety but is not consistently a stronger predictor of depression than the WVAS.	2016	natural
Small age-range and cross-sectional nature precluded assessment of development of the AMIC in adolescent depression.	2015	natural
This longitudinal study examined the association between antenatal maternal depression, postnatal trajectories, and current maternal depression and offspring bullying victimization at 11 years.	2017	natural
LOF also was positively associated with depression and social anxiety.	2016	natural
Findings suggest that it may be critical to examine both affective and physiological stress responses when assessing risk for depression in adolescents.	2018	natural
Depressed individuals exhibit memory biases on the self-referent encoding task (SRET), such that those with depression exhibit poorer recall of positive, and enhanced recall of negative, trait adjectives (referred to as positive and negative processing biases).	2015	natural
For lifetime depression, cognitive performance was lower for digit symbol in younger adults, but higher for vocabulary in both younger (0.03 SD) and older (0.05 SD) adults.	2015	natural
The overlap of somatic symptoms of depression with symptoms of cancer treatment is widely acknowledged and studied.	2015	natural
We sought to characterize depression among a cohort (N = 453) of PLWHA initiating antiretroviral therapy in Uganda via factor analysis of a widely used measure of depression, the Hopkins Symptom Checklist (HSCLD).	2015	natural
This study aims to explore the characteristics and risk factors of cognitive impairment in adolescent patients with first-episode depression.	2018	natural
Dropouts also were more likely to have a depressive disorder, more comorbid diagnoses, and more severe depression and suicidal symptoms.	2017	natural
The main purpose of this study was to examine the relationships among gratitude, self-esteem, depression, and suicidal ideation.	2015	natural
Higher depression symptoms were associated with an attenuated P300 to distressed infant faces, but not with happy or neutral infant faces.	2016	natural
A record of depression was a predictor of worse overall survival in breast cancer patients (adjusted HR = 1.33, 95 CI: 1.20-1.48, p < 0.001), while the effect of bipolar was not statistically significant (adjusted HR = 1.33, 95 CI: 0.97-1.82, p = 0.079).	2016	natural
In total, 28 patients with bipolar depression and 91 patients with unipolar depression were included.	2015	natural
In the first study, positive reappraisal reported for both time periods was significantly correlated with current positive emotion, but not negative emotion with mixed findings for anxiety and depression, and positive reappraisal use increased with time since stressor onset.	2016	natural
Thus, a self-critic's ability to be open and responsive to care and support from others protected against depression.	2016	natural
Whilst many studies have examined links between depression and cognitiveaffective processing in the nonABI population, their applicability to this important clinical group, where cognitive difficulties can be marked, remains unknown.	2018	natural
These spectra were bridged by numerous disorder-level interactions, the most consistent of which was between depression and oppositional defiant disorder (ODD).	2018	natural
This work represents an important advance for the study of AD biomarkers, as well as for more effective pharmacological treatment of patients with AD and associated depression.	2016	natural
These findings suggest that the distinction between internal and external manifestations of spirituality is important and that given the current religious climate, interventions that focus on supporting internal spiritual practice may be a more important and effective approach for AAW with co-occurring HIV infection and depression.	2016	natural
Depression accounted for significant differences on IIP-32 global and the Too Open subscale but not on Hard to be Sociable, Hard to be Supportive, and Hard to be Involved subscales.	2015	natural
There were 170 adolescents (M age = 16.4 years; 22 female; 28 Hispanic, 61 Non-Hispanic White) with comorbid depressive disorder/SUD randomized to one of three sequences of receiving the Adolescent Coping With Depression Course and Functional Family Therapy for SUD (depression treatment followed by SUD treatment; SUD treatment followed by depression treatment; coordinated treatment).	2016	natural
Item response theory (IRT)informed statistical analyses were applied to each of the 14 anxiety and depression symptom measures that 251 European Canadian and 206 Chinese Canadian university student participants completed to remove items that functioned differentially across samples.	2015	natural
The outcome measures were Hedges' g for continuous depression ratings, and categorical response and remission rates.	2015	natural
