They may be broken down into three groups: those issues involving cultural values and definitions of mental_health; those issues that relate to undisclosed goals maintained by the therapist that may differ from the patient's as well as recommendations for types of treatment; and those issues which relate to the psychoterapeutic method, with its emphasis on the therapeutic relationship and its encouragement of openness of patient communication which may result in problems relating to confidentiality and privacy.	1987	natural
The mental_health status of a group of 486 admissions to the Philadelphia Prisons was systematically examined in a carefully controlled study using multiple indices of psychopathology.	1985	natural
Of primary importance appears to be the reduction of anxiety and depression and, consequently, the activation of hope which may be triggered simply with the act of beig interviewed by a mental_health worker and the anticipation of future professional care.	1988	natural
Perceptions and mental_health policies should be revised to reflect the reality of more similarities than differences among aging widows and widowers.	1986	natural
Although most mental_health professionals doubt the capacity of mentally retarded patients to benefit from psychotherapy, a review of case studies, writings, and research revealed that mentally retarded patients responded positively to treatment.	1989	natural
From a social systems and family systems perspective, this paper considers the relationships among protective service clients, caseworkers in protective service agencies and clinicians asked to provide mental_health services.	1986	natural
The privatization of mental_health services during the last decade has literally reshaped the way state and county departments of mental_health go about fulfilling their statutory responsibilities.	1989	natural
In order to be equal to the task of serving the mental_health needs of the community, mental_health professionals must develop methodology which is both effective and affordable, avoiding both undertreatment and overtreatment of those who need and seek their services.	1985	natural
C'hild psychiatrists and mental_health professionals who work with handicapped children should be aware of the new developments in law, legislation, and court rulings in order to give adequate and appropriate guidance to the AIDS-afflicted, their families, and their communities.	1988	natural
The results indicate that approximately two-thirds of the subjects were identifiable by relatively stringent criteria as being psychiatrically disturbed and in need of specific mental_health treatment services, and 34 were identifiable by all indicators of psychopathology used.	1985	natural
In the field of preventive mental_health, the author has supervised the therapeutic relationship in many groups of helping professionals from different areas over a period of several years.	1985	natural
Some of the cultural factors affecting the utilization of mental_health services are saving face, stoicism, respect for authority and discrimination which may cause them to seek help only at advanced stages of illness.	1987	natural
These data have important implications for mental_health toddler workers involved in training teachers in early childhood settings.	1988	natural
Residents of South-Verona who contacted the mental_health services in 1983 were traced and followed for a period of 1 year, utilizing a psychiatric case register.	1986	natural
It is suggested that the greater the child's difficulty in integrating the experiences from these three different levels the poorer the healing process after abuse and the worse the effectwill be on the child's subsequent mental_health.	1988	natural
Analyses, based on variables derived from coded audiotapes of simulated helping interactions and from ratings of helper effectiveness, indicated many similarities between mental_health professionals and mutual help leaders but considerable differences between these two groups and divorce lawyers.	1986	natural
A significant negative correlation has been found between strain and mental_health.	1988	natural
The internal consistency reliability of a five-item measure of socially desirable response set, the SDRS-5, was examined in two samples: 614 outpatients of medical providers and 3053 outpatients of medical and mental_health providers.	1989	natural
In this final article of the series on this issue, attention is drawn to the views of professionals, in both the mental_health and legal fields, on the resolution of the Baby M case specifically and surrogate motherhood in general.	1989	natural
This article aims at assessing the problem of mental_health for people involved in varied functions in syndical organizations.	1985	natural
In analyses using 30 items common to the mental_health and health clinics samples, additional but weaker factors related to access and office procedures were found.	1989	natural
Art therapy for Hispanics at a Chicago mental_health center is described, including art therapy assessments and results, accompanied by photographs of clients' art work.	1986	natural
The expansion of mental_health services during the 1960s from a single remote mental hospital to centers and clinics in mainstream communities fostered the development of community psychology in Hong Kong.	1989	natural
In addition to these pathological changes, certain mental_health resources for medical students have declined (although there is considerable variability from one location to another).	1988	natural
All studies about childhood mental_health are based on referral by adults.	1986	natural
An educational approach that connects concerns about health, mental_health, and sexuality could help alleviate fear and thus benefit cancer patients and their partners and families.	1987	natural
The need for each strategy is illustrated with one or more examples of problems that have arisen when mental_health professionals have failed to obtain consent for their activities, have been insufficiently sensitive to or unaware of conflicts between the usual norms in their professions, and the norms of law enforcement agencies, or have identified too strongly with law enforcement personnel.	1986	natural
Implications of the findings were also discussed with regard to earlier results obtained with adults that suggest mental_health advantages associated with higher levels of masculinity.	1986	natural
However mortality over the nine-year time span is related to poorer initial mental_health and cognitive ability, thus revealing that selective survival masks the extent to which mental conditions decline over time, with impaired White males the least likely to survive.	1989	natural
South East Asian refugees refuse mental_health services until behavior is quite extreme.	1989	natural
The status of a fully indigenous mental_health program serviced and controlled by the Tohono O'odham (Papago) Indian tribe is reviewed from the perspective of its 17-year history.	1988	natural
A statistical study was conducted at the Occupa- tional Therapy section of Walter Reed Army Medical Center, Washington, D.C., to determine the inter-rater reliability of a clinical assessment and documentation instrument designed for psychosocial (mental_health) patients.	1986	natural
The present study examined the relationship between religious and nonreligious paranormal beliefs and mental_health, as well as the possibility that nonreligious subjects compensate for a lack of identification with traditional religion by increased nonreligious paranormal beliefs.	1987	natural
The material comprises 200 successive psychiatric patients from a mental_health centre and a central mental hospital in Finland.	1986	natural
The authors suggest that the use of minority mental_health concepts by the researcher/consultant facilitates the establishment of mutual credibility between the group members and the newcomer.	1988	natural
One involves a classified list of risk indicators for different stages of infancy, and the other involves a validation in an 8year longitudinal epidemiological study of the mental_health of 400 children identified during their first year by use of these very early indicators as guides.	1988	natural
It has been suggested that the personality of the individual influences appraisal processes that determine ratings of both social support and mental_health, thus leading to an association between these variables that reflects only their shared self-report bias.	1989	natural
Previous research has established that wives' employment has a negative effect on the mental_health of husbands.	1985	natural
Professionally led groups had greater impact on improvement of mental_health indices compared to the peer-led groups.	1985	natural
Contrary to the popular practice that mediators be professionally educated in law or the mental_health field, mediators in New Hampshire are trained community volunteers.	1989	natural
There was no evidence of language delay in either group and no significant association between child behaviour and maternal mental_health.	1989	natural
Providers of mental_health services in both public and private sectors are becoming increasingly dependent on third-party health insurance to cover the costs of outpatient psychotherapy.	1988	natural
Professional and public liability requires mental_health practitioners to develop more reliable methods by which violent behavior may be diagnosed, managed with effective strategies, and ultimately prevented.	1985	natural
A total of 66 clergy were surveyed using a questionnaire designed to determine the following: clergy and church demographic characteristics, clergy involvement in counseling activity, referral practices and value placed on collaboration with mental_health resources, and receptivity towards consultation with mental_health professionals.	1985	natural
In this article, I try to reconstruct the bygone mind-set that saw the controlling of deviants as a way to do good in God's name, and I compare it with the contemporary mind-set that sees controlling deviants as doing good in the name of mental_health.	1987	natural
This article presents recent findings from the interrelated fields of infant mental_health and infant development to draw implications for work with at-risk populations.	1988	natural
The hypothesis that members of Asian ethnic minorities appear to use mental_health services less because they are psychologically more robust in the face of difficulties therefore seems questionable.	1989	natural
These questions go to the heart of community mental_health, deinstitutionalization, mental_health policy development and evaluation, and many other areas in which psychologists are playing major roles.	1989	natural
Few psychologists were initially involved in the local community mental_health movement, but its momentum resulted in increasing numbers of practitioner psychologists working in community-based service settings.	1989	natural
The results provide strong support for a model in which recipients' perception of support is determined significantly and strongly by actual interpersonal transactions as reported by significant others, moderately by the recipients' negative outlook bias, and weakly by their anxiety and depression as indicators of their poor mental_health.	1987	natural
The present study employed the Templer Death Anxiety Scale and the Langer Mental Health Scale in examining death anxiety and mental_health as a function of length of incarceration in 56 male prisoners, categorized according to homicidal, sexual, or nonviolent convictions.	1986	natural
There was no evidence of differential treatment toward otherthanBlack clients at a Black community mental_health center when comparisons were conducted with the greatest possible methodological rigor.	1989	natural
Self-esteem has long been considered an essential component of good mental_health.	1987	natural
The present study suggests that adjustment and mental_health problems, with the lack of social and institutional support, may be one of the major reasons refugees turn to psychoactive substances to alleviate their stresses and to forget their problems.	1987	natural
In addition, recommendations are suggested by professionals working in the fields of hearing impairment and mental_health.	1988	natural
Marital stress was not predictive of poorer mental_health.	1988	natural
Standardized instruments are often used to assess the need for mental_health services in a community.	1989	natural
The author argues such an image is produced by the fact that social and mental_health services deal mainly with families at grips with multiple, long-standing problems.	1989	natural
As a group, patients who chose not to continue in treatment tended to be younger and less dysfunctional and had less prior mental_health treatment.	1989	natural
The development of an epidemiological study of mental_health, social background factors, suicidal behaviors (suicidal ideas, deliberate self-harm, and attempted suicide), values concerning suicide, and experience of suicide in others is described.	1985	natural
The results of the analysis of the use of mental_health services according to marital status, employment status and changes in social relationships were in keeping with social support theory.	1986	natural
The aim was to prevent poor mental_health and loss of motivation to seek reemployment among those who continued to be unemployed and to promote high-quality reemployment.	1989	natural
There are also indications that the rate of disciplinary infractions varies with the nature, severity, and chronicity of inmate mental_health problems.	1986	natural
This study predicted and demonstrated high positive correlations between repressor-sensitization, self-image disparity and mental_health.	1986	natural
Recent research suggests that children with encopresis do have numerous behavior problems, but that these problems are generally not as severe as the behavior problems found in children referred for mental_health services.	1988	natural
The author describes the different stages in the construction of governmental policies emphasizing specifically the way the policies in mental_health are being developed in Quebec.	1986	natural
They may be broken down into three groups: those issues involving cultural values and definitions of mental_health; those issues that relate to undisclosed goals maintained by the therapist that may differ from the patient's as well as recommendations for types of treatment; and those issues which relate to the psychoterapeutic method, with its emphasis on the therapeutic relationship and its encouragement of openness of patient communication which may result in problems relating to confidentiality and privacy.	1987	natural
Using an instrument developed in the United States to assess students' knowledge of mental_health in old age, the present study tested 179 Australian undergraduates who varied in age, sex, and the frequency of their contact with aged people at home, at work, and in the neighborhood.	1988	natural
The potential predictive value of the social contextual measures of life-event stress for mental_health variables was generally supported by the findings.	1985	natural
Other analyses showed that social support can counteract the negative effects of unsuccessful job search on mental_health and that such effects are particularly pronounced among the more highly motivated job seekers.	1987	natural
Research in community psychology focused more on problems than solutions, although this is less true of the mental_health area than that of social issues.	1985	natural
Comparison with findings from studies of general mental_health services use suggests that influences on help-seeking may vary across psychiatric disorders.	1987	natural
Skillful juggling of conflicting loyalties is one of the variables that define college counseling as a mental_health specialty.	1989	natural
Recommendations are made for replicating this study in other mental_health settings and with other populations such as the mentally retarded and the elderly.	1989	natural
This article explores the relationship between mental_health problems of prison inmates and the inmates' involvement in custodial violations.	1986	natural
It is important for the art therapist to focus on our environment, the social changes, our professional standards and our training for mental_health providers, and to be alert to changes that may be needed for the 1990's.	1989	natural
The competence of an occupational therapist in mental_health is built on a generalist training acquired in a first university cycle.	1986	natural
This study examined pointintime and pointofview antecedent cue effects on teachers and mental_health workers perceptions of life events impact on students.	1989	natural
These issues are addressed in a study of the relation between the social environment at work and mental_health.	1987	natural
Since the patient had been evaluated by mental_health professionals repeatedly from age 5, we had access to a well-documented longitudinal view of his life.	1985	natural
The results suggest that poor marks, absence of positive coping behaviors, and presence of negative coping behaviors are indicators of later mental_health problems, that the absence of positive coping behaviors may be more indicative of later problems than the presence of negative coping behaviors, and that there are sex differences in the time periods at which indicators of school productivity are important.	1987	natural
Both dimensional and categorical analyses support the view of assaultive children as being in need of mental_health services.	1988	natural
This paper presents and evaluates a model for group mental_health consultation with teachers in which sessions are organized around mental_health issues rather than cases.	1986	natural
The development of an epidemiological study of mental_health, social background factors, suicidal behaviors (suicidal ideas, deliberate self-harm, and attempted suicide), values concerning suicide, and experience of suicide in others is described.	1985	natural
Some of the findings suggest a crisis process, in which service use increases rapidly following an economic stressor, whereas other findings suggest a more insidious process, in which economic stressors slowly weaken the mental_health of the community and eventually lead to increased mental_health service use.	1989	natural
Older residents, relative to their younger counterparts, had more intense medical and mental_health care needs.	1989	natural
These findings point to the importance of and need for psychological research that examines the relationship between gender and sex roles and mental_health, the inclusion of the resultant knowledge in mental_health education and training, and the application of that knowledge to the design of mental_health services.	1987	natural
Professional and public liability requires mental_health practitioners to develop more reliable methods by which violent behavior may be diagnosed, managed with effective strategies, and ultimately prevented.	1985	natural
This paper reviews several approaches to the delivery of culturally sensitive mental_health services to Hispanic populations and describes the development of a new modality for Puerto Rican adolescents.	1988	natural
Each of these measures was related to use of mental_health services but only among women meeting DIS-DSM III criteria for a recent psychiatric disorder, our indicator of need for treatment.	1986	natural
To talk of mental_health in the work milieu is to talk about: illness, productivity problems, absenteism... It appears as though it is not the work itself that is the cause of fatigue, but the social life, the extra-curricular activities.	1985	natural
Finally, I'll address the issue of isolation, which occurs because of the social prejudice against fat people and can create physical and mental_health problems.	1989	natural
Until recently mental_health care in Greece was mainly delivered by old traditional mental hospitals and few outpatient services.	1989	natural
Infant mental_health practitioners have continually striven to understand and to improve disordered parentinfant relationships.	1989	natural
The normalizing influence of staff and clients jointly engaging in activities suggests that facility administrators and mental_health consultants underscore the importance of staff's daytoday routine activities and interaction in the adjustment of clients.	1985	natural
Examples of the delivery of mental_health services are reviewed.	1985	natural
Awareness ofinterpersonal forces upon mental_health clinicians is crucial to allow mature balancing of the many factors involved in the decision making process.	1986	natural
It was found that CTRS could significantly differentiate a behaviorally deviant group and the normal population; that CTRS has a strong positive correlation with the teacher's decision to refer a child to a mental_health professional; that the CTRS by itself is not useful as a diagnostic instrument; and finally, it cannot stand alone as a screening instrument in the epidemiological study of childhood hyperactivity.	1989	natural
Although they show higher levels of externalizing behavior problems than do mental_health control subjects, they show comparable levels of internalizing problems.	1988	natural
This study was a followup investigation on the counselor's role in community mental_health.	1988	natural
There was no evidence of language delay in either group and no significant association between child behaviour and maternal mental_health.	1989	natural
The problems of children with chronic illness generally extend beyond immediate medical concerns Some of these children experience concomitant psychosocial problems This article describes a family-focused social skills development model which has been used in the children's mental_health field to improve children's social interaction, impulse control, and social problem-solving skills In this model, skill training can be focused directly on the child, the family, or both, depending on the resources available, the individual family situation, and whether the child is receiving inpatient or outpatient services Possible preventative and remedial applications of this social skills development model for children and families with chronic illness are discussed.	1989	natural
The results suggest important areas for mental_health professionals to be involved in the care of individuals with cancer if comprehensive care is to be provided.	1989	natural
This study examines the relative contributions of job- and gender-related variables to the mental_health of Hispanic women professionals.	1987	natural
Recent changes in society associated with Japan's rapid economic development are affecting the mental_health of children and families.	1989	natural
It is urged that this movement be countered by a coalition of mental_health professionals, government agencies, and families of the mentally ill, coming together in a broad and integrated campaign to educate the public and secure the resources necessary for adequate and comprehensive care.	1987	natural
Consequently, these factors should be addressed by mental_health professionals in research and treatment of pathological gambling.	1989	natural
In this article, we present an inventory of strategies for promoting mental_health and we describe the skills needed to achieve such a promotion.	1985	natural
Divorce mediation represents an important new modality for mental_health professionals.	1985	natural
In the past, mainstream Western mental_health professionals tended to ignore or dismiss Asian psychologies.	1988	natural
The author starts with the fact that every mental_health worker, to give meaning to its practice, refers to his knowledge of his practices social frame; he then explores some of the social dimensions inherent to a definition of the mental_health field.	1986	natural
This article presents a preliminary model for disaster intervention in schools, reconceptualized from the preventive model (Caplan, 1964) underlying community mental_health intervention and modified to meet the specific needs of the school organization in disaster.	1988	natural
The present paper presents the results of an investigation of the instrument's factor structure, with data from 809 patients in a community mental_health center.	1987	natural
Now that psychotherapy is well established as a valuable treatment in the field of mental_health it is possible to consider future expansion as a cost-effective way to improve the general mental_health of the country.	1989	natural
As background for the potential development of preventive mental_health education programs, the beliefs, feelings, and behavioral intentions of fifthand sixthgrade children toward mental_health issues were surveyed.	1985	natural
Comparison with findings from studies of general mental_health services use suggests that influences on help-seeking may vary across psychiatric disorders.	1987	natural
This study attempted to evaluate the progress of mental_health professionals regarding sex-role stereotyping in clinical functioning, identified as a problem over 10 years ago by Broverman et al. (	1985	natural
Based upon suggestions from legal and mental_health professionals, the authors advocate allocating state resources for interprofessional family courts which would provide custody counseling, mediation, evaluation, and consultation as alternatives to adversarial methods.	1985	natural
This paper examines the extent of physical and sexual abuse among runaway youths and the association of that abuse with behavior, mental_health, life events, and parental mental_health.	1989	natural
