The need for generalist mental_health services to be better supported and the need for structured, evidence-based risk management practice to be extended to civil psychiatric patient care was indicated.	2012	natural
As part of the 2007 National Survey on Adoptive Parents (NSAP), parents with children 517years old (N=1722) were asked if their children had received mental_health services and how helpful these services were.	2013	natural
In 2006, Typhoon Xangsane disrupted a mental_health needs assessment in Vietnam in which the Self Reporting Questionnaire-20 (SRQ-20), and the Demographic and Health Surveys Wealth Index, a measure of SES created for use in low-income countries, were administered pre-typhoon.	2013	natural
The aim of this paper was to explore what a range of stakeholders perceive as the main challenges facing Uganda's mental_health system and the primary ways of addressing them.	2011	natural
One effective preventive approach to improving adolescent mental_health may be providing parents with psychoeducation concerning the importance of pleasant and affirming interactions with their children.	2013	natural
In situations where adult veteran children had difficulty with the transition to civilian life or returned with mental_health problems, parents were often the first to identify these problems and to support their children in accessing appropriate care.	2012	natural
Differences in demographic data between the two groups suggest that the programs may serve two different populations, and that both programs are important components of a comprehensive mental_health plan for children and youth.	2010	natural
In a full model adjusting for these risk factors, cannabis was not significantly associated with mental_health problems, although an association at trend level was apparent.	2013	natural
These data provide a comparison point for existing studies of mental_health diagnoses as well as new information about substance abuse disorders.	2010	natural
Anxiety and depression are serious co-morbid mental_health concerns for persons with COPD.	2013	natural
The study's participants were 152 mental_health professionals at 58 institutions in Seoul and the Gyeon-gi area.	2010	natural
The study has significance because both diabetes selfefficacy and propensity towards risk behaviour are potential targets for educational and counselling interventions designed to improve diabetes selfcare regimes and resultant metabolic and mental_health outcomes.	2013	natural
The present study tested the influence of co-occurring mental_health diagnoses on the relationship between length of stay and treatment outcome among adolescents residing in an inpatient substance abuse treatment facility.	2014	natural
IRD was inversely associated with self-reported physical and mental_health via these different emotional pathways.	2012	natural
A semistructured questionnaire having yes/no type questions was administered to 30 mental_health and 30 nonmental_health professionals.	2012	natural
Throughout there is a strong conviction that thinking family is an essential core of effective mental_health treatment, because families can heal.	2014	natural
Program participants showed significant improvements in mental_health, pain catastrophizing, and suffering levels, while the controls remained relatively unchanged.	2012	natural
The purpose of the current investigation was to assess interest in mental_health services among parents of adolescent solid organ transplant recipients and the relationship between parent perceived need for mental_health services and patient health-related quality of life (HRQOL).	2013	natural
Specifically, this study examined whether black-white differences in growth of depressive affect shift over time, and the extent to which that shift, if any, was associated with racial differences in the rate and mental_health consequences of early adult social roles (e.g., living arrangements, work/college status, and single-parenthood) and socio-economic status (SES).	2011	natural
The findings advance a theory of syndemics and suggest that in order to be maximally effective both HIV prevention and HIV care must be delivered holistically such that sexual risk behaviors are addressed in relation to, and in sync with, the drug use and mental_health of the individual.	2013	natural
517 mental_health professionals in 8 countries sorted 60 cards containing the names of mental_disorders into groups of similar disorders, and then formed a hierarchical structure by aggregating and disaggregating these groupings.	2013	natural
Specifically, having a diagnosed mental_health condition was associated with a greater risk of suicide among OEF/OIF veterans (hazard ratio [HR] = 4.41; 95 confidence interval [CI]: 2.57, 7.55; p < .01) than among non-OEF/OIF veterans (HR = 2.48; 95 CI [2.27, 2.71]; p < .01).	2012	natural
Overall, surveyed clergy support collaborations to improve childhood mental_health.	2012	natural
This may impact upon the physical and mental_health of the caregiver and therefore needs to be investigated.	2010	natural
Nonsuicidal self-injury (NSSI) is a significant issue among college students but few resources are available to college mental_health professionals.	2012	natural
Furthermore, the wide spectrum of linguistic and cultural diversity in these groups, as well as the varied immigration experiences of this heterogeneous population, warrants better understanding of their unique health status and health and mental_health care needs.	2013	natural
We have demonstrated that legislation is an important mechanism to drive change in any forensic mental_health system such as the development of medium and low secure services in Scotland.	2013	natural
This pilot study aimed to explore the clinical outcomes and therapeutic relationship for clients of an adult mental_health service using Beating the Blues, a computerised cognitive behaviour therapy (CCBT) package.	2010	natural
When entered simultaneously in a multiple regression analysis, inconsistent discipline, negative parental emotional expressiveness, and parent mental_health demonstrated the strongest relationship to disruptive behavior problems and problems with emotion regulation.	2012	natural
Results indicate that testosterone treatment in FTMs is associated with a positive effect on mental_health on measures of depression, anxiety, and anger, while CRS appears to be more important for the alleviation of body dissatisfaction.	2014	natural
This lack of self-control may have negative consequences for ostracized peoples mental_health, including their level of depressive symptoms.	2012	natural
Results are discussed in relation to possible mediators and moderators of the association between nature connectedness and mental_health.	2011	natural
This approach to care is increasingly included as a central part of mental_health policy and service provision in a number of countries including the UK and Ireland, to address the needs of people who have severe and enduring mental_disorders.	2011	natural
Cross-sectional analyses showed that negative religious coping was associated with poorer mental_health and functioning, and greater perceptions of stigma and discrimination.	2013	natural
These individuals were more likely to have experienced other forms of childhood adversity and to exhibit poor mental_health compared to those who reported no history of CSA.	2013	natural
What contribution can psychologists make to improve the mental_health of this growing sector of the population?	2014	natural
Including mental_health or parenting abilities ranked instruments whose composite scores were 35 lower.	2012	natural
Despite advances in public awareness of mental_disorders in youth, a substantial proportion of young people with severe mental_disorders have never received specialty mental_health care.	2011	natural
This informed the development of a suite of proposed PIs for mental_health services.	2013	natural
Counselors who become familiar with these practices and ways in which they promote positive mental_health can gain new understanding and methods for assisting clients and thereby extend their therapeutic effectiveness.	2012	natural
Only 19 respondents do not prescribe antidepressants, and instead refer depressed patients to mental_health specialists.	2013	natural
Having more PF promotes the ability to identify and differentiate the nuances of pleasant and unpleasant emotions, which enhances an individual's mental_health.	2013	natural
This paper utilizes the latest empirical evidence to propose a diagram detailing pathways from maltreatment to delinquency through potential intervening risk factors, including substance abuse, mental_health problems, school difficulties, negative peer networks, and running away from home.	2010	natural
Given the difficulties associated with access to mental_health services for refugees, both preventive and community-based interventions within family, school, and peer systems hold particular promise.	2012	natural
The presence of symptoms related to PTSD may be associated with an indirect negative impact on social contacts and a poorer therapeutic alliance with mental_health professionals.	2012	natural
Longstanding depression in adolescence is a powerful predictor of continued mental_health problems in adulthood.	2011	natural
While these two paradigms are diametrically opposed in theory, they are often required to be juxtaposed in practice, especially for therapists working in mainstream mental_health services.	2011	natural
To date, the dominant approach for promoting the uptake of EBPTs in clinical settings has been to target the education and training of mental_health providers, with many consumers remaining unaware of the potential benefits of EBPTs for anxiety disorders.	2013	natural
Physicians and psychiatrists need to be aware of the co-occurrence of mental and physical health problems and the challenges posed for both general and mental_health services.	2014	natural
Self- and caregiver-rated child mental_health (Strengths and Difficulties Questionnaire), depressive (Depression Self-Rating Scale), and posttraumatic stress (Child Revised Impact of Events Scale) symptoms and caregiver mental_health (Self-Report Questionnaire) were assessed.	2011	natural
Television was the most common source of information about mental_health issues in the previous 12 months (accessed by 20.5 of respondents) followed by pamphlets and brochures (accessed by 15.6 of respondents).	2011	natural
72 of clinical staff members responded to the survey, for a sample of 154 mental_health clinicians; 26.6 of the clinicians counseled more than half of their clients annually about all three cardiovascular disease (CVD) risk factors.	2013	natural
Most older adults who access mental_health services do so in primary care settings, where interdisciplinary, collaborative models of care have been found to be quite effective.	2012	natural
The impact of disasters on the mental_health, well-being and social inclusion of children and young people is well established.	2014	natural
Yet the mental_health implications of engaging in these relationships are unclear; past research has found negative associations, positive associations, or no association with mental_health.	2014	natural
A nationally representative sample of American adolescents (N = 3,614) between the ages of 12 and 17 completed structured telephone interviews assessing homicide survivorship and mental_health consequences including posttraumatic stress disorder (PTSD), depression, drug use, and alcohol abuse.	2012	natural
In 2006, randomly selected employees (N = 549) of a hospital in Beijing were surveyed concerning their exposures to the city's 2003 SARS outbreak and the ways in which the outbreak had affected their mental_health.	2012	natural
A narrative review of various governmental policy documents and selected papers relevant to teamworking and recovery-focused care within mental_health services, in an Irish context.	2013	natural
At this stage, there is insufficient evidence to support the notion that these technologies can replace face-to-face interventions; however, they have many properties which, if used correctly and with ethical considerations, may enhance therapy, prevention, and public mental_health.	2013	natural
A qualitative approach with an Interpretative Phenomenological Analysis was utilised to explore the accounts of five mothers of young people who had self-harmed and yielded three main themes: The Unknown, which reflected the mothers' contextual experience of an ominous sense of uncertainty about what is still to come out; shame and blame, which led the mothers to feel exposed and vulnerable in front of mental_health professionals; and knowledge, which appeared as a key influence on the mothers' relationships with services, where withholding or sharing of knowledge left mothers feeling either excluded and isolated, or included and empowered.	2011	natural
Overweight and obesity in ED patients are thus not only associated with physical health problems, but also with mental_health issues.	2014	natural
Improving access to mental_health services is a challenge and requires the creation of new venues within the healthcare system.	2013	natural
Participants included 543 public sector, master's-level mental_health and substance abuse therapists who treat adolescents.	2011	natural
This study used a one-off image rescripting session, using an A-B design with four participants with psychosis who were attending adult mental_health community services.	2014	natural
Treatment suggestions were provided with the intention of removing barriers and incorporating culturally sensitive methodologies, while continuing to work closely with our local mental_health providers and Hmong leadership.	2012	natural
Identification and management of aggression is a major mental_health priority in hospitalised patients.	2013	natural
Finally, we examined whether generational status moderated the impact of racial and cultural predictors of mental_health by testing our model across immigrant and U.S.-born samples.	2011	natural
Thirty-two percent of cases had no contact with services for a mental_health reason preceding the index diagnosis, and nearly 50 received the index diagnosis of psychosis in the emergency department.	2013	natural
With the exception of posttraumatic stress, one-year trajectories for all mental_health outcomes showed significant improvement (p < .001).	2011	natural
Moreover, the mental_health field must become better prepared to support service members and families across a rapidly evolving landscape of military operations around the world, including those who are making the transition from active duty to Veteran status and navigating a return to civilian life and those families in which parents will continue to actively serve and deploy in combat zones.	2013	natural
There is a considerable need for adolescents with intentional assault-related injuries to be screened for alcohol and mental_health problems, and to be referred for appropriate treatment interventions if they score at problem levels.	2010	natural
Campus mental_health needs are in the spotlight.	2010	natural
In this study we evaluate the program's effectiveness using merged administrative data from various state agencies for the years 2007-2011, comparing FTT clients to released prisoners who, despite having serious mental_health disorders, did not meet the criterion for DMH services.	2012	natural
Using the Fall 2009 American College Health Association-National College Health Assessment, responses from heterosexual, gay, lesbian, bisexual, and unsure students (N = 27,454) relating to mental_health issues and impact of these issues on academics were examined.	2011	natural
Fifty-one multitraumatized mental_health patients with refugee backgrounds completed the Rorschach (Meyer & Viglione, 2008), Harvard Trauma Questionnaire, and Hopkins Symptom Checklist-25 (Mollica, McDonald, Massagli, & Silove, 2004), and the World Health Organization Quality of Life-BREF questionnaire (WHOQOL Group, 1998) before the start of treatment.	2013	natural
Implications of these results for interventions to promote mental_health and wellbeing are discussed.	2010	natural
Male adolescents showed smaller variations in depression and anxiety by smoking status, but were more likely to seek mental_health services.	2012	natural
This metaanalytic review examined the role of received and perceived social support in promoting mental_health among first responders (e.g., firefighters, police officers, and paramedics or emergency medical services personnel).	2010	natural
Intimacy-related content was positively associated with relationship quality and mental_health.	2012	natural
Hazardous drinking was found to partially mediate the relationship between PTSD and functional mental_health, but not physical health.	2010	natural
To explore mental_health symptom presentation in South Asians in the US and to identify facilitators and barriers to treatment.	2014	natural
The present study examined the relation between institutional climate (support, growth, atmosphere, and repression) and aggressive incidents using data of 72 patients in a secure (forensic) mental_health clinic and a clinic for prolonged intensive care.	2013	natural
Integrating CBT into school mental_health providers' repertoires through training and consultation is a critical step for dissemination and implementation of empirically supported psychosocial treatments.	2012	natural
Forty-eight semi-structured interviews were conducted with mental_health care professionals working in 16 European countries.	2013	natural
The authors organize their recommendations around several key principles from various mental_health codes of ethics.	2013	natural
This meta-analysis is the first systematic quantitative review of studies evaluating the impact of integrated programs on maternal mental_health.	2010	natural
Patients with chronic medical conditions (CMCs) and a comorbid anxiety or mood disorder tend to report more symptoms and experience poorer treatment outcomes compared with those without mental_health comorbidity.	2013	natural
Despite a dramatic growth of Asian communities in North America, the cultural norms, values, and practices of Asians are generally unknown in the professional community, posing a significant challenge in diagnosis and treatment of mental_health problems.	2010	natural
This study aimed to find out about the experience of an infant or young child in care, to learn about possible reasons for the under-detection of mental_health and emotional difficulties in a group of particularly vulnerable children, and to inform training and support for professionals.	2011	natural
To examine differences across a community mental_health system and a private managed care system in the accuracy of a warning system designed to identify youth at risk for deterioration in mental_health services.	2012	natural
Recommendations are offered regarding the infrastructure needed to sustain mental_health consultation capacity in early care and education settings, and related policies and practices.	2012	natural
This study highlights the possible detrimental influences of maternal mental_health in relation to mothers providing their child with a positive parental role model around eating and feeding.	2013	natural
A possible relationship between mindfulness and thought recognition may operate to influence other mechanisms to heighten mental_health, as well as reduce anger and aggression.	2012	natural
Few studies investigated suicidal behaviour or mental_health difficulties in the profession.	2012	natural
I discuss the implications of the findings with regard to theories about religion, mental_health, and gender in South Korean context.	2013	natural
Most participants displayed poor knowledge of mental_disorders and reported that they referred to colleagues or to an external mental_health service if they suspected a possible mental_disorder in a patient.	2012	natural
This article is intended to assist mental_health counselors, counselor educators, and counseling students who are already familiar with basic terms and concepts in transgender care.	2010	natural
Despite an impressive body of literature demonstrating this relationship and claims that comorbidity matters, few studies examine comorbidity using multiple distinct mental_health indicators, with most studies instead adopting single or composite mental_health measures.	2010	natural
The impacts of trauma on behavior and mental_health are profound, and highly effective interventions targeting sequelae of childhood trauma are currently being developed for use in low resource areas.	2014	natural
Although sexual minority (SM) adolescent girls are at high risk for suicidal behavior, little is known about their use of mental_health services (MHS).	2012	natural
Sustainable solutions to the access to mental_health care problems are complex and must address both the availability of mental_health care resources and the acceptability of those resources to consumers.	2013	natural
Our findings suggest that mental_health providers and sexuality educators should be more concerned about the influence of religiosity on internalized homonegativity and outness when clients have a history of affiliation with Evangelical Protestant faiths more so than Catholic or Mainline Protestant faiths.	2012	natural
Staff from six participating agencies received training in (a) how to identify and screen individuals with mild ID for depressive symptoms and risk factors for depression, and (b) supportive referral of identified individuals to GPs for mental_health services.	2013	natural
For women but not men, baseline mental_health was associated with risk of experiencing any subsequent unemployment whereas for men but not women mental_health was associated with the duration of unemployment amongst those who experienced unemployment.	2012	natural
Results indicated significant correlation coefficients between family violence, mental_health, and hope.	2014	natural
Participants completed a survey assessing sexual activity, mental_health and physical health at baseline (3-5-day post-surgery; n=60) and 2-month post-surgery (n=42).	2012	natural
The study draws on survey data producing some of the first representative estimates of mental_health services and staffing in private schools.	2012	natural
A post hoc exploratory examination of changes that were associated with improved quality of life in ESML participants revealed significant reductions of depressive symptoms and behavior problems (p < .05), improved family communication (p < .05), self-efficacy (p < .01), Medical Outcomes Study short form (SF-36) role-emotional (p < .05), SF-36 social functioning (p < .05), and SF-36 mental_health components (p < .01) in improvers.	2010	natural
This study presents qualitative findings from an intensive dialogue meeting held with a multidisciplinary sample of 35 leaders in education, children's mental_health and related fields.	2012	natural
We identified maternal mental_health trajectories in pre- and postnatal period, and examined their association with later child mental_health and development.	2011	natural
Similarly, mental_health symptoms of the respondents were associated with the partner's violent attitudes.	2011	natural
Policy efforts to improve community mental_health should consider psychosocial job quality in conjunction with efforts to increase employment rates.	2013	natural
Implementation factors monitored suggest that it is feasible to integrate and evaluate evidence-based mental_health assessments and intervention into programmatic services run by an NGO in low/middle resource countries.	2013	natural
For African Americans, but not non-Latino whites, the perceived efficacy of mental_health treatment improved the likelihood of past-year specialty use.	2011	natural
Child care and parenting needs of adults with mental_illness are of growing concern, especially among those seeking Department of Veterans Affairs (VA) mental_health services.	2013	natural
Both groups also self-evaluated their physical and mental_health, while we administered general (Mini-Mental State Examination) and specific (Digit Symbol Substitution Test) cognitive assessments.	2014	natural
Throughout the past 50 years mental_health services have aimed to provide and improve high quality inpatient care.	2014	natural
This paper shares results of a qualitative study of the perceived determinants of life satisfaction among 30 high school students who were diverse in terms of mental_health; 610 participants were classified as complete mental_health, vulnerable, symptomatic but content, or troubled at two time points separated by a year.	2013	natural
There is increasing evidence that experiencing discrimination may contribute to poor mental_health among Black Americans.	2011	natural
The role of clinical supervision in the largerscale implementation of effective mental_health treatments has begun to attract attention in effectiveness research and implementation science.	2013	natural
The median length of stay for mental_health visits (169 minutes) significantly exceeded that of other visits (108 minutes).	2011	natural
This article outlines a series of arguments concerning the effects of gender in moderating the effect of religious involvement on mental_health and examines them empirically.	2010	natural
This study examined relationships between caregiver mental_health and the extent to which needs were met in families of individuals with traumatic brain injury (TBI) in Mexico City, Mexico.	2013	natural
There is a worldwide shortage of mental_health professionals trained in the provision of mental_health services to older adults.	2010	natural
