The authors organize their recommendations around several key principles from various mental_health codes of ethics.	2013	natural
This meta-analysis is the first systematic quantitative review of studies evaluating the impact of integrated programs on maternal mental_health.	2010	natural
Patients with chronic medical conditions (CMCs) and a comorbid anxiety or mood disorder tend to report more symptoms and experience poorer treatment outcomes compared with those without mental_health comorbidity.	2013	natural
The Italian MHCSF is a reliable and valid instrument to measure well-being and the positive aspects of mental_health.	2014	natural
Despite a dramatic growth of Asian communities in North America, the cultural norms, values, and practices of Asians are generally unknown in the professional community, posing a significant challenge in diagnosis and treatment of mental_health problems.	2010	natural
This study aimed to find out about the experience of an infant or young child in care, to learn about possible reasons for the under-detection of mental_health and emotional difficulties in a group of particularly vulnerable children, and to inform training and support for professionals.	2011	natural
Despite the fact that most children presenting to public mental_health services are referred for disruptive behavior problems, supervision sessions are infrequently focused on practice elements consistent with EB treatments for this population.	2011	natural
To examine differences across a community mental_health system and a private managed care system in the accuracy of a warning system designed to identify youth at risk for deterioration in mental_health services.	2012	natural
Patients at the psychiatric day hospital and mental_health professionals were invited to complete the study questionnaire.	2011	natural
Recommendations are offered regarding the infrastructure needed to sustain mental_health consultation capacity in early care and education settings, and related policies and practices.	2012	natural
This study highlights the possible detrimental influences of maternal mental_health in relation to mothers providing their child with a positive parental role model around eating and feeding.	2013	natural
A possible relationship between mindfulness and thought recognition may operate to influence other mechanisms to heighten mental_health, as well as reduce anger and aggression.	2012	natural
Few studies investigated suicidal behaviour or mental_health difficulties in the profession.	2012	natural
This paper looks at evidence from a systematic review undertaken for the National Institute of Clinical Excellence (NICE) in England and commissioned as a prelude to the issuing in 2008 of national public health guidance on mental_health interventions at primary (elementary) school level (children aged four to 11 years).	2010	natural
I discuss the implications of the findings with regard to theories about religion, mental_health, and gender in South Korean context.	2013	natural
We assessed parenting behaviors, family conflict, mental_health, sexual behavior, substance use, and HIV-related health behaviors over time.	2012	natural
Most participants displayed poor knowledge of mental_disorders and reported that they referred to colleagues or to an external mental_health service if they suspected a possible mental_disorder in a patient.	2012	natural
This article is intended to assist mental_health counselors, counselor educators, and counseling students who are already familiar with basic terms and concepts in transgender care.	2010	natural
Despite an impressive body of literature demonstrating this relationship and claims that comorbidity matters, few studies examine comorbidity using multiple distinct mental_health indicators, with most studies instead adopting single or composite mental_health measures.	2010	natural
The impacts of trauma on behavior and mental_health are profound, and highly effective interventions targeting sequelae of childhood trauma are currently being developed for use in low resource areas.	2014	natural
Although sexual minority (SM) adolescent girls are at high risk for suicidal behavior, little is known about their use of mental_health services (MHS).	2012	natural
Sustainable solutions to the access to mental_health care problems are complex and must address both the availability of mental_health care resources and the acceptability of those resources to consumers.	2013	natural
Our findings suggest that mental_health providers and sexuality educators should be more concerned about the influence of religiosity on internalized homonegativity and outness when clients have a history of affiliation with Evangelical Protestant faiths more so than Catholic or Mainline Protestant faiths.	2012	natural
Staff from six participating agencies received training in (a) how to identify and screen individuals with mild ID for depressive symptoms and risk factors for depression, and (b) supportive referral of identified individuals to GPs for mental_health services.	2013	natural
Implications for screening for mental_health and appropriate treatment planning are discussed.	2014	natural
For women but not men, baseline mental_health was associated with risk of experiencing any subsequent unemployment whereas for men but not women mental_health was associated with the duration of unemployment amongst those who experienced unemployment.	2012	natural
Results indicated significant correlation coefficients between family violence, mental_health, and hope.	2014	natural
Participants completed a survey assessing sexual activity, mental_health and physical health at baseline (3-5-day post-surgery; n=60) and 2-month post-surgery (n=42).	2012	natural
The study draws on survey data producing some of the first representative estimates of mental_health services and staffing in private schools.	2012	natural
A post hoc exploratory examination of changes that were associated with improved quality of life in ESML participants revealed significant reductions of depressive symptoms and behavior problems (p < .05), improved family communication (p < .05), self-efficacy (p < .01), Medical Outcomes Study short form (SF-36) role-emotional (p < .05), SF-36 social functioning (p < .05), and SF-36 mental_health components (p < .01) in improvers.	2010	natural
In both countries, the vast majority of mental_health care needs are not fulfilled.	2011	natural
This study presents qualitative findings from an intensive dialogue meeting held with a multidisciplinary sample of 35 leaders in education, children's mental_health and related fields.	2012	natural
We identified maternal mental_health trajectories in pre- and postnatal period, and examined their association with later child mental_health and development.	2011	natural
Similarly, mental_health symptoms of the respondents were associated with the partner's violent attitudes.	2011	natural
Policy efforts to improve community mental_health should consider psychosocial job quality in conjunction with efforts to increase employment rates.	2013	natural
This has potential cost implications for local mental_health services in relation to out of area treatment placements and perhaps more importantly to the overall quality of patient care.	2011	natural
These results support theories of therapeutic jurisprudence, suggesting that having a CPO can improve mental_health outcomes.	2012	natural
The discussion regarding a refugee population focuses on service integration needs and emerging collaborative models as well as ways in which refugee mental_health research can be improved.	2014	natural
Implementation factors monitored suggest that it is feasible to integrate and evaluate evidence-based mental_health assessments and intervention into programmatic services run by an NGO in low/middle resource countries.	2013	natural
For African Americans, but not non-Latino whites, the perceived efficacy of mental_health treatment improved the likelihood of past-year specialty use.	2011	natural
The current study tested whether an abbreviated version of Defiant Children (Barkley, 1987), an efficacious parent training program to address the behavioral noncompliance often associated with disruptive behavior disorders, could be implemented successfully within a community mental_health clinic setting by master's-level therapists.	2011	natural
Child care and parenting needs of adults with mental_illness are of growing concern, especially among those seeking Department of Veterans Affairs (VA) mental_health services.	2013	natural
Both groups also self-evaluated their physical and mental_health, while we administered general (Mini-Mental State Examination) and specific (Digit Symbol Substitution Test) cognitive assessments.	2014	natural
Throughout the past 50 years mental_health services have aimed to provide and improve high quality inpatient care.	2014	natural
Our findings indicate that poor mental_health and specific mental_health conditions remain prevalent in primary care.	2014	natural
This paper shares results of a qualitative study of the perceived determinants of life satisfaction among 30 high school students who were diverse in terms of mental_health; 610 participants were classified as complete mental_health, vulnerable, symptomatic but content, or troubled at two time points separated by a year.	2013	natural
There is increasing evidence that experiencing discrimination may contribute to poor mental_health among Black Americans.	2011	natural
A continuation of Part I, which introduced mental_health recovery concepts to family therapists, Part II of this article outlines a collaborative, appreciative approach for working in recovery-oriented contexts.	2012	natural
Accordingly, there is an increasing need for geriatric mental_health services with the rapid growth of the aging population worldwide (Bragg , 2012).	2013	natural
The role of clinical supervision in the largerscale implementation of effective mental_health treatments has begun to attract attention in effectiveness research and implementation science.	2013	natural
The median length of stay for mental_health visits (169 minutes) significantly exceeded that of other visits (108 minutes).	2011	natural
This article outlines a series of arguments concerning the effects of gender in moderating the effect of religious involvement on mental_health and examines them empirically.	2010	natural
This study examined relationships between caregiver mental_health and the extent to which needs were met in families of individuals with traumatic brain injury (TBI) in Mexico City, Mexico.	2013	natural
These results are informative when designing training for GPs in communication and mental_health.	2012	natural
There is a worldwide shortage of mental_health professionals trained in the provision of mental_health services to older adults.	2010	natural
While these very young children are at the greatest peril for physical, mental_health, and developmental issues and tend to spend the longest time in the foster care system, little research has been done to explore their experiences and developmental outcomes.	2013	natural
Results of this study indicate that respondents primarily conceptualize mental_health problems as spiritual matters and seek to address these concerns with an Ors priest first.	2014	natural
Adolescents with intellectual disabilities may have considerable mental_health problems which are functionally impairing yet frequently unidentified and hence untreated.	2012	natural
The results provide hints to parents and teachers for improving the mental_health of children in immigrant families by reducing the occurrence of depression.	2011	natural
Delivering culturally responsive EBPs is essential for mental_health practitioners working within racially, culturally, and ethnically diverse settings and across a variety of disorders.	2011	natural
Existing research on the correlates of mental_health effects of rape suggests that rape victims are at higher risk for poor overall health status.	2011	natural
Calls in Spanish revealed language access barriers, with fewer than half of Spanish-speaking callers to schools and mental_health agencies obtaining an appointment.	2013	natural
The current cross-sectional study describes traumatic event exposure in detail and its relationship to behavioral health among an at-risk sample of young children (N = 184), under 6 years of age, upon enrollment into an early childhood, family-based, mental_health system of care.	2012	natural
Preventing child mental_health problems and child obesity have been recognized as public health priorities.	2014	natural
Whilst some important aspects of Justice Bell's decision concerning the general methodology to be applied when analysing human rights were overturned in the subsequent Court of Appeal decision of R v Momcilovic [2010] VSCA 50, the latter decision did not concern mental_health and so leaves Kracke as the most detailed articulation and analysis of human rights within this difficult sphere.	2010	natural
The study examined dispositional optimism s role in buffering the effect of warzone stress on mental_health symptoms and mental_health symptoms on work impairment.	2011	natural
Although many similarities existed between sexes for predictors of violent offending, the findings of this study indicate that more attention needs to be paid to the mental_health of female offenders.	2014	natural
A total of 5,960 high-school students participated and reported on SAD, life time victimization, PTSS and mental_health service utilization.	2013	natural
Burdening selection and cultural/political context are suggested as interpretative perspectives on the contextual and personal influences on the complex relationship between parenthood and mental_health.	2010	natural
Although previous research suggests that increased religiosity is associated with better mental_health and many authors have conjectured that religion-based social support may help explain this connection, scant research has directly examined whether religion-based support mediates religiosity and mental_health.	2014	natural
Existing theories suggest that the mother-infant relationship has a potentially significant effect on long-term adult mental_health, but there are few empirical data to support this view.	2014	natural
The ability to adaptively exert control over negative emotions is associated with beneficial mental_health outcomes.	2013	natural
Externalizing and internalizing mental_health problems were assessed at age 8 years (Rutter scales), substance use and externalizing and internalizing problems [Youth Self-Report (YSR)] at age 15-16 years, and hospital diagnoses for internalizing disorders (age 25) and criminal offences (age 20) from nationwide registers in adulthood.	2014	natural
Iraq and Afghanistan war veterans experience significant rates of posttraumatic stress disorder (PTSD) and other trauma-related mental_health conditions.	2012	natural
We present a conceptual model and recommendations to guide future research on the effect of mental_health treatment on HIV transmission risk behavior among PLWHA.	2010	natural
Family engagement was defined as receipt of a high dose of visits and home visitor response to intimate partner violence (IPV) and poor maternal mental_health as measured via record review and by maternal report of trust in the home visitor.	2010	natural
First, we provide an overview of important contextual issues to be considered when addressing research questions pertinent to the implementation of mental_health interventions in schools.	2014	natural
Furthermore, husbands' perceived community disorder is directly associated with their own physical and mental_health.	2010	natural
Preterm birth confers risk for poor outcome, including mental_health problems.	2014	natural
One hundred and five patients under the care of secondary mental_health care services were assessed using the Mini-ICF-APP and several well-established measures of functioning and symptom severity.	2013	natural
The loss of a client to suicide is a painful personal and professional experience for mental_health providers.	2012	natural
This included practices such as the explicit discussion of emotions and mental_health and the consumption of feminine drinks under certain circumstances (e.g., in private, with close friends).	2013	natural
There is growing recognition that to maximize service impacts, first-time users of community mental_health services require treatment approaches different from those for experienced users.	2014	natural
Errors have been found to frequently occur in the management of case records within mental_health service systems.	2014	natural
Since the experience and expression of mental_health is partly culturally determined, it is of interest to examine if similar associations are found in other cultural settings.	2013	natural
To assess long-term effects of early traumatic brain injury (TBI) on mental_health, cognition, behaviour and adjustment and to identify prognostic factors.	2013	natural
Compared to Whites, Asian and Black elders were less likely to see a mental_health professional or receive counseling in the past year.	2010	natural
We argue that implementing interventions synchronously across multiple pathways has considerable potential to reduce and eventually eliminate disparities in mental_health care.	2012	natural
This study explored how crisis mental_health clinicians and police officers experience the service interface to identify perceived challenges tocollaboration and possible solutions.	2012	natural
Using data from the prospective, population-based Avon Longitudinal Study of Parents and Children (ALSPAC), we investigated the associations between binge patterns of alcohol consumption during pregnancy (4 drinks per day) and child mental_health [as rated by both parent (n = 4,610) and teacher (n = 4,274)] and academic outcomes [based on examination results (n = 6,939)] at age 11 years.	2014	natural
Family functioning mediated the effects of SES and shame on caregiver mental_health and also moderated the effects of SES and shame on caregiver depression.	2014	natural
Findings advance the culture and suicide literature by highlighting how current research and practice that characterize suicidal ideation and behaviors as a mental_health phenomenon may not comprehensively identify suicidality among an ethnic minority group.	2014	natural
Our findings suggest that salubrious effects of volunteering on the self-perceived physical and mental_health of middle- aged and older- aged adults varied by their participation in different forms of religiosity.	2013	natural
The present study examined whether common psychiatric labels (i.e., mental disease, mental_disorders, mental_health problems, and mental_illness) elicited divergent attitudes and perceptions in a group of participants.	2013	natural
The objective of this study was to measure the lifetime prevalence of BD, and to describe the socio-demographics, comorbidities, and use of mental_health services among 15-24-year-olds with BD.	2010	natural
When we re-examine what is known about these children outside of pathologizing assumptions, what do we know about promoting their mental_health and adaptation?	2012	natural
An integrative approach addressing both substance misuse and mental_health factors is pivotal.	2014	natural
The aim of this article is to describe the short-term effects of relationships with significantly older females on the substance use and mental_health of adolescent boys.	2012	natural
The BFDS was negatively correlated with helpful coping mechanisms (family hardiness, and parent empowerment), and positive adjustment (caregiver quality of life and positive parenting experiences), and positively correlated with known stressors (severity of aggressive behavior, negative life events) and problematic coping and outcomes (caregiver burden, worry, mental_health problems).	2010	natural
Internet addiction (IA) is an emerging social and mental_health issue among youths.	2014	natural
Some authors suggest that besides the fundamental components, cognitive reserve (CR) also reflects the influence of a combination of factors that improve mental_health.	2011	natural
Associations of mobile phone use after lights out with mental_health, suicidal feelings, and self-injury were cross-sectionally examined in 17,920 adolescents using a self-report questionnaire.	2012	natural
Controlling for the hierarchical structure of the data, latent variable regression analysis indicated that the programme had a significant positive effect on coping and on the impact of mental_health difficulties in daily life.	2012	natural
This study examined differences in mental_health service use in non-Hispanic white, black, Hispanic, and Asian adolescents who experienced an episode of major depression.	2011	natural
With 99 correlations from 23 independent studies, the overall relationship between racial discrimination and mental_health was statistically significant ( r = .23).	2011	natural
Variation in disclosure of thoughts of suicide to a mental_health or primary care provider depends, in part, on patient characteristics.	2014	natural
Interactions indicate soldiers with both mental_health and injury history are particularly vulnerable.	2010	natural
This study examined the latent structure of a number of measures of mental_health (MH) and mental_illness (MI) in substance use disorder outpatients to determine whether they represent two independent dimensions, as Keyes (2005) found in a community sample.	2010	natural
Little is known about the characteristics of young psychologically-distressed refugees in mental_health services, and how they vary according to the duration of settlement.	2013	natural
Help-seeking is an adaptive means to address mental_health difficulties, but sufferers often fail to seek assistance.	2010	natural
This reorientation from discrete categorical disorder manifestations to underlying cross-cutting dimensions of individual functioning has generated considerable debate across the community of mental_health researchers and clinicians (with strong views voiced both pro and con).	2014	natural
Issues about how cellular phone use relates to adolescent mental_health, such as suicidal ideation and attempts, are important because of the high rate of cellular phone usage among children in that age group.	2014	natural
Using theAndersen Social and Behavioral Model (1995) the following shared predictors of mental_health service use across both sectors by custodial grand-families emerged: grandchildren's externalizing symptoms, having other grandchildren in the household with medical or psychiatric diagnoses and corresponding use of services in the other sector.	2012	natural
The Church has always been associated with care of the sick; this continues today many clergy see people with mental_health issues.	2011	natural
The results indicate that 'core' competencies for mental_health work in the context of an FHT go well beyond those required for an embedded mental_health 'programme' or specialised mental_health counsellors, but rather they relate to the core and discipline-specific competencies of members of the entire team.	2013	natural
Depression and social anxiety disorder (SAD) are two of the most common mental_health conditions, and often occur together.	2013	natural
MQOL had a favorable impact on the mental_health composite score of the Short Form-36 at the end of treatment but not at 6 months (effect size=0.52 and -0.04); health-related QOL as measured by the Functional Assessment of Cancer Therapy-Prostate at the end of treatment and 6 months (effect size=0.14 and 0.10); and prostate cancer specific anxiety as measured by the Memorial Anxiety Scale for Prostate Cancer at the end of treatment and 6 months (effect size=0.45 and 0.23).	2011	natural
Evaluation for child custody is one of the most criticized areas of forensic mental_health assessment due to the perceived lack of standardization in evaluation methods.	2012	natural
This study helps to inform efforts to increase the cultural sensitivity of mental_health services for the underserved population of Chinese-immigrant families.	2011	natural
We undertook a systematic review of the international literature for studies that used validated instruments and techniques to diagnose prevalence rates of physical and mental_health disorders in homeless adolescents.	2014	natural
Longitudinal case study data is presented, showing contradiction and escalating contest between ethics-orientated and rules-based systems in a high-commitment mental_health setting, triggering a crisis and organisational closure.	2013	natural
Findings implicate the role of coping in the relationship between family environment and adolescent mental_health.	2014	natural
Three types of economic analyses that can be undertaken within mental_health services are outlined: (a) cost-benefit analysis, (b) cost-utility analysis and (c) cost-minimisation analysis.	2013	natural
Further, neither self-stigma nor attitudes toward mental_health care predicted engaging in needed mental_health care when cynicism was included in the model.	2013	natural
Lower scores of mental_health and feelings of inferior integration set the necessity for early counseling and intervention needs.	2011	natural
Other-unforgiveness was unrelated to mental_health and life satisfaction while self-unforgiveness was a predictor of both.	2012	natural
The findings are discussed not only in relation to the latent deprivation model but also in relation to common approaches to job satisfaction and mental_health.	2010	natural
Seeking help from religious advisors for mental_health problems varies dramatically among ESEMeD countries.	2010	natural
