The first of a two-phase project is reported that examined the prospective effects of stress and social support on the physical and mental_health of the elderly.	1986	natural
The authors finally suggest that this type of communication is fundamental to the mental_health of youth within the family unit.	1988	natural
This report presents information about the types of group homes within a state system based upon the characteristics and service needs of 1,050 persons in 118 group homes and questions the role of community mental_health centers in addressing certain service needs of group home residents.	1985	natural
The findings are discussed from mental_health and sex roles perspectives.	1986	natural
This study reports on the associations between a number of personality factors and spouse mental_health, happiness, and communication (N = 78).	1986	natural
In a mental_health setting, a self-instructional training program tailored to the specific behavioral deficits of each subject was introduced sequentially in a multiple-baseline design.	1986	natural
The support of administration and the multidisciplinary interaction of mental_health professionals among themselves and with nonpsychiatric physicians have been crucial to the Center's viability.	1989	natural
The data showed the children were functioning with adequate mental_health.	1988	natural
Data are cited that show the rapid shift from free choice care to various forms of managed care, and practitioners are urged to participate in shaping the changes that are now in process in order to develop a humane and effective system of mental_health care.	1989	natural
The second section spells out some of the possible administrative considerations and concerns regarding supervision in family service agencies, mental_health centers, social service organizations, and similar counseling environments.	1986	natural
This study was a followup investigation on the counselor's role in community mental_health.	1988	natural
At a time when the courts are increasingly called on to settle disputes, the mental_health profession finds itself vulnerable to litigation under legal doctrines that were previously limited to the medical establishment.	1985	natural
What are the mental_health consequences of an unsuccessful job search?	1987	natural
Finally, it suggests specific reforms that may improve the use of mental_health experts in legal proceedings.	1989	natural
However, promotion is an aspect of mental_health's prevention not often discussed.	1985	natural
From being a service that was influenced by mental_health clinics with a psychodynamic approach, it has developed into a more school- and education-orientated service.	1989	natural
The support of administration and the multidisciplinary interaction of mental_health professionals among themselves and with nonpsychiatric physicians have been crucial to the Center's viability.	1989	natural
No relationship was found between service employment and either of the mental_health service use indices.	1989	natural
The objectives of this study were to investigate the mental_health of Iranian high school and college students with regard to sex differences and to compare the results with those from other countries.	1989	natural
There is opportunity for coalition building among fat women, health and mental_health professionals, and organizations like Ample Opportunity which support a positive lifestyle not dependent on weight reduction.	1989	natural
Three areas of assessment are recommended: assessment of major stresses (migration stress, acculturation stress, life cycle stress, and family stress); assessment of strengths; and assessment of culturally specific responses to mental_health problems.	1988	natural
The author describe the different stages of the project as much from the point of view of the workers'experiences, the ideological evolution, the organisational modalities as from its impact on the network of the mental_health distribution services.	1986	natural
The scores of Hare Krishna women did not differ significantly from those of women in the US general population on all 9 scales so their mental_health was equivalent.	1987	natural
Forensic Psychiatry has been criticized for losing pace with more general psychiatric trends toward community mental_health.	1987	natural
Results indicate (a) distinctly different trends between APA- and non-APA-accredited programs in many program characteristics, (b) increasing female applications, admissions, and enrollments, (c)no improvement in minority student admissions, (d) increasing hospital internships, and (e) increasing initial job placements in hospitals, community mental_health centers, and private practice.	1989	natural
First, we trace the dialectical development of the ideology of community mental_health and the rediscovery of community.	1986	natural
A multiple baseline across groups design was used to assess the effectiveness of first self-monitoring (feedback), then self-monitoring plus assigned goals (feedback and goal setting), on the proportion of work hours spent in direct client contact by 17 clinicians in a rural mental_health center.	1988	natural
On the other hand, the young adult using mental_health services sees the impact social integration will have on his quality of life : is life outside possible when both institutional organization and conditions within society contribute to impoverishing one's personality and resources?	1988	natural
They may be broken down into three groups: those issues involving cultural values and definitions of mental_health; those issues that relate to undisclosed goals maintained by the therapist that may differ from the patient's as well as recommendations for types of treatment; and those issues which relate to the psychoterapeutic method, with its emphasis on the therapeutic relationship and its encouragement of openness of patient communication which may result in problems relating to confidentiality and privacy.	1987	natural
Perceptions and mental_health policies should be revised to reflect the reality of more similarities than differences among aging widows and widowers.	1986	natural
Although most mental_health professionals doubt the capacity of mentally retarded patients to benefit from psychotherapy, a review of case studies, writings, and research revealed that mentally retarded patients responded positively to treatment.	1989	natural
From a social systems and family systems perspective, this paper considers the relationships among protective service clients, caseworkers in protective service agencies and clinicians asked to provide mental_health services.	1986	natural
In order to be equal to the task of serving the mental_health needs of the community, mental_health professionals must develop methodology which is both effective and affordable, avoiding both undertreatment and overtreatment of those who need and seek their services.	1985	natural
In the field of preventive mental_health, the author has supervised the therapeutic relationship in many groups of helping professionals from different areas over a period of several years.	1985	natural
Some of the cultural factors affecting the utilization of mental_health services are saving face, stoicism, respect for authority and discrimination which may cause them to seek help only at advanced stages of illness.	1987	natural
These data have important implications for mental_health toddler workers involved in training teachers in early childhood settings.	1988	natural
Analyses, based on variables derived from coded audiotapes of simulated helping interactions and from ratings of helper effectiveness, indicated many similarities between mental_health professionals and mutual help leaders but considerable differences between these two groups and divorce lawyers.	1986	natural
The internal consistency reliability of a five-item measure of socially desirable response set, the SDRS-5, was examined in two samples: 614 outpatients of medical providers and 3053 outpatients of medical and mental_health providers.	1989	natural
This article aims at assessing the problem of mental_health for people involved in varied functions in syndical organizations.	1985	natural
In analyses using 30 items common to the mental_health and health clinics samples, additional but weaker factors related to access and office procedures were found.	1989	natural
The expansion of mental_health services during the 1960s from a single remote mental hospital to centers and clinics in mainstream communities fostered the development of community psychology in Hong Kong.	1989	natural
In addition to these pathological changes, certain mental_health resources for medical students have declined (although there is considerable variability from one location to another).	1988	natural
All studies about childhood mental_health are based on referral by adults.	1986	natural
An educational approach that connects concerns about health, mental_health, and sexuality could help alleviate fear and thus benefit cancer patients and their partners and families.	1987	natural
The need for each strategy is illustrated with one or more examples of problems that have arisen when mental_health professionals have failed to obtain consent for their activities, have been insufficiently sensitive to or unaware of conflicts between the usual norms in their professions, and the norms of law enforcement agencies, or have identified too strongly with law enforcement personnel.	1986	natural
A statistical study was conducted at the Occupa- tional Therapy section of Walter Reed Army Medical Center, Washington, D.C., to determine the inter-rater reliability of a clinical assessment and documentation instrument designed for psychosocial (mental_health) patients.	1986	natural
The material comprises 200 successive psychiatric patients from a mental_health centre and a central mental hospital in Finland.	1986	natural
One involves a classified list of risk indicators for different stages of infancy, and the other involves a validation in an 8year longitudinal epidemiological study of the mental_health of 400 children identified during their first year by use of these very early indicators as guides.	1988	natural
It has been suggested that the personality of the individual influences appraisal processes that determine ratings of both social support and mental_health, thus leading to an association between these variables that reflects only their shared self-report bias.	1989	natural
There was no evidence of language delay in either group and no significant association between child behaviour and maternal mental_health.	1989	natural
Providers of mental_health services in both public and private sectors are becoming increasingly dependent on third-party health insurance to cover the costs of outpatient psychotherapy.	1988	natural
Professional and public liability requires mental_health practitioners to develop more reliable methods by which violent behavior may be diagnosed, managed with effective strategies, and ultimately prevented.	1985	natural
A total of 66 clergy were surveyed using a questionnaire designed to determine the following: clergy and church demographic characteristics, clergy involvement in counseling activity, referral practices and value placed on collaboration with mental_health resources, and receptivity towards consultation with mental_health professionals.	1985	natural
Few psychologists were initially involved in the local community mental_health movement, but its momentum resulted in increasing numbers of practitioner psychologists working in community-based service settings.	1989	natural
The results provide strong support for a model in which recipients' perception of support is determined significantly and strongly by actual interpersonal transactions as reported by significant others, moderately by the recipients' negative outlook bias, and weakly by their anxiety and depression as indicators of their poor mental_health.	1987	natural
There was no evidence of differential treatment toward otherthanBlack clients at a Black community mental_health center when comparisons were conducted with the greatest possible methodological rigor.	1989	natural
Self-esteem has long been considered an essential component of good mental_health.	1987	natural
In addition, recommendations are suggested by professionals working in the fields of hearing impairment and mental_health.	1988	natural
The author argues such an image is produced by the fact that social and mental_health services deal mainly with families at grips with multiple, long-standing problems.	1989	natural
The development of an epidemiological study of mental_health, social background factors, suicidal behaviors (suicidal ideas, deliberate self-harm, and attempted suicide), values concerning suicide, and experience of suicide in others is described.	1985	natural
The results of the analysis of the use of mental_health services according to marital status, employment status and changes in social relationships were in keeping with social support theory.	1986	natural
The aim was to prevent poor mental_health and loss of motivation to seek reemployment among those who continued to be unemployed and to promote high-quality reemployment.	1989	natural
This study predicted and demonstrated high positive correlations between repressor-sensitization, self-image disparity and mental_health.	1986	natural
Recent research suggests that children with encopresis do have numerous behavior problems, but that these problems are generally not as severe as the behavior problems found in children referred for mental_health services.	1988	natural
The author describes the different stages in the construction of governmental policies emphasizing specifically the way the policies in mental_health are being developed in Quebec.	1986	natural
They may be broken down into three groups: those issues involving cultural values and definitions of mental_health; those issues that relate to undisclosed goals maintained by the therapist that may differ from the patient's as well as recommendations for types of treatment; and those issues which relate to the psychoterapeutic method, with its emphasis on the therapeutic relationship and its encouragement of openness of patient communication which may result in problems relating to confidentiality and privacy.	1987	natural
Using an instrument developed in the United States to assess students' knowledge of mental_health in old age, the present study tested 179 Australian undergraduates who varied in age, sex, and the frequency of their contact with aged people at home, at work, and in the neighborhood.	1988	natural
The potential predictive value of the social contextual measures of life-event stress for mental_health variables was generally supported by the findings.	1985	natural
Other analyses showed that social support can counteract the negative effects of unsuccessful job search on mental_health and that such effects are particularly pronounced among the more highly motivated job seekers.	1987	natural
Comparison with findings from studies of general mental_health services use suggests that influences on help-seeking may vary across psychiatric disorders.	1987	natural
Skillful juggling of conflicting loyalties is one of the variables that define college counseling as a mental_health specialty.	1989	natural
Recommendations are made for replicating this study in other mental_health settings and with other populations such as the mentally retarded and the elderly.	1989	natural
This article explores the relationship between mental_health problems of prison inmates and the inmates' involvement in custodial violations.	1986	natural
The competence of an occupational therapist in mental_health is built on a generalist training acquired in a first university cycle.	1986	natural
This study examined pointintime and pointofview antecedent cue effects on teachers and mental_health workers perceptions of life events impact on students.	1989	natural
These issues are addressed in a study of the relation between the social environment at work and mental_health.	1987	natural
The results suggest that poor marks, absence of positive coping behaviors, and presence of negative coping behaviors are indicators of later mental_health problems, that the absence of positive coping behaviors may be more indicative of later problems than the presence of negative coping behaviors, and that there are sex differences in the time periods at which indicators of school productivity are important.	1987	natural
Both dimensional and categorical analyses support the view of assaultive children as being in need of mental_health services.	1988	natural
The development of an epidemiological study of mental_health, social background factors, suicidal behaviors (suicidal ideas, deliberate self-harm, and attempted suicide), values concerning suicide, and experience of suicide in others is described.	1985	natural
Some of the findings suggest a crisis process, in which service use increases rapidly following an economic stressor, whereas other findings suggest a more insidious process, in which economic stressors slowly weaken the mental_health of the community and eventually lead to increased mental_health service use.	1989	natural
Older residents, relative to their younger counterparts, had more intense medical and mental_health care needs.	1989	natural
Professional and public liability requires mental_health practitioners to develop more reliable methods by which violent behavior may be diagnosed, managed with effective strategies, and ultimately prevented.	1985	natural
Finally, I'll address the issue of isolation, which occurs because of the social prejudice against fat people and can create physical and mental_health problems.	1989	natural
Until recently mental_health care in Greece was mainly delivered by old traditional mental hospitals and few outpatient services.	1989	natural
The normalizing influence of staff and clients jointly engaging in activities suggests that facility administrators and mental_health consultants underscore the importance of staff's daytoday routine activities and interaction in the adjustment of clients.	1985	natural
There was no evidence of language delay in either group and no significant association between child behaviour and maternal mental_health.	1989	natural
The problems of children with chronic illness generally extend beyond immediate medical concerns Some of these children experience concomitant psychosocial problems This article describes a family-focused social skills development model which has been used in the children's mental_health field to improve children's social interaction, impulse control, and social problem-solving skills In this model, skill training can be focused directly on the child, the family, or both, depending on the resources available, the individual family situation, and whether the child is receiving inpatient or outpatient services Possible preventative and remedial applications of this social skills development model for children and families with chronic illness are discussed.	1989	natural
The results suggest important areas for mental_health professionals to be involved in the care of individuals with cancer if comprehensive care is to be provided.	1989	natural
Recent changes in society associated with Japan's rapid economic development are affecting the mental_health of children and families.	1989	natural
It is urged that this movement be countered by a coalition of mental_health professionals, government agencies, and families of the mentally ill, coming together in a broad and integrated campaign to educate the public and secure the resources necessary for adequate and comprehensive care.	1987	natural
Consequently, these factors should be addressed by mental_health professionals in research and treatment of pathological gambling.	1989	natural
In this article, we present an inventory of strategies for promoting mental_health and we describe the skills needed to achieve such a promotion.	1985	natural
Divorce mediation represents an important new modality for mental_health professionals.	1985	natural
In the past, mainstream Western mental_health professionals tended to ignore or dismiss Asian psychologies.	1988	natural
The author starts with the fact that every mental_health worker, to give meaning to its practice, refers to his knowledge of his practices social frame; he then explores some of the social dimensions inherent to a definition of the mental_health field.	1986	natural
Now that psychotherapy is well established as a valuable treatment in the field of mental_health it is possible to consider future expansion as a cost-effective way to improve the general mental_health of the country.	1989	natural
As background for the potential development of preventive mental_health education programs, the beliefs, feelings, and behavioral intentions of fifthand sixthgrade children toward mental_health issues were surveyed.	1985	natural
This study attempted to evaluate the progress of mental_health professionals regarding sex-role stereotyping in clinical functioning, identified as a problem over 10 years ago by Broverman et al. (	1985	natural
Based upon suggestions from legal and mental_health professionals, the authors advocate allocating state resources for interprofessional family courts which would provide custody counseling, mediation, evaluation, and consultation as alternatives to adversarial methods.	1985	natural
This paper examines the extent of physical and sexual abuse among runaway youths and the association of that abuse with behavior, mental_health, life events, and parental mental_health.	1989	natural
Preventive mental_health measures can be properly planned only if the various factors leading to the adolescent's personality structure are extensively investigated.	1988	natural
In this study, 60 normal university students and 45 new client applicants for mental_health services completed the Survey of Personal Beliefs to assess irrational ideation and the Beck Depression Inventory, the State-Trait Anxiety Inventory, the State-Trait Anger Inventory, the Problematic Situations Questionnaire, and the Profile of Mood States to assess negative emotionality.	1989	natural
The author argues such an image is produced by the fact that social and mental_health services deal mainly with families at grips with multiple, long-standing problems.	1989	natural
Results of path model analyses of physical, psychosocial, and demographic predictors of mental_health of both men and women are offered.	1986	natural
Bivariate results indicate that immigrant children are not at increased risk for psychiatric disorder or poor school performance and that they use mental_health and social services significantly less often than do their nonimmigrant peers.	1989	natural
The effects of a training workshop on mental_health practitioners' attitudes toward homosexuality and counseling behavior were compared with the effects of no intervention.	1989	natural
The current community mental_health movement, struggling under the misnomer deinstitutionalization, is a worthy effort that can succeed if given adequate support and unburdened of pessimism and scapegoating.	1987	natural
These findings also contribute to our understanding of the disproportional use of mental_health related services by women.	1986	natural
Although family coping resources are lower among those experiencing economic distress and are generally positively related to mental_health, their role as mediators of relationships between economic distress and mental_health is limited.	1989	natural
There were, however, no direct effects of smog levels on mental_health.	1987	natural
Economic distress is negatively associated with mental_health.	1989	natural
The status of a fully indigenous mental_health program serviced and controlled by the Tohono O'odham (Papago) Indian tribe is reviewed from the perspective of its 17-year history.	1988	natural
The advent of PL 94142, the Education of All Handicapped Children Act of 1975, served as a threat to some child mental_health professionals, who feared that it would lead to the formation of mental_health facilities in the schools.	1986	natural
The effect of high and low assertiveness on locus of control and health problems was examined with 78 direct-service workers in mental_health and mental retardation settings in northeastern Pennsylvania.	1985	natural
The authors belonged to a team of five mental_health professionals who studied 40 families, beginning more than a year before the evacuation to shortly thereafter Using both direct observation and interviews, the team studied sources of and responses to stress.	1987	natural
Major findings of the study include: (a.) the complexity of attitudes towards suicide; (b) substantial differences between clergy and other mental_health professionals; (c) differences between physicians and psychologists on attribution of manipulative motivation to suicide attempts; (d) a relationship between attitudes and personal familiarity with suicide; (t) an ordering of professional groups on the Empathic Understanding Scale reflecting psychological, medical, or religious training; group differences on the recognition of suicide lethality signs; and (g) a relationship between knowledge of lethality and several attitudinal factors.	1985	natural
In response to the neglect, this article examines western cultural assumptions and four salient cross-cultural counseling themes: conceptions of mental_health, goals of treatment, techniques of treatment, and roles of therapeutic participants.	1986	natural
