While these very young children are at the greatest peril for physical, mental_health, and developmental issues and tend to spend the longest time in the foster care system, little research has been done to explore their experiences and developmental outcomes.	2013	natural
Results of this study indicate that respondents primarily conceptualize mental_health problems as spiritual matters and seek to address these concerns with an Ors priest first.	2014	natural
Using the resident assessment instrument - mental_health (RAI-MH), an assessment that is used to collect demographic and clinical information within 72 hours of hospital admission, 169 geriatric patients with dementia were compared with 308 geriatric patients without dementia.	2014	natural
To examine the associations among mental_health problems, maternal monitoring and permissiveness, mother-daughter communication and attachment, and sexual behaviors among African American girls receiving outpatient psychiatric care.	2011	natural
Adolescents with intellectual disabilities may have considerable mental_health problems which are functionally impairing yet frequently unidentified and hence untreated.	2012	natural
The 1966 assassination of South Africa's prime minister by a schizophrenic parliamentary messenger led directly to a series of commissions of enquiry into the management of mental_health services, followed by new mental_health legislation in 1973 and the compulsory registration of clinical psychologists.	2011	natural
The results provide hints to parents and teachers for improving the mental_health of children in immigrant families by reducing the occurrence of depression.	2011	natural
In addition, 57 of distressed patients who did not access mental_health services did not perceive the need for help.	2014	natural
Delivering culturally responsive EBPs is essential for mental_health practitioners working within racially, culturally, and ethnically diverse settings and across a variety of disorders.	2011	natural
Existing research on the correlates of mental_health effects of rape suggests that rape victims are at higher risk for poor overall health status.	2011	natural
Calls in Spanish revealed language access barriers, with fewer than half of Spanish-speaking callers to schools and mental_health agencies obtaining an appointment.	2013	natural
The current cross-sectional study describes traumatic event exposure in detail and its relationship to behavioral health among an at-risk sample of young children (N = 184), under 6 years of age, upon enrollment into an early childhood, family-based, mental_health system of care.	2012	natural
Preventing child mental_health problems and child obesity have been recognized as public health priorities.	2014	natural
Whilst some important aspects of Justice Bell's decision concerning the general methodology to be applied when analysing human rights were overturned in the subsequent Court of Appeal decision of R v Momcilovic [2010] VSCA 50, the latter decision did not concern mental_health and so leaves Kracke as the most detailed articulation and analysis of human rights within this difficult sphere.	2010	natural
The study examined dispositional optimism s role in buffering the effect of warzone stress on mental_health symptoms and mental_health symptoms on work impairment.	2011	natural
Although many similarities existed between sexes for predictors of violent offending, the findings of this study indicate that more attention needs to be paid to the mental_health of female offenders.	2014	natural
Understanding crisis in the family is important to mental_health practice since it can serve as a guide in delivering service to at-risk families.	2014	natural
These range from direct interventions intended to reduce the severity and/or frequency of the speech behaviors of stuttering, to those intended to alleviate the anxiety and other mental_health issues that can accompany the disorder.	2012	natural
The global increase in elderly population all over the world, especially in Portugal, justifies the importance of mental_health study in this age group.	2014	natural
A total of 5,960 high-school students participated and reported on SAD, life time victimization, PTSS and mental_health service utilization.	2013	natural
Burdening selection and cultural/political context are suggested as interpretative perspectives on the contextual and personal influences on the complex relationship between parenthood and mental_health.	2010	natural
These results show an independent temporal relationship between peer aggression and later mental_health and substance use problems in adolescence.	2014	natural
Although previous research suggests that increased religiosity is associated with better mental_health and many authors have conjectured that religion-based social support may help explain this connection, scant research has directly examined whether religion-based support mediates religiosity and mental_health.	2014	natural
Existing theories suggest that the mother-infant relationship has a potentially significant effect on long-term adult mental_health, but there are few empirical data to support this view.	2014	natural
The ability to adaptively exert control over negative emotions is associated with beneficial mental_health outcomes.	2013	natural
Externalizing and internalizing mental_health problems were assessed at age 8 years (Rutter scales), substance use and externalizing and internalizing problems [Youth Self-Report (YSR)] at age 15-16 years, and hospital diagnoses for internalizing disorders (age 25) and criminal offences (age 20) from nationwide registers in adulthood.	2014	natural
Narcissistic personality disorder (NPD) and not otherwise specified personality disorder (borderline and narcissistic) are major mental_health problems for men.	2013	natural
Iraq and Afghanistan war veterans experience significant rates of posttraumatic stress disorder (PTSD) and other trauma-related mental_health conditions.	2012	natural
We present a conceptual model and recommendations to guide future research on the effect of mental_health treatment on HIV transmission risk behavior among PLWHA.	2010	natural
Family engagement was defined as receipt of a high dose of visits and home visitor response to intimate partner violence (IPV) and poor maternal mental_health as measured via record review and by maternal report of trust in the home visitor.	2010	natural
First, we provide an overview of important contextual issues to be considered when addressing research questions pertinent to the implementation of mental_health interventions in schools.	2014	natural
Furthermore, husbands' perceived community disorder is directly associated with their own physical and mental_health.	2010	natural
Preterm birth confers risk for poor outcome, including mental_health problems.	2014	natural
One hundred and five patients under the care of secondary mental_health care services were assessed using the Mini-ICF-APP and several well-established measures of functioning and symptom severity.	2013	natural
This article addresses the controversy within the mental_health community and among researchers that has stifled progress.	2013	natural
The loss of a client to suicide is a painful personal and professional experience for mental_health providers.	2012	natural
This included practices such as the explicit discussion of emotions and mental_health and the consumption of feminine drinks under certain circumstances (e.g., in private, with close friends).	2013	natural
There is growing recognition that to maximize service impacts, first-time users of community mental_health services require treatment approaches different from those for experienced users.	2014	natural
Errors have been found to frequently occur in the management of case records within mental_health service systems.	2014	natural
Borderline personality disorder is a serious mental_health problem for which one of its main characteristics is significant difficulties in relationships with others.	2010	natural
Since the experience and expression of mental_health is partly culturally determined, it is of interest to examine if similar associations are found in other cultural settings.	2013	natural
To assess long-term effects of early traumatic brain injury (TBI) on mental_health, cognition, behaviour and adjustment and to identify prognostic factors.	2013	natural
Fathers' mental_health was assessed by self-report (Symptom Checklist-5, SCL-5) in week 17 or 18 of gestation.	2014	natural
Compared to Whites, Asian and Black elders were less likely to see a mental_health professional or receive counseling in the past year.	2010	natural
This analytic approach also suggests that future research should seek to identify causal paths, and may include other intervening variables related to poverty (such as child housework and caring responsibilities) or to child mental_health (such as stigma and abuse), that are linked to both familial HIV/AIDS and educational outcomes.	2014	natural
We argue that implementing interventions synchronously across multiple pathways has considerable potential to reduce and eventually eliminate disparities in mental_health care.	2012	natural
This study explored how crisis mental_health clinicians and police officers experience the service interface to identify perceived challenges tocollaboration and possible solutions.	2012	natural
Using data from the prospective, population-based Avon Longitudinal Study of Parents and Children (ALSPAC), we investigated the associations between binge patterns of alcohol consumption during pregnancy (4 drinks per day) and child mental_health [as rated by both parent (n = 4,610) and teacher (n = 4,274)] and academic outcomes [based on examination results (n = 6,939)] at age 11 years.	2014	natural
Family functioning mediated the effects of SES and shame on caregiver mental_health and also moderated the effects of SES and shame on caregiver depression.	2014	natural
Findings advance the culture and suicide literature by highlighting how current research and practice that characterize suicidal ideation and behaviors as a mental_health phenomenon may not comprehensively identify suicidality among an ethnic minority group.	2014	natural
Our findings suggest that salubrious effects of volunteering on the self-perceived physical and mental_health of middle- aged and older- aged adults varied by their participation in different forms of religiosity.	2013	natural
The present study examined whether common psychiatric labels (i.e., mental disease, mental_disorders, mental_health problems, and mental_illness) elicited divergent attitudes and perceptions in a group of participants.	2013	natural
The objective of this study was to measure the lifetime prevalence of BD, and to describe the socio-demographics, comorbidities, and use of mental_health services among 15-24-year-olds with BD.	2010	natural
When we re-examine what is known about these children outside of pathologizing assumptions, what do we know about promoting their mental_health and adaptation?	2012	natural
An integrative approach addressing both substance misuse and mental_health factors is pivotal.	2014	natural
The aim of this article is to describe the short-term effects of relationships with significantly older females on the substance use and mental_health of adolescent boys.	2012	natural
The BFDS was negatively correlated with helpful coping mechanisms (family hardiness, and parent empowerment), and positive adjustment (caregiver quality of life and positive parenting experiences), and positively correlated with known stressors (severity of aggressive behavior, negative life events) and problematic coping and outcomes (caregiver burden, worry, mental_health problems).	2010	natural
Internet addiction (IA) is an emerging social and mental_health issue among youths.	2014	natural
Some authors suggest that besides the fundamental components, cognitive reserve (CR) also reflects the influence of a combination of factors that improve mental_health.	2011	natural
In this study, the authors empirically developed a standardized intervention to assist mental_health providers in emergency prevention and management (EPM) with their clients.	2012	natural
Associations of mobile phone use after lights out with mental_health, suicidal feelings, and self-injury were cross-sectionally examined in 17,920 adolescents using a self-report questionnaire.	2012	natural
Controlling for the hierarchical structure of the data, latent variable regression analysis indicated that the programme had a significant positive effect on coping and on the impact of mental_health difficulties in daily life.	2012	natural
This study examined differences in mental_health service use in non-Hispanic white, black, Hispanic, and Asian adolescents who experienced an episode of major depression.	2011	natural
With 99 correlations from 23 independent studies, the overall relationship between racial discrimination and mental_health was statistically significant ( r = .23).	2011	natural
Findings suggest that (a) students are unsure whether or not their training programs have an official procedure in place for dealing with problematic students; (b) the problems they observe most commonly involve poor interpersonal skills; (c) consistent with other mental_health programs, school psychology graduate students most often talk with their peers or avoid contact with the problematic peer when they have concerns rather than go to faculty; (d) the majority (49.4) of the respondents feel that faculty or training directors have the most responsibility for the identification of problematic peers but that students have an ethical duty to provide information to the teaching staff if they feel they have a reason to believe there is a problem of which the faculty is unaware.	2012	natural
Variation in disclosure of thoughts of suicide to a mental_health or primary care provider depends, in part, on patient characteristics.	2014	natural
Interactions indicate soldiers with both mental_health and injury history are particularly vulnerable.	2010	natural
This study examined the latent structure of a number of measures of mental_health (MH) and mental_illness (MI) in substance use disorder outpatients to determine whether they represent two independent dimensions, as Keyes (2005) found in a community sample.	2010	natural
Little is known about the characteristics of young psychologically-distressed refugees in mental_health services, and how they vary according to the duration of settlement.	2013	natural
Help-seeking is an adaptive means to address mental_health difficulties, but sufferers often fail to seek assistance.	2010	natural
This reorientation from discrete categorical disorder manifestations to underlying cross-cutting dimensions of individual functioning has generated considerable debate across the community of mental_health researchers and clinicians (with strong views voiced both pro and con).	2014	natural
To examine patterns, predictors and unmet needs of service utilisation and access to mental_health and/or drug and alcohol services among community-dwelling adults with severe traumatic brain injury, and compare those who displayed challenging behaviours with those not displaying challenging behaviour.	2014	natural
Issues about how cellular phone use relates to adolescent mental_health, such as suicidal ideation and attempts, are important because of the high rate of cellular phone usage among children in that age group.	2014	natural
Using theAndersen Social and Behavioral Model (1995) the following shared predictors of mental_health service use across both sectors by custodial grand-families emerged: grandchildren's externalizing symptoms, having other grandchildren in the household with medical or psychiatric diagnoses and corresponding use of services in the other sector.	2012	natural
The Church has always been associated with care of the sick; this continues today many clergy see people with mental_health issues.	2011	natural
The results indicate that 'core' competencies for mental_health work in the context of an FHT go well beyond those required for an embedded mental_health 'programme' or specialised mental_health counsellors, but rather they relate to the core and discipline-specific competencies of members of the entire team.	2013	natural
Depression and social anxiety disorder (SAD) are two of the most common mental_health conditions, and often occur together.	2013	natural
MQOL had a favorable impact on the mental_health composite score of the Short Form-36 at the end of treatment but not at 6 months (effect size=0.52 and -0.04); health-related QOL as measured by the Functional Assessment of Cancer Therapy-Prostate at the end of treatment and 6 months (effect size=0.14 and 0.10); and prostate cancer specific anxiety as measured by the Memorial Anxiety Scale for Prostate Cancer at the end of treatment and 6 months (effect size=0.45 and 0.23).	2011	natural
This study set out to examine the impact of a health and personal development programme (the Social, Personal and Health Education Programme) which had been 'enhanced' by the addition of a mental_health promotion component.	2013	natural
Evaluation for child custody is one of the most criticized areas of forensic mental_health assessment due to the perceived lack of standardization in evaluation methods.	2012	natural
This study helps to inform efforts to increase the cultural sensitivity of mental_health services for the underserved population of Chinese-immigrant families.	2011	natural
We undertook a systematic review of the international literature for studies that used validated instruments and techniques to diagnose prevalence rates of physical and mental_health disorders in homeless adolescents.	2014	natural
Longitudinal case study data is presented, showing contradiction and escalating contest between ethics-orientated and rules-based systems in a high-commitment mental_health setting, triggering a crisis and organisational closure.	2013	natural
Findings implicate the role of coping in the relationship between family environment and adolescent mental_health.	2014	natural
The increased popularity and functionality of mobile devices has a number of implications for the delivery of mental_health services.	2014	natural
Three types of economic analyses that can be undertaken within mental_health services are outlined: (a) cost-benefit analysis, (b) cost-utility analysis and (c) cost-minimisation analysis.	2013	natural
Further, neither self-stigma nor attitudes toward mental_health care predicted engaging in needed mental_health care when cynicism was included in the model.	2013	natural
Lower scores of mental_health and feelings of inferior integration set the necessity for early counseling and intervention needs.	2011	natural
However, these results suggest that a brief intervention delivered by psychiatrists in a mental_health treatment setting does seem to make an impact on these smokers.	2011	natural
Other-unforgiveness was unrelated to mental_health and life satisfaction while self-unforgiveness was a predictor of both.	2012	natural
The findings are discussed not only in relation to the latent deprivation model but also in relation to common approaches to job satisfaction and mental_health.	2010	natural
Seeking help from religious advisors for mental_health problems varies dramatically among ESEMeD countries.	2010	natural
The seven papers in this section increase our understanding of how the demands of U.S. military operations impact couples, family functioning, parenting, and child psychological adjustment and provide an additional resource for mental_health professionals who work with these families.	2011	natural
A case study of a participant in a community-based mental_health program called Project FOCUS in Orange County, California details how art was used to assist a young woman to identify and achieve her personal goals, mitigate her emotional and behavioral problems, and reach a sense of overall well-being.	2013	natural
In the final models, older age and receiving more support were associated with worse physical health-related QOL whereas African American race and fewer stroke survivor problems were associated with better mental_health.	2013	natural
These findings underscore the contribution of early maternal well-being to later parenting and child outcomes, highlighting the importance of mental_health and parenting support in the early parenting years.	2014	natural
Each PA parameter was significantly (p<.05) associated with a decreased odds of depressive symptoms and/or treatment for depression or anxiety, but not with impaired mental_health functioning.	2013	natural
While not seeking to trivialize their patients criminal behaviour, psychiatrists need to drive the delivery of innovative mental_health services within youth detention centres and collaborate with those in the political, legal, youth justice, education and child safety sectors to inform debate of the challenges faced by young people in custody.	2013	natural
Although learning objectives, often in the form of competencies, are now standard for training mental_health professionals, they are not generally used to guide psychotherapy supervision.	2014	natural
Further, we considered subsequent impact of work-to-family conflict and enrichment on women's health (physical and mental_health) 8 months after women returned to work and the impact of health on voluntary turnover 12 months after women returned to work.	2011	natural
The purpose of this study was to describe the demographic and employment characteristics of Australian occupational therapists working in youth mental_health and explore the relationship between these characteristics and the occupational therapist's role.	2011	natural
Secondary analyses of data from 589 families seeking outpatient mental_health services, completing the Child Behavior Checklist and semi-structured diagnostic interviews.	2014	natural
Although employment is thought to promote mental_health and well-being, work of poor psychosocial quality is not associated with any better mental_health than unemployment.	2013	natural
Preoperative prayer coping, but not other religious factors, predicted less mental fatigue at the 30-month follow-up, after controlling for key demographics, medical comorbidities, cardiac function (previous cardiovascular intervention, congestive heart failure, left ventricular ejection fraction, New York Heart Association Classification), mental_health (depression, anxiety), and protectors (optimism, hope, social support).	2012	natural
The relationships between wisdom and age and between wisdom and mental_health are complex with empirical results often inconsistent.	2014	natural
The relationship between religiosity and mental_health is a relatively well-researched field within North America, covering numerous domains of religiosity, including: religion, spirituality, prayer, church attendance, church affiliation and belief in God or a higher power.	2014	natural
The participant reported substantial improvements in mental_health and reduced substance use from baseline to post-intervention assessment, and these improvements were sustained at 1- and 3-month follow-up assessments.	2014	natural
The first canonical correlation supported the main hypothesis associating stress and procrastination with poorer mental_health.	2010	natural
This special issue of the Canadian Journal of School Psychology examines the vision and the capacity of schools to be strategically positioned as a hub for service delivery in meeting the mental_health needs of Canadas children and youth.	2012	natural
It argues that mental_health issues should be fully integrated into Disaster Risk Reduction plans and policies, which are likely to be included in the Post-2015 Millennium Development Goals.	2013	natural
Children living with perinatal HIV illness (PHIV+) disproportionately reside in disadvantaged neighborhoods and contend with persistent mental_health challenges.	2011	natural
Results indicate that non-manualized cognitive behavioural therapy administered for an average of 14.88 sessions was successful at treating mental_health concerns, as measured by a self-report questionnaire collected several times throughout treatment.	2013	natural
This article investigates and compares the effect of four types of role perceptionsrole breadth, instrumentality, efficacy, and discretionon teachers' and coaches' engagement in helping behaviour that supports young people's mental_health through promotion, prevention, and early intervention.	2014	natural
These results show an independent temporal relationship between peer aggression and later mental_health and substance use problems in adolescence.	2014	natural
Deficits in self-regulation at the level of behavior, and cognitive control and executive functioning, at the level of brain processing, are related to both academic and mental_health problems, suggesting a possible psychological mechanism.	2012	natural
This article examined the relationship between suicide behaviors and displacement, as defined by out-of-home placement, in a sample of juvenile-justice-involved youth with mental_health issues.	2011	natural
This has not previously been investigated for child mental_health.	2011	natural
Treatment group participants completed a 10-session evidence-based intervention, the Mom's Empowerment Program, designed to treat common mental_health issues after exposure to IPV and assist women with access to resources.	2014	natural
Comprehensive data from the meeting by three independent notetakers were analysed and integrated to fully capture the discussion of research priorities for education and mental_health.	2012	natural
