The views of news staff were very similar to those of the mental_health workers, suggesting substantial common ground for cooperative efforts to combat negative psychiatric stereotypes.	1985	natural
Models in which coping strategies were postulated as having mediator, moderator, and independent main effects were tested using multiple indexes of mental_health.	1989	natural
Prevention is an approach more and more talked about in mental_health.	1985	natural
Research on psychological self-help books has not demonstrated conclusively that improvements in mental_health occur after people read the books.	1989	natural
The effects of a training workshop on mental_health practitioners' attitudes toward homosexuality and counseling behavior were compared with the effects of no intervention.	1989	natural
The current community mental_health movement, struggling under the misnomer deinstitutionalization, is a worthy effort that can succeed if given adequate support and unburdened of pessimism and scapegoating.	1987	natural
Analyses indicated significant differences between blacks and whites in their conceptions of mental_illness; blacks' responses were more stereotypic, and whites' were closer to those of mental_health professionals.	1985	natural
A statistical study was conducted at the Occupa- tional Therapy section of Walter Reed Army Medical Center, Washington, D.C., to determine the inter-rater reliability of a clinical assessment and documentation instrument designed for psychosocial (mental_health) patients.	1986	natural
Here the transcultural approach offers a needed bridge for effective Native American alcohol and mental_health counseling.	1989	natural
The current third-party fee-for-service mode of reimbursement for mental_health services emphasizes individual, pathology-oriented intervention and thus has disadvantages for clients and carriers.	1987	natural
The failure of nonreligious subjects to compensate fully for this traditional religious belief deficit was reflected in their mental_health ratings on the Langer's Mental Health Scale (Langer, 1962).	1987	natural
The concept of Case Mix in community mental_health service program evaluation can be useful in mental_health program evaluation if the definition of case mix is expanded beyond Diagnostic Related Groups (DRG), where DRG is solely based upon diagnosis and length of hospitalization stay.	1987	natural
In this article, I try to reconstruct the bygone mind-set that saw the controlling of deviants as a way to do good in God's name, and I compare it with the contemporary mind-set that sees controlling deviants as doing good in the name of mental_health.	1987	natural
Three areas of assessment are recommended: assessment of major stresses (migration stress, acculturation stress, life cycle stress, and family stress); assessment of strengths; and assessment of culturally specific responses to mental_health problems.	1988	natural
These findings also contribute to our understanding of the disproportional use of mental_health related services by women.	1986	natural
A unique program variable, that of a mental_health counseling component, is described in some detail.	1989	natural
Alternative treatment models are needed for high-risk and symptomatic people who are unresponsive to traditional mental_health interventions.	1986	natural
Of the various recent and past stresses, only the recent ones, unemployment and later unpleasant life events, had an additional exacerbating (interactive) effect on mental_health.	1987	natural
Although the ability of mental_health professionals to predict violence adequately was widely accepted till the late 1960s, a number of important studies then seemed to establish irrefutably the conclusion that clinical assessments of dangerousness, or violence proneness, were hopelessly inaccurate.	1988	natural
Although family coping resources are lower among those experiencing economic distress and are generally positively related to mental_health, their role as mediators of relationships between economic distress and mental_health is limited.	1989	natural
The role of mental_health professionals testifying as expert witnesses has been the subject of increasing criticism.	1989	natural
There were, however, no direct effects of smog levels on mental_health.	1987	natural
The hypothesis that members of Asian ethnic minorities appear to use mental_health services less because they are psychologically more robust in the face of difficulties therefore seems questionable.	1989	natural
In 1976 the University Department of Psychiatry at the Haukeland General Hospital in Bergen, Norway, assumed the comprehensive responsibility for the mental_health service to a population of 205,000 in a geographical area comprising most of the city and some of its surroundings.	1985	natural
The research findings indicate that compared to the general population of defendenats, mentally disordered defendants receive more severe criminal sanctions, and are often subjected to both punishment and mental_health treatment ordered on the authority of the criminal court.	1987	natural
Economic distress is negatively associated with mental_health.	1989	natural
The two criteria were then combined to generate four patterns of use of mental_health services (high usersand long-term users, neither high nor long-term users, high users only, long-term users only).	1986	natural
The status of a fully indigenous mental_health program serviced and controlled by the Tohono O'odham (Papago) Indian tribe is reviewed from the perspective of its 17-year history.	1988	natural
Mothers had been separated for 33 months or less and did not have prior histories of using mental_health services.	1985	natural
The advent of PL 94142, the Education of All Handicapped Children Act of 1975, served as a threat to some child mental_health professionals, who feared that it would lead to the formation of mental_health facilities in the schools.	1986	natural
Relationships among economic distress, family coping resources and behaviors, and mental_health are examined among a sample of 203 married men and 207 married women.	1989	natural
This social elaboration of the mental_health's field comes about the same way discomfort or diseases are defined, or through the introduction of notions often implicit, such as social adaptation, values, responsibility, similarity between therapists and patients.	1986	natural
Professional and public liability requires mental_health practitioners to develop more reliable methods by which violent behavior may be diagnosed, managed with effective strategies, and ultimately prevented.	1985	natural
The effect of high and low assertiveness on locus of control and health problems was examined with 78 direct-service workers in mental_health and mental retardation settings in northeastern Pennsylvania.	1985	natural
A growing body of research literature suggests a relationship between mental_health status and attitudes toward suicide among adolescents.	1986	natural
The variables assessed were: perception of mental_illness in the vignettes; desired social distance; emotional and physical burden expected; and expected negative influence on one's mental_health from association with the type of persons portrayed in the vignettes.	1989	natural
The authors belonged to a team of five mental_health professionals who studied 40 families, beginning more than a year before the evacuation to shortly thereafter Using both direct observation and interviews, the team studied sources of and responses to stress.	1987	natural
Major findings of the study include: (a.) the complexity of attitudes towards suicide; (b) substantial differences between clergy and other mental_health professionals; (c) differences between physicians and psychologists on attribution of manipulative motivation to suicide attempts; (d) a relationship between attitudes and personal familiarity with suicide; (t) an ordering of professional groups on the Empathic Understanding Scale reflecting psychological, medical, or religious training; group differences on the recognition of suicide lethality signs; and (g) a relationship between knowledge of lethality and several attitudinal factors.	1985	natural
Stress in teaching derives from a variety of sources, and evidence exists linking such stress to physical and mental_health concerns.	1989	natural
In response to the neglect, this article examines western cultural assumptions and four salient cross-cultural counseling themes: conceptions of mental_health, goals of treatment, techniques of treatment, and roles of therapeutic participants.	1986	natural
The emphases in infant mental_health have been in the three areas of supporting the motherinfant dyad through education, psychotherapy to help parents resolve emotional conflicts that interfere with the parentinfant interaction, and support during the acute crisis that follows an abnormal birth.	1985	natural
On the other hand, such efforts may not be sufficient to reduce unmet need for mental_health treatment among men with psychiatric disorders.	1986	natural
This interview sample survey of adult residents of San Francisco's Chinatown was conducted in an effort to understand the phenomenon of underutilization of mental_health services by Chinese Americans and the reasons underlying this phenomenon.	1989	natural
It is the conclusion of this author that the peer supervision carried to extreme format is viable, but only under certain specific conditions which in the short run may make the model less attractive to community mental_health centers.	1986	natural
These attributes, which define the discipline in the mental_health field, are contrasted with the singular traits of other community mental_health professions.	1988	natural
Effective mental_health workers need to be prepared to provide what is needed and to be able to work in both areas.	1987	natural
Empirical investigations of adolescent mental_health and development within the social context of the family are reviewed.	1989	natural
The factors which influence the mental_health of girls and boys are analysed and discussed.	1989	natural
The ability of informants' ratings of social support to predict the adjustment of the adolescents to a major life stress was viewed as evidence that the commonly found link between social support and mental_health reflects more than self-report biases.	1989	natural
Bereavement groups constitute a particularly efficient preventive intervention for this high-risk population and thus represent excellent preventive mental_health practice.	1988	natural
The specific findings suggest that two processes may be operating in the relationship of labor force participation and manufacturing employment with mental_health service utilization.	1989	natural
Implications of the current data and related literature for mental_health workers are briefly discussed.	1987	natural
This study examines the relationship between attitudes and use of mental_health related services using data collected from 4838 respondents in the first wave of the Yale Epidemiological Catchment Area (ECA) project.	1986	natural
The hypothesis that members of Asian ethnic minorities appear to use mental_health services less because they are psychologically more robust in the face of difficulties therefore seems questionable.	1989	natural
This article reviews the current status of mental_health services to children, youth, and families to highlight the necessity of an integrated system of mental_health care.	1989	natural
Existing and emerging programs for the severely mentally ill have the potential for success but will require renewed commitment and advocacy on the part of mental_health professionals.	1987	natural
This paper analyses and explores one aspect of the relationship between the mental_health system and the criminal justice system.	1986	natural
These findings generally suggest that Chinese adolescents' recollections of their parents' treatment styles are significantly associated with their own psychological well-being, whether defined by active or passive mental_health criteria.	1989	natural
Burnout scores were compared for OTRs working in physical disabilities, mental_health, and developmental disabilitics.	1987	natural
Finally, I'll address the issue of isolation, which occurs because of the social prejudice against fat people and can create physical and mental_health problems.	1989	natural
Moreover, there was no correlation between the mental_health and the Jourard Self-Confidence Scale.	1987	natural
To be a healing community it will need to discern a response to the mental_health needs around us.	1987	natural
As predicted, increases in self-reported economic stress adversely affected psychological health, controlling for prior mental_health status.	1986	natural
This paper presents a rationale for the use of an educational model for meeting the mental_health needs of children and youth.	1986	natural
The results suggest that poor marks, absence of positive coping behaviors, and presence of negative coping behaviors are indicators of later mental_health problems, that the absence of positive coping behaviors may be more indicative of later problems than the presence of negative coping behaviors, and that there are sex differences in the time periods at which indicators of school productivity are important.	1987	natural
Implications of the findings for future research on the relationships between gender role, body image, and indices of mental_health are discussed.	1988	natural
Investigated whether emotionality, assessed in 1975, predicted the reporting of both objective stress (life events) and subjective stress (hassles) 10 years later, and how emotionality affected the relation between both objective and subjective stress and mental_health.	1989	natural
This study compares the child abuserelated knowledge and attitudes of pediatricians (n = 47), mental_health professionals (n = 53), teachers (n = 104), and college students (n = 68).	1986	natural
However, these behaviors do not have positive relationships with mental_health and do not counteract the effects of economic distress on mental_health.	1989	natural
The current community mental_health movement, struggling under the misnomer deinstitutionalization, is a worthy effort that can succeed if given adequate support and unburdened of pessimism and scapegoating.	1987	natural
Baker and Schulberg's Community Mental Health Ideology scale was administered to 53 executive directors of community mental_health centers.	1988	natural
Lesbian victims of partner abuse are even less likely than are their heterosexual counterparts to seek help in shelters or from counselors because of the overlay of homophobia that exists both in the battered women's movement and among mental_health professionals.	1989	natural
Previous research has suggested that black Americans tend to view mental_health services and community mental_health centers more negatively than do white Americans.	1985	natural
Resident Assistants (RA) can play an important role in providing mental_health services on a college campus because of their dual role as both peer and counselor.	1987	natural
Narcissism has become a construct attracting increasing attention in mental_health.	1988	natural
This article describes the process of instituting in a community a mental_health preventive program that had originated in a third line psychiatric institution.	1986	natural
The Health-Sickness Rating Scale for Children, with 24 clinical vignettes as anchors for various points along the scale, was developed as a measure of overall mental_health and sickness in children.	1988	natural
A statistical study was conducted at the Occupa- tional Therapy section of Walter Reed Army Medical Center, Washington, D.C., to determine the inter-rater reliability of a clinical assessment and documentation instrument designed for psychosocial (mental_health) patients.	1986	natural
This study compared the differences in the three quality-of-life variables of job satisfaction, life satisfaction, and mental_health, and their correlates, based on differences in career orientation vs gender differences.	1986	natural
A growing body of research literature suggests a relationship between mental_health status and attitudes toward suicide among adolescents.	1986	natural
The factors which influence the mental_health of girls and boys are analysed and discussed.	1989	natural
Race as a factor in premature termination from treatment was investigated at a community mental_health center staffed largely by Black counselors and serving a largely Black clientele.	1989	natural
This paper argued that problems of coordination and integration of community mental_health systems are best approached from a network perspective in which all linkages between agencies are considered simultaneously.	1987	natural
A planned comparison indicated that the restful alert TM group improved most, followed by MF, in contrast to relaxation and no-treatment groups, on paired associate learning; 2 measures of cognitive flexibility; mental_health; systolic blood pressure; and ratings of behavioral flexibility, aging, and treatment efficacy.	1989	natural
Nearly all families were referred for mental_health counseling and parent training, but only 33 complied.	1985	natural
Individuals who were in better mental_health at the initial assessment experienced fewer stressful events and higher levels of social support over the subsequent 6-month period.	1986	natural
The frequent association made in the academic press between poverty and minor and major mental_health problems is unfounded.	1989	natural
The beliefs of several lay groups about the symptoms, causes, and treatments of schizophrenia were examined and compared with those of mental_health professionals.	1987	natural
Practitioners in this field, whether lawyers or mental_health services providers, exhibit the deleterious symptoms of this conflicted state of things which range from an indiscriminate hyperactivity to nearcatatonia.	1988	natural
Need for riskreduction education, mental_health service provision, and assistance in grieving the ongoing loss of loved ones continues to exist among members of the gay community.	1989	natural
Both lack of control over the speed of activities and discretion were related to mental_health indices, but support was found for the role of discretion as a buffer in an interactive sense on one outcome measure only.	1986	natural
Nevertheless, it was found that only a minority of ADDH children had received specialized mental_health or social services in the past 6 months.	1989	natural
Finally, it suggests specific reforms that may improve the use of mental_health experts in legal proceedings.	1989	natural
The last part of this bibliography provides an analysis of the trends of the research literature on mental_health of Mexican immigrant women.	1987	natural
The paucity of available knowledge for clinicians and researchers about the nature of suicide among contemporary New York Puerto Ricans poses seriousproblemsfor mental_health programs and practice.	1989	natural
This paper reports two studies which explored opposite ends of the mental_health continuum as they relate to suicide attitudes among young people.	1986	natural
The program augments the traditional course offerings and provides reciprocal service for the university and mental_health facilities.	1987	natural
The author carried out a study on the somatic and mental_health of Marie Besnard who, having at first been accused of poisoning eleven members of her family, was finally acquitted in 1961.	1985	natural
There was no evidence of differential treatment toward otherthanBlack clients at a Black community mental_health center when comparisons were conducted with the greatest possible methodological rigor.	1989	natural
One-hundred sixty-eight mental_health, welfare, and juvenile court personnel from six different locales within a state rated (a) the amenability to treatment of four case vignettes involving juvenile offenders and (b) the effectiveness of a variety of services for youth.	1988	natural
The importance of outcome research for evaluating the effectiveness of mental_health services was documented.	1986	natural
Many adolescents experience serious mental_health problems and many are not getting the help they need.	1989	natural
It is also observed that disciplinary dispositions for referred inmates occasionally invoke the assistance of mental_health staff, and that these actions are often combined with the imposition of punishment.	1986	natural
There was no evidence of differential treatment toward otherthanBlack clients at a Black community mental_health center when comparisons were conducted with the greatest possible methodological rigor.	1989	natural
The paucity of available knowledge for clinicians and researchers about the nature of suicide among contemporary New York Puerto Ricans poses seriousproblemsfor mental_health programs and practice.	1989	natural
The low rates of admission for schizophrenia of Pakistani women is attributed to a tendency on their part to opt out of the formal mental_health system after an initial encounter, possibly to return to their native land.	1987	natural
The present study evaluated the prevalence of psychopathology in three age groups in childhood and adolescence, in both genders, using a new self-report scale of mental_health problems for children and adolescents.	1986	natural
The failure of nonreligious subjects to compensate fully for this traditional religious belief deficit was reflected in their mental_health ratings on the Langer's Mental Health Scale (Langer, 1962).	1987	natural
Today's college and university students find mental_health services far more available and acceptable than did students in their parents' generation.	1988	natural
Public and private cooperation and planning are certainly in order if the public interest is to be served in addressing the nation's mental_health problems.	1989	natural
They may be broken down into three groups: those issues involving cultural values and definitions of mental_health; those issues that relate to undisclosed goals maintained by the therapist that may differ from the patient's as well as recommendations for types of treatment; and those issues which relate to the psychoterapeutic method, with its emphasis on the therapeutic relationship and its encouragement of openness of patient communication which may result in problems relating to confidentiality and privacy.	1987	natural
If this type of supervision appears so important to the author, it is only that a more extensive group of helping professionals can better meet the mental_health needs of the population.	1985	natural
The present study examined the relationship between religious and nonreligious paranormal beliefs and mental_health, as well as the possibility that nonreligious subjects compensate for a lack of identification with traditional religion by increased nonreligious paranormal beliefs.	1987	natural
Results revealed some differences in opinion between psychiatrists and nonpsychiatrists, most notably concerning the mental_health of psychiatrists.	1988	natural
The conclusion that the decline of community mental_health is primarily a result of the current political, social, and fiscal environment is examined in this paper.	1988	natural
This report presents information about the types of group homes within a state system based upon the characteristics and service needs of 1,050 persons in 118 group homes and questions the role of community mental_health centers in addressing certain service needs of group home residents.	1985	natural
The study demonstrated variability in medical and mental_health evaluations of foster children, and lack of coordination in the gathering and transmission of medical information in the 14 counties.	1987	natural
The current third-party fee-for-service mode of reimbursement for mental_health services emphasizes individual, pathology-oriented intervention and thus has disadvantages for clients and carriers.	1987	natural
The role of attorneys in relationship to mental_health experts is examined.	1987	natural
Other analyses showed that social support can counteract the negative effects of unsuccessful job search on mental_health and that such effects are particularly pronounced among the more highly motivated job seekers.	1987	natural
Psychologists play an extremely limited role in priority decision making and in the promotion of mental_health at the community level.	1989	natural
Two issues came to the forefront: Is it appropriate or possible for the private sector to take over the delivery of all mental_health services, and if so, who will ensure that the poor receive adequate care?	1989	natural
Inmates who can be characterized as disturbed-disruptive present difficult problems for both custodial and mental_health staff.	1986	natural
Bivariate results indicate that immigrant children are not at increased risk for psychiatric disorder or poor school performance and that they use mental_health and social services significantly less often than do their nonimmigrant peers.	1989	natural
Although the ability of mental_health professionals to predict violence adequately was widely accepted till the late 1960s, a number of important studies then seemed to establish irrefutably the conclusion that clinical assessments of dangerousness, or violence proneness, were hopelessly inaccurate.	1988	natural
Participants in the study were 72 adults of both sexes who sought mental_health services at a Veterans Administration outpatient Mental Hygiene Clinic.	1985	natural
This social elaboration of the mental_health's field comes about the same way discomfort or diseases are defined, or through the introduction of notions often implicit, such as social adaptation, values, responsibility, similarity between therapists and patients.	1986	natural
