Treatment group participants completed a 10-session evidence-based intervention, the Mom's Empowerment Program, designed to treat common mental_health issues after exposure to IPV and assist women with access to resources.	2014	natural
Comprehensive data from the meeting by three independent notetakers were analysed and integrated to fully capture the discussion of research priorities for education and mental_health.	2012	natural
Risk assessment procedures and guidelines by mental_health services and criminal justice systems may need review in light of these findings.	2011	natural
Educational level, will to have children, poor marital relationship, previous in-vitro fertilisation attempt and duration of the infertility were predictors of lower mental_health scores in infertile men.	2010	natural
Those without a history of mental_health treatment were more likely to endorse health concerns as a treatment motivator and were more likely to terminate treatment early.	2013	natural
The obstacles most in the way of eradicating this virus include religious prohibitions against same sex behavior, poverty, lack of access to medical and mental_health care.	2013	natural
However, it is unknown whether parental attributions affect adolescents' mental_health directly or indirectly by influencing the youths' attributional style.	2012	natural
This study examined correlates of trauma and PTSD among homeless youth with a focus on the impact of homeless culture, substance addiction, and mental_health challenges.	2010	natural
Multinomial logistic regression explored the associations between latent classes and mental_health comorbidities.	2013	natural
Active parenting and effective communication between schools and parents about truancy may contribute to the promotion of adolescent mental_health and early detection of psychological problems.	2012	natural
Cross-sectional analyses showed that negative religious coping was associated with poorer mental_health and functioning, and greater perceptions of stigma and discrimination.	2013	natural
Children in the behavior-academic-peer risk class, characterized by high aggressive behavior, low academic achievement, and low peer acceptance, had conduct problems, academic difficulties, and increased mental_health service use in adolescence.	2011	natural
Outcome measures are critical to the development of quality mental_health services and for their continuous improvement activities.	2011	natural
Unemployed persons and persons with an insecure job showed equally worse mental_health than securely employed persons on average.	2013	natural
Disordered attitudes, binge eating, and compensatory behaviors were associated with poorer mental_health HRQoL, and body dissatisfaction was associated with poorer physical health HRQoL. The current study assessed HRQoL among adolescents with EDs, finding several consistencies with the literature on adults with EDs.	2014	natural
Our sample of 242 children describes demographics, rates for mental_health problem identification, and length of time after entering foster care that mental_health needs were identified.	2010	natural
This article uses data from a national, longitudinal study of families involved with the U.S. child welfare system to examine how collaboration between local child welfare agencies, schools, and community mental_health providers influences children's receipt of necessary mental_health services.	2011	natural
We believe that public-private partnerships should be formed to help clergy recognise when referrals are appropriate, and to help improve relationships between clergy and mental_health professionals.	2013	natural
This frequently results in major depression and anxiety, increasing the possibility of referral to mental_health services.	2011	natural
We found that immigrants and refugees, particularly those of non-western origin, endorsed different types of depression treatments from native Norwegians and mental_health professionals, and judged who deserved treatment and who was overreacting based on the patient's culture and social circumstances, while native Norwegians did not.	2011	natural
Although the timing and extent of exposure to orphanage care did not influence outcome, participants' reports of poorer quality adoptive family experience and a negative view of their adoption were significantly associated with poorer mental_health outcomes (difference in means = 0.76, 95 CI 1.33-0.19, p = .01; difference in means = 1.2, 95 CI 0.68-1.73, p = .01, respectively).	2013	natural
To disseminate scientific knowledge in the process of mental_health education and promotion, language shall be carefully crafted to avoid unnecessary stigma.	2011	natural
For African Americans, prior use of public subsidies and for Whites, the absence of mental_health problems also predicted subsidy usage.	2010	natural
Mortality was relatively high for the cohort overall in relation to national norms [standardized mortality ratio 3.23, 95 confidence interval (CI) 2.83-3.67] but not in relation to other mental_health service users with similar diagnoses.	2012	natural
Deficits in the ability to recognize anxiety disorders and beliefs about them, (i.e., mental_health literacy) may contribute to low levels of help seeking.	2010	natural
Although many similarities existed between sexes for predictors of violent offending, the findings of this study indicate that more attention needs to be paid to the mental_health of female offenders.	2014	natural
Timely access to information of this kind is crucial to the generation of evidence-based mental_health interventions in a population that is especially important to the country's development vision.	2011	natural
In this paper, the author puts forward a view that in relation to recent developments in contemporary mental_health services, specifically in the provision of care and treatment for forensic and anti-social personality disordered patients and offenders, the application of psychoanalysis might have a particularly important role to play.	2010	natural
Nevertheless, the moderate but clear underrepresentation at the crude level of people with high alcohol consumption, abstainers and people with poor mental_health should be taken into consideration when interpreting results from health surveys.	2012	natural
In this study, primary care outpatients with histories of mental_health treatment evidenced statistically significantly higher levels of pain as well as statistically significantly higher levels of pain catastrophizing than their peers.	2014	natural
This study represents one of the first empirical confirmations that, at least in a war context, suffering the unconfirmed loss of a family member has specific negative mental_health consequences compared to suffering a confirmed loss.	2010	natural
This emphasizes the importance of current socio-political living conditions for mental_health, even with respect to the psychopathological sequelae of past traumatic experiences.	2014	natural
Obsessive-compulsive disorder (OCD) is a disabling mental_health condition.	2013	natural
This paper addresses the proportion of youth in these settings who receive mental_health services and psychoactive medications.	2012	natural
A cognitively based intervention was developed and offered to adolescents with a variety of mental_health problems in different secure settings, and the outcomes compared with a control group.	2011	natural
The insights of stakeholder groups about neuroimaging for mental_health care are a largely untapped resource of information and guidance for translational efforts.	2012	natural
More importantly, it proposes guidelines for mental_health professionals conducting an assessment of such persons.	2012	natural
This study is concordant with previous observational studies in describing relationships between measures of diet quality and mental_health problems in adolescents.	2013	natural
Evidence in these areas is important in evaluation of the function of mental_health services in the relevant catchment area.	2012	natural
The results of this study should be reviewed by study abroad programs and used to enhance students experiences while abroad by providing intercultural training and offering mental_health resources for students abroad.	2010	natural
Living together with a new partner, either in marriage or cohabitation, seems beneficial for mental_health, even in cases of (high) conflict.	2014	natural
Research indicates that being the victim of bullying is not a random event and can be predicted by individual characteristics and family factors; can be stable across ages; is associated with severe symptoms of mental_health problems, including self-harm, violent behaviour and psychotic symptoms; has long-lasting effects that can persist until late adolescence; and contributes independently to children's mental_health problems.	2010	natural
There is a particular need for further CAT outcome research with common mental_health problems.	2014	natural
This study examined differences in mental_health service use in non-Hispanic white, black, Hispanic, and Asian adolescents who experienced an episode of major depression.	2011	natural
Informed by Wards (1996) theory of psychological and sociocultural adaptation, this study identified links between acculturation and the mental_health of older Iranian immigrants living in Canada (N = 103).	2014	natural
In the total sample, 59.0 had one or more mental_health problems at follow-up, whereas 96.2 were facing at least one adjustment problem.	2013	natural
Maternal and child health programmes, as well as poverty-alleviation and educational interventions, may be beneficial for maternal mental_health.	2014	natural
The field of school psychology has advocated for the use of evidencedbased interventions to address mental_health problems.	2011	natural
This paper presents a model of a groupbased intervention for the treatment of clients with Obsessive Compulsive Disorder (OCD) referred to secondary mental_health care services, which has been developed by the authors over the last five years.	2010	natural
Fathers are at risk of experiencing postnatal mental_health difficulties, which may persist across the early childhood period for some fathers.	2012	natural
As children mature, problems stemming from troubled caregiver-infant relations may result in referral to mental_health or child protection services.	2014	natural
We discuss several issues that emerge from these studies, including research approaches that narrow the gap between research and practice, the importance of interventions that develop competencies across multiple domains of student functioning, the role of school mental_health within a multi-modal intervention context, and the policy implications of the findings within this collection of articles.	2011	natural
Initial validation of the MHPSI was conducted with a sample of 212 mental_health employees and graduate student counseling interns.	2014	natural
The current integrative review investigated thematic studies relevant to incorporating Chinese Buddhism into counselling, psychotherapy, psychology, and mental_health; identified topical and methodological gaps; and, finally, proposed future research directions for developing Chinese-Buddhism-oriented counselling theories.	2013	natural
Recently, the U.S. NIMH has elaborated this vision through a new framework for mental_health research, the Research Domain Criteria (RDoC).	2014	natural
We identified five trajectories depicting unique timing and course of maternal mental_health from pregnancy into 1 year of mothering: Stable low levels of mental_health symptoms (75) and prenatal , early postpartum and late postpartum mental_health problems.	2011	natural
Counselling culturally diverse populations poses several challenges for mental_health professionals in schools as well as the wider community.	2012	natural
His goal is to close this gap and achieve better mental_health outcomes by disseminating awareness of LGBTQ health needs and recommending adaptations for clinical work with respect to both the self and the patient.	2012	natural
Among the studies meeting inclusion criteria, HIV risk was associated with multilevel determinants at the levels of policy, sociocultural context, health and mental_health, and sexual practices.	2012	natural
The aim of this article is to review and highlight evidence-based computerised cognitive behavioural therapy (cCBT) programmes that can potentially be used in Ireland for the treatment of mild-to-moderate mental_health difficulties.	2013	natural
The dominant themes encountered in the initial analysis depicted people experiencing mental_illness as dangerous and a threat to the public, where the mental_health system has failed to manage them adequately.	2011	natural
Proactive follow-up is necessary to increase the likelihood of PEP completion and address the mental_health and HIV risk needs of survivors.	2012	natural
Anxiety sensitivity (AS) has been implicated in the development and maintenance of a range of mental_health problems.	2014	natural
Although considered an improvement over previous approaches by some, the current mental_health discourse continues to reflect ideologies that assume a universal psychology of individual mental_health.	2010	natural
Results indicate that testosterone treatment in FTMs is associated with a positive effect on mental_health on measures of depression, anxiety, and anger, while CRS appears to be more important for the alleviation of body dissatisfaction.	2014	natural
Such interventions can maximise the use of sparse mental_health resources.	2013	natural
These findings have implications for disclosure of mental_health status.	2010	natural
Results indicated that physical symptoms and impairments, mental_health symptoms and impairments and difficulties with day-to-day activities directly or indirectly predicted challenges to social inclusion for adults living with HIV.	2014	natural
The review by Klahr and Burt (this issue) is very welcome as it covers a condition that is the commonest in child and adolescent mental_health, but one that is usually met with woefully inadequate availability of interventions despite an excellent evidence base of effective treatments.	2014	natural
Finally, burnout mediated the relationship between study demands and mental_health outcomes.	2014	natural
Most importantly, six recommendations are made to address the longstanding insufficient training within the mental_health professions regarding the assessment and management of suicidal patients.	2012	natural
Narcissistic personality disorder (NPD) and not otherwise specified personality disorder (borderline and narcissistic) are major mental_health problems for men.	2013	natural
Developmental models highlight the impact of early risk factors on both the onset and growth of substance use, yet few studies have systematically examined the indirect effects of risk factors across several domains, and at multiple developmental time points, on trajectories of substance use and adult adjustment outcomes (e.g., educational attainment, mental_health problems, criminal behavior).	2010	natural
The findings from these questionnaires indicate a much higher than national level of perceived mental_health difficulties within this population.	2010	natural
Two hierarchical regressions were performed to evaluate the extent to which religious factors predicted mental and physical fatigue, respectively, after controlling for key demographics, medical indices, and mental_health.	2012	natural
The General Health Questionnaire (GHQ) was used for assessing mental_health and the Mini-Mental State Examination (MMSE) for assessing cognitive functioning.	2012	natural
Given the growing population of Latino immigrants in the United States, it is critical for counselors to understand pre- and postimmigration social contextual factors affecting the mental_health of this heterogeneous ethnic population.	2012	natural
Interventions aimed at MM users should stress the related effects of tobacco and risky alcohol use as well as mental_health needs.	2014	natural
Costs of mental_health services were calculated for a nine-year period.	2014	natural
Although these results generally support the hypothesis that a healthy nutritional fetal uptake, as indicated by BW and PI, is associated with better lifetime mental_health, further work is needed to characterize the nature of the association between fetal growth and subsequent psychopathology.	2010	natural
We wished to investigate, in a clinical sample of adolescents referred to a state-funded mental_health service, the prevalence of (attenuated or frank) psychotic experiences and the relationship with affective, anxiety and behavioural disorders, multimorbid psychopathology, global functioning, and suicidal behaviour.	2014	natural
The findings also underscore the importance of early identification, early intervention, and ongoing counseling for mental_health problems among children affected by HIV/AIDS.	2013	natural
We then turn to the possible impact of grandparental acts of altruism, and examine whether benefits of grandparental care in industrialized societies may manifest in terms of less tangible dimensions, such as the grandchildren's cognitive and verbal ability, mental_health, and well-being.	2010	natural
They responded to the Arabic versions of the Oxford Happiness Inventory, the Love of Life Scale, and the Satisfaction with Life Scale, as well as five separate single-item self-rating scales assessing physical health, mental_health, happiness, satisfaction, and religiosity.	2011	natural
Women were treated more frequently by an alternative caretaker (20.6 vs. 14.8; p=0.025), men more often in mental_health care organizations (61.0 vs. 53.7; p=0.025).	2014	natural
The Medicaid beneficiary rate is positively associated with the number of mental_health clinics, mental_health and substance abuse social workers, mental_health counselors, and psychiatrists, with no significant association with mental_health physician offices or psychologists.	2013	natural
The main outcome was the presence of mental_health needs measured by the Developmental Behaviour Checklist.	2012	natural
A new finding is the stronger association that family dysfunction has with poorer mental_health in males than females, when controlling for academic competence and coping skills.	2014	natural
In addition to multiple relationship situations faced by most mental_health providers, a number of the items dealt specifically with multiple relationships that arise in faith-based environments or with religious clients.	2011	natural
Boy arsonists were more likely to have greater mental_health problems, report gang involvement, a history of prior delinquency and prior arson, and were found to set fires at their residence when compared to girl arsonists.	2011	natural
Both social disorder within the community, reported by caregivers, and perceived stigma, reported by youth, positively covaried with youths' externalizing and internalizing scores - indicating that higher levels of each at baseline and follow-up were associated with higher levels of mental_health problems at both time points (p < .05).	2014	natural
Furthermore, husbands' perceived community disorder is directly associated with their own physical and mental_health.	2010	natural
This article examines the origin and the context of the implementation project of community treatment according to the perspective of community and alternative mental_health groups in Qubec.	2011	natural
Results indicate that men who seek help for IPV victimization have the most positive experiences in seeking help from family/friends, and mental_health and medical providers.	2011	natural
The implications of these results, as well the factors that might inform the ongoing development of mental_health court programs, are discussed.	2014	natural
In particular, effective screening procedures should be developed to identify students who experience a large number of stressors and thus are at high risk for developing mental_health problems.	2011	natural
However, there are family-based mental_health treatments for immigrant families.	2010	natural
Although the timing and extent of exposure to orphanage care did not influence outcome, participants' reports of poorer quality adoptive family experience and a negative view of their adoption were significantly associated with poorer mental_health outcomes (difference in means = 0.76, 95 CI 1.33-0.19, p = .01; difference in means = 1.2, 95 CI 0.68-1.73, p = .01, respectively).	2013	natural
Goals of the model are to increase knowledge of mental_health and mental_health service options to refugees, as well as support the process of adjusting to life in the United States.	2014	natural
Collaborative approaches are being increasingly advocated for addressing a variety of health, mental_health and social needs for children, youth and families.	2010	natural
The results are discussed in terms of the potential significance of attachment for mental_health.	2010	natural
This special issue describes one aspect of this transformation of the largest health system in the U.S.; the system-wide efforts to integrate mental_health treatment into the primary care setting in VA.	2010	natural
A better understanding of the association between public knowledge, attitudes and behaviours and the internalization of stigma among people with mental_health problems is needed.	2012	natural
Previous research on medical students' mental_health has focused almost exclusively on students' emotional well-being and/or their personal psychological functioning, neglecting the more public side of medical training - the students' social health.	2013	natural
Furthermore, associations of stalking victimization with poor mental_health, psychosocial functioning, and use of medication are largely comparable across gender.	2012	natural
Also, the approach of identifying natural social contexts that are associated with endogenous oxytocin release offers the potential of behavioral therapy as an addition or alternative to chemical therapy in the field of mental_health.	2014	natural
Individuals with multiple symptoms also reported poorer mental_health, and self-perceived health.	2012	natural
This study examined the relationships between young people's expectations, preferences, and actual experience of therapy on their clinical outcome, mental_health care service use, and helpseeking intentions.	2014	natural
The results demonstrate that most respondents rely on informal means of seeking help whereas mental_health and medical services are underused.	2012	natural
A model of mature adults' intentions to utilise mental_health services is proposed.	2010	natural
Collaborative care models among pediatric primary care and child and adolescent mental_health providers are increasingly emphasized to improve quality of and access to mental_health services.	2013	natural
Second, the military setting has unique characteristics that may help to destigmatize substance abuse and mental_health problems, remove barriers to treatment, and facilitate access to military members to deal with substance abuse and mental_health problems.	2011	natural
This study suggests that the differential association between cumulative adversity and mental_health is best captured when accounting for both time of occurrence and adversity type.	2012	natural
However, other variables demonstrated unexpected negative associations with postdeployment mental_health (e.g., positive affect and affectionate social support).	2013	natural
We discuss the rationale for such a combined treatment approach, prominent examples of this combined treatment approach for other mental_health disorders, and potential combined treatment approaches for pediatric ADHD.	2014	natural
Rates of mental_health symptoms and homelessness among alumni who received foster care are disproportionately and disturbingly high.	2011	natural
Some aspects of this program bear significant resemblance to what recent experts in global mental_health (GMH) have been proposing.	2014	natural
Most (66) successfully followed up with a mental_health provider.	2013	natural
Based on minority stress theory, this pilot study found that for a sample of MLBAF (n = 116), the odds of self-reported poor mental_health were more than five times higher for each unit increase in stress and almost seven times higher for sexual abuse.	2014	natural
Multivariate analyses showed that employment status was strongly related to better physical and mental_health QOL after controlling for potential confounders.	2011	natural
After adjusting for the effect of children's age, maternal social support, and children's behaviour problems, time pressure but not hours of caregiving, had a significant positive relationship with maternal mental_health problems.	2010	natural
Most mental_disorders often onset during the adolescent years, providing opportunities for educators, health care providers, and related stakeholders to work collaboratively in addressing adolescent mental_health care needs.	2013	natural
It was found that the rates of mental_health conditions in mothers, including those who had given birth in the preceding year, were no higher than in women without children.	2010	natural
Evidence-based practices to improve outcomes for children with severe behavioral and emotional problems have received a great deal of attention in children's mental_health.	2010	natural
The amount of time it took for completed commitment orders to be submitted to the state mental_health authority by the Clerks of Court of each county accounted for a meaningful portion of days defendants spent in jail awaiting transfer to a state hospital, with considerable variation across counties with respect to waiting times.	2010	natural
