Clergy also revealed a strong interest in attending seminars relating to stress, marital communication, psychological testing, divorce, depression, working with mental_health professionals, anger, delinquency, and sexual problems, with the stipulation that these programs be of minimal cost and time.	1985	natural
Psychiatrists, psychologists, social workers, and nurses in private practice were surveyed with a view to the feasibility of referring patients from the public sector as part of comprehensive mental_health planning.	1986	natural
The fidelity of a translated survey instrument used to measure attitudes toward mental_health was evaluated using statistical methods based on item response theory.	1989	natural
The factors which influence the mental_health of girls and boys are analysed and discussed.	1989	natural
This study reports the results of an experiment comparing a developmental-acquisition model of case management to usual case management services provided through a mental_health center.	1988	natural
Resident Assistants (RA) can play an important role in providing mental_health services on a college campus because of their dual role as both peer and counselor.	1987	natural
The approach of the Book About Dying is presented as a technique and model for dealing with the attendant feelings of a death in the family, with perhaps its most important benefit to the family being its preventive mental_health function.	1985	natural
Based on a sample of black residents in a city in the Northeast, the study found that fewer than 20 of black persons possess negative attitudes toward community mental_health centers, that 34 possess positive attitudes, that women and married persons tend to possess more positive attitudes than do men and unmarried persons, that those with high levels of racial consciousness tend to possess more positive attitudes than those who do not, and that those with a high tolerance of substance use tend to possess more negative attitudes than do less tolerant persons.	1985	natural
The present study examined the relationship between religious and nonreligious paranormal beliefs and mental_health, as well as the possibility that nonreligious subjects compensate for a lack of identification with traditional religion by increased nonreligious paranormal beliefs.	1987	natural
Positive treatment effects were associated with pretreatment agreement between counselor and patient about some mental_health values, but with pretreatment disagreement about others.	1989	natural
At a minimum, the mental_health clinician must negotiate a role relative to the foster family, especially the foster parents, biological parents, and the Child Protective Service Agency (CPS) represented by the caseworker.	1988	natural
There was no evidence of language delay in either group and no significant association between child behaviour and maternal mental_health.	1989	natural
These items were augmented by 15 more access and procedural items in an evaluation of a student mental_health service (N = 146).	1989	natural
Since the treatment took place within a full service community mental_health clinic, it was possible to provide psychiatric evaluation and consultation of both mother and child and the use of two therapists working collaboratively.	1986	natural
The National Academy of Certified Clinical Mental Health Counselors was developed by the American Mental Health Counselors Association as an effort to firmly establish the role and identity of mental_health counselors in the fields of counseling and mental_health.	1985	natural
At a time when our guidance is increasingly sought by parents, courts, and social policy planners, it is critical that infant mental_health professionals establish clearer standards for training, engage in more rigorous selfmonitoring of our clinical and our research efforts, and recognize the extraordinary risks for bias in all of our work.	1988	natural
Respondents who did not continue in self-help groups were characterized by a desire for mental_health services, involvement in relationships and saw time conflicts as the primary factor for not continuing.	1985	natural
This article covers the actual knowledge on the organization of infirmary work and its effects on nurses' physical and mental_health.	1985	natural
This study evaluates the relationship between school mental_health professionals' judged satisfaction of their supervision of nonprofessional childaides and adjustment changes in referred children seen by the aides.	1985	natural
The more overweight the obese child, the healthier the mother rated the family, and the better her own mental_health as assessed by a self-report method; and in families of obese girls, the greater the degree of overweight, the worse the rated family functioning.	1987	natural
Based on the results of this study it is possible to speculate either that the Boverman results were primarily an artifact of their forced-choice methodology or that progress has been made in a more nonsexist direction among mental_health professionals.	1985	natural
Two within household telephone sampling techniques for collecting citizen survey data for community mental_health center's needs assessments were compared on the basis of respondent demographic characteristics; response, completion, and refusal rates; and, administrative costs.	1987	natural
The factor structure of the Adolescent Multiphasic Personality Inventory (AMPI) in a mental_health center psychiatric patient population was examined (N = 70).	1987	natural
The first of a two-phase project is reported that examined the prospective effects of stress and social support on the physical and mental_health of the elderly.	1986	natural
The authors finally suggest that this type of communication is fundamental to the mental_health of youth within the family unit.	1988	natural
This report presents information about the types of group homes within a state system based upon the characteristics and service needs of 1,050 persons in 118 group homes and questions the role of community mental_health centers in addressing certain service needs of group home residents.	1985	natural
The findings are discussed from mental_health and sex roles perspectives.	1986	natural
Hierarchical regression analyses indicated that stressors and coping strategies explained between 12 and 40 of the variance on mental_health indexes.	1989	natural
This study reports on the associations between a number of personality factors and spouse mental_health, happiness, and communication (N = 78).	1986	natural
Models in which coping strategies were postulated as having mediator, moderator, and independent main effects were tested using multiple indexes of mental_health.	1989	natural
In a mental_health setting, a self-instructional training program tailored to the specific behavioral deficits of each subject was introduced sequentially in a multiple-baseline design.	1986	natural
The support of administration and the multidisciplinary interaction of mental_health professionals among themselves and with nonpsychiatric physicians have been crucial to the Center's viability.	1989	natural
The data showed the children were functioning with adequate mental_health.	1988	natural
Data are cited that show the rapid shift from free choice care to various forms of managed care, and practitioners are urged to participate in shaping the changes that are now in process in order to develop a humane and effective system of mental_health care.	1989	natural
The second section spells out some of the possible administrative considerations and concerns regarding supervision in family service agencies, mental_health centers, social service organizations, and similar counseling environments.	1986	natural
This study was a followup investigation on the counselor's role in community mental_health.	1988	natural
At a time when the courts are increasingly called on to settle disputes, the mental_health profession finds itself vulnerable to litigation under legal doctrines that were previously limited to the medical establishment.	1985	natural
What are the mental_health consequences of an unsuccessful job search?	1987	natural
This paper examines the association between adolescent pregnancy and socioenvironmental, physical, and mental_health problems in 1590 inner-city females aged 1318 who use health clinics.	1987	natural
Finally, it suggests specific reforms that may improve the use of mental_health experts in legal proceedings.	1989	natural
However, promotion is an aspect of mental_health's prevention not often discussed.	1985	natural
From being a service that was influenced by mental_health clinics with a psychodynamic approach, it has developed into a more school- and education-orientated service.	1989	natural
The support of administration and the multidisciplinary interaction of mental_health professionals among themselves and with nonpsychiatric physicians have been crucial to the Center's viability.	1989	natural
No relationship was found between service employment and either of the mental_health service use indices.	1989	natural
Clergy also revealed a strong interest in attending seminars relating to stress, marital communication, psychological testing, divorce, depression, working with mental_health professionals, anger, delinquency, and sexual problems, with the stipulation that these programs be of minimal cost and time.	1985	natural
The objectives of this study were to investigate the mental_health of Iranian high school and college students with regard to sex differences and to compare the results with those from other countries.	1989	natural
There is opportunity for coalition building among fat women, health and mental_health professionals, and organizations like Ample Opportunity which support a positive lifestyle not dependent on weight reduction.	1989	natural
Three areas of assessment are recommended: assessment of major stresses (migration stress, acculturation stress, life cycle stress, and family stress); assessment of strengths; and assessment of culturally specific responses to mental_health problems.	1988	natural
The author describe the different stages of the project as much from the point of view of the workers'experiences, the ideological evolution, the organisational modalities as from its impact on the network of the mental_health distribution services.	1986	natural
Respondents were asked about their propensity to use mental_health services, their perceptions of barriers to using services, and the potential reactions of family members to their receiving mental_health treatment.	1986	natural
Research on psychological self-help books has not demonstrated conclusively that improvements in mental_health occur after people read the books.	1989	natural
This paper will focus on the physical and mental_health of professional and nonprofessional health workers who come into contact with AIDS patients and others infected with HIV.	1988	natural
The scores of Hare Krishna women did not differ significantly from those of women in the US general population on all 9 scales so their mental_health was equivalent.	1987	natural
Forensic Psychiatry has been criticized for losing pace with more general psychiatric trends toward community mental_health.	1987	natural
Over 1,200 adults in a representative nationwide sample were administered the Thematic Apperception Test (TAT) and an unstructured interview which produced 25 measures of subjective mental_health and ultimately six factor scores: unhappiness, lack of gratification, strain, feelings of vulnerability, lack of self-confidence, and uncertainty.	1987	natural
Results indicate (a) distinctly different trends between APA- and non-APA-accredited programs in many program characteristics, (b) increasing female applications, admissions, and enrollments, (c)no improvement in minority student admissions, (d) increasing hospital internships, and (e) increasing initial job placements in hospitals, community mental_health centers, and private practice.	1989	natural
First, we trace the dialectical development of the ideology of community mental_health and the rediscovery of community.	1986	natural
A multiple baseline across groups design was used to assess the effectiveness of first self-monitoring (feedback), then self-monitoring plus assigned goals (feedback and goal setting), on the proportion of work hours spent in direct client contact by 17 clinicians in a rural mental_health center.	1988	natural
In this study, 60 normal university students and 45 new client applicants for mental_health services completed the Survey of Personal Beliefs to assess irrational ideation and the Beck Depression Inventory, the State-Trait Anxiety Inventory, the State-Trait Anger Inventory, the Problematic Situations Questionnaire, and the Profile of Mood States to assess negative emotionality.	1989	natural
On the other hand, the young adult using mental_health services sees the impact social integration will have on his quality of life : is life outside possible when both institutional organization and conditions within society contribute to impoverishing one's personality and resources?	1988	natural
They may be broken down into three groups: those issues involving cultural values and definitions of mental_health; those issues that relate to undisclosed goals maintained by the therapist that may differ from the patient's as well as recommendations for types of treatment; and those issues which relate to the psychoterapeutic method, with its emphasis on the therapeutic relationship and its encouragement of openness of patient communication which may result in problems relating to confidentiality and privacy.	1987	natural
The mental_health status of a group of 486 admissions to the Philadelphia Prisons was systematically examined in a carefully controlled study using multiple indices of psychopathology.	1985	natural
Of primary importance appears to be the reduction of anxiety and depression and, consequently, the activation of hope which may be triggered simply with the act of beig interviewed by a mental_health worker and the anticipation of future professional care.	1988	natural
Perceptions and mental_health policies should be revised to reflect the reality of more similarities than differences among aging widows and widowers.	1986	natural
Although most mental_health professionals doubt the capacity of mentally retarded patients to benefit from psychotherapy, a review of case studies, writings, and research revealed that mentally retarded patients responded positively to treatment.	1989	natural
From a social systems and family systems perspective, this paper considers the relationships among protective service clients, caseworkers in protective service agencies and clinicians asked to provide mental_health services.	1986	natural
In order to be equal to the task of serving the mental_health needs of the community, mental_health professionals must develop methodology which is both effective and affordable, avoiding both undertreatment and overtreatment of those who need and seek their services.	1985	natural
C'hild psychiatrists and mental_health professionals who work with handicapped children should be aware of the new developments in law, legislation, and court rulings in order to give adequate and appropriate guidance to the AIDS-afflicted, their families, and their communities.	1988	natural
In the field of preventive mental_health, the author has supervised the therapeutic relationship in many groups of helping professionals from different areas over a period of several years.	1985	natural
Some of the cultural factors affecting the utilization of mental_health services are saving face, stoicism, respect for authority and discrimination which may cause them to seek help only at advanced stages of illness.	1987	natural
These data have important implications for mental_health toddler workers involved in training teachers in early childhood settings.	1988	natural
Analyses, based on variables derived from coded audiotapes of simulated helping interactions and from ratings of helper effectiveness, indicated many similarities between mental_health professionals and mutual help leaders but considerable differences between these two groups and divorce lawyers.	1986	natural
The internal consistency reliability of a five-item measure of socially desirable response set, the SDRS-5, was examined in two samples: 614 outpatients of medical providers and 3053 outpatients of medical and mental_health providers.	1989	natural
This article aims at assessing the problem of mental_health for people involved in varied functions in syndical organizations.	1985	natural
In analyses using 30 items common to the mental_health and health clinics samples, additional but weaker factors related to access and office procedures were found.	1989	natural
Art therapy for Hispanics at a Chicago mental_health center is described, including art therapy assessments and results, accompanied by photographs of clients' art work.	1986	natural
The expansion of mental_health services during the 1960s from a single remote mental hospital to centers and clinics in mainstream communities fostered the development of community psychology in Hong Kong.	1989	natural
In addition to these pathological changes, certain mental_health resources for medical students have declined (although there is considerable variability from one location to another).	1988	natural
All studies about childhood mental_health are based on referral by adults.	1986	natural
An educational approach that connects concerns about health, mental_health, and sexuality could help alleviate fear and thus benefit cancer patients and their partners and families.	1987	natural
The need for each strategy is illustrated with one or more examples of problems that have arisen when mental_health professionals have failed to obtain consent for their activities, have been insufficiently sensitive to or unaware of conflicts between the usual norms in their professions, and the norms of law enforcement agencies, or have identified too strongly with law enforcement personnel.	1986	natural
The status of a fully indigenous mental_health program serviced and controlled by the Tohono O'odham (Papago) Indian tribe is reviewed from the perspective of its 17-year history.	1988	natural
A statistical study was conducted at the Occupa- tional Therapy section of Walter Reed Army Medical Center, Washington, D.C., to determine the inter-rater reliability of a clinical assessment and documentation instrument designed for psychosocial (mental_health) patients.	1986	natural
The material comprises 200 successive psychiatric patients from a mental_health centre and a central mental hospital in Finland.	1986	natural
The authors suggest that the use of minority mental_health concepts by the researcher/consultant facilitates the establishment of mutual credibility between the group members and the newcomer.	1988	natural
One involves a classified list of risk indicators for different stages of infancy, and the other involves a validation in an 8year longitudinal epidemiological study of the mental_health of 400 children identified during their first year by use of these very early indicators as guides.	1988	natural
It has been suggested that the personality of the individual influences appraisal processes that determine ratings of both social support and mental_health, thus leading to an association between these variables that reflects only their shared self-report bias.	1989	natural
Professionally led groups had greater impact on improvement of mental_health indices compared to the peer-led groups.	1985	natural
Contrary to the popular practice that mediators be professionally educated in law or the mental_health field, mediators in New Hampshire are trained community volunteers.	1989	natural
There was no evidence of language delay in either group and no significant association between child behaviour and maternal mental_health.	1989	natural
Providers of mental_health services in both public and private sectors are becoming increasingly dependent on third-party health insurance to cover the costs of outpatient psychotherapy.	1988	natural
Professional and public liability requires mental_health practitioners to develop more reliable methods by which violent behavior may be diagnosed, managed with effective strategies, and ultimately prevented.	1985	natural
A total of 66 clergy were surveyed using a questionnaire designed to determine the following: clergy and church demographic characteristics, clergy involvement in counseling activity, referral practices and value placed on collaboration with mental_health resources, and receptivity towards consultation with mental_health professionals.	1985	natural
In this article, I try to reconstruct the bygone mind-set that saw the controlling of deviants as a way to do good in God's name, and I compare it with the contemporary mind-set that sees controlling deviants as doing good in the name of mental_health.	1987	natural
The hypothesis that members of Asian ethnic minorities appear to use mental_health services less because they are psychologically more robust in the face of difficulties therefore seems questionable.	1989	natural
These questions go to the heart of community mental_health, deinstitutionalization, mental_health policy development and evaluation, and many other areas in which psychologists are playing major roles.	1989	natural
Few psychologists were initially involved in the local community mental_health movement, but its momentum resulted in increasing numbers of practitioner psychologists working in community-based service settings.	1989	natural
The results provide strong support for a model in which recipients' perception of support is determined significantly and strongly by actual interpersonal transactions as reported by significant others, moderately by the recipients' negative outlook bias, and weakly by their anxiety and depression as indicators of their poor mental_health.	1987	natural
There was no evidence of differential treatment toward otherthanBlack clients at a Black community mental_health center when comparisons were conducted with the greatest possible methodological rigor.	1989	natural
Self-esteem has long been considered an essential component of good mental_health.	1987	natural
In addition, recommendations are suggested by professionals working in the fields of hearing impairment and mental_health.	1988	natural
Standardized instruments are often used to assess the need for mental_health services in a community.	1989	natural
The author argues such an image is produced by the fact that social and mental_health services deal mainly with families at grips with multiple, long-standing problems.	1989	natural
As a group, patients who chose not to continue in treatment tended to be younger and less dysfunctional and had less prior mental_health treatment.	1989	natural
The development of an epidemiological study of mental_health, social background factors, suicidal behaviors (suicidal ideas, deliberate self-harm, and attempted suicide), values concerning suicide, and experience of suicide in others is described.	1985	natural
The results of the analysis of the use of mental_health services according to marital status, employment status and changes in social relationships were in keeping with social support theory.	1986	natural
The aim was to prevent poor mental_health and loss of motivation to seek reemployment among those who continued to be unemployed and to promote high-quality reemployment.	1989	natural
There are also indications that the rate of disciplinary infractions varies with the nature, severity, and chronicity of inmate mental_health problems.	1986	natural
This study predicted and demonstrated high positive correlations between repressor-sensitization, self-image disparity and mental_health.	1986	natural
Recent research suggests that children with encopresis do have numerous behavior problems, but that these problems are generally not as severe as the behavior problems found in children referred for mental_health services.	1988	natural
The author describes the different stages in the construction of governmental policies emphasizing specifically the way the policies in mental_health are being developed in Quebec.	1986	natural
They may be broken down into three groups: those issues involving cultural values and definitions of mental_health; those issues that relate to undisclosed goals maintained by the therapist that may differ from the patient's as well as recommendations for types of treatment; and those issues which relate to the psychoterapeutic method, with its emphasis on the therapeutic relationship and its encouragement of openness of patient communication which may result in problems relating to confidentiality and privacy.	1987	natural
Using an instrument developed in the United States to assess students' knowledge of mental_health in old age, the present study tested 179 Australian undergraduates who varied in age, sex, and the frequency of their contact with aged people at home, at work, and in the neighborhood.	1988	natural
The potential predictive value of the social contextual measures of life-event stress for mental_health variables was generally supported by the findings.	1985	natural
Other analyses showed that social support can counteract the negative effects of unsuccessful job search on mental_health and that such effects are particularly pronounced among the more highly motivated job seekers.	1987	natural
Comparison with findings from studies of general mental_health services use suggests that influences on help-seeking may vary across psychiatric disorders.	1987	natural
Skillful juggling of conflicting loyalties is one of the variables that define college counseling as a mental_health specialty.	1989	natural
