To summarize the literature about the clinical presentation and treatment interventions of childhood reactions to terrorism-induced trauma.	2004	natural
The present study shows how, although he was writing well before the introduction of the term 'post-traumatic stress disorder', Carl Rogers provided a theory of therapy and personality that contains an account of threat-related psychological processes largely consistent with contemporary trauma theory.	2004	natural
The two samples did not differ in the magnitude of either the zero-order correlations or the multiple correlations between the two types of exposure to community violence and the four types of symptoms of trauma.	2001	natural
This paper examines the research and theoretical literature on potential links between trauma and psychosis.	2003	natural
Understanding the role of trauma history is important for improving intervention efforts aimed at alleviating stress following a trauma.	2000	natural
This study compares trauma responses in firefighters and paramedics who have been questioned in postmortem inquiries following a critical event in the work-place and those who have not.	2003	natural
In contrast, following the trauma challenge, participants with PTSD showed a pattern of startle modulation suggestive of greater defensive reactivity and reduced visual perceptual engagement.	2004	natural
Cluster analysis revealed four major emotional patterns: two of them, 'Integrative' and 'Low intensity' turned out to be adaptive, and 'Ruminating alexithymic' and 'Depressive enactant' to be maladaptive, when their role in moderating between trauma and PTS was the criterion.	2002	natural
The possible application of 2 recent cognitive models of PTSD in adults to understanding PTSD in children and adolescents is discussed in this paper, within the context of what is already known about children's reaction to trauma and existing theoretical accounts of childhood PTSD.	2002	natural
The first group is comparable with the trauma controls.	2001	natural
Aggressivity and violence reproduce trauma, which then contributes to the reproduction of gender.	2002	natural
This paper presents a comparison for two samples (college and noncollege) of older, urban African-American adolescents of correlations between two measures of exposure to community violence (victim and witness) and four types of psychological trauma symptoms (anger, anxiety, depression, and dissociation).	2001	natural
These findings suggest that the PK scale is not particularly useful in detecting PTSD in civilian trauma samples.	2001	natural
PTSD identifies the most severe trauma victims, who are markedly distinguishable from victims with subthreshold PTSD.	2004	natural
This article presents trauma theory and characteristics of traumatized adolescents.	2001	natural
There is a large literature on the way sexual trauma affects later sexual functioning and relationships.	2001	natural
Empirical data regarding reactions to research participation would be very useful to address the question of whether it is harmful for trauma survivors to participate in trauma studies.	2003	natural
They are treated with awe if they tell a certain kind of trauma story, and are ignored or vilified if they tell another.	2003	natural
Jobs with a high degree of variability in manual materials handling requirements expose limitations in current low-back injury risk assessment tools and emphasize the need for a probabilistic representation of the biomechanical stress in order to quantify both acute and cumulative trauma risk.	2000	natural
The profound disruption in basic trust, the common feelings of shame, guilt, and inferiority, and the need to avoid reminders of the trauma that might be found in social life, all foster withdrawal from close relationships.	2000	natural
This article presents a framework for understanding how the trauma of political violence experienced in one generation can pass to another that did not directly experience it, and proposes a model to guide clinical intervention.	2004	natural
These links were partially mediated by the relationship between trauma exposure and increased maternal depression.	2003	natural
On a first level, fixation to the trauma, like in screen-memories, gives way to a first displacement.	2002	natural
To determine whether employees of a regional trauma center wore seat belts any more often than did visitors to the medical center and residents of the state.	2002	natural
In addition, using the attachment motivation system and trauma research, we elaborate on why certain types of negative experiences in psychotherapy and psychoanalysis should be avoided.	2001	natural
The other side consists in a intrapsychic change, which flows from severe trauma.	2002	natural
After establishing equivalence, structural equation modeling was used to determine the impact of acculturation on peritraumatic dissociation after controlling for other relevant covariates, including assault characteristics, intoxication before the assault, and trauma exposure history.	2002	natural
This prospective longitudinal study was designed to investigate the relationship between acute stress disorder (ASD) and the subsequent development of posttraumatic stress disorder (PTSD) in a population of severely injured hospitalised trauma survivors.	2004	natural
The premature termination of the treatment due to the therapist's departure enabled the child to articulate for the first time her feelings, in the transference, about the trauma and the traumatizing agent.	2001	natural
In this article we discuss the importance of anticipating and addressing the emotional difficulties students experience in graduate-level courses on trauma and violence.	2001	natural
Presence of significant arousal during trauma predicted frequency of posttrauma panic attacks, but not its severity.	2004	natural
One such relationship, the dyadic couple, is explored in this paper and the impact trauma has on different subtypes of intimacy.	2001	natural
including parental trauma exposure and parental PTSD, can also contribute to the experience of child trauma.	2001	natural
Psychogenic fugue is a disorder of memory that occurs following emotional or psychological trauma and results in a loss of one's personal past including personal identity.	2004	natural
Participants were tested by measuring electrodermal activity to two sets of 15 auditory stimuli of different intensity, and to six vignettes, four neutral, one of general stress and one trauma related.	2002	natural
The overall means for the scale were considerably lower than reported in most studies on other kinds of trauma.	2003	natural
The size of the THODST did not distinguish between the three risk groups, nor did it correlate with any potential or established markers of sexual abuse other than three potential markers of hymenal trauma: narrowing of the posterior hymenal rim, hymenal tears and lacerations, and hymenal clefts between 5 and 7 o'clock in the supine position.	2001	natural
This paper offers a therapeutic alternative to working with complex client problems, based on a cognitive behavioural therapy (CBT) approach, which is informed by a combination of schema-focussed cognitive behavioural therapy (McGinn and Young 1996; Young 1994; Padesky 1994; Pretzer and Fleming 1989), specialized cognitive behaviourally-focussed trauma therapy (Herbert 1996, 2001, 2002a, 2002b; Herbert and Wetmore 1999, 2001), eye movement desensitization and reprocessing techniques (EMDR Shapiro 1995) and mindfulness techniques (Bennett-Goleman 2001; Teasdale et al.	2002	natural
Furthermore, attributional style contributed to the prediction of both depressive and trauma symptoms.	2004	natural
At one-year follow-up of a prior intervention for disaster-related symptoms, some previously treated children were still suffering significant trauma symptoms.	2002	natural
AS-related psychological concerns were a statistical predictor of PTSD symptoms when the entire sample of women was considered but not among the subset with a trauma history.	2002	natural
For the random sample, contact with the ER, especially for a trauma injury, was related to children liking the ER more.	2002	natural
The evidence for and against the current emphasis on peritraumatic dissociation is discussed, and the range of biological and cognitive mechanisms that potentially mediate acute trauma response are reviewed.	2002	natural
The results are discussed in the context of a functional hypothesis about the developmental relations between memory specificity, trauma and depression.	2004	natural
This article applies such a dynamic perspective of PSS to victims of crime and argues that one's perspective of victim status may be well served by taking into account the history of victimization and trauma that these individuals have experienced.	2004	natural
The article examines how recent research and writing regarding the neurological impact of trauma and early attachment experiences might inform our understanding of sexual behavior problems, particularly in dealing with children and adolescents.	2004	natural
It thus appears that critical events in child welfare practice are encountered by individuals whose resources may already be taxed through coping on an ongoing basis with high levels of challenge and stress, thereby increasing the intensity of trauma reactions.	2004	natural
Reexperiencing symptoms are usually sensory impressions and emotional responses from the trauma that appear to lack a time perspective and a context.	2004	natural
In the article Refugee Survivors of Torture: Trauma and Treatment, W. Gorman (2001) consolidates liberation theory, multiculturalism, and traumatology into a treatment framework that draws from P. Freire (1973); A. J. Marsella, M. J. Friedman, E. T. Gerrity, and R. Scurfield (1996); and J. L. Herman (1992).	2003	natural
This article describes a seemingly sophisticated, but mostly contrived and often erroneous ;false memory; defense, and compares it in a brief review to what the science says about the effect of trauma on memory.	2000	natural
The importance of clergy in trauma recovery is also well documented.	2003	natural
This field study was aimed at shedding light on the magnitude of children's specific trauma related responses in the context of ongoing massive missile attacks that took place along Israel's northern border resulting in their forced evacuation.	2001	natural
Although early interventions for trauma remain underdeveloped and understudied, practice guidelines gleaned from preliminary but promising treatment approaches are offered.	2002	natural
Research primarily since the early 1990s has shown that psychological trauma can have detrimental effects on brain function that are not only lasting but that may alter patterns of subsequent neurodevelopment, particularly in children although developmental effects may be seen in adults as well.	2004	natural
Using path analysis, poor perception of mother's health demonstrated an indirect effect on somatic preoccupation via borderline personality symptomatology, whereas, poor perception of father's health demonstrated an indirect effect on somatic preoccupation via childhood trauma.	2000	natural
126 female survivors of childhood sexual abuse completed anonymous survey packages which included a modified version of the Attributional Style Questionnaire, the Trauma Symptom Checklist-40, and questions regarding demographics and abuse characteristics.	2001	natural
Several studies of people coping with loss or trauma suggest that posttraumatic growth is common.	2003	natural
Victims of other types of childhood traumas (e.g., car accidents) reported less forgetting than victims of childhood sexual abuse or multiple types of trauma.	2002	natural
Trauma theory and traumatic bonding are integrated into the ecological model of parenting in battered women.	2000	natural
This study investigates the long-term course of general psychopathology following trauma in adolescence using a standardised diagnostic interview and comparisons with a matched control group.	2000	natural
The Study Circle, a democratic, interactive adult learning format, is introduced to make up for this lack by educating managers and co-workers about the various stages in the trauma recovery process and teaching them how to facilitate a TLE employee's re-entry to the workplace.	2000	natural
The book also contains impartial assessments of Freud's collaborators, such as Adler, Rank, Ferenczi, Jung, and data about trauma and loss in the lives of patients as well as colleagues.	2003	natural
A combination of qualitative and quantitative methods may be optimal for the acquisition of sensitive trauma information with wary and vulnerable street populations.	2004	natural
The paper raises questions about whether some trauma can ever be fully assimilated, and whether, for Michael, the mourning process could lead to a reintegrated sense of self and of a 'psychic intactness', dependent on the survival of his good 'internal couple'.	2001	natural
We examined the effects of critical incident exposure (trauma exposure) and routine (nontraumatic) work environment stressors on sleep quality after controlling for the effects of work shift schedule.	2002	natural
A sample of 208 children comprised intrafamilial trauma, extrafamilial trauma, combined trauma, and nontrauma groups.	2000	natural
A clinically pertinent distinction is made between the cognitions and emotions experienced at the time of the trauma and, subsequently, in flashback experiences, and secondary negative appraisals.	2002	natural
For those who disclosed a high-intensity trauma, uncertainty-oriented persons exhibited less inhibition (lower skin conductance levels) and a greater increase in arousal (higher heart rate) relative to certainty-oriented persons.	2004	natural
Additionally, substance-using clients with a history of childhood trauma had significantly more individual therapy sessions attended than clients without a history of childhood trauma.	2000	natural
Contemporary work on trauma and dissociation may be seen as an illustration of, and developing from, early psychoanalytic formulations on the organization of the personality.	2003	natural
The mother's background of early neglect and trauma is described, in the light of recent literature about the early intergenerational transmission of traumatic experiences, in order to demonstrate possible treatment modalities and the need to consider both protective and risk factors.	2001	natural
It is argued that the poet seems to have experienced a trauma during the first months of life in the shape of erratic infant care, that caused environmental impingement.	2003	natural
The present study examined the occurrence of malevolent environment factors (e.g., poverty, hunger), substance use, trauma exposure, and PTSD among 51 male adolescent offenders recruited from juvenile treatment facilities representing the highest level of security in Massachusetts.	2000	natural
American Psychiatric Association, 1994) posttraumatic stress disorder symptoms in children exposed to trauma.	2001	natural
Greater attention to relationship factors and consideration of trauma factors is encouraged.	2004	natural
The perpetration of violence in later life is viewed in the context of identifying with the aggressor, the obliteration of thought processes and the repetition of the earlier childhood trauma.	2000	natural
The findings suggest that a diagnosis of PTSD rather than a history of trauma is associated with borderline and self-defeating personality disorder features.	2000	natural
In addition, more work is needed to understand the effects of culture, gender, age and ethnicity on trauma in children/adolescents to allow for better provision of health services.	2004	natural
PP/PTSD symptoms were not associated with demographic factors, previous trauma, treatment, or insight.	2002	natural
Ninety-four participants suffering from chronic PTSD were assessed for suicidal ideation, plans and attempts since the index trauma as part of a comprehensive assessment.	2004	natural
When interviews were rated additionally in terms of lack of resolution, 59 of the sample were unresolved with respect to experiences of trauma or loss.	2001	natural
Hypnosis and the related phenomenon of dissociation have long been linked to trauma.	2003	natural
The fear-ful-avoidant attachment style was the best predictor of both the cognitive disruptions and symptoms of distress in female trauma therapists.	2003	natural
Data were collected on a sample of 130 trained non-professional trauma counsellors in the South African banking sector.	2001	natural
Despite the high prevalence of violence in the lives of women of reproductive age, and the adverse consequences posed to pregnant women suffering from PTSD, few studies have examined violence-related trauma and PTSD among pregnant women.	2004	natural
A review of the last 20 years of research on CSA does not support the view that the majority of children known to have been sexually abused exhibit signs or symptoms of trauma.	2003	natural
The vast majority of intrusive memories can be interpreted as re-experiencing of warning signals, i.e., stimuli that signalled the onset of the trauma or of moments when the meaning of the event changed for the worse.	2004	natural
Things have moved on since then, and trauma is being recognised within the addiction field.	2004	natural
An additional source of trauma in bereavement, occurring when the previous representation or introject of the deceased is shattered, is considered for its status as an additional source of complication in the traumas of bereavement.	2003	natural
PTSD participants had higher HRs at 1 week but not at 1 month after trauma than non-PTSD participants.	2004	natural
The presently available, replicated, but uncontrolled evidence indicates that the Trauma Program is effective in meeting its goals.	2004	natural
Such thinking appears frequent in survivors of trauma (e.g. 'If only I had stayed at home then I wouldn't have had the accident'), but has received little systematic empirical investigation.	2004	natural
We studied cognitive functioning and its relationship to current and subsequent PTSD severity during an early phase of trauma response.	2001	natural
The results are discussed with reference to other studies dealing with the effect of attributions on subsequent adjustment among victims of trauma.	2003	natural
This article summarizes scales assessing trauma and its effects on youths.	2002	natural
Although all children had experienced at least one symptom of trauma, only 3 or 24 of the children, depending on the measure used, met criteria for PTSD based on the DSM-IV.	2002	natural
Although this finding is in line with clinical reports given by trauma victims, it was not sustained by objective evidence.	2003	natural
Other predictors included reproductive history, behavioral and health-related variables, psychological trauma and distress, ethnicity, and income.	2000	natural
Measures included a trauma inventory, the Clinician Administered PTSD Scale (CAPS), the depression module of the Structured Clinical Interview (SCID), and the Core Bereavement Items (CBI).	2004	natural
Acute reactions to trauma are examined in 267 individuals severely injured via community violence.	2003	natural
A similar line of investigation will be followed to examine the concept of psychological trauma.	2002	natural
The relationship between cumulative trauma and total number of CP/DES symptoms revealed that as the cumulative number of types of trauma increased the number of CP/DES symptoms rose.	2000	natural
The Integrative Stage Model (ISM) is applied to Katrina, a trauma survivor suffering primarily from chronic post-traumatic stress disorder and associated long-standing interpersonal and affect regulation difficulties, which often result in self-injurious behavior, The ISM is a long-term, integrative, feminist-oriented stage approach focused on self-care/safety, interpersonal functioning, and trauma processing.	2000	natural
A live infant observation is also reported, in which an infant manifests a dissociative reaction in the wake of a discrete trauma.	2004	natural
Possible reasons for the effectiveness of EMDR are discussed, ranging from the fundamental nature of trauma reactions to the nonexposure mechanisms utilized in information processing models.	2002	natural
After adjusting for demographic characteristics, lifetime anxiety and depressive disorders, alcohol and substance dependence, and all types of trauma: results showed that childhood physical abuse was associated with increased risk of lung disease (OR= 1.5 (1.1, 2.2)), peptic ulcer (OR= 1.5 (1.03, 2.2)) and arthritic disorders (OR= 1.5 (1.1, 2.2)); childhood sexual abuse was associated with increased risk of cardiac disease (OR = 3.7 (1.5, 9.4)); and childhood neglect was associated with increased risk of diabetes (OR=2 2 (1.1, 4.4)) and autoimmune disorders (OR =4.4 (1.7, 11.6)).	2004	natural
Five factors are proposed that influence the response to trauma, including biological factors, developmental level at the time of trauma, severity of the stressor, social context, and prior and subsequent life events.	2000	natural
Greater detail and a moderate level of personalization in the description of the trauma were associated with decreased symptoms of dysphoria and social anxiety.	2001	natural
Cases of blunt abdominal injury (N = 927) to children ages 0 to 4 years were extracted from the National Pediatric Trauma Registry.	2004	natural
The findings supported the hypothesis, with a specific link between somatoform dissociation and the severity of reported childhood trauma involving physical contact or injury.	2001	natural
Furthermore, among UN soldiers one of these interaction effects was reversed, indicating social support to be important for those low on trauma exposure, while among relief workers support was important in the high-exposure condition.	2003	natural
Adjusting for gender differences in the number of lifetime traumata, or in the likelihood of the trauma being associated with particular reactions to or consequences of the event (i.e. thinking that one would be killed or seriously injured; sustaining a serious physical injury; seeing someone else seriously injured or killed) did not result in a lessening of the PTSD risk in women.	2000	natural
The cur rent study rep li cates and ex tends re cent re search that ex am ined perfor mance in a di rected for get ting task us ing PTSD and trauma his tory as the group ing vari ables (McNally, Metzger, Lasko, Clancy, & Pitman, 1998) to col lege stu dents who were clas si fied as high or low dissociators based on their per for mance on the Dissociative Ex pe ri ences Scale (DES: Bernstein & Putnam, 1986).	2001	natural
During the 1994 siege in Sarajevo, 791 children aged 6 to 16 years participated in a study of trauma experience and response, in which assessment questionnaires (Impact of Event Scale, PTSD Reaction Index, Children's Depression Inventory, Child Behavior Checklist, and War Experience Questionnaire) were completed by children and their teachers.	2002	natural
The intersection of cognitive science and trauma offers both challenge and potential.	2001	natural
CTT-BW includes trauma history exploration, PTSD psychoeducation, stress management, psychoeducation about dysfunctional self-talk and self-monitoring of self-talk, exposure to abuse reminders, Cognitive Therapy for Trauma-Related Guilt (E. S. Kubany & F. P. Manke, 1995), and modules on assertiveness, managing contacts with former partners, self-advocacy strategies, and avoiding revictimization.	2003	natural
Also discussed are a number of variables that combine to determine the effects of such victimization, including type and characteristics of the assault; victim variables such as demographics, psychological reactions at the time of the trauma, previous victimization history, current or previous psychological difficulties, and general coping style; and sociocultural factors such as poverty, social inequality, and inadequate social support.	2004	natural
Based on comparisons to Jung's model of generic complexes, it is possible to define the Trauma Complex as a set of psychological processes which are archaic and typical, i.e., archetypal.	2004	natural
Dissociative identity disorder (DID), with its typical etiology of extreme, repetitive childhood trauma, usually includes manifestations of childlike ego-states, among others.	2004	natural
The psychosomatic problem was not a single entity, but rather was comprised of diverse interwoven elements such as somatization, conversion on pre-oedipal and oedipal levels, conflicts over aggression, sexuality, identity, masochism, secondary gain, anaclitic depression, internalized self-other interactions with a depressed mother and transgenerational transmission of trauma.	2003	natural
Trauma is proposed as a key to understanding the development and persistence of conduct disorder, in conjunction with other contributing factors.	2002	natural
The utility of the brief PTSD measures that do not key to a single trauma is limited by lengthiness and high reading levels.	2001	natural
In addition, to the extent that internal representations of a trauma can be traced over time, traumatic experiences present unique opportunities for the study of early memory.	2002	natural
In adjusted analyses, inpatients were at increased risk for reporting all types of trauma except combat.	2004	natural
This paper explores prevailing sociocultural and theoretical beliefs regarding dependency in the psychotherapy of trauma survivors, provides a working definition of dependency, offers an analysis of its complex nature, and describes the theory of structural dissociation, which helps illuminate the often contradictory manifestations of dependency in chronically traumatized patients.	2001	natural
