On the other hand, trauma after infancy and before age 18 provided the strongest correlation with adult outcome: consistent with the theory of the effect of cumulative trauma on psychic functioning, children experiencing two or more adverse circumstances had significantly lower levels of global functioning as adults than those spared multiple traumas.	2002	natural
This study aimed to examine the long-term correlates of childhood trauma in regard to interpersonal functioning in adulthood.	2004	natural
Results suggest that behavioral hostility among persons in a stable phase of illness may be closely related to disinhibition and trauma history while hostile attitudes may be more closely linked with attitudes about current psychosocial circumstances.	2002	natural
Although causal relations cannot be assessed in this cross-sectional study, these results suggest that, as compared to the low and mid-range categories, high hypnotizables may experience a greater frequency of trauma symptoms after burn injury.	2002	natural
Multiple linear regression analyses were performed to identify the impact of demographic variables, childhood abuse, adulthood trauma, major life events in the past year, and daily hassles in the past month, as well as psychopathology on hormonal stress responsiveness.	2002	natural
Treatment proved most beneficial for participants who had suffered from intentional trauma and those who had not previously discussed the traumatic events with significant others.	2003	natural
Imaginal exposure to trauma memories and hypnosis are techniques most likely to affect the intrusive symptoms of PTSD, while cognitive and psychodynamic approaches may address better the numbing and avoidance symptoms.	2002	natural
This study examined the relationships among trauma, posttraumatic stress disorder (PTSD), and religious beliefs.	2003	natural
Despite the high prevalence of violence in the lives of women of reproductive age, and the adverse consequences posed to pregnant women suffering from PTSD, few studies have examined violence-related trauma and PTSD among pregnant women.	2004	natural
Such factors may predispose agoraphobics to become psychiatrically ill after more minor trauma.	2001	natural
The underwater trauma may provide an important and potentially powerful model for understanding the mechanisms underlying the relationship between stress, cognition, and learning.	2000	natural
The available evidence indicates that alternative means of conceptualizing acute trauma reactions and identifying acutely traumatized people who are at risk of developing PTSD need to be considered.	2002	natural
The Davidson Trauma Scale (DTS) was developed as a self-rating for use in diagnosing and measuring symptom severity and treatment outcome in post-traumatic stress disorder (PTSD); 630 subjects were identified by random digit dialing and evaluated for a history of trauma.	2002	natural
Neglect was the most frequently reported type of childhood trauma, suggesting the importance of other childhood experiences in addition to sexual and/or physical abuse in the development of dissociative psychopathology.	2000	natural
The findings of biological researchers and the observations of psychoanalysts are integrated, as they apply to two functions that are damaged by trauma: the capacity for representation and the capacity for self-regulation.	2003	natural
The framework is used to generate hypothetical accounts of the role of dysfunctional emotional processes and maladaptive emotion socialization in early motherinfant interaction in the development of Disorganized attachment along two distinct pathways, one associated with actual abuse of the infant and the other associated with maternal unresolved trauma.	2004	natural
This analysis may also suggest that defects and trauma in the earliest years may be conducive to alexithymia, deficient contact between feelings and words, linked to the risk of developing serious psychosomatic illnesses.	2001	natural
We examined how trauma-specific appraisals and coping efforts mediate between traumatic experiences, acuteness of trauma, and length of imprisonment and posttraumatic stress symptoms (PTS) among 103 Palestinian former political prisoners.	2002	natural
Recent trauma research, however, has rediscovered trauma dissociation, which is separate from repression.	2002	natural
Thus, our results demonstrate that cross-sectional and non-clinical studies relying on self-reports of dissociation and trauma should seriously consider the possibility that dissociation, together with its correlates absent-mindedness and fantasy proneness, contribute to trauma self-reports.	2002	natural
The premature termination of the treatment due to the therapist's departure enabled the child to articulate for the first time her feelings, in the transference, about the trauma and the traumatizing agent.	2001	natural
The data suggests that missionaries from North America have a greater resilience to trauma than is found in the general North American population.	2003	natural
These case studies demonstrate the need for systematic research to further investigate the potential relationship between aging, degenerative disease, and PTSD symptoms in elderly trauma survivors.	2004	natural
We examined participant reactions to different trauma assessment procedures in domestic violence (N = 260), rape (N = 108), and physical assault (N = 62) samples.	2003	natural
Interestingly, those who experienced a single form of maltreatment reported no more trauma symptoms than did participants who reported no maltreatment history at all.	2003	natural
Beginning with a prophecy made by Nostradamus in 1555, many have described subdural hematoma and its relationship to trauma and abuse.	2001	natural
To describe the presenting characteristics, hospital course, and hospital charges associated with hospital admissions for head trauma in young children at a regional pediatric trauma center, and to examine whether these factors differ among abused and non-abused subjects.	2004	natural
Findings from a National Institute on Drug Abuse-funded study examining the link between trauma, drug use and violence among youth are presented.	2000	natural
The results support the reliability of trauma and PTSD assessments in clients with severe mental_illness.	2001	natural
Further subcategorization and development of the broad categories of trauma and resolution were recommended and may be useful in shedding light on how change happens in EMDR.	2002	natural
This article presents the Trauma Outcome Process, an integrated treatment model for guiding clinical practice with children with sexually abusive behavior problems.	2000	natural
Writing about trauma or stress has been shown to improve health and reduce stress, but can negatively affect mood.	2004	natural
In addition, rather than performance on general neuropsychological memory tests, the frequent occurrence of intrusive memories and the avoidance of reminders of trauma predicted less autobiographical memory specificity.	2002	natural
This article presents a framework for understanding how the trauma of political violence experienced in one generation can pass to another that did not directly experience it, and proposes a model to guide clinical intervention.	2004	natural
The experience of trauma was significantly associated with the likelihood of PTS.	2002	natural
A treatment model that addresses the early trauma and its aftereffects concerning intimacy and sexuality is discussed.	2002	natural
Assessments included substance use severity, trauma history, PTSD symptomatology, and comorbid psychiatric disorders.	2003	natural
Fiction enhances clinical conceptualizations of traumatic emotion and memory by providing unique access into psychological states, including the effects of trauma on the individual's sense of self and relation to the world.	2004	natural
Pediatric abdominal trauma leads to intense use of hospital resources and a high risk of in-hospital mortality.	2004	natural
While I think it is clinically dangerous to assume that trauma can cause the actual, permanent destruction of part of the personalitythis assumption can lead to unwarranted therapeutic pessimismtrauma certainly often carries the subjective experience of partial death or dying.	2002	natural
The conclusion is that findings regarding the relationship of exposure to community violence with psychological symptoms of trauma obtained from college students may tentatively be generalized to older adolescents who are not in college.	2001	natural
Few relationships between memory characteristics and trauma symptoms were found.	2003	natural
These observed effects of counterfactual thinking on blame assignment are consistent with those obtained with uninvolved observers and with victims of other types of trauma.	2003	natural
Students who have been known to commit violent acts should be adequately assessed for violence exposure and symptoms of psychological trauma, with special attention given to the suicide potential of violent females.	2001	natural
Additionally, untreated childhood trauma can create serious mental and physical complications later in life.	2004	natural
Some of the main symptoms, such as reactualization of the trauma, dissociation, personality disorders, pathological relationship with food, distortion of body image, suicide attempts and self-inflicted punishment that victims of abuse and eating disordered subjects share are examined.	2001	natural
Signs of unresolved trauma found in the discourse of mothers, such as dissociation, are also studied.	2004	natural
Special attention is given to the role of improvisation in exposing, dealing with and healing the trauma.	2004	natural
This article shows how group process intervention can be used to foster resilience in adults who experience exceptional trauma in their daily lives.	2000	natural
The presence of more than one type of SIB was linked to a more pronounced clinical symptomatology and trauma history. .	2003	natural
Improved (n = 21) and nonimproved (n = 13) PTSD patients (a mixed trauma population) were compared for fear activation and habituation patterns during and between the 1st and 2nd prolonged exposure sessions.	2002	natural
The term peritraumatic emotional hotspot is used to describe moments of peak distress during trauma.	2002	natural
It is concluded that although exposure treatments with trauma patients are associated with therapists' distress, therapists seem able to cope with it in a healthy way.	2000	natural
In most cases headache can be categorized as migraine or tension-type headache without significant organic pathology, i.e. head trauma, structural lesion, etc.	2002	natural
Ehlers and Clark (Behaviour Research and Therapy 38 (2000) 319-345) propose that a predominance of data-driven processing (i.e., processing sensory impressions) during the trauma contributes to the development of this memory pattern, and therefore, predicts PTSD symptoms after trauma.	2002	natural
Staff involved both professionally and as a civilian, particularly those who witnessed the trauma, or those who had experienced previous emotional problems and trauma, had the highest levels of symptomatology.	2002	natural
The study replicated previous findings of reduced texture productivity among patients who always remembered sexual trauma of childhood-onset.	2000	natural
This study examines the frequency of social services referral of an alcohol positive cohort of adolescent trauma patients.	2001	natural
These results are interpreted in terms of a self-referent, upward CFT style that is normative following trauma for all survivors, regardless of levels of trauma-related distress, and that is applied to any negative events that are encountered.	2004	natural
Trauma from the mother's own infancy is seen to have created an internal, autistic, deadened, psychic space.	2000	natural
In two studies, we tested one particular implication of this scenario, namely, that dissociative symptoms are related to endorsement of vague rather than specific items about childhood trauma.	2004	natural
The analyst's making optimal use of dissociative processes in an intersubjective and interpersonal context enables the patient more readily to self-regulate affect in those areas of implicit memory where trauma has left its mark; the dissociated ghosts of not-me are thus persuaded, little-by-little, to cease their haunting and participate more and more actively and openly as self-reflective, self-expressive parts of me.	2003	natural
Measures included a trauma inventory, the Clinician Administered PTSD Scale (CAPS) (Blake et al.,	2004	natural
Trauma exposure, social role in the organization, and intrusion symptoms at 23 weeks, explained 36 of the variance in PTSD-symptoms at 4 months.	2003	natural
As a consequence of the trauma, the patients became psychosocially vulnerable and suffered from a variety of symptoms: hypersensitivity to sounds, difficulties with concentrating and remembering, increased anxiety and sensitivity to stress.	2003	natural
Various issues of central importance to the field of trauma were continually raised and debated at the 1998 Meeting on Trauma and Cognitive Science.	2001	natural
The present findings cast doubts on theories that emphasize the role of childhood trauma in overgeneral autobiographical memory.	2001	natural
The Stressful Life Events Screening Questionnaire categorized 1,909 sophomore women into groups including no trauma exposure, exposure to a serious non-Criterion A event only, exposure to several unique noninterpersonal and interpersonal events, and exposure to multiple interpersonal events.	2000	natural
Level of upset was moderately to strongly related to levels of past trauma and current symptoms, while perceived usefulness was not significantly related to any experiences or symptoms.	2003	natural
Because dissociation, abnormalities in the hypothalamic-pituitary-adrenocortical axis, and catecholamine functioning have all been implicated in the development of stress disorders such as posttraumatic stress disorder, these data suggest that some biological differences may exist before index trauma exposure and before the development of stress-related illness.	2001	natural
A review of the last 20 years of research on CSA does not support the view that the majority of children known to have been sexually abused exhibit signs or symptoms of trauma.	2003	natural
This study confirms the strong association between trauma and dissociative symptoms as a whole, including somatoform dissociation.	2002	natural
Consequently, little is known about the clinical correlates of trauma in recently victimized older adults.	2002	natural
The author discusses how data from the empirically derived typologies can be incorporated within a multidimensional assessment framework based on the Trauma Outcome Process model (Burton, Rasmussen, Bradshaw, Christopherson, & Huke, 1998; Rasmussen, Burton, & Christopherson, 1992; Rasmussen, 1999, 2001, 2002).	2004	natural
A background of early neglect and trauma experienced by the mother is illustrated considering recent literature about early intergenerational transmission of traumatic experiences in order to demonstrate treatment modalities in view of protective and risk factors.	2000	natural
In a prospective longitudinal study of 138 consecutive patients suffering from TBI who were admitted to the Magdeburg University Hospital, 60 could be assessed neuropsychologically 8--31 days after trauma and 18--45 weeks later.	2001	natural
After adjusting for acute stress symptoms reported after the attacks, greater parent-adolescent conflict was positively associated with adolescents' trauma symptoms, distress, and functional impairment at 1 year.	2004	natural
Four groups of participants were asked to color name positive words, neutral words, and trauma words; these groups included 15 women who believed that they harbored repressed memories of childhood sexual abuse (CSA), 13 women who reported recovered memories of CSA, 15 women who had never forgotten their CSA, and 12 women who had never been abused.	2000	natural
The SES scoring continuum, reflecting objective severity of acts, was only modestly associated with subjective trauma associated with rape, attempted rape, coercion, and contact.	2004	natural
Treating the trauma of rape: cognitive behavioral therapy for PTSD.	2003	natural
It is finally maintained that psychic trauma forces upon the victim a vast and difficult transformation, in relation to which the body can be used as an antisymbolic device to resist mental change.	2003	natural
Five factors are proposed that influence the response to trauma, including biological factors, developmental level at the time of trauma, severity of the stressor, social context, and prior and subsequent life events.	2000	natural
Trauma is proposed as a key to understanding the development and persistence of conduct disorder, in conjunction with other contributing factors.	2002	natural
Common reactions of children following trauma have been examined in the literature; however, mediating variables, problems with assessment, and current diagnostic criteria related to PTSD may temper our understanding of the issues.	2002	natural
Reciprocally, the etiology of attachment disturbances should include an assessment of possible exposure to trauma in the child and in the parents.	2004	natural
The events of September 11th, 2001, have had long-lasting effects on our culture, interpersonal relationships, understanding of evil intent and terrorism, and approach to and treatment of trauma states.	2003	natural
Can the catastrophe of trauma be healed?	2003	natural
This study investigated the association of trauma symptoms and hypnotizability in 43 hospitalized survivors of burn injury.	2002	natural
Historical trauma (HT) is cumulative emotional and psychological wounding over the lifespan and across generations, emanating from massive group trauma experiences; the historical trauma response (HTR) is the constellation of features in reaction to this trauma.	2003	natural
A key challenge in trauma care is the prevention of psychopathology.	2002	natural
The study included 118 participants who were randomly assigned to write about one of four topics in a 2 (writing about perceived benefits vs. not writing about perceived benefits)2 (writing about trauma vs. not writing about trauma) factorial design.	2000	natural
Several conceptual ideas are developed, including the varied ways people experienced the disaster in terms of zones of sadness; the organic nature of the way the disaster unfolded; the language of the victims in terms of underlying rhetorical structures of response; and psycho-historical considerations that suggest, in part, why the disaster was such a collective trauma.	2002	natural
A four-stage progression of treatment is outlined: development of the Pilot, teaching the system's adults to engage in parenting the child alters, healing the wounds and the defensiveness of the Protector/Controller, and the internalization of the image of Ideal Parents so that the client can continue to resolve any surfacing memories of trauma or inadequate rearing.	2002	natural
All three cases have histories of early childhood trauma, dissociative symptoms and features of Obsessive Compulsive Spectrum Disorders that have proven to be treatment resistant with previous cognitive/behavioural and pharmacological interventions.	2001	natural
Emergence of trauma memories was not uniquely traceable to treatment.	2000	natural
The current study had the following four goals: (a) provide additional data on the internal consistency reliability, (b) examine the relationship between Mt Scale scores and various school-related domains, (c) examine the relationship between Mt scores and indices of distress (trauma exposure, post-traumatic stress disorder [PTSD] symptoms, and history of psychological treatment), and (d) examine the diagnostic accuracy of cutting scores across the full spectrum of possible scores using receiver operating characteristic (ROC) analyses.	2002	natural
This article summarizes scales assessing trauma and its effects on youths.	2002	natural
Recent research has focused on the occurrence of anxiety symptoms after miscarriage and has suggested that early pregnancy loss (EPL) should be conceptualised from the perspective of a trauma experience.	2001	natural
Neuropsychological rehabilitation, first preceded by an initial neuropsychological examination (standard psychological tests: WAIS-R, RAVLT, Rey's CFT, BVRT and clinical experiments tailored to DE's condition), was initiated 1 year after trauma.	2003	natural
Because abusive head trauma occurs without witnesses other than the perpetrator in most cases, we need to infer certain information to fill the gaps of validated facts.	2001	natural
We divided the sample into three groups: no trauma exposure (21), trauma-exposed without PTSD (59), and trauma-exposed with PTSD (20).	2004	natural
As predicted, clients with definite sexual abuse scored significantly higher than clients known not to be sexually abused on Armstrong and Loewenstein's (1990) Trauma Content index (TC/R), with an effect size greater than 1 SD.	2000	natural
The shared trauma of these horrifying events affected many individuals on many levels.	2004	natural
Psychological distress was evaluated with Trauma Symptoms Checklist for Children (TSC-C; Briere, 1989).	2003	natural
RESEARCH DESIGN, A representative sample of survivors of TBI were selected on the basis of having suffered significant disturbance in consciousness following their trauma event in the form of coma and/or post-traumatic amnesia.	2002	natural
On a 0 to 9 severe trauma scale patients had significantly more severe traumatic events (mean score, 1.31; SD 1.21) than control subjects (0.52; SD 0.80; P <.0001).	2002	natural
The therapist's intense personal anxiety about failure and about management of the difficulties that arise is linked to the impact of trauma.	2001	natural
The Trauma Symptom Checklist for Young Children (TSCYC) is a 90-item caretaker-report measure of childrens trauma- and abuse-related symptomatology.	2001	natural
Themes were identified which led to a delineation of how each parent coped with this trauma in their lives.	2004	natural
Severe maternal affect dysregulation in the wake of chronic, early-onset violent-trauma exposure manifested as psychogenic seizures, referred to in the mother's native Spanish as ataques de nervios, the latter, an idiom of distress, commonly associated with childhood trauma and dissociation.	2003	natural
Participants in the trauma condition reported experiencing more physical symptoms subsequent to the intervention relative to those in the other conditions.	2000	natural
The relationships between the reported experience of these forms of maltreatment in childhood, family characteristics during childhood, and current psychological adjustment (trauma symptomatology and self-depreciation) were assessed.	2000	natural
A relational approach to therapy calls for consideration of attachment issues in creating the frame for therapy and tailoring treatment to the individual trauma survivor.	2003	natural
This paper aims to consider the implications of an integrated account of trauma memory for pharmacological treatments that have been proposed for the prevention of PTSD.	2004	natural
A `chosen trauma' is one component of this identity.	2001	natural
This study compared the expectations for career counseling and the level of career maturity among trauma survivors and nonsurvivors (individuals who have had no trauma experience) who participated in a program at a midwestern social service agency.	2001	natural
Normally, further therapeutic interventions are also necessary, drawing on traditional methods for integrating the trauma into the patient's biography.	2002	natural
The Family Trauma Centre is a communitybased treatment service for children, young people and their families.	2004	natural
Making links among the recent trauma, earlier developmental experiences that may have rendered the individual vulnerable to the development of PTSD, and ways that conflicts are reenacted in the therapeutic dyad, dynamic therapists seek to help traumatized individuals re-establish a sense of coherence and meaning in their lives.	2002	natural
The study does not provide evidence for re-establishing prior diagnostic systems of depressive disorders based on the presence or absence of neurotic characteristics or on the presence or absence of a psychic trauma as in ICD-8.	2004	natural
Factors such as direct trauma exposure and the personal attributes of mental_health workers, which have been suggested to be associated with VT, are also assessed.	2003	natural
These related and overlapping theories are also relevant to the use of couple therapy with partners who have histories of early trauma.	2004	natural
The specific difficulties encountered by this population and the therapist responses are discussed: the need to tell the trauma story and the therapist's ability to listen; the patient's need for constancy and therapist's ability to stay; the patient's need to give and the therapist's ability to receive; the patient's problem with evil and the therapist's ability to believe.	2001	natural
This paper explores the impact of working with trauma on the practitioner who works therapeutically with survivors of childhood abuse, and their supervisor's role in helping to manage the resulting terror, horror and trauma.	2004	natural
Those participants with a prior child abuse history were more symptomatic after adult trauma than those with no such history.	2004	natural
This study investigated prevalence rates of secondary traumatic stress symptoms in Israeli Police forensic technicians, and the relationship between these symptoms and perceived social support as well as perceived severity of prior trauma (combat, work, personal).	2004	natural
