It also aimed to examine the relationship between initial coping style and subsequent psychological trauma.	2000	natural
It is finally maintained that psychic trauma forces upon the victim a vast and difficult transformation, in relation to which the body can be used as an antisymbolic device to resist mental change.	2003	natural
Five factors are proposed that influence the response to trauma, including biological factors, developmental level at the time of trauma, severity of the stressor, social context, and prior and subsequent life events.	2000	natural
Trauma is proposed as a key to understanding the development and persistence of conduct disorder, in conjunction with other contributing factors.	2002	natural
Common reactions of children following trauma have been examined in the literature; however, mediating variables, problems with assessment, and current diagnostic criteria related to PTSD may temper our understanding of the issues.	2002	natural
Reciprocally, the etiology of attachment disturbances should include an assessment of possible exposure to trauma in the child and in the parents.	2004	natural
The events of September 11th, 2001, have had long-lasting effects on our culture, interpersonal relationships, understanding of evil intent and terrorism, and approach to and treatment of trauma states.	2003	natural
Can the catastrophe of trauma be healed?	2003	natural
This study investigated the association of trauma symptoms and hypnotizability in 43 hospitalized survivors of burn injury.	2002	natural
The mother's background of early neglect and trauma is described, in the light of recent literature about the early intergenerational transmission of traumatic experiences, in order to demonstrate possible treatment modalities and the need to consider both protective and risk factors.	2001	natural
Historical trauma (HT) is cumulative emotional and psychological wounding over the lifespan and across generations, emanating from massive group trauma experiences; the historical trauma response (HTR) is the constellation of features in reaction to this trauma.	2003	natural
A key challenge in trauma care is the prevention of psychopathology.	2002	natural
The study included 118 participants who were randomly assigned to write about one of four topics in a 2 (writing about perceived benefits vs. not writing about perceived benefits)2 (writing about trauma vs. not writing about trauma) factorial design.	2000	natural
Several conceptual ideas are developed, including the varied ways people experienced the disaster in terms of zones of sadness; the organic nature of the way the disaster unfolded; the language of the victims in terms of underlying rhetorical structures of response; and psycho-historical considerations that suggest, in part, why the disaster was such a collective trauma.	2002	natural
A four-stage progression of treatment is outlined: development of the Pilot, teaching the system's adults to engage in parenting the child alters, healing the wounds and the defensiveness of the Protector/Controller, and the internalization of the image of Ideal Parents so that the client can continue to resolve any surfacing memories of trauma or inadequate rearing.	2002	natural
At the same time an insufficient explicit trauma memory is formed that manifests itself in insufficient cortical processing of trauma content.	2002	natural
All three cases have histories of early childhood trauma, dissociative symptoms and features of Obsessive Compulsive Spectrum Disorders that have proven to be treatment resistant with previous cognitive/behavioural and pharmacological interventions.	2001	natural
Emergence of trauma memories was not uniquely traceable to treatment.	2000	natural
The current study had the following four goals: (a) provide additional data on the internal consistency reliability, (b) examine the relationship between Mt Scale scores and various school-related domains, (c) examine the relationship between Mt scores and indices of distress (trauma exposure, post-traumatic stress disorder [PTSD] symptoms, and history of psychological treatment), and (d) examine the diagnostic accuracy of cutting scores across the full spectrum of possible scores using receiver operating characteristic (ROC) analyses.	2002	natural
This article summarizes scales assessing trauma and its effects on youths.	2002	natural
There are two primary problems with trauma response theories.	2003	natural
Findings from the study highlight the value of programs designed to identify trauma victims, screen for problematic behaviors, and intervene to improve long-term health outcomes.	2003	natural
Among the adverse mental_health consequences of childhood trauma is the risk related to the development of posttraumatic stress disorder (PTSD) in adulthood.	2001	natural
Recent research has focused on the occurrence of anxiety symptoms after miscarriage and has suggested that early pregnancy loss (EPL) should be conceptualised from the perspective of a trauma experience.	2001	natural
Neuropsychological rehabilitation, first preceded by an initial neuropsychological examination (standard psychological tests: WAIS-R, RAVLT, Rey's CFT, BVRT and clinical experiments tailored to DE's condition), was initiated 1 year after trauma.	2003	natural
Research has also shown a clear positive association between self-reported trauma and overgeneral memory.	2003	natural
Because abusive head trauma occurs without witnesses other than the perpetrator in most cases, we need to infer certain information to fill the gaps of validated facts.	2001	natural
We divided the sample into three groups: no trauma exposure (21), trauma-exposed without PTSD (59), and trauma-exposed with PTSD (20).	2004	natural
As predicted, clients with definite sexual abuse scored significantly higher than clients known not to be sexually abused on Armstrong and Loewenstein's (1990) Trauma Content index (TC/R), with an effect size greater than 1 SD.	2000	natural
One aspect of the emotional environment is unique to this kind of caregiving situation: that parents are often unable to validate the true nature of their child's relationship with the EPSM or, ultimately, the trauma experienced by the child when the EPSM leaves.	2000	natural
The shared trauma of these horrifying events affected many individuals on many levels.	2004	natural
Psychological distress was evaluated with Trauma Symptoms Checklist for Children (TSC-C; Briere, 1989).	2003	natural
The nature, origins, and timing of conflict and compromise formation in mental development are discussed, as well as their relation to psychic trauma.	2002	natural
Although researchers have become increasingly knowledgeable about the effects of critical events on rescue workers, to date, no studies have focused on the stress and trauma experienced as a result of having one's actions questioned in such a process.	2003	natural
RESEARCH DESIGN, A representative sample of survivors of TBI were selected on the basis of having suffered significant disturbance in consciousness following their trauma event in the form of coma and/or post-traumatic amnesia.	2002	natural
On a 0 to 9 severe trauma scale patients had significantly more severe traumatic events (mean score, 1.31; SD 1.21) than control subjects (0.52; SD 0.80; P <.0001).	2002	natural
The therapist's intense personal anxiety about failure and about management of the difficulties that arise is linked to the impact of trauma.	2001	natural
The Trauma Symptom Checklist for Young Children (TSCYC) is a 90-item caretaker-report measure of childrens trauma- and abuse-related symptomatology.	2001	natural
Additionally, substance-using clients with a history of childhood trauma had significantly more individual therapy sessions attended than clients without a history of childhood trauma.	2000	natural
Themes were identified which led to a delineation of how each parent coped with this trauma in their lives.	2004	natural
Severe maternal affect dysregulation in the wake of chronic, early-onset violent-trauma exposure manifested as psychogenic seizures, referred to in the mother's native Spanish as ataques de nervios, the latter, an idiom of distress, commonly associated with childhood trauma and dissociation.	2003	natural
Participants in the trauma condition reported experiencing more physical symptoms subsequent to the intervention relative to those in the other conditions.	2000	natural
The relationships between the reported experience of these forms of maltreatment in childhood, family characteristics during childhood, and current psychological adjustment (trauma symptomatology and self-depreciation) were assessed.	2000	natural
A relational approach to therapy calls for consideration of attachment issues in creating the frame for therapy and tailoring treatment to the individual trauma survivor.	2003	natural
This paper aims to consider the implications of an integrated account of trauma memory for pharmacological treatments that have been proposed for the prevention of PTSD.	2004	natural
A `chosen trauma' is one component of this identity.	2001	natural
The representation patterns did not differ according to the severity of trauma or the post-detention conditions.	2004	natural
This study compared the expectations for career counseling and the level of career maturity among trauma survivors and nonsurvivors (individuals who have had no trauma experience) who participated in a program at a midwestern social service agency.	2001	natural
Normally, further therapeutic interventions are also necessary, drawing on traditional methods for integrating the trauma into the patient's biography.	2002	natural
The Family Trauma Centre is a communitybased treatment service for children, young people and their families.	2004	natural
Making links among the recent trauma, earlier developmental experiences that may have rendered the individual vulnerable to the development of PTSD, and ways that conflicts are reenacted in the therapeutic dyad, dynamic therapists seek to help traumatized individuals re-establish a sense of coherence and meaning in their lives.	2002	natural
The study does not provide evidence for re-establishing prior diagnostic systems of depressive disorders based on the presence or absence of neurotic characteristics or on the presence or absence of a psychic trauma as in ICD-8.	2004	natural
We examined trauma rates in a cohort of panic disorder patients.	2002	natural
Factors such as direct trauma exposure and the personal attributes of mental_health workers, which have been suggested to be associated with VT, are also assessed.	2003	natural
These related and overlapping theories are also relevant to the use of couple therapy with partners who have histories of early trauma.	2004	natural
This approach features motivational interviewing, self-control training, and trauma resolution and integrates eye movement desensitization and reprocessing (EMDR).	2000	natural
The specific difficulties encountered by this population and the therapist responses are discussed: the need to tell the trauma story and the therapist's ability to listen; the patient's need for constancy and therapist's ability to stay; the patient's need to give and the therapist's ability to receive; the patient's problem with evil and the therapist's ability to believe.	2001	natural
This paper explores the impact of working with trauma on the practitioner who works therapeutically with survivors of childhood abuse, and their supervisor's role in helping to manage the resulting terror, horror and trauma.	2004	natural
These findings provide support for EMDR's use as a trauma treatment for boys ages 10-16, as well as support for the hypothesis that effective trauma treatment can lead to reduced conduct problems in this population.	2002	natural
This article posits a form of dissociation--resulting from trauma--linked to disastrous knowledge, signifying a person's incapacity to use language and symbol to organize the core of the traumatic experience in terms of semantically structured self-in-relation.	2001	natural
Those participants with a prior child abuse history were more symptomatic after adult trauma than those with no such history.	2004	natural
This study investigated prevalence rates of secondary traumatic stress symptoms in Israeli Police forensic technicians, and the relationship between these symptoms and perceived social support as well as perceived severity of prior trauma (combat, work, personal).	2004	natural
This paper suggests a tentative hypothesis to explain the apparent paucity of dissociative disorder patients between the 1920s and the 1970s: that the trance phenomenon that is now so characteristic in patients who struggle with childhood trauma may be a manner of handling emotional distress specific to certain periods in American history.	2004	natural
Thus, support was found for a model in which PTSD contributes to the development of other disorders following trauma, whereas no evidence was found to suggest that comorbid disorders develop independently of PTSD following trauma, or that comorbidity was due to symptom overlap among disorders.	2002	natural
In contrast to Study 1, prior history of PTSD, perception of life threat, and the index trauma being a sexual assault all predicted posttrauma panic, whereas prior trauma exposure and depression did not.	2004	natural
First, research findings are presented, followed by guidelines for the assessment of trauma and PTSD.	2002	natural
Trauma precipitated PTSD in subjects who had significantly fewer premorbid predisposing factors than did agoraphobics.	2001	natural
Furthermore, attributional style contributed to the prediction of both depressive and trauma symptoms.	2004	natural
The majority of trauma research published over the 15-year span was in English.	2004	natural
The relationship between coping with trauma and the use of various spiritual beliefs is well established.	2003	natural
Sense of Coherence was found not to be a consistent moderator of the relationship between the work-related experiences of the trauma counsellors and the indicators of secondary traumatic stress.	2001	natural
Prior research suggests that PTSD may be underdiagnosed when trauma is not the presenting problem.	2002	natural
His suicide dynamics consist of blurred self-other boundaries, ecdytic fantasies, trauma internalization, and an attempt to exterminate a bad object through self-destruction.	2003	natural
Although females were at greater risk than males within the subsample of those who had experienced trauma, the large gender differences noted in some recent epidemiological research were not replicated.	2001	natural
Research on talking about trauma as a means of coping typically relies on retrospective self-reports.	2002	natural
Comparisons between the ETI and other instruments for the assessment of trauma, as well as instruments for the measurement of symptoms related to abuse, such as dissociation and PTSD, demonstrated good convergent validity.	2000	natural
Two-hundred and five women completed the Childhood Trauma Questionnaire (Bernstein et al.,	2003	natural
In this light the author examines the affective and cognitive qualities that render Ferenczi a mentor of our possible future development, taking into consideration the following aspects: the communicative and intersubjective perspective that denotes Ferenczi's thought since his first writings; the receptive, reflective, and selfreflective capacities which have progressively accompanied his own commitment and clinical attitude; and his elective work on trauma and the traumatic, including the algogenic messages transmitted during the healing process by analysts in fear (and perhaps terror) of their own regression and countertransferential catastrophe.	2004	natural
The fear-ful-avoidant attachment style was the best predictor of both the cognitive disruptions and symptoms of distress in female trauma therapists.	2003	natural
To assess the outcome of severe traumatic brain injury at least 1 year after trauma, in relation to some early clinical prognostic factors occurring during coma recovery.	2004	natural
Staff involved both professionally and as a civilian, particularly those who witnessed the trauma, or those who had experienced previous emotional problems and trauma, had the highest levels of symptomatology.	2002	natural
Trauma severity is best related to PTSD symptomatology experienced in 1990, mitigated in part by greater education level and age at the time of trauma exposure.	2000	natural
Controlled studies on the psychiatric effects of noncombat trauma were reviewed and a meta-analysis of these data was conducted.	2000	natural
Further subcategorization and development of the broad categories of trauma and resolution were recommended and may be useful in shedding light on how change happens in EMDR.	2002	natural
Finally, secondary and associated responses to trauma are discussed that are common across many types of traumatic experience.	2000	natural
To describe the presenting characteristics, hospital course, and hospital charges associated with hospital admissions for head trauma in young children at a regional pediatric trauma center, and to examine whether these factors differ among abused and non-abused subjects.	2004	natural
This study assessed the association between spirituality and psychopathology in a group of sexual abuse victims and controls with a focus on whether spirituality moderated the association between sexual trauma and psychopathology.	2004	natural
This study addressed long-term effects of extreme trauma among Holocaust survivors (N = 126) in an older (75-94 years) sample of the Israeli Jewish population.	2003	natural
Despite the fact that only a small percentage of individuals fail to adjust positively following trauma, the magnitude and scope of incidents of mass violence dictate that a large number of individuals may develop enduring psychopathology as a result of such events.	2002	natural
Thus, reducing trauma symptoms among adults with moderate to severe symptoms may be a particularly effective HIV-prevention intervention for adults living with HIV/AIDS.	2002	natural
There is a large literature on the way sexual trauma affects later sexual functioning and relationships.	2001	natural
This case-study identifies the links between an insecure-avoidant pattern of attachment organization, unresolved childhood trauma, emotional detachment, substance misuse and violent offending behaviour in adulthood.	2002	natural
We examined whether the emotional response to hip arthroplasty predicted functional recovery after controlling for preoperative function and surgical trauma.	2001	natural
Treatment should be tailored to the severity and type of presenting PTSD symptoms, to the type of trauma experience, and to the many likely comorbid diagnoses and adjustment problems.	2002	natural
These groups recalled words they were instructed to remember more often than words they were instructed to forget regardless of whether they were trauma related.	2001	natural
How widespread is extreme trauma and PTSD in the general psychiatry population?	2002	natural
The unresolved state of mind with respect to loss or trauma as assessed in the Adult Attachment Interview is common in clinical and forensic groups, as well as in mothers whose infants are classified as disorganized in their attachment relationship to them.	2004	natural
These pilot results support the development of an adjunct intervention to augment current PTSD treatments for women veterans with histories of sexual and physical trauma.	2004	natural
The purpose included debriefing of practitioners, as well as the education of trauma symptoms and assessment for client intervention.	2003	natural
The article re-examines trauma and bereavement and the category of loss considered to be traumatic bereavement.	2003	natural
Because of methodological problems with the traditional questionnaire measurement of dispositional attributional style, this investigation added a structured content analysis of participants' trauma narratives to examine associations between trauma-specific attributions and PTSD symptoms.	2003	natural
The article examines how recent research and writing regarding the neurological impact of trauma and early attachment experiences might inform our understanding of sexual behavior problems, particularly in dealing with children and adolescents.	2004	natural
A child's self-efficacy beliefs impact the course and treatment of PTSD, because perceived self-efficacy plays a mediating role in children's ability to cope with trauma.	2002	natural
Research in this area includes well characterized trauma models, genetically engineered animals and neuroprotective studies.	2003	natural
Students who were exposed to high levels of violence at school also were significantly more likely to experience clinical levels of trauma symptoms than students who were exposed to low levels of violence at school.	2004	natural
As well, and specifically, the paper explores a comparative understanding of the development of two different modalities of early psychodynamic concepts with regard to children and their response to trauma, aspects that continue through theoretical and clinical practice today.	2003	natural
Victims of other types of childhood traumas (e.g., car accidents) reported less forgetting than victims of childhood sexual abuse or multiple types of trauma.	2002	natural
Despite the high prevalence of violence in the lives of women of reproductive age, and the adverse consequences posed to pregnant women suffering from PTSD, few studies have examined violence-related trauma and PTSD among pregnant women.	2004	natural
Recruitment was not random, the sample size was modest, and trauma event endorsement was based on retrospective accounts.	2004	natural
This article applies such a dynamic perspective of PSS to victims of crime and argues that one's perspective of victim status may be well served by taking into account the history of victimization and trauma that these individuals have experienced.	2004	natural
This article presents a framework for understanding how the trauma of political violence experienced in one generation can pass to another that did not directly experience it, and proposes a model to guide clinical intervention.	2004	natural
The initial core responses to trauma include reexperiencing and avoidance symptoms that occur across four modes of experience.	2000	natural
Perceived control was assessed in terms of past, present, and future control over the trauma, and adjustment was assessed in terms of current symptoms of distress (i.e., depression and anxiety) and posttraumatic stress disorder, and life satisfaction.	2004	natural
This dissociation of implicit and explicit memory prevents the extinction of the emotional response to the trauma and perpetuates the disorder.	2002	natural
Participants were 571 patients seen as part of a hospital trauma service who had acute traumatic brain injuries, and 228 patients involved in head injury litigation.	2002	natural
The advantages of an individual-focused, longitudinal approach to recovery from a trauma are discussed.	2001	natural
To summarize the literature about the clinical presentation and treatment interventions of childhood reactions to terrorism-induced trauma.	2004	natural
Participants who wrote only about trauma or perceived benefits showed significantly fewer health center visits for illness 3 months after writing.	2000	natural
A group of 39 trauma patients with injuries to parts of the body other than the head were used as controls.	2001	natural
Three main alternatives are considered; can psychosis cause PTSD, can trauma cause psychosis and could psychosis and PTSD both be part of a spectrum of responses to a traumatic event?	2003	natural
The idea of reprocessing trauma memories to bring about recovery, central to the psychological account of PTSD, is translated into terms more familiar in the biological literature using the concept of reconsolidation of active memories.	2004	natural
Staff involved both professionally and as a civilian, particularly those who witnessed the trauma, or those who had experienced previous emotional problems and trauma, had the highest levels of symptomatology.	2002	natural
Trauma repair, deformity, and unsightly blemishes may cause social embarrassment and take thousands of individuals to plastic surgeons.	2003	natural
Furthermore, the unprecedented nature of the terrorist actions raises new issues regarding how children may respond to and cope with trauma.	2002	natural
This paper explores prevailing sociocultural and theoretical beliefs regarding dependency in the psychotherapy of trauma survivors, provides a working definition of dependency, offers an analysis of its complex nature, and describes the theory of structural dissociation, which helps illuminate the often contradictory manifestations of dependency in chronically traumatized patients.	2001	natural
As compared to patients with brain damage caused by trauma (n=12) or subarachnoid haemorrhage (SAH; n=9), those caused by other cerebrovascular accidents (n=3) or anoxic encephalopathy (n=2) appeared to demonstrate a much smaller improvement in their PVS score.	2004	natural
Initial findings demonstrate a phenomenological link between CEA and eating psychopathology, and suggest that this association might be different to the links for other forms of trauma (i.e., CEA may have a relationship with a broader range of eating symptoms than sexual and physical abuse).	2000	natural
This paper examines the research and theoretical literature on potential links between trauma and psychosis.	2003	natural
Much of the literature on surviving childhood sexual abuse has traditionally relied on approaches which assume a reflective transparency between the original experience and retrospective accounts of trauma.	2000	natural
